45,1012230142,12020064,230142,วัดปรมัยยิกาวาส(แสนสวัสดิ์วิทยาคาร),WATPARAMAIYIKAWAS,นายจิรปรัชญ์ ณ ป้อมเพ็ชร์,อนุบาล-มัธยมศึกษาตอนต้น,,หมู่ 7 โอ่งอ่าง,เกาะเกร็ด,ปากเกร็ด,นนทบุรี,11120,watparamaiyikawas@gmail.com,watparamaiyikawas.com,เกาะเกร็ด,25845765,25845765,1 กรกฏาคม 2472,25,1,ขนาดเล็ก,มีไฟฟ้า,14,108,11,08 มิถุนายน 2562 เวลา 08:50:12 น.
46,1012230144,12020066,230144,วัดศาลากุล,watsalakun,นายชัยฤกษ์ วุฒิธาดา,อนุบาล-ประถมศึกษา,,หมู่ 3 ศาลากุล,เกาะเกร็ด,ปากเกร็ด,นนทบุรี,11120,watsalakun@gmail.com,www.salakun.net,เกาะเกร็ด,5845147,25845147,1 พฤษภาคม 2482,20,4,ขนาดเล็ก,มีไฟฟ้า,12,88,8,27 กันยายน 2562 เวลา 10:22:02 น.
47,1012230132,12020067,230132,คลองเกลือ,klongklua,นายปณต จตุพศ,อนุบาล-ประถมศึกษา,,หมู่ 2 -,คลองเกลือ,ปากเกร็ด,นนทบุรี,11120,klk.sch2017@gmail.com,klongklau.ac.th,เทศบาลนครปากเกร็ด,25746313,25732093,7 มิถุนายน 2495,35,5.4,ขนาดใหญ่,มีไฟฟ้า,55,798,29,17 ตุลาคม 2562 เวลา 10:06:08 น.
48,1012230127,12020068,230127,วัดท่าเกวียน(ศึกษาประชาสรรค์),WATTHAKWIEN,นายกิตติศักดิ์ ศรีปทุมานุรักษ์,อนุบาล-มัธยมศึกษาตอนต้น,,หมู่ 6 คูวังแดง,คลองข่อย,ปากเกร็ด,นนทบุรี,11120,oldtrafford_thailand@hotmail.com,www.facebook.com/โรงเรียนวัดท่าเกวียน(ศึกษาประชาสรรค์),คลองข่อย,9260661,29260661,2479,20,15,ขนาดกลาง,มีไฟฟ้า,31,458,17,08 มิถุนายน 2561 เวลา 11:40:15 น.
49,1012230129,12020069,230129,สามัคคีวิทยา(เชื้อผู้ดีอุปถัมภ์),samakkeewittaya,นายสุนทร เกิดสุข,อนุบาล-มัธยมศึกษาตอนต้น,,หมู่ 11,คลองข่อย,ปากเกร็ด,นนทบุรี,11120,smk2004@maildozy.com,http://smkwittaya.com/,คลองข่อย,9256365,9256365,1 เมษายน 2525,20,25,ขนาดกลาง,มีไฟฟ้า,23,266,11,29 ตุลาคม 2562 เวลา 12:52:39 น.
50,1012230092,12020070,230092,วัดศรีเขตนันทาราม,Watsrikhetnuntharam,นางสาวสมจิตร รอดเพชร,อนุบาล-ประถมศึกษา,,หมู่ 10 -,คลองข่อย,ปากเกร็ด,นนทบุรี,11120,srikhet@nonedu2.go.th,www.srikhet.ac.th,คลองข่อย,21584951,21584951,30 พฤศจิกายน 2477,13,15,ขนาดกลาง,มีไฟฟ้า,24,367,12,08 มิถุนายน 2562 เวลา 17:17:22 น.
51,1012230121,12020071,230121,วัดอินทาราม(สงค์วอนอุทิศ),Wat Intaram (Song-won-u-tit),นายประสิทธิ์ เด่นพัฒนพิทักษ์,อนุบาล-ประถมศึกษา,,หมู่ 1 ลำพูลาย,คลองพระอุดม,ปากเกร็ด,นนทบุรี,11120,watintaram2016@outlook.ac.th,,คลองพระอุดม,5017296,25017296,พ.ศ. 2492,15,3,ขนาดเล็ก,มีไฟฟ้า,14,94,8,07 มิถุนายน 2562 เวลา 09:54:08 น.
52,1012230122,12020072,230122,วัดสพานสูง(รถไฟนุเคราะห์),Watsapansoong School,นางศิริพร ศรีอินทร์สุทธิ์,อนุบาล-ประถมศึกษา,,หมู่ 3 บ้านแหลม,คลองพระอุดม,ปากเกร็ด,นนทบุรี,11120,watsapansoongschool@gmail.com,,องค์การบริหารส่วนตำบลคลองพระอุดม,25017284,25017284,29/11/2442,30,6,ขนาดกลาง,มีไฟฟ้า,17,303,8,07 มิถุนายน 2562 เวลา 15:31:36 น.
53,1012230125,12020073,230125,รุ่งเรืองวิทยา,Rungruengwittaya,นางสาววรรณวิภา ฉลาด,อนุบาล-มัธยมศึกษาตอนต้น,,หมู่ 10 สุเหร่าใหญ่,ท่าอิฐ,ปากเกร็ด,นนทบุรี,11120,rrw.non@gmail.com,rrw.ac.th,ท่าอิฐ,25258000,25258050,2479,17,13,ขนาดกลาง,มีไฟฟ้า,29,435,18,31 พฤษภาคม 2561 เวลา 13:10:41 น.
54,1012230145,12020075,230145,วัดเชิงเลน,watcheanglen school,นายจวน วงษ์ปิ่น,อนุบาล-ประถมศึกษา,,หมู่ 8 ท่าอิฐ,ท่าอิฐ,ปากเกร็ด,นนทบุรี,11120,watclschool@gmail.com,www.watcheanglenschool.com,องค์การบริหารส่วนตำบลท่าอิฐ,25258217,25258217,17 กุมภาพันธ์ 2476,20,15,ขนาดเล็ก,มีไฟฟ้า,16,107,9,07 มิถุนายน 2562 เวลา 09:42:36 น.
55,1012230139,12020076,230139,ชลประทานสงเคราะห์,Cholpratansongkroh,นางจิราภรณ์ บุญไกรสร,อนุบาล-มัธยมศึกษาตอนต้น,,หมู่ 1 โรงเรียนชลประทานสงเคราะห์,บางตลาด,ปากเกร็ด,นนทบุรี,11120,Cpskschool@gmail.com,www.cpsk.ac.th,เทศบาลนครปากเกร็ด,25838339,25843762,4 มิถุนายน 2498,30,2,ขนาดใหญ่,มีไฟฟ้า,76,962,38,07 มิถุนายน 2562 เวลา 12:41:11 น.
56,1012230140,12020077,230140,ประเสริฐอิสลาม,Prasert School,นายศรัณย์ ศรลัมพ์,อนุบาล-มัธยมศึกษาตอนต้น,,หมู่ 3 ประเสริฐอิสลาม,บางตลาด,ปากเกร็ด,นนทบุรี,11120,psi_school@freei.co.th,prasert.ac.th,เทศบาลตำบลบางตลาด,25838342,25833643,2474,20,3,ขนาดกลาง,มีไฟฟ้า,35,450,19,10 ตุลาคม 2562 เวลา 15:24:11 น.
57,1012230119,12020078,230119,วัดตำหนักเหนือ(ชื่นวิทยานุสรณ์),wattamnaknue,นางสาวสุจรินทร์ วรรณมาศ,อนุบาล-ประถมศึกษา,,หมู่ 3 บ้านเตย,บางตะไนย์,ปากเกร็ด,นนทบุรี,11120,wattamnak01@nonedu2.go.th,,บางตะไนย์,25017243,25017243,11-09-2476,25,10,ขนาดเล็ก,มีไฟฟ้า,12,54,8,07 มิถุนายน 2561 เวลา 10:09:55 น.
58,1012230120,12020079,230120,วัดตาล,wattal,นางศิริวรรณ สมบูรณ์พันธ์,อนุบาล-ประถมศึกษา,,หมู่ 1 หมู่บ้านวัดตาล,บางตะไนย์,ปากเกร็ด,นนทบุรี,11120,wattalschool@hotmail.co.th,www.wattalschool.ac.th,บางตะไนย์,25017210,25017210,14 กุมภาพันธ์ 2476,25,10,ขนาดกลาง,มีไฟฟ้า,23,372,14,23 ตุลาคม 2562 เวลา 13:31:30 น.
59,1012230138,12020082,230138,วัดผาสุกมณีจักร,phasukmaneejak,นางผุสดี หวายนำ,อนุบาล-ประถมศึกษา,,หมู่ 9 เมืองทองธานี,บางพูด,ปากเกร็ด,นนทบุรี,11120,,www.phasuk.ac.th,เทศบาลนครปากเกร็ด,25033361,25033361,2520,26,7,ขนาดใหญ่,มีไฟฟ้า,59,851,24,13 มิถุนายน 2561 เวลา 11:18:24 น.
60,1012230135,12020083,230135,วัดโพธิ์บ้านอ้อย,Watphobanaoyschool,นางสมศรี เต็มอนุภาพกุล,อนุบาล-ประถมศึกษา,,หมู่ 4 โพธิ์บ้านอ้อย,บางพูด,ปากเกร็ด,นนทบุรี,11120,watphobanaoyschool@Gmail.com,school.obec.go.th/phoban aoy/,เทศบาลนครปากเกร็ด,5844218,25844218,15052482,20,4,ขนาดใหญ่,มีไฟฟ้า,41,610,19,08 มิถุนายน 2562 เวลา 18:43:42 น.
61,1012230134,12020086,230134,ไทยรัฐวิทยา95 (วัดโพธิ์ทองบน),thairathwittaya95(watpothongbon),นายศุภกฤษ ไชยศร,อนุบาล-มัธยมศึกษาตอนต้น,,หมู่ 2 -,บ้านใหม่,ปากเกร็ด,นนทบุรี,11120,thairath95_@hotmail.com,www.thairath95.ac.th,ปากเกร็ด,25839127,25839127,29/11/2442,33.5,10,ขนาดใหญ่,มีไฟฟ้า,54,801,27,07 มิถุนายน 2562 เวลา 09:38:55 น.
62,1012230141,12020087,230141,วัดกลางเกร็ด,Wat Klangkret School,นายธีระชัย หันยอ,อนุบาล-ประถมศึกษา,,หมู่ 1 -,บางตลาด,ปากเกร็ด,นนทบุรี,11120,kk.school11@gmail.com,www.watklangkredschool.ac.th,เทศบาลนครปากเกร็ด,25845344,25845344,15 กันยายน 2476,18,1,ขนาดกลาง,มีไฟฟ้า,21,270,11,07 มิถุนายน 2562 เวลา 10:13:54 น.
63,1012230131,12020089,230131,วัดบางพูดใน (นนทวิทยา),Watbangpoodnai School,นางรัตนาภรณ์ สถิรพันธ์,อนุบาล-ประถมศึกษา,,หมู่ 1 -,ปากเกร็ด,ปากเกร็ด,นนทบุรี,11120,bangpoodnai@hotmail.com,www.bangpoodnai.net,เทศบาลนครปากเกร็ด,25839128,25839128,1 มิถุนายน 2482,23,2,ขนาดกลาง,มีไฟฟ้า,24,390,16,10 มิถุนายน 2562 เวลา 12:26:32 น.
