46,1014310045,14010054,310045,บ่อแร่,Borae,นายณฐกร นิรพาธ,อนุบาล-มัธยมศึกษาตอนต้น,,หมู่ 11 บ่อแร่,หนองขนาก,ท่าเรือ,พระนครศรีอยุธยา,13130,churakram@gmail.com,boraeschool.com,หนองขนาก,0-3520-0308,,26 มิถุนายน 2483,45,5,ขนาดกลาง,มีไฟฟ้า,18,129,11,28 พฤษภาคม 2561 เวลา 08:44:47 น.
47,1014310046,14010056,310046,วัดทุ่งมน,watthungmon,นางวรรณมาศ พรหมมา,อนุบาล-ประถมศึกษา,,หมู่ 2 ทุ่งมน,หนองขนาก,ท่าเรือ,พระนครศรีอยุธยา,13130,somchaipool@gmail.com,http://202.143.174.14/web/index_view_history.php?School_ID=1014310046,หนองขนาก,0-35902437,,13 กรกฎาคม 2488,60,10,ขนาดเล็ก,มีไฟฟ้า,8,71,8,17 กันยายน 2562 เวลา 08:38:41 น.
48,1014310047,14010057,310047,วัดบ้านแถว,Watbanthaeo School,-,อนุบาล-ประถมศึกษา,,หมู่ 4 บ้านแถว,หนองขนาก,ท่าเรือ,พระนครศรีอยุธยา,13130,Luksika_jung_9@hotmail.com,-,หนองขนาก,897402327,-,9 พฤศจิกายน 2477,48,13,ขนาดเล็ก,มีไฟฟ้า,6,31,8,17 ตุลาคม 2561 เวลา 08:38:25 น.
49,1014310071,14010058,310071,ชุมชนวัดเสด็จ(คุณศรีประเสริฐอุปถัมภ์),chomchonwatsadet,นางสาวอลิสสา บุญช่วย,อนุบาล-มัธยมศึกษาตอนต้น,,หมู่ 5 สวนกล้วย,คลองสะแก,นครหลวง,พระนครศรีอยุธยา,13260,watsadetschool@thaimail,data.bopp-obec.info/web/?School_ID=1014310071,คลองสะแก,35259839,,2520,20,5,ขนาดกลาง,มีไฟฟ้า,22,296,11,18 มิถุนายน 2562 เวลา 15:20:30 น.
50,1014310072,14010059,310072,วัดทองทรงธรรม (สามัคคีนฤมิต),thongsongthum,-,อนุบาล-ประถมศึกษา,,หมู่ 2 คลองสะแกใต้,คลองสะแก,นครหลวง,พระนครศรีอยุธยา,13260,thongsongthum@hotmail.com,soc-ay1.aru.ac.th/14101373/,คลองสะแก,0-3577-9209,0-3577-9209,2477,16,10,ขนาดเล็ก,มีไฟฟ้า,4,0,0,25 มิถุนายน 2562 เวลา 13:24:59 น.
51,1014310059,14010060,310059,วัดมเหยงค์,Watmahaeyong School,นายอรรถพล บุตะมะ,อนุบาล-ประถมศึกษา,,หมู่ 7 ไผ่หนอง,ท่าช้าง,นครหลวง,พระนครศรีอยุธยา,13260,watmahaeyong53@gmail.com,data.bopp-obec.info/web/index_view.php?School_ID=1014310059&page=info,เทศบาลตำบลอรัญญิก,0-3576-1245,-,26 ตุลาคม 2488,30,11,ขนาดกลาง,มีไฟฟ้า,16,288,9,18 มิถุนายน 2562 เวลา 09:14:59 น.
52,1014310060,14010061,310060,วัดน้อย (วิเชียรสร้อยเกลียวอุปถัมภ์),WATNOI,นายชำนิ พิมพาภรณ์,อนุบาล-ประถมศึกษา,,หมู่ 4 ท่าช้างเหนือ,ท่าช้าง,นครหลวง,พระนครศรีอยุธยา,13260,atirat2@hotmail.com,www.watnoi.ac.th,อรัญญิก,35761485,35761485,8 กรกฎาคม 2466,30,10,ขนาดกลาง,มีไฟฟ้า,12,159,8,24 มิถุนายน 2562 เวลา 20:56:37 น.
53,1014310066,14010063,310066,นครหลวง (พิบูลประเสริฐวิทย์),Nakhonluang Piboonprasertwit,นายแทน เฉลยไตร,อนุบาล-ประถมศึกษา,,หมู่ 2 บ้านมอญ,นครหลวง,นครหลวง,พระนครศรีอยุธยา,13260,pibool2471@gmail.com,n-piboon.com,นครหลวง,0-3525-9480,0-3535-9509,2471,30,1,ขนาดใหญ่,มีไฟฟ้า,29,636,20,25 มิถุนายน 2562 เวลา 11:13:48 น.
54,1014310073,14010065,310073,วัดโพธิ์ทอง (วาสนานุกูล),Watpotongschool,นางสาวกนกรัตน์ ฤทธิไชยกูล,อนุบาล-ประถมศึกษา,,หมู่ 3 ต้นโพธิ์,บ่อโพง,นครหลวง,พระนครศรีอยุธยา,13260,wutjam2609@.obecmail.obec.go.th,www.watpotong.com,บ่อโพง,0-3536-4918,0-3536-4918,2484,25,20,ขนาดเล็ก,มีไฟฟ้า,9,86,8,01 มิถุนายน 2562 เวลา 12:19:03 น.
55,1014310074,14010066,310074,วัดราษฎร์บำเพ็ญ (กริ่ง สง่า อุปภัมก์),WATRAJBUMPEN ( KRING SA-NGA SITOOPPATAM ) SCHOOL,นายสมศักดิ์ บุญฤทธิ์,อนุบาล-มัธยมศึกษาตอนต้น,,หมู่ 2 บ้านท่าวัด,บ่อโพง,นครหลวง,พระนครศรีอยุธยา,13260,rajbampen@thaimail.com,,บ่อโพง,0-3535-9519,,19 มิถุนายน 2466,15,12,ขนาดกลาง,มีไฟฟ้า,18,124,11,24 มิถุนายน 2562 เวลา 13:36:05 น.
56,1014310075,14010067,310075,วัดบ้านดาบ,Watbandarb,นายวีระยุทธ สิงหะหล้า,อนุบาล-ประถมศึกษา,,หมู่ 7 บ้านดาบ,บ่อโพง,นครหลวง,พระนครศรีอยุธยา,13260,bandaab@hotmail.com,,บ่อโพง,0-3576-4082,-,2477,13,10,ขนาดกลาง,มีไฟฟ้า,13,129,8,25 มิถุนายน 2562 เวลา 16:02:34 น.
57,1014310064,14010068,310064,วัดลาย (ทวีปัญญา),Watlay (Thawepanya),นางพรทิพย์ ไชยประณิธาน,อนุบาล-ประถมศึกษา,,หมู่ 2 บางพระครู,บางพระครู,นครหลวง,พระนครศรีอยุธยา,13260,Watlay@hotmail.com,facebook.com/Watlay16,นครหลวง,"0-3571-3111,0-3",,16 มิ.ย. 2486,50,10,ขนาดกลาง,มีไฟฟ้า,11,134,8,30 มิถุนายน 2560 เวลา 05:02:17 น.
58,1014310069,14010069,310069,วัดเรือแข่ง (ประชาอุปถัมภ์),WATRUAKANG,นางสาวปิยะกมล บุญศาสตร์,อนุบาล-ประถมศึกษา,,หมู่ 4 วัดเรือแข่ง,บางระกำ,นครหลวง,พระนครศรีอยุธยา,13260,,,นครหลวง,0-3535-9513,35359513,2467,18,3,ขนาดกลาง,มีไฟฟ้า,14,225,8,19 มิถุนายน 2562 เวลา 22:34:17 น.
59,1014310068,14010070,310068,วัดบ้านชุ้ง (อดุลประชาวิทย์),watbanchung shcool,นายสุทธิพงษ์ บุญประดับวงศ์,อนุบาล-มัธยมศึกษาตอนต้น,,หมู่ 6 บ้านชุ้ง,บ้านชุ้ง,นครหลวง,พระนครศรีอยุธยา,13260,,www.watbanchung.blogspot.com,บ้านชุ้ง,0-35760140,35760140,29 กรกฎาคม 2472,25,5,ขนาดกลาง,มีไฟฟ้า,17,269,11,25 มิถุนายน 2562 เวลา 21:14:52 น.
60,1014310070,14010071,310070,วัดละมุด (ร.ส.พ.ราษฎร์บํารุง),watlamood,นางดวงภัทร สุนิมิตร,อนุบาล-ประถมศึกษา,,หมู่ 2 ปากจั่น,ปากจั่น,นครหลวง,พระนครศรีอยุธยา,13260,watlamut_aya@hotmail.com,,ปากจั่น,0-3536-0953,,พ.ศ.2467,24,4,ขนาดกลาง,มีไฟฟ้า,13,148,8,26 พฤษภาคม 2560 เวลา 10:41:22 น.
61,1014310061,14010072,310061,วัดทอง (สามัคคยานุสรณ์),watthong,นายสุทธิพงษ์ บุญประดับวงศ์,อนุบาล-ประถมศึกษา,,หมู่ 2 พระนอนไทย,พระนอน,นครหลวง,พระนครศรีอยุธยา,13260,watthongschool@hotmail.com,,อรัญญิก,0-3576-1598,0-3576-1598,29พ.ค.2466,30,10,ขนาดเล็ก,มีไฟฟ้า,8,64,8,28 มิถุนายน 2562 เวลา 16:25:52 น.
62,1014310062,14010073,310062,วัดสำมะกัน (เปี่ยมวิทยาราษฎร์บำรุง),Watsammakan,นางสาวรุ้งทิพย์ ผดุงโภชน์,อนุบาล-ประถมศึกษา,,หมู่ 5 บ้านแม่ลา,แม่ลา,นครหลวง,พระนครศรีอยุธยา,13260,sammakan@hotmail.com,http://data.bopp-obec.info/web/index.php?School_ID=1014310062,แม่ลา,0-35-339262,,29 มิ.ย. 2482,25.7,ุ6,ขนาดเล็ก,มีไฟฟ้า,7,35,8,31 พฤษภาคม 2561 เวลา 11:02:38 น.
63,1014310063,14010074,310063,วัดปรีดาราม,Predaram,นางสุจิตรา ศิริสุรักษ์,อนุบาล-ประถมศึกษา,,หมู่ 3 แม่ลา,แม่ลา,นครหลวง,พระนครศรีอยุธยา,13260,watpree@hotmail.com,,แม่ลา,0-35339252,-,2485,25,5,ขนาดกลาง,มีไฟฟ้า,13,133,8,25 มิถุนายน 2561 เวลา 11:04:43 น.
64,1014310058,14010075,310058,วัดใหญ่ (สามไถผาสุขประเสริฐ),Watyai,นางกุลริศา สีเนหะ,อนุบาล-ประถมศึกษา,,หมู่ 2 สันเจ้า,สามไถ,นครหลวง,พระนครศรีอยุธยา,13260,neetap12@gmail.com,,อรัญญิก,0-3535-9501,,25 ก.ค. 2472,33,8,ขนาดเล็ก,มีไฟฟ้า,6,43,8,30 พฤษภาคม 2561 เวลา 12:55:58 น.
65,1014310076,14010076,310076,วัดมาบพระจันทร์ (รัฐบำรุงประชาวิทยา),WATMAPPRACHAN SCHOOL,นายไมตรี พรมภักดี,อนุบาล-ประถมศึกษา,,หมู่ 1 มาบพระจันทร์,หนองปลิง,นครหลวง,พระนครศรีอยุธยา,13260,mabprachan@hotmail.com,mapprachan@hotmail.com,หนองปลิง,35764342,35764342,30 ตุลาคม 2477,20,15,ขนาดกลาง,มีไฟฟ้า,12,149,8,22 มิถุนายน 2561 เวลา 13:38:45 น.
66,1014310077,14010077,310077,บ้านหนองโคก (อดุลถวิลราษฎร์บำรุง),Bannongkhok,-,อนุบาล-ประถมศึกษา,,หมู่ 3 หนองโคก,หนองปลิง,นครหลวง,พระนครศรีอยุธยา,13260,bannongkhok @ hot mail com.th,data.bopp-obec.info/web/?School_ID=1014310077,หนองปลิง,035-764270,,2510,32,7,ขนาดเล็ก,มีไฟฟ้า,3,0,0,04 มิถุนายน 2561 เวลา 14:49:45 น.
67,1014310175,14010078,310175,วัดจอมเกษ,watjomket school,นางสาวธารินี สุเพ็งคำ,อนุบาล-ประถมศึกษา,,หมู่ 2 ขยาย,ขยาย,บางปะหัน,พระนครศรีอยุธยา,13220,chatin707@gmail.com,data.bopp-obec.info/web/?School_ID=1014310175,โพธิ์สามต้น-ขยาย,-,-,2477,10,6,ขนาดเล็ก,มีไฟฟ้า,11,87,8,18 กันยายน 2562 เวลา 10:15:48 น.
68,1014310162,14010080,310162,วัดค่าย (เล็กจุฬาประชานุสรณ์),WATKAY ( LEKJULAPRACHANUSORN),นางสาวเขมนรินน์ สุขมะโน,อนุบาล-ประถมศึกษา,,หมู่ 1 บ้านค่าย,ขวัญเมือง,บางปะหัน,พระนครศรีอยุธยา,13220,lay_1234@windowslive.com,watkhaischool.circlecamp.com,บางปะหัน,0-3537-7479,-,2460,15,3,ขนาดกลาง,มีไฟฟ้า,13,188,8,18 มกราคม 2561 เวลา 12:53:35 น.
69,1014310155,14010081,310155,วัดตาลเอน (โศภนชนูปถัมภ์),wattan - en,นางสาวบัวพันธ์ ผิวทอง,อนุบาล-ประถมศึกษา,,หมู่ 1 ตาลเอน,ตาลเอน,บางปะหัน,พระนครศรีอยุธยา,13220,,http://data.bopp-obec.info/web/?School_ID=1014310155,บ้านขล้อ,0-3577-8534,,11 พฤศจิกายน 2476,20,7,ขนาดกลาง,มีไฟฟ้า,13,120,8,27 มิถุนายน 2560 เวลา 01:41:55 น.
70,1014310165,14010082,310165,วัดศรีภวังค์,WATSRIPAWANG,นายพิชิต แสงวาโท,อนุบาล-ประถมศึกษา,,หมู่ 1 คลองสาร,ทับน้ำ,บางปะหัน,พระนครศรีอยุธยา,13220,watsripawangschool@hotmail.com,,ทับน้ำ,,-,1 พฤศจิกายน 2483,20,6,ขนาดเล็ก,มีไฟฟ้า,7,51,8,17 มิถุนายน 2562 เวลา 15:11:53 น.
71,1014310166,14010083,310166,วัดผึ่งแดด (บุญสืบวิชชนูปถัมภ์),Watpuengdad,นางเรณู สีนิล,อนุบาล-ประถมศึกษา,,หมู่ 4 บ้านทับน้ำ,ทับน้ำ,บางปะหัน,พระนครศรีอยุธยา,13220,watpuengdad_1234@hotmail.com,-,อบต.ทับน้ำ,0-3573-5632,35780666,1/12/2477,16,6,ขนาดกลาง,มีไฟฟ้า,18,187,11,31 พฤษภาคม 2561 เวลา 13:26:13 น.
72,1014310156,14010084,310156,วัดทางกลาง (ประชาสามัคคีอุปถัมภ์),Wattangklang,นางสาวงามสม ไชยวุธ,อนุบาล-มัธยมศึกษาตอนต้น,,หมู่ 4 ทางกลาง,ทางกลาง,บางปะหัน,พระนครศรีอยุธยา,13220,tangklang_school@thaimail.com,data.bopp-obec.info/web/?School_ID=1014310156,เสาธง,0-3577-8055,0-3577-8055,29/06/2477,18,9,ขนาดกลาง,มีไฟฟ้า,17,149,11,11 ตุลาคม 2561 เวลา 12:51:47 น.
73,1014310178,14010085,310178,วัดพระงาม,Watprangam,นายวิรัช จันทร์ศักดิ์,อนุบาล-ประถมศึกษา,,หมู่ 1 พระงาม,บางเดื่อ,บางปะหัน,พระนครศรีอยุธยา,13220,0,,บางเดื่อ,0-35377277,0,25 กรกฎาคม 2484,15,7,ขนาดกลาง,มีไฟฟ้า,11,156,8,04 มิถุนายน 2562 เวลา 19:24:53 น.
74,1014310179,14010086,310179,วัดบางเดื่อ,WATBANGDUE SCHOOL,นางสาวสมบูรณ์ แก้วสุวรรณ์,อนุบาล-มัธยมศึกษาตอนต้น,,หมู่ 5 บางเดื่อ,บางเดื่อ,บางปะหัน,พระนครศรีอยุธยา,13220,watbangdueschool@gmail.com,,บางเดื่อ,0,0,2482,15,6,ขนาดกลาง,มีไฟฟ้า,20,240,11,22 มกราคม 2561 เวลา 09:29:38 น.
75,1014310164,14010087,310164,วัดโตนด (บุญชื่นอุปถัมภ์),Wat Tanod,นางสาวอรอุมา ขันธพาลี,อนุบาล-ประถมศึกษา,,หมู่ 5 บางนางร้า,บางนางร้า,บางปะหัน,พระนครศรีอยุธยา,13220,on_line695@hotmail.com,-,ตานิม,0-3530-1728,-,2518,20,3,ขนาดเล็ก,มีไฟฟ้า,6,46,7,17 มิถุนายน 2562 เวลา 09:31:55 น.
76,1014310173,14010088,310173,วัดเทพอุปการาม(อุป อุ่นพัฒนาประชาสรรค์),wattepupakaram,-,อนุบาล-ประถมศึกษา,,หมู่ 2 ตานิม,ตานิม,บางปะหัน,พระนครศรีอยุธยา,13220,wattepupakaram@gmil.com,http://data.bopp-obec.info/emis/index.php,?????,035-777-299,035-777-299,29 กรกฏาคม 2477,12,7,ขนาดเล็ก,มีไฟฟ้า,6,85,8,16 ตุลาคม 2561 เวลา 09:50:41 น.
77,1014310174,14010089,310174,วัดเกาะเลิ่ง,watkaoleang,-,อนุบาล-ประถมศึกษา,,หมู่ 1 เกาะเลิ่ง,บางปะหัน,บางปะหัน,พระนครศรีอยุธยา,13220,wonderfull2904@hotmail.com,-,บางปะหัน,-,,11/09/2476,15,5,ขนาดเล็ก,มีไฟฟ้า,8,76,8,04 ตุลาคม 2562 เวลา 20:56:15 น.
78,1014310159,14010091,310159,วัดนาค,Watnak,นายสามารถ กองโชค,อนุบาล-ประถมศึกษา,,หมู่ 7 วัดนาค,บางปะหัน,บางปะหัน,พระนครศรีอยุธยา,13220,,watnakschool.ac.th,บางปะหัน,35381497,35381497,5 กรกฎาคม 2474,8,2,ขนาดใหญ่,มีไฟฟ้า,25,506,19,05 มิถุนายน 2561 เวลา 09:58:20 น.
79,1014310154,14010092,310154,วัดบางเพลิง (คงสกุลมากอุทิศ),Bangpierng,-,อนุบาล-ประถมศึกษา,,หมู่ 3 บางเพลิง,บางเพลิง,บางปะหัน,พระนครศรีอยุธยา,13220,snidnois16@hotmail.com,,บางเพลิง,"0-3538-1497,0-3",,19/06/2482,15,4,ขนาดเล็ก,มีไฟฟ้า,3,43,8,17 มิถุนายน 2562 เวลา 14:14:36 น.
80,1014310153,14010093,310153,วัดแก้วตา,Watkeawta,-,อนุบาล-ประถมศึกษา,,หมู่ 1 แก้วตา,บางเพลิง,บางปะหัน,พระนครศรีอยุธยา,13220,deelert555@gmail.com,,บ้านขล้อ,0-3571-0629,-,23 พฤษภาคม 2512,20,7,ขนาดเล็ก,มีไฟฟ้า,4,94,8,18 มิถุนายน 2562 เวลา 09:15:18 น.
81,1014310151,14010094,310151,ชุมชนวัดโขดเขมาราม(ประชาประเสริฐวิทย์),Chumchon Watkhod Kamaram,นางสาวอรุณีย์ จันทร์เสวก,อนุบาล-มัธยมศึกษาตอนต้น,,หมู่ 2 บ้านขล้อ,บ้านขล้อ,บางปะหัน,พระนครศรีอยุธยา,13220,watkhod.sc@gmail.com,data.bopp-obec.info/emis/editschooldata.php?School_ID=1014310151,บ้านขล้อ,0-3577-6262,0-3577-6262,2471,23,12,ขนาดกลาง,มีไฟฟ้า,17,154,11,07 ตุลาคม 2562 เวลา 10:28:40 น.
82,1014310167,14010095,310167,วัดบ้านม้า,watbanma,นางสาวปิยนันท์ แววนิลานนท์,อนุบาล-ประถมศึกษา,,หมู่ 3 บ้านม้า,บ้านม้า,บางปะหัน,พระนครศรีอยุธยา,13220,,,อบต.ทับน้ำ,0-3577-7615,,15 พฤศจิกายน 2470,15,5,ขนาดเล็ก,มีไฟฟ้า,6,92,8,12 มิถุนายน 2562 เวลา 10:26:53 น.
83,1014310168,14010096,310168,วัดโพธิ์ทอง,pothong school,นายไพรวรรณ ใจเสงี่ยม,อนุบาล-ประถมศึกษา,,หมู่ 1 บ้านป่า,บ้านม้า,บางปะหัน,พระนครศรีอยุธยา,13220,-,-,ทับน้ำ,0-3577-7581,-,17/05/2482,15,9,ขนาดกลาง,มีไฟฟ้า,13,130,9,26 มิถุนายน 2562 เวลา 10:43:14 น.
84,1014310157,14010097,310157,วัดอินกัลยา,Wutinkanlaya,นายเสรี ตั้งเจริญ,อนุบาล-ประถมศึกษา,,หมู่ 1 บ้านลี่,บ้านลี่,บางปะหัน,พระนครศรีอยุธยา,13220,,www.inkanlaya.com,บ้านลี่,0-3577-7581,,24 มิถุนายน 2499,12,2,ขนาดกลาง,มีไฟฟ้า,12,173,8,17 มิถุนายน 2562 เวลา 12:27:10 น.
85,1014310158,14010098,310158,วัดประมุง (แจ่มราษฎร์รังสรรค์),watpramung,ดร.สุกฤษฎิ์ มายุศิริ,อนุบาล-ประถมศึกษา,,หมู่ 3 บ้านลี่,บ้านลี่,บางปะหัน,พระนครศรีอยุธยา,13220,pramungschool@yahoo.co.th,http://data.bopp-obec.info/emis/editschooldata.php,บ้านลี่,35377103,35377103,11 เมษายน 2478,10,3.5,ขนาดเล็ก,มีไฟฟ้า,9,97,8,11 มิถุนายน 2562 เวลา 14:33:47 น.
86,1014310176,14010099,310176,วัดนนทรีย์,WATNONTHREE,นางสาวยุวดี พันธ์สุจริต,อนุบาล-ประถมศึกษา,,หมู่ 8 นนทรีย์,พุทเลา,บางปะหัน,พระนครศรีอยุธยา,13220,,,พุทเลา,35789211,35780211,7 พ.ค. 2472,5,4,ขนาดเล็ก,มีไฟฟ้า,9,88,8,01 มิถุนายน 2562 เวลา 10:37:26 น.
87,1014310177,14010100,310177,วัดโคก (ธูปะเตมีย์อุปถัมภ์),watkhok,นางสาวประภาพร ยอดย้อย,อนุบาล-ประถมศึกษา,,หมู่ 4 พุทเลา,พุทเลา,บางปะหัน,พระนครศรีอยุธยา,13220,-,-,พุทเลา,0-3578-0228,-,24 สิงหาคม 2483,3,5,ขนาดเล็ก,มีไฟฟ้า,5,45,8,18 มิถุนายน 2562 เวลา 07:43:10 น.
88,1014310181,14010102,310181,วัดโพธิ์หอม,Wat Pho Hom School,นางสุรชา เขาแก้ว,อนุบาล-ประถมศึกษา,,หมู่ 3 โพธิ์สามต้น,โพธิ์สามต้น,บางปะหัน,พระนครศรีอยุธยา,13220,ditmusix@hotmail.com,www.facebook.com/wadphohom,โพธิ์สามต้น,0-3575-0061,,7 กันยายน 2477,8,7,ขนาดเล็ก,มีไฟฟ้า,8,95,9,30 มิถุนายน 2560 เวลา 06:43:23 น.
89,1014310182,14010103,310182,วัดดาวคะนอง,WatDaoKhanong,นายบรรจง ผาสุข,อนุบาล-มัธยมศึกษาตอนต้น,,หมู่ 1 โพธิ์สามต้น,โพธิ์สามต้น,บางปะหัน,พระนครศรีอยุธยา,13220,waewni@gmail.com,http://www.facebook.com/pages/%E0%B9%82%E0%B8%A3%E0%B8%87%E0%B9%80%E0%B8%A3%E0%B8%B5%E0%B8%A2%E0%B8%99%E0%B8%A7%E0%B8%B1%E0%B8%94%E0%B8%94%E0%B8%B2%E0%B8%A7%E0%B8%84%E0%B8%B0%E0%B8%99%E0%B8%AD%E0%B8%87-%E0%B8%AD%E0%B8%A2%E0%B8%B8%E0%B8%98%E0%B8%A2%E0%B8%B,โพธิ์สามต้น,0-3573-6359,-,21 มิถุนายน,9,15,ขนาดกลาง,มีไฟฟ้า,13,150,11,31 พฤษภาคม 2561 เวลา 08:43:53 น.
90,1014310152,14010104,310152,วัดเสาธงเก่า (ถึงสุขประชาสรรค์),Wat Saothongkao,นางสาวถาวร พรสิงห์,อนุบาล-ประถมศึกษา,,หมู่ 2 เสาธงเก่า,เสาธง,บางปะหัน,พระนครศรีอยุธยา,13220,wadsouton@thaimail.com,data.bopp-obec.info/web/index.php?School_ID=1014310152,เสาธง,0-3577-7104,,13/05/2472,15,5.3,ขนาดเล็ก,มีไฟฟ้า,12,107,8,27 มิถุนายน 2561 เวลา 07:52:49 น.
