91,1014310171,14010106,310171,วัดดอกไม้,WATDOKMAI,-,อนุบาล-ประถมศึกษา,,หมู่ 2 บ้านแจ้ง,หันสัง,บางปะหัน,พระนครศรีอยุธยา,13220,watdokmaischool@hotmail.com,soc-ay1.aru.ac.th/14102470/,หันสัง,035-333717,,2 พฤษภาคม พ.ศ. 2495,15,5,ขนาดเล็ก,มีไฟฟ้า,6,40,7,26 มิถุนายน 2562 เวลา 13:46:19 น.
92,1014310170,14010109,310170,วัดไก่,watkai,นางฐานิษตา สีหนาท,อนุบาล-ประถมศึกษา,,หมู่ 3 บ้านแจ้ง,หันสัง,บางปะหัน,พระนครศรีอยุธยา,13220,,www.watkai.ac.th,หันสัง,0-3538-9217,-,11052482,10,5,ขนาดกลาง,มีไฟฟ้า,14,122,8,23 มิถุนายน 2562 เวลา 17:32:19 น.
93,1014310244,14010110,310244,วัดพระแก้ว โสภณประสิทธิ์วิทยาคาร,Wat Phakaew school,-,อนุบาล-ประถมศึกษา,,หมู่ 6 -,กระจิว,ภาชี,พระนครศรีอยุธยา,13140,-,-,กระจิว,0-35 77-3319,35773319,-,35,10,ขนาดเล็ก,มีไฟฟ้า,19,336,11,17 มิถุนายน 2562 เวลา 13:57:33 น.
94,1014310262,14010112,310262,ชุมชนโคกม่วงเผอิญศรีภูธรอุปถัมภ์,Chumchon Khokmuang Pa-ensriputhon Upatham,นายวุฒิ สอนคง,อนุบาล-ประถมศึกษา,,หมู่ 1 โคกม่วง,โคกม่วง,ภาชี,พระนครศรีอยุธยา,13140,khokmuang@gmail.com,,โคกม่วง,35750199,35750199,1 สิงหาคม พ.ศ. 2481,36,3,ขนาดกลาง,มีไฟฟ้า,12,152,8,06 มกราคม 2563 เวลา 13:45:11 น.
95,1014310263,14010113,310263,วัดโคกกรวด,Kokgrud,นายพัฒน์พงษ์ นาสมใจ,อนุบาล-ประถมศึกษา,,หมู่ 12 โคกกรวด,โคกม่วง,ภาชี,พระนครศรีอยุธยา,13140,,,โคกม่วง,"0-3531-2240,0-3",,พ.ศ.2481,40.8,5.9,ขนาดเล็ก,มีไฟฟ้า,8,66,8,10 มิถุนายน 2562 เวลา 07:11:24 น.
96,1014310264,14010114,310264,วัดโคกสังข์,watkhoksang prachanugoon,นางรวีวรรณ ลี้เจริญ,อนุบาล-ประถมศึกษา,,หมู่ 7 โคกสังข์,โคกม่วง,ภาชี,พระนครศรีอยุธยา,13140,khoksang@gmail.com,http://data.bopp-obec.info/web/?School_ID=1014310264,โคกม่วง,0-3531-2265,-,พ.ศ.2481,35,4,ขนาดเล็ก,มีไฟฟ้า,7,76,8,19 กุมภาพันธ์ 2563 เวลา 12:45:11 น.
97,1014310265,14010115,310265,บ้านดอนข่อย,Bandonkhoi school,นายทรงชัย เลิศวัฒนาพร,อนุบาล-มัธยมศึกษาตอนต้น,,หมู่ 10 ดอนข่อย,โคกม่วง,ภาชี,พระนครศรีอยุธยา,13140,-,https://data.bopp-obec.info/web/?School_ID=1014310265,โคกม่วง,0-3577-4206,0-3577-4206,19 ธันวาคม 2503,40,5,ขนาดกลาง,มีไฟฟ้า,17,229,11,22 มิถุนายน 2562 เวลา 22:52:28 น.
98,1014310252,14010116,310252,ตะโกดอนหญ้านาง,Tagodonyanang,นางสาวจิราภรณ์ เทพกรรณ์,อนุบาล-มัธยมศึกษาตอนต้น,,หมู่ 2 ตะโก,ดอนหญ้านาง,ภาชี,พระนครศรีอยุธยา,13140,takhopachi@gmail.com,,ดอนหญ้านาง,35774079,35774079,1 กุมภาพันธ์ 2515,35,10,ขนาดกลาง,มีไฟฟ้า,16,224,11,26 พฤษภาคม 2560 เวลา 10:39:25 น.
99,1014310242,14010119,310242,วัดภาชี,watphachi,นายวัชรินทร์ ภูมิโคกรักษ์,อนุบาล-ประถมศึกษา,,หมู่ 5 บ้านนายี่,ไผ่ล้อม,ภาชี,พระนครศรีอยุธยา,13140,Phachi.school@hotmail.com,,นอกเขตเทศบาล,0-3577-2354,0-3577-2354,1พฤษภาคม2460,30,1.5,ขนาดกลาง,มีไฟฟ้า,13,194,8,27 มกราคม 2563 เวลา 13:20:27 น.
100,1014310249,14010121,310249,วัดนาอุ่น,Watnaoun School,นางเกตุชญา วงษ์เพิก,อนุบาล-ประถมศึกษา,,หมู่ 4 ไผ่ล้อม,ไผ่ล้อม,ภาชี,พระนครศรีอยุธยา,13140,,,ไผ่ล้อม,0-35772251,,7 สิงหาคม 2472,30,8,ขนาดเล็ก,มีไฟฟ้า,9,107,8,20 มิถุนายน 2561 เวลา 16:32:12 น.
101,1014310248,14010122,310248,วัดหัวคุ้ง,Wathuakung School,นางสาวสุนิษา สัมฤทธิ์,อนุบาล-ประถมศึกษา,,หมู่ 10 บ้านครัว,ไผ่ล้อม,ภาชี,พระนครศรีอยุธยา,13140,wathukung@hotmail.com,www.wathuakung.ac.th,ไผ่ล้อม,09-44432682,-,21 ธันวาคม 2477,40,10,ขนาดเล็ก,มีไฟฟ้า,10,97,8,23 มิถุนายน 2562 เวลา 20:03:16 น.
102,1014310246,14010124,310246,วัดหนองบัว,WATNONGBUA,นางสาวเสาวคนธ์ เจริญมังษา,อนุบาล-ประถมศึกษา,,หมู่ 5 หนองบัว,พระแก้ว,ภาชี,พระนครศรีอยุธยา,13140,watnongbua59@gmail.com,,องค์การบริหารส่วนตำบลพระแก้ว,035-775080,35775080,22 มิ.ย. 2468,25,10,ขนาดกลาง,มีไฟฟ้า,8,124,8,12 สิงหาคม 2562 เวลา 19:22:11 น.
103,1014310251,14010125,310251,วัดอุทการาม,WATAUTHAKARAM,นายทองดี ทองทา,อนุบาล-ประถมศึกษา,,หมู่ 4,ภาชี,ภาชี,พระนครศรีอยุธยา,13140,authakaram@gmail.com,-,ภาชี,035-311282,-,2509,37,1,ขนาดเล็ก,มีไฟฟ้า,10,106,8,05 มิถุนายน 2562 เวลา 13:20:54 น.
104,1014310243,14010126,310243,วัดเจริญธรรม เผอิญศรีภูธรอุปถัมภ์,Charoentham school,นายวัชรวิทย์ ครุรัฐปิยสกุล,อนุบาล-ประถมศึกษา,,หมู่ 3 บ้านวัด,ภาชี,ภาชี,พระนครศรีอยุธยา,13140,-,http://data.bopp-obec.info/web/?School_ID=1014310243,เทศบาลตำบลภาชี,0-3531-1281,35311281,2472,35,3,ขนาดกลาง,มีไฟฟ้า,20,330,10,26 พฤษภาคม 2560 เวลา 10:46:06 น.
105,1014310257,14010127,310257,ชุมชนวัดระโสม,rasom community school,นายปฏิญญา ไตรพรหม,อนุบาล-มัธยมศึกษาตอนต้น,,หมู่ 6 บ้านระโสม,ระโสม,ภาชี,พระนครศรีอยุธยา,13140,krupatinya@hotmail.com,,ระโสม,923135544,-,13 กรกฎาคม 2477,34,8,ขนาดกลาง,มีไฟฟ้า,19,209,11,11 ตุลาคม 2561 เวลา 10:51:04 น.
106,1014310258,14010128,310258,วัดมาบโพธิ์,watmappho,นายรัชชานนท์ สินด้ายดำ,อนุบาล-ประถมศึกษา,,หมู่ 4 บ้านมาบโพธิ์,ระโสม,ภาชี,พระนครศรีอยุธยา,13140,,,ระโสม,"0-3636-3018,0-3",,2485,50,20,ขนาดเล็ก,มีไฟฟ้า,8,68,8,21 มิถุนายน 2562 เวลา 12:25:09 น.
107,1014310259,14010129,310259,วัดผดุงธรรม,watphadungtham,-,อนุบาล-ประถมศึกษา,,หมู่ 2 บ้านใหม่,ระโสม,ภาชี,พระนครศรีอยุธยา,13140,phadungtham2010@hotmail.com,www.facebook.com/watphadungthamschool/,อบต. ระโสม,,,2480,40,12,ขนาดกลาง,มีไฟฟ้า,10,146,8,25 มิถุนายน 2562 เวลา 16:53:51 น.
108,1014310260,14010130,310260,วัดหนองนาง,nongnang,นายภาณุมาศ ตามเพิ่ม,อนุบาล-ประถมศึกษา,,หมู่ 9 หนองนาง,ระโสม,ภาชี,พระนครศรีอยุธยา,13140,nongnang@school,,ระโสม,0-35-750-085,-,26 ธันวาคม 2482,41,7.3,ขนาดกลาง,มีไฟฟ้า,11,134,8,12 มกราคม 2560 เวลา 12:28:58 น.
109,1014310255,14010133,310255,วัดหนองเป้า,Watnongpao,นางสาวภรณี พนิรัมย์,อนุบาล-ประถมศึกษา,,หมู่ 1 หนองเป้า,หนองน้ำใส,ภาชี,พระนครศรีอยุธยา,13140,,,หนองน้ำใส,"0-3531-1356,0-3",-,-,50,5,ขนาดกลาง,มีไฟฟ้า,15,174,8,11 ตุลาคม 2561 เวลา 22:50:30 น.
110,1014310322,14010134,310322,วัดธรรมจริยา,wattamajariya,นางศิริวรรณ พรหมกสิกร,อนุบาล-มัธยมศึกษาตอนต้น,,หมู่ 2 คลองสิบ,ข้าวงาม,วังน้อย,พระนครศรีอยุธยา,13170,,wattamajariya.com,ข้าวงาม,"0-357-99-548,0-35750074",35799548,15/12/2477,45,12,ขนาดกลาง,มีไฟฟ้า,16,297,11,21 มิถุนายน 2562 เวลา 15:38:58 น.
111,1014310308,14010135,310308,วัดศรีประชา,watsripracha,นางกุสุมา ยี่ภู่,อนุบาล-ประถมศึกษา,,หมู่ 1 บัวชม,ชะแมบ,วังน้อย,พระนครศรีอยุธยา,13170,sripracha2019@gmail.com,,ชะแมบ,35257259,35257259,2503,25,5,ขนาดใหญ่,มีไฟฟ้า,34,565,18,18 มิถุนายน 2562 เวลา 15:12:02 น.
112,1014310309,14010136,310309,วัดวงษ์สวรรค์,Wat Wong Sawan,นางสาวกฎพร ไกรมงคลประชา,อนุบาล-ประถมศึกษา,,หมู่ 4 คลอง 27,ชะแมบ,วังน้อย,พระนครศรีอยุธยา,13170,-,www.facebook.com/watwongsawanschool,ชะแมบ,-,-,17กรกฎาคม 2477,45,10,ขนาดเล็ก,มีไฟฟ้า,7,81,8,01 มิถุนายน 2562 เวลา 10:38:17 น.
113,1014310310,14010137,310310,กลางคลอง 27,Klangklong27,นางน้ำอ้อย เมืองนาคิน,อนุบาล-ประถมศึกษา,,หมู่ 3 คลอง 27,ชะแมบ,วังน้อย,พระนครศรีอยุธยา,13170,,,ชะแมบ,0-3535-5040,,9 มิ.ย. 2483,40,10,ขนาดกลาง,มีไฟฟ้า,10,136,9,17 มิถุนายน 2562 เวลา 09:08:34 น.
114,1014310325,14010138,310325,วัดยมนาตามธรรม,watyormanatamthum,นางสาวอุไลย รัตนพันธ์,อนุบาล-ประถมศึกษา,,หมู่ 2 คลองแขก,ชะแมบ,วังน้อย,พระนครศรีอยุธยา,13170,-,-,ชะแมบ,0-35902487,-,29/11/2442,25,5,ขนาดกลาง,มีไฟฟ้า,14,147,9,28 มิถุนายน 2560 เวลา 07:02:11 น.
115,1014310326,14010139,310326,สุวพรรณสนิทวงศ์พิทยา,Suwapan Sanitwong Pittaya,ดร.ฮินดล เดชเสถียร,อนุบาล-ประถมศึกษา,,หมู่ 2 คลองแขก,ชะแมบ,วังน้อย,พระนครศรีอยุธยา,13170,swp10139@hotmail.com,suwapan.ac.th,องค์การบริหารส่วนตำบลชะแมบ,094-5598592,,25 พฤษภาคม 2481,42,7,ขนาดกลาง,มีไฟฟ้า,15,224,9,10 มิถุนายน 2562 เวลา 13:06:28 น.
116,1014310314,14010140,310314,วัดสุคันธาราม (สุคันธวิทยาคาร),Watsukantaram (Sukantawittayakan),นายธนศักดิ์ เปาริก,อนุบาล-มัธยมศึกษาตอนต้น,,หมู่ 6 เสาวังคา,บ่อตาโล่,วังน้อย,พระนครศรีอยุธยา,13170,,,บ่อตาโล่,0-3526-9466,0-3526-9466,12 ก.ค. 2477,30,13,ขนาดกลาง,มีไฟฟ้า,27,459,15,25 พฤษภาคม 2560 เวลา 10:48:22 น.
117,1014310316,14010141,310316,บ้านสร้าง (สำริต ภู่เงิน อนุสรณ์),Bansang,นางประคอง ฐิตะสุต,อนุบาล-ประถมศึกษา,,หมู่ 2 -,บ่อตาโล่,วังน้อย,พระนครศรีอยุธยา,13170,,,บ่อตาโล่,0-3525-4013,,5 พ.ค. 2483,30,10,ขนาดเล็ก,มีไฟฟ้า,8,126,8,09 มิถุนายน 2562 เวลา 15:07:35 น.
118,1014310317,14010142,310317,บ้านบ่อตาโล่,Babotalo,นายคณิต ไผ่พูล,อนุบาล-ประถมศึกษา,,หมู่ 4 บ่อตาโล่,บ่อตาโล่,วังน้อย,พระนครศรีอยุธยา,13170,Banbotalo M.4@Gmail.com,http://www.thai-school.net/banbotalo,บ่อตาโล่,0-3527-5010,35275010,24 มิ.ย. 2483,18,5,ขนาดกลาง,มีไฟฟ้า,12,170,8,20 มิถุนายน 2561 เวลา 14:02:48 น.
119,1014310318,14010143,310318,วัดห้วยจระเข้ (เกตุอร่ามอุปถัมภ์),Huayjorakhae,นางสาวนปภา สิงโพธิ์ทอง,อนุบาล-ประถมศึกษา,,หมู่ 9 ห้วยจระเข้,บ่อตาโล่,วังน้อย,พระนครศรีอยุธยา,13170,,,บ่อตาโล่,927178911,,1 พฤษภาคม 2482,35,7,ขนาดเล็ก,มีไฟฟ้า,9,63,8,17 มิถุนายน 2562 เวลา 14:08:04 น.
120,1014310319,14010144,310319,มุสลิมบำรุง,musalimbumrung,นางสาวณรงลักษณ์ บาลมล,อนุบาล-ประถมศึกษา,,หมู่ 5 รางน้ำใส,บ่อตาโล่,วังน้อย,พระนครศรีอยุธยา,13170,saranya03377@gmail.com,musalim.net,บ่อตาโล่,0-3527-1797,-,2498,30,10,ขนาดกลาง,มีไฟฟ้า,13,188,8,19 มิถุนายน 2562 เวลา 20:53:35 น.
121,1014310315,14010145,310315,วัดศิวาราม,watsiwaram,นายศรีจันทร์ ปัสสาคำ,อนุบาล-ประถมศึกษา,,หมู่ 5 -,บ่อตาโล่,วังน้อย,พระนครศรีอยุธยา,13170,Watsiwaramschool@gmail.com,-,บ่อตาโล่,0-3575-0317,0-3575-0317,14 กันยายน 2480,27,5,ขนาดกลาง,มีไฟฟ้า,19,241,11,26 มิถุนายน 2562 เวลา 10:28:01 น.
122,1014310324,14010146,310324,พระอินทร์ศึกษา (กล่อมสกุลอุทิศ),Prainsuksa Klomsakul Utid School,ว่าที่ร้อยตรี ดร.คุณาวุฒิ เดชเสถียร,อนุบาล-มัธยมศึกษาตอนปลาย,,หมู่ 5 ประตูน้ำพระอินทร์,พยอม,วังน้อย,พระนครศรีอยุธยา,13180,prainsuksaschool2@gmail.com,prainsuksa.ac.th,พยอม,0-3536-1228,-,2500,45,18,ขนาดใหญ่พิเศษ,มีไฟฟ้า,93,1727,56,02 กรกฎาคม 2562 เวลา 20:34:45 น.
123,1014310333,14010147,310333,วัดพะยอม,WADPAYOM,นางจุฑามณี เมยมงคล,อนุบาล-ประถมศึกษา,,หมู่ 4 วัดพะยอม คลองสอง,พยอม,วังน้อย,พระนครศรีอยุธยา,13170,wadpayom@hotmail.com,http://www.wpyschool.ac.th,พยอม,0-3570-0872,0-3570-0872,พ.ศ.2477,45,20,ขนาดกลาง,มีไฟฟ้า,15,201,9,18 มิถุนายน 2562 เวลา 08:41:22 น.
124,1014310334,14010148,310334,ชลประทานอนุเคราะห์,CHONPRATAN ANUKROH,นางจุไรรัตน์ เอิบกมล,อนุบาล-มัธยมศึกษาตอนต้น,,หมู่ 5 ประตูน้ำพระอินทร์,พยอม,วังน้อย,พระนครศรีอยุธยา,13170,cholpratan@hotmail.com,http://school.obec.go.th/chol/ https://cholpratananukroh.wixsite.com/aya1,พยอม,0-3536-1330,0-3536-1330,18 สิงหาคม 2497,50,15,ขนาดใหญ่,มีไฟฟ้า,41,773,24,03 เมษายน 2562 เวลา 10:42:06 น.
125,1014310320,14010149,310320,วัดบ้านช้าง,watbanchang school,นายชาญชัย ศาลาจันทร์,อนุบาล-มัธยมศึกษาตอนต้น,,หมู่ 10 ลำตาเสา,ลำตาเสา,วังน้อย,พระนครศรีอยุธยา,13170,,,ลำตาเสา,0-3527-5002,35275002,15 กรกฏาคม 2477,25,10,ขนาดกลาง,มีไฟฟ้า,19,217,11,21 พฤษภาคม 2562 เวลา 08:20:22 น.
126,1014310321,14010150,310321,บ้านกะทุ่มลาย,Ban Krathum Lai School,นางชะโลม คุ้มวงษ์,อนุบาล-ประถมศึกษา,,หมู่ 12 ไดนกยาง,ลำตาเสา,วังน้อย,พระนครศรีอยุธยา,13170,,https://data.bopp-obec.info/web/?School_ID=1014310321,เทศบาลเมืองตำบลลำตาเสา,0-3527-5309,,1 กรกฎาคม 2483,18,7,ขนาดเล็ก,มีไฟฟ้า,10,137,9,18 พฤษภาคม 2562 เวลา 14:08:41 น.
127,1014310323,14010151,310323,วังน้อยวิทยาภูมิ,wangnoiwittayapum,นายอำพล โงวรรณ,อนุบาล-มัธยมศึกษาตอนต้น,,หมู่ 4 นราวัลย์,ลำตาเสา,วังน้อย,พระนครศรีอยุธยา,13170,mai9040@gmail.com,wangnoiwit.ac.th/,ลำตาเสา,0-3527-1290,35271118,25/12/2476,30,2,ขนาดใหญ่,มีไฟฟ้า,51,963,32,20 มิถุนายน 2562 เวลา 08:28:29 น.
128,1014310313,14010152,310313,จรูญกิมลี้กิจจาทรอนุสรณ์,JAROONKIMLEEKITJATRONANUSORN,นายบุญเลิศ เพชรมณี,อนุบาล-มัธยมศึกษาตอนต้น,,หมู่ 1 วัดตาดง,ลำตาเสา,วังน้อย,พระนครศรีอยุธยา,13170,-,www.Thai-School.nec/Jaroon,ลำตาเสา,0-3579-9218,0-3579-9218,13/07/2447,35,8,ขนาดกลาง,มีไฟฟ้า,19,228,11,13 มิถุนายน 2561 เวลา 10:31:47 น.
129,1014310327,14010153,310327,วัดลาดทราย,Watladsai,นางสุวิมล เปลื้องกระโทก,อนุบาล-ประถมศึกษา,,หมู่ 4 ลาดทราย,ลำไทร,วังน้อย,พระนครศรีอยุธยา,13170,ladsai_sch@msn.com,-,ลำไทร,35271935,035 - 271935,9 ต.ค. 2477,35,7,ขนาดกลาง,มีไฟฟ้า,12,308,8,25 ตุลาคม 2562 เวลา 09:07:36 น.
130,1014310328,14010154,310328,วัดกุฎีประสิทธิ์,Watkudeeprasit,นางมณฑา รักธรรม,อนุบาล-ประถมศึกษา,,หมู่ 1 บ้านหัวคลอง,ลำไทร,วังน้อย,พระนครศรีอยุธยา,13170,,www.kudeprasit.com,ลำไทร,"0-3574-4934, 0-",,11/07/2477,30,14,ขนาดกลาง,มีไฟฟ้า,13,130,8,31 พฤษภาคม 2561 เวลา 10:18:58 น.
131,1014310329,14010155,310329,วัดลำพระยา (แช่มช้อยวิทยา),Lampraya,-,อนุบาล-มัธยมศึกษาตอนต้น,,หมู่ 4 คลองแปด,วังจุฬา,วังน้อย,พระนครศรีอยุธยา,13170,Watlampraya.school@gmail.com,data.bopp-obec.info/web/?School_ID=1014310329,วังจุฬา,,,20 สิงหาคม 2477,25,8,ขนาดกลาง,มีไฟฟ้า,21,227,12,20 พฤศจิกายน 2561 เวลา 18:14:41 น.
132,1014310330,14010156,310330,วัดสว่างอารมณ์,Watsawang School,นายประจบ จันทะเวช,อนุบาล-ประถมศึกษา,,หมู่ 1 วังจุฬา,วังจุฬา,วังน้อย,พระนครศรีอยุธยา,13170,watsawang2555@gmail.com,www.watsawang.ac.th,วังจุฬา,35802038,35802038,-,33,10,ขนาดใหญ่,มีไฟฟ้า,38,702,24,25 มิถุนายน 2562 เวลา 10:58:22 น.
133,1014310331,14010157,310331,วัดมณฑลประสิทธิ์ (อาจธวัชประชานุกูล),watmonthonprasit,นางสาวดลภัคษร แสงฉวาง,อนุบาล-มัธยมศึกษาตอนต้น,,หมู่ 4 -,วังน้อย,วังน้อย,พระนครศรีอยุธยา,13170,-,data.bopp-obec.info/web/index_kru.php?School_ID=1014310331,วังน้อย,0-3527-2405,-,5 พฤศจิกายน 2481,25,5,ขนาดกลาง,มีไฟฟ้า,18,247,11,27 มิถุนายน 2562 เวลา 14:00:23 น.
134,1014310332,14010158,310332,สิทธิพยากรณ์,Sittipayagorn,นางสาวสุรารักษ์ มานะประสพสุข,อนุบาล-ประถมศึกษา,,หมู่ 6 คลองสี่,วังน้อย,วังน้อย,พระนครศรีอยุธยา,13170,,www.sittipayagron.com,วังน้อย,0-3575-0079,35750079,01/05/2483,38,8,ขนาดกลาง,มีไฟฟ้า,17,224,9,23 มกราคม 2563 เวลา 16:01:08 น.
135,1014310311,14010159,310311,คอตันคลอง 27,kotunklong27,นายวสันต์ แคดี,อนุบาล-ประถมศึกษา,,หมู่ 6 คลอง 27,สนับทึบ,วังน้อย,พระนครศรีอยุธยา,13170,kotunklong27_school@outlook.co.th,www.thai-school.net/kotunklong27,สนับทึบ,-,-,1 มิถุนายน พ.ศ.2485,45,13,ขนาดกลาง,มีไฟฟ้า,14,140,8,21 ตุลาคม 2562 เวลา 10:10:46 น.
136,1014310312,14010160,310312,บ้านลำแดง,banlumdaeng,นางชุลี รุ่งพานิช,อนุบาล-มัธยมศึกษาตอนต้น,,หมู่ 3 ลำแดง,หันตะเภา,วังน้อย,พระนครศรีอยุธยา,13170,,,หันตะเภา,035-799104,,29 มิถุนายน 2482,35,14,ขนาดกลาง,มีไฟฟ้า,25,342,14,05 มิถุนายน 2560 เวลา 10:06:57 น.
137,1014310392,14010161,310392,วัดสะแก,WAT SAKAE,นายจำลอง มากประมูล,อนุบาล-มัธยมศึกษาตอนต้น,,หมู่ 5 สะแก,ข้าวเม่า,อุทัย,พระนครศรีอยุธยา,13210,sakae2502@gmail.com,,อบต.ข้าวเม่า,0-3577-0154,35770154,1 พฤษภาคม 2466,12,5.1,ขนาดกลาง,มีไฟฟ้า,18,256,11,17 มิถุนายน 2562 เวลา 13:31:53 น.
