1,1014310015,14010003,310015,ประชาสามัคคี,prachasamakkee,นางสาววิจิตรา อินทสุวรรณ์,อนุบาล-ประถมศึกษา,,หมู่ 8 หน้าวัดโคก,คลองตะเคียน,พระนครศรีอยุธยา,พระนครศรีอยุธยา,13000,prachasamakkee@hotmail.com,,คลองตะเคียน,0-3570-1232,-,พ.ศ. 2482,20,10,ขนาดเล็ก,มีไฟฟ้า,11,99,8,18 มิถุนายน 2562 เวลา 12:10:59 น.
2,1014310016,14010004,310016,บ้านคลองตะเคียน หมู่ 2,Banklongtakien Moo 2,นายมานพ สุขเกษม,อนุบาล-มัธยมศึกษาตอนต้น,,หมู่ 2 คลองตะเคียน,คลองตะเคียน,พระนครศรีอยุธยา,พระนครศรีอยุธยา,13000,-,data.bopp-obec.info/emis/schooldata-view.php?School_ID=1014310016&Area_CODE=1401,คลองตะเคียน,0-3570-1205,0-3570-1205,พ.ศ.2464,18,15,ขนาดใหญ่,มีไฟฟ้า,34,503,23,24 มิถุนายน 2562 เวลา 14:47:38 น.
3,1014310029,14010005,310029,วัดกลางคลองสระบัว,watkrangkrongsabua,นายเสน่ห์ ชาติจันทึก,อนุบาล-ประถมศึกษา,,หมู่ 3 คลองสระบัว,คลองสระบัว,พระนครศรีอยุธยา,พระนครศรีอยุธยา,13000,marnop_suk@hotmail.com,-,คลองสระบัว,"0-3532-8818, 0-",-,1 พฤศจิกายน 2477,5,6,ขนาดกลาง,มีไฟฟ้า,13,193,8,13 มิถุนายน 2561 เวลา 09:13:28 น.
4,1014310007,14010006,310007,วัดพนัญเชิง(ไตรรัตนนายก),Phananchoeng School,นายบรรจง น้อยทอง,อนุบาล-มัธยมศึกษาตอนต้น,,หมู่ 4 ชุมชนวัดพนัญเชิง,คลองสวนพลู,พระนครศรีอยุธยา,พระนครศรีอยุธยา,13000,pnc_school@hotmail.com,,พระนครศรีอยุธยา,035-951568,035-951568,พ.ศ. 2496,8.5,4.5,ขนาดกลาง,มีไฟฟ้า,23,395,14,06 ธันวาคม 2562 เวลา 12:54:01 น.
5,1014310027,14010007,310027,ประตูชัย,pratoochaischool,นายสุระพล เฉลิมสถาน,อนุบาล-มัธยมศึกษาตอนต้น,,หมู่ 2 -วัดวรโพธิ์,ท่าวาสุกรี,พระนครศรีอยุธยา,พระนครศรีอยุธยา,13000,pratoochaischool@gmail.com,www.pratoochai.ac.th,พระนครศรีอยุธยา,"0-3524-5419,0-3",35245419,1 มิถุนายน 2504,2,2,ขนาดใหญ่พิเศษ,มีไฟฟ้า,105,2394,64,26 มิถุนายน 2562 เวลา 10:00:00 น.
6,1014310028,14010008,310028,อนุบาลพระนครศรีอยุธยา,Anuban pranakhon si ayutthaya,นายบุญเลิศ โตสมบุญ,อนุบาล-ประถมศึกษา,,หมู่ 3 เลขที่ 1 ถนนอู่ทอง,ท่าวาสุกรี,พระนครศรีอยุธยา,พระนครศรีอยุธยา,13000,anubanay56@gmail.com,http://school.obec.go.t้h,เทศบาลนครพระนครศรีอยุธยา,0-3525-1133,35245052,17/05/2487,3,2,ขนาดใหญ่พิเศษ,มีไฟฟ้า,138,1812,48,18 มิถุนายน 2561 เวลา 08:34:31 น.
7,1014310001,14010009,310001,วัดไผ่,Watphai,นางสาวประภาภรณ์ พลรักษ์,อนุบาล-ประถมศึกษา,,หมู่ 2 บ้านโพธิ์,บ้านเกาะ,พระนครศรีอยุธยา,พระนครศรีอยุธยา,13000,,,nullnullnull,"0-3532-2233,0-3",,2479,20,10,ขนาดเล็ก,มีไฟฟ้า,8,64,8,18 มิถุนายน 2562 เวลา 08:52:03 น.
8,1014310020,14010010,310020,วัดพระงาม(อรรถกฤษณ์ประชารัฐ),Watphrangam(Utthakritpracharat) School,นายอาทร หาสียา,อนุบาล-ประถมศึกษา,,หมู่ 3 วัดพระงาม,บ้านป้อม,พระนครศรีอยุธยา,พระนครศรีอยุธยา,13000,prangam1@gmail.com,-,บ้านป้อม,0-35795834,--,5 มกราคม 2477,5,8,ขนาดเล็ก,มีไฟฟ้า,9,106,8,21 มิถุนายน 2562 เวลา 23:40:36 น.
9,1014310019,14010011,310019,วัดกษัตราธิราช,Wat Kasattratiraj Primary School,-,อนุบาล-ประถมศึกษา,,หมู่ 7 บ้านวัดกษัตรา,บ้านป้อม,พระนครศรีอยุธยา,พระนครศรีอยุธยา,13000,,htt://school.obec.go.th,บ้านป้อม,0-3580-1363,35801363,1921/05/00,13,8,ขนาดเล็ก,มีไฟฟ้า,7,47,8,01 มิถุนายน 2562 เวลา 12:52:02 น.
10,1014310017,14010012,310017,วัดไก่เตี้ย(วิทยสุนทร),Watkaitia,นายธนกร พันธะศรี,อนุบาล-ประถมศึกษา,,หมู่ 2 บ้านรุน,บ้านรุน,พระนครศรีอยุธยา,พระนครศรีอยุธยา,13000,tanakorn2348@gmail.com,,เกาะเรียน,641214570,35703247,1 พฤศจิกายน 2477,13,10,ขนาดเล็ก,มีไฟฟ้า,9,52,8,17 มิถุนายน 2562 เวลา 13:24:38 น.
11,1014310023,14010014,310023,ปฐมวิทยาคาร,PATHOMWITTAYAKARN,ดร.ธนวัฒน์ พินนอก,อนุบาล-มัธยมศึกษาตอนต้น,,หมู่ 4 บ้านใหม่,บ้านใหม่,พระนครศรีอยุธยา,พระนครศรีอยุธยา,13000,pathomwk@gmail.com,http://data.bopp-obec.info/web/?School_ID=1014310023,บ้านใหม่,035-398321,-,2472,11,15,ขนาดกลาง,มีไฟฟ้า,19,201,11,25 มิถุนายน 2562 เวลา 14:28:36 น.
12,1014310024,14010015,310024,วัดกุฎีลาย,Watkudeelai School,นางสาวกิตติญาดา เมฆแสงสี,อนุบาล-ประถมศึกษา,,หมู่ 7 ท้ายไผ่,บ้านใหม่,พระนครศรีอยุธยา,พระนครศรีอยุธยา,13000,gurusumo@gmail.com,school.obec.go.th/kudeelai,บ้านใหม่,0-3571-3379,35713379,29/11/2442,3,10,ขนาดเล็ก,มีไฟฟ้า,6,57,9,18 มีนาคม 2562 เวลา 09:51:36 น.
13,1014310012,14010016,310012,วัดทำใหม่,WatThummai,นางอภิญญา อ่อนจริง,อนุบาล-ประถมศึกษา,,หมู่ 6 วัดทำใหม่,ปากกราน,พระนครศรีอยุธยา,พระนครศรีอยุธยา,13000,apionj1111@obecmail.obec.go.th,,ปากกราน,,,2464,10,12,ขนาดกลาง,มีไฟฟ้า,12,187,8,03 กุมภาพันธ์ 2563 เวลา 13:05:14 น.
14,1014310018,14010017,310018,วัดกลาง (ปากกรานสามัคคี),WatKlang (Pak-kran samakkee,นางธณัญญา โพธิ์ศรี,อนุบาล-ประถมศึกษา,,หมู่ 13 ปากกราน,ปากกราน,พระนครศรีอยุธยา,พระนครศรีอยุธยา,13000,thananya217@gmail.com,,ปากกราน,815732590,-,13 กรกฎาคม พ.ศ.2482,9,9,ขนาดกลาง,มีไฟฟ้า,10,124,8,31 มีนาคม 2562 เวลา 15:17:42 น.
15,1014310013,14010018,310013,วัดช้าง,watchang,นางพักตร์วิภา ตะเพียนทอง,อนุบาล-ประถมศึกษา,,หมู่ 1 บ้านพลู,ปากกราน,พระนครศรีอยุธยา,พระนครศรีอยุธยา,13000,watchangschool.pakkran@gmail.com,school.obec.go.th/watchang,ปากกราน,35705509,35705509,20 เมษายน 2510,11,7,ขนาดเล็ก,มีไฟฟ้า,11,77,8,25 มิถุนายน 2562 เวลา 14:11:15 น.
16,1014310014,14010019,310014,วัดปากกราน,Watpakkran School,นางสาวกันดารัตน์ วงษ์ปัน,อนุบาล-ประถมศึกษา,,หมู่ 10 ทุ่งปากกราน,ปากกราน,พระนครศรีอยุธยา,พระนครศรีอยุธยา,13000,watpakkran_school@hotmail.com,www.watpakkran school.com,ปากกราน,0-3570-5768,35705768,พ.ศ.2482,10,10,ขนาดเล็ก,มีไฟฟ้า,9,87,8,29 มกราคม 2562 เวลา 12:42:51 น.
17,1014310004,14010020,310004,วัดพระญาติการาม,Watprayattikaram,นายฐานิตย์ เนคมานุรักษ์,อนุบาล-มัธยมศึกษาตอนต้น,,หมู่ 5 ไผ่ลิง,ไผ่ลิง,พระนครศรีอยุธยา,พระนครศรีอยุธยา,13000,wpy2479@gmail.com,www.wpy.ac.th,อโยธยา,0-35339353,0-35339353,1 มิถุนายน 2479,10,4,ขนาดกลาง,มีไฟฟ้า,24,437,15,27 มิถุนายน 2562 เวลา 12:38:24 น.
18,1014310005,14010021,310005,วัดประดู่ทรงธรรม(จียพันธ์บำรุง),WATPRADOOTHONGTHAM,นายอดิศร สุภาพคำ,อนุบาล-มัธยมศึกษาตอนต้น,,หมู่ 4 ชุมชนวัดประดู่ทรงธรรม(จียพันธ์บำรุง),ไผ่ลิง,พระนครศรีอยุธยา,พระนครศรีอยุธยา,13000,pradoo0021@gmail.com,http://data.bopp-obec.info/web/?School_ID=1014310005,ไผ่ลิง,35881596,35881596,2482,10,4,ขนาดกลาง,มีไฟฟ้า,30,443,16,27 มิถุนายน 2562 เวลา 09:28:42 น.
19,1014310006,14010022,310006,วัดใหญ่ชัยมงคล(ภาวนารังสี),watyaichaimongkol,นางจุฑามาศ รอดภัย,อนุบาล-มัธยมศึกษาตอนต้น,,หมู่ 2 -,ไผ่ลิง,พระนครศรีอยุธยา,พระนครศรีอยุธยา,13000,watyai2011@gmail.com,watyaiay.com,เทศบาลเมืองอโยธยา,0-3524-3027,35243027,1 พฤษภาคม 2517,15,5,ขนาดใหญ่,มีไฟฟ้า,38,712,22,01 มิถุนายน 2562 เวลา 10:51:49 น.
20,1014310021,14010023,310021,สุดินสหราษฎร์,sudinsaharat,นายสาโรจน์ ตะปะสา,อนุบาล-มัธยมศึกษาตอนต้น,,หมู่ 2 ภูเขาทอง,ภูเขาทอง,พระนครศรีอยุธยา,พระนครศรีอยุธยา,13000,su_sopa@hotmail.com,-,ภูเขาทอง,35256798,-,30/06/2478,2,9,ขนาดกลาง,มีไฟฟ้า,18,168,11,07 มิถุนายน 2562 เวลา 10:37:15 น.
21,1014310030,14010024,310030,ลุมพลีชนูปถัมภ์,Lumpleechanupatum,นายสุชาติ ทองมา,อนุบาล-มัธยมศึกษาตอนต้น,,หมู่ 2 ลุมพลี,ลุมพลี,พระนครศรีอยุธยา,พระนครศรีอยุธยา,13000,-,www.Lumpleechanupatum.com,ลุมพลี,035-796504,035-796504,-,3,5,ขนาดกลาง,มีไฟฟ้า,36,551,22,26 มิถุนายน 2562 เวลา 21:52:49 น.
22,1014310025,14010025,310025,วัดช้างใหญ่(ประคณห์คดีประชารัฐ),watchangyai,นายสาโรช เกิดทรัพย์,อนุบาล-ประถมศึกษา,,หมู่ 1 โรงนา,วัดตูม,พระนครศรีอยุธยา,พระนครศรีอยุธยา,13000,,,วัดตูม,0-3571-3264,,22 พฤศจิกายน 2477,2,7,ขนาดเล็ก,มีไฟฟ้า,6,62,8,30 มิถุนายน 2560 เวลา 12:43:15 น.
23,1014310026,14010026,310026,วัดตูม (สิริปุณยาประชาสรรค์),Wattoom,นางละอองศรี สุวินัย,อนุบาล-ประถมศึกษา,,หมู่ 3 วัดตูม,วัดตูม,พระนครศรีอยุธยา,พระนครศรีอยุธยา,13000,,,วัดตูม,0-35704934,,2503,1.5,4,ขนาดเล็ก,มีไฟฟ้า,9,79,8,21 มกราคม 2563 เวลา 10:46:16 น.
24,1014310033,14010027,310033,วัดสว่างอารมณ์,watsawanga-rom,นางวริยาพัชร วรภัสร์สรกุล,อนุบาล-มัธยมศึกษาตอนต้น,,หมู่ 1 สวนพริก,สวนพริก,พระนครศรีอยุธยา,พระนครศรีอยุธยา,13000,,,สวนพริก,35781558,35781558,พ.ศ.2472,6,10,ขนาดกลาง,มีไฟฟ้า,19,198,11,07 พฤษภาคม 2562 เวลา 14:24:45 น.
25,1014310011,14010030,310011,พรพินิตพิทยาคาร,PHONPHINITPHITTHAYAKHAN,นายผล พรมทอง,อนุบาล-ประถมศึกษา,,หมู่ 4 บ้านบางกะจะ,สำเภาล่ม,พระนครศรีอยุธยา,พระนครศรีอยุธยา,13000,piphonphinit@gmail.com,soc-ay1.aru.ac.th/14100800,สำเภาล่ม,035701670/0860404544,35701670,1 กรกฎาคม 2482,10,5,ขนาดกลาง,มีไฟฟ้า,12,123,8,17 มิถุนายน 2562 เวลา 08:47:26 น.
26,1014310010,14010031,310010,วัดพุทไธศวรรย์,watputthaisawan,นายไตรรัตน์ เอี่ยมพันธ์,อนุบาล-มัธยมศึกษาตอนต้น,,หมู่ 8 บ้านคลองคูจาม,สำเภาล่ม,พระนครศรีอยุธยา,พระนครศรีอยุธยา,13000,watputthaisawan@hotmail.com,-,สำเภาล่ม,0-3570-1333,-,สิงหาคม พ.ศ. 2474,14,12,ขนาดกลาง,มีไฟฟ้า,19,244,11,10 ตุลาคม 2561 เวลา 15:13:49 น.
27,1014310002,14010032,310002,วัดหันตรา,Wat Huntra School,นางสุรีรัตน์ จันทร์ลอย,อนุบาล-ประถมศึกษา,,หมู่ 2 หันตรา,หันตรา,พระนครศรีอยุธยา,พระนครศรีอยุธยา,13000,wathantraschool@gmail.com,th-th.facebook.com/wathuntraschool,หันตรา,0-3570-9175,0-3570-9175,6 กรกฎาคม พ.ศ.2482,10,4.5,ขนาดเล็ก,มีไฟฟ้า,27,455,16,12 กุมภาพันธ์ 2561 เวลา 13:02:46 น.
28,1014310038,14010034,310038,วัดบัวงาม,watbuangam,-,อนุบาล-มัธยมศึกษาตอนต้น,,หมู่ 6 ชุมชนวัดบัวงาม,จำปา,ท่าเรือ,พระนครศรีอยุธยา,13130,,,เทศบาลตำบลท่าหลวง,35225317,35225317,พ.ศ.2463,50,5,ขนาดกลาง,มีไฟฟ้า,12,93,11,27 มิถุนายน 2562 เวลา 15:07:03 น.
29,1014310039,14010035,310039,วัดจําปา,Watjampa School,นายธนสาร ศุภพันธ์,อนุบาล-ประถมศึกษา,,หมู่ 4 จำปา,จำปา,ท่าเรือ,พระนครศรีอยุธยา,13130,watjampa54@gmail.com,data.bopp-obec.info/web/?School_ID=1014310039,จำปา,0-3534-2723,,พ.ศ.2447,41,2.5,ขนาดเล็ก,มีไฟฟ้า,5,42,8,01 มิถุนายน 2562 เวลา 07:28:16 น.
30,1014310043,14010036,310043,วัดจงกลณี (ประสิทธิ์วิทยา),Jonggonneeschool,นางขวัญใจ เบญจะขันธ์,อนุบาล-ประถมศึกษา,,หมู่ 5 กอกา,ท่าเจ้าสนุก,ท่าเรือ,พระนครศรีอยุธยา,13130,kodjutha@gmail.com,http://data.bopp-obec.info/web/?School_ID=1014310043,ท่าเจ้าสนุก,898240202,,28 มิถุนายน 2498,40,2,ขนาดเล็ก,มีไฟฟ้า,6,60,8,11 ตุลาคม 2561 เวลา 08:41:28 น.
31,1014310057,14010037,310057,วัดสฎางค์,watsadang,นางกฤตญพร รสารักษ์,อนุบาล-ประถมศึกษา,,หมู่ 6 สฎางค์,ท่าเจ้าสนุก,ท่าเรือ,พระนครศรีอยุธยา,13130,varuncharee@hotmail.com,-,ท่าเจ้าสนุก,0-3534-1817,35341817,2 พฤษภาคม 2467,45,4,ขนาดเล็ก,มีไฟฟ้า,10,72,8,07 กรกฎาคม 2560 เวลา 06:47:05 น.
32,1014310036,14010038,310036,วัดไก่จ้น(ชลประทานอุปถัมภ์),Watkaijon,นายกริชนรินทร์ สิงคเวหน,อนุบาล-ประถมศึกษา,,หมู่ 10 บ้านไก่จ้น,ท่าหลวง,ท่าเรือ,พระนครศรีอยุธยา,18270,watkaijoun_school@hotmail.com,,อบต.ท่าหลวง,35750056,,2466,40.6,5,ขนาดเล็ก,มีไฟฟ้า,9,58,8,13 มิถุนายน 2562 เวลา 13:51:45 น.
33,1014310037,14010039,310037,วัดหัวหิน,Wat Huahin Primary School,นายสรายุทธ ห้วยหงษ์ทอง,อนุบาล-ประถมศึกษา,,หมู่ 2 บ้านหัวหิน,ท่าหลวง,ท่าเรือ,พระนครศรีอยุธยา,18270,,,ท่าหลวง,0-3522-4377,0-3522-4377,15 สิงหาคม พ.ศ.2495,45,5,ขนาดกลาง,มีไฟฟ้า,13,179,9,04 มิถุนายน 2562 เวลา 10:23:04 น.
34,1014310034,14010040,310034,วัดสะตือ,Watsatue,นายไพรัช โตโสภณ,อนุบาล-ประถมศึกษา,,หมู่ 6 ท่างาม,ท่าหลวง,ท่าเรือ,พระนครศรีอยุธยา,13130,sthong1960@yahoo.com,,ท่าหลวง,"0-3522-5315,0-3",35225315,2468,37,3.1,ขนาดกลาง,มีไฟฟ้า,16,171,9,07 มิถุนายน 2561 เวลา 12:40:52 น.
35,1014310049,14010042,310049,ชุมชนวัดบ้านร่อม,CHUMCHONWATBANROM,นางประภัสสร มะณีพันธ์,อนุบาล-ประถมศึกษา,,หมู่ 2 บ้านโคกกุ่ม,บ้านร่อม,ท่าเรือ,พระนครศรีอยุธยา,13130,chumchonwatbanromschool@gmail.com,http://watbanromcommunity.blogspot.com/,บ้านร่อม,"0-3522-3220,0-3",-,19/07/2466,50,6,ขนาดเล็ก,มีไฟฟ้า,11,99,8,11 ธันวาคม 2561 เวลา 14:09:48 น.
36,1014310050,14010043,310050,วัดดอนประดู่,WATDONPRADOO,-,อนุบาล-ประถมศึกษา,,หมู่ 5 บ้านดอนประดู่,บ้านร่อม,ท่าเรือ,พระนครศรีอยุธยา,13130,kao_narathip@hotmail.com,watdonpradoo.thport.com,อบต.บ้านร่อม,892385018,,2521,44,10,ขนาดเล็ก,มีไฟฟ้า,4,28,8,17 พฤษภาคม 2561 เวลา 11:52:14 น.
37,1014310041,14010044,310041,วัดแค,Watkaeschool,นางวิมล คำขจร,อนุบาล-ประถมศึกษา,,หมู่ 4 อรัญญิก,ปากท่า,ท่าเรือ,พระนครศรีอยุธยา,13130,,,ปากท่า,0-3571-5333,,5 กันยายน 2465,75,15,ขนาดเล็ก,มีไฟฟ้า,9,87,8,21 มิถุนายน 2562 เวลา 13:24:04 น.
38,1014310040,14010045,310040,วัดเทพคันธาราม,THEPKUNTARAM,นางนิรัติศัย นารถพลายพันธุ์,อนุบาล-ประถมศึกษา,,หมู่ 5 ตะเคียนด้วน,โพธิ์เอน,ท่าเรือ,พระนครศรีอยุธยา,13130,thepkuntaram_school@gmail.com,,โพธิ์เอน,"0-3571-5222,0-3",,2482,40,10,ขนาดเล็ก,มีไฟฟ้า,6,52,8,27 ตุลาคม 2561 เวลา 09:38:22 น.
39,1014310051,14010046,310051,วัดสามเรือน,WAT SAMRUAN,นางเพ็ญประภา บุญบุตร,อนุบาล-ประถมศึกษา,,หมู่ 4 สามเรือน,โพธิ์เอน,ท่าเรือ,พระนครศรีอยุธยา,13130,samruan.school@gmail.com,,โพธิ์เอน,0-3575-0005,,15/08/2481,27,10,ขนาดเล็ก,มีไฟฟ้า,10,73,8,10 ตุลาคม 2561 เวลา 15:14:11 น.
40,1014310052,14010047,310052,วัดโพธิ์เอน,WATPHO-EN,นางสาวพิกุลทอง แววไธสง,อนุบาล-ประถมศึกษา,,หมู่ 2 โพธิ์เอน,โพธิ์เอน,ท่าเรือ,พระนครศรีอยุธยา,13130,-,,โพธิ์เอน,,-,พ.ศ.2462,38,8,ขนาดเล็ก,มีไฟฟ้า,10,72,8,25 มิถุนายน 2562 เวลา 08:15:08 น.
41,1014310053,14010048,310053,วัดบึง,Watbueng,นายสายัณห์ พันธ์ไม้,อนุบาล-ประถมศึกษา,,หมู่ 8 บ้านบึง,วังแดง,ท่าเรือ,พระนครศรีอยุธยา,13130,watbuengschool@hotmail.com,www.watbueng.ac.th,วังแดง,0-3576-2123,,2465,40,7,ขนาดเล็ก,มีไฟฟ้า,9,64,8,08 มิถุนายน 2562 เวลา 19:34:35 น.
42,1014310054,14010049,310054,วัดวังแดงเหนือ,watwangdangnua,-,อนุบาล-มัธยมศึกษาตอนต้น,,หมู่ 2 วังแดง,วังแดง,ท่าเรือ,พระนครศรีอยุธยา,13130,wangdangschool@yahoo.co.th,-,วังแดง,-,-,2457,28,7,ขนาดเล็ก,มีไฟฟ้า,11,118,11,25 กุมภาพันธ์ 2562 เวลา 20:55:45 น.
43,1014310042,14010051,310042,วัดศาลาลอย,WATSALALOY,นายวิเชียร สามิภักดิ์,อนุบาล-ประถมศึกษา,,หมู่ 11 บ้านศาลาลอย,ศาลาลอย,ท่าเรือ,พระนครศรีอยุธยา,13130,salaloy1@gmail.com,,ศาลาลอย,35267131,,12 ตุลาคม 2465,39,7,ขนาดกลาง,มีไฟฟ้า,15,181,8,18 มิถุนายน 2562 เวลา 13:56:28 น.
44,1014310056,14010052,310056,วัดนางคุ่ม,WATNANGKUM,นายประภาส ชาตินันท์,อนุบาล-มัธยมศึกษาตอนต้น,,หมู่ 1 บ้านแขก-บางตะไล,ศาลาลอย,ท่าเรือ,พระนครศรีอยุธยา,13130,,,ศาลาลอย,0-3522-3233,,11/02/2465,40,5,ขนาดกลาง,มีไฟฟ้า,16,140,11,06 มิถุนายน 2562 เวลา 11:20:23 น.
45,1014310044,14010053,310044,ประชาผดุงวิทย์ (ฟ้อน ฟุ้ง อุทิศ),prachaphadungwit,ว่าที่ร้อยตรีวีรยุทธ นิมิตรดี,อนุบาล-ประถมศึกษา,,หมู่ 7 หนองกระเบียน,หนองขนาก,ท่าเรือ,พระนครศรีอยุธยา,13130,pracha10053@gmail.com,prachaphadungwit.go.th,อบต.หนองขนาก,818539421,,พ.ศ. 2489,45,6,ขนาดกลาง,มีไฟฟ้า,10,121,8,10 มิถุนายน 2562 เวลา 08:48:27 น.
