138,1014310393,14010162,310393,วัดโตนด,Wattanod,นายปราริชญ์ นามคุณ,อนุบาล-ประถมศึกษา,,หมู่ 10 วัดโตนด,ข้าวเม่า,อุทัย,พระนครศรีอยุธยา,13210,subwan33@gmail.com,http://soc-ay1.aru.ac.th/14104337/,ข้าวเม่า,"0-3534-5503,0-3",,31 ตุลาคม พ.ศ. 2477,9,6,ขนาดเล็ก,มีไฟฟ้า,9,35,7,06 มิถุนายน 2562 เวลา 10:28:16 น.
139,1014310394,14010163,310394,บ้านเป็ด,BAN PED,นายดิเรก ดาวเรือง,อนุบาล-ประถมศึกษา,,หมู่ 14 หนองคัดค้าว,ข้าวเม่า,อุทัย,พระนครศรีอยุธยา,13210,banped.2484@gmail.com,,ข้าวเม่า,856154997,,2484,25,10,ขนาดเล็ก,มีไฟฟ้า,7,44,8,28 มิถุนายน 2562 เวลา 14:24:50 น.
140,1014310397,14010164,310397,วัดคานหาม,khanham,นางสาวเจตสุมนต์ สุเมธีประดิษฐ์,อนุบาล-มัธยมศึกษาตอนต้น,,หมู่ 4 คานหาม,คานหาม,อุทัย,พระนครศรีอยุธยา,13210,,www.watkhanham.ac.th,คานหาม,0-3588-0157,0-3588-0157,12 กันยายน 2469,15,12,ขนาดกลาง,มีไฟฟ้า,22,344,11,17 มิถุนายน 2562 เวลา 20:27:13 น.
141,1014310389,14010165,310389,วัดโคกมะยม,wat Khokmayom,นายเสริมพงศ์ เมืองมั่น,อนุบาล-ประถมศึกษา,,หมู่ 5 โคกมะยม,คานหาม,อุทัย,พระนครศรีอยุธยา,13210,Cokmayomuthai@yahoo.co.th,,คานหาม,035-800741,035-800741,25 เมษายน 2467,15,5,ขนาดกลาง,มีไฟฟ้า,15,236,8,18 มิถุนายน 2562 เวลา 10:24:09 น.
142,1014310390,14010166,310390,เชาวน์วัศ,chaowat,นายนฤพงษ์ พิมพ์ทอง,อนุบาล-ประถมศึกษา,,หมู่ 5 หนองไม้ซุง,คานหาม,อุทัย,พระนครศรีอยุธยา,13210,choewatschool @ hunsa.c,chaoewat school.,คานหาม,35800580,35800580,2519,16,10,ขนาดกลาง,มีไฟฟ้า,21,416,14,18 มิถุนายน 2562 เวลา 13:03:34 น.
143,1014310398,14010167,310398,วัดกะสังข์ (พิศิษฎ์นวการอุปถัมภ์),watkasang school,นางหนึ่งนิจ ปลื้มอารมย์,อนุบาล-ประถมศึกษา,,หมู่ 1 ชุมชนวัดกะสังข์,ธนู,อุทัย,พระนครศรีอยุธยา,13000,watkasang10140167@gmail.com,http://data.bopp-obec.info/emis/admin.php?Username=watkasang,ธนู,871210710,,16 สิงหาคม 2464,15,10,ขนาดเล็ก,มีไฟฟ้า,9,61,8,17 มิถุนายน 2562 เวลา 14:39:39 น.
144,1014310395,14010168,310395,วัดขุนทิพย์ (สาครราษฎร์บำรุง),WATKUNTIP SCHOOL,นายไพรัตน์ พันธุรัตน์,อนุบาล-ประถมศึกษา,,หมู่ 12,ธนู,อุทัย,พระนครศรีอยุธยา,13210,paipan3007@obecmail.go.th,-,ธนู,0-3535-6244,-,3 พฤษภาคม 2466,14,2,ขนาดกลาง,มีไฟฟ้า,11,100,8,28 มิถุนายน 2562 เวลา 09:03:10 น.
145,1014310391,14010169,310391,บ้านช้าง,banchang school,-,อนุบาล-ประถมศึกษา,,หมู่ 3 บ้านขวิดใต้,บ้านช้าง,อุทัย,พระนครศรีอยุธยา,13210,,,บ้านช้าง,0-3575-0917,,20 กรกฎาคม 2483,22,7,ขนาดกลาง,มีไฟฟ้า,6,144,8,28 พฤษภาคม 2562 เวลา 10:34:12 น.
146,1014310379,14010170,310379,วัดบ้านหีบ,Watbanheep,นายอุทัย มะลิใจ,อนุบาล-ประถมศึกษา,,หมู่ 1 บ้านหีบ,บ้านหีบ,อุทัย,พระนครศรีอยุธยา,13210,omangporbee@gmail.com,school.obec.go.th,บ้านหีบ,0-3577-0557,-,1 พ.ค. 2468,35,5,ขนาดเล็ก,มีไฟฟ้า,12,120,8,01 มิถุนายน 2562 เวลา 08:08:25 น.
147,1014310380,14010171,310380,วัดนางชี,watnangchee,นางศศวัน ชินนาทศิริกุล,อนุบาล-ประถมศึกษา,,หมู่ 9 ปากร่อง,บ้านหีบ,อุทัย,พระนครศรีอยุธยา,13210,,,บ้านหีบ,35951026,,1 พฤษภาคม 2467,25,8,ขนาดเล็ก,มีไฟฟ้า,9,58,8,01 มิถุนายน 2562 เวลา 10:56:59 น.
148,1014310381,14010172,310381,วัดไทรงาม,watsaingam,นายกึกก้อง บุญจันทร์,อนุบาล-ประถมศึกษา,,หมู่ 4 บ้านระบาง,บ้านหีบ,อุทัย,พระนครศรีอยุธยา,13210,,,บ้านหีบ,0-3577-0555,0-3577-0555,7/7/2481,24,3,ขนาดกลาง,มีไฟฟ้า,11,140,8,21 มิถุนายน 2562 เวลา 10:12:57 น.
149,1014310372,14010173,310372,วัดพรานนก,watphrannok,นายชิณกร เกษศิริ,อนุบาล-มัธยมศึกษาตอนต้น,,หมู่ 2 บ้านพรานนก,โพสาวหาญ,อุทัย,พระนครศรีอยุธยา,13210,phrannok2481@gmail.com,,โพสาวหาญ,0-3573-6351,35772061,21072481,40,15,ขนาดเล็ก,มีไฟฟ้า,14,103,11,27 มิถุนายน 2562 เวลา 11:03:33 น.
150,1014310374,14010175,310374,วัดโพธิ์สาวหาญ,WATPHOSAOHAN,นายประสิทธิชัย จับฟั่น,อนุบาล-ประถมศึกษา,,หมู่ 3 โพสาวหาญ,โพสาวหาญ,อุทัย,พระนครศรีอยุธยา,13210,phosaohan@gmail.com,,โพสาวหาญ,840820293,-,8 พฤษภาคม 2501,49,16,ขนาดเล็ก,มีไฟฟ้า,10,90,8,24 มิถุนายน 2562 เวลา 06:57:19 น.
151,1014310375,14010176,310375,วัดโคกโพธิ์,WATKHOKPHO,-,อนุบาล-ประถมศึกษา,,หมู่ 7 บ้านโคกโพธิ์,โพสาวหาญ,อุทัย,พระนครศรีอยุธยา,13210,watkokpho@outlook.co.th,-,โพสาวหาญ,035-902497,-,21 กรกฎาคม 2477,44.8,20,ขนาดเล็ก,มีไฟฟ้า,3,33,8,17 มิถุนายน 2562 เวลา 21:23:08 น.
152,1014310376,14010178,310376,วัดดอนพุดซา,Watdonpudza,นางสาวสุนิสา คงสุวรรณ,อนุบาล-มัธยมศึกษาตอนต้น,,หมู่ 10 บ้านดอนพุดซา,สามบัณฑิต,อุทัย,พระนครศรีอยุธยา,13210,ksunisa54@yahoo.com,,สามบัณฑิต,0-3577-2555,0-3577-2555,04 พฤษภาคม 2483,30,12,ขนาดกลาง,มีไฟฟ้า,18,192,11,31 พฤษภาคม 2561 เวลา 12:51:21 น.
153,1014310377,14010179,310377,วัดกุ่มแต้,watkumtae,-,อนุบาล-ประถมศึกษา,,หมู่ 6 บ้านกุ่มแต้,สามบัณฑิต,อุทัย,พระนครศรีอยุธยา,13210,,https://data.bopp-obec.info/web/index.php?School_ID=1014310377,สามบัณฑิต,035-902498,,13 กุ่มภาพันธ์ 2510,40,15,ขนาดเล็ก,มีไฟฟ้า,3,36,8,27 มิถุนายน 2560 เวลา 06:20:06 น.
154,1014310382,14010180,310382,วัดอุทัย (เชาวนวิทยา),watuthai school,นายมานพ ทับเงิน,อนุบาล-มัธยมศึกษาตอนต้น,,หมู่ 2 ละมุ,เสนา,อุทัย,พระนครศรีอยุธยา,13210,watuthai01@gmail.com,data.bopp-obec.info/web/index.php?School_ID=1014310382,เสนา,35773070,0-3577-3069,2464,30,7,ขนาดกลาง,มีไฟฟ้า,14,242,11,01 มิถุนายน 2562 เวลา 12:55:36 น.
155,1014310383,14010181,310383,บ้านข่อยโทน,Bankoiton,นายศุภฤกษ์ จันทร์วิฐี,อนุบาล-มัธยมศึกษาตอนต้น,,หมู่ 4 บ้านข่อยโทน,เสนา,อุทัย,พระนครศรีอยุธยา,13210,khoitone@hotmail.com,http://data.bopp-obec.info/web/?School_ID=1014310383,เสนา,083-0950491,-,2483,23.4,6.5,ขนาดเล็ก,มีไฟฟ้า,11,119,11,26 มิถุนายน 2562 เวลา 18:15:50 น.
156,1014310384,14010182,310384,วัดหนองน้ำส้ม (เจียนวิทยาคาร),watnongnamsom school,นางสาวน้ำอ้อย สุทรพฤกษ์,อนุบาล-ประถมศึกษา,,หมู่ 3 บ้านหนองน้ำส้ม,หนองน้ำส้ม,อุทัย,พระนครศรีอยุธยา,13210,hiphop722@gmail.com,,อบต.หนองน้ำส้ม,035-797256,035-797256,28 เมษายน 2467,26,16,ขนาดเล็ก,มีไฟฟ้า,10,87,8,29 มิถุนายน 2561 เวลา 14:06:12 น.
157,1014310378,14010183,310378,บ้านคู้คด,Bankukot,นายนิรุทธิ์ พิกุลเทพ,อนุบาล-ประถมศึกษา,,หมู่ 6 ขนอน,หนองน้ำส้ม,อุทัย,พระนครศรีอยุธยา,13210,bankukot@gmail.com,www.bankukot.ac.th,หนองน้ำส้ม,,,9 มิถุนายน 2483,25,10,ขนาดกลาง,มีไฟฟ้า,12,125,8,04 ตุลาคม 2562 เวลา 10:23:43 น.
158,1014310370,14010184,310370,วัดหนองไม้ซุง,Watnongmaisung,นายสมทรง อนุภาพ,อนุบาล-มัธยมศึกษาตอนต้น,,หมู่ 1 หนองไม้ซุง,หนองไม้ซุง,อุทัย,พระนครศรีอยุธยา,13210,jinda_za@hotmail.com,-,หนองไม้ซุง,35771033,35771033,8 กรกฎาคม 2482,40,20,ขนาดกลาง,มีไฟฟ้า,19,188,11,24 มิถุนายน 2562 เวลา 19:38:28 น.
159,1014310371,14010185,310371,วัดสนามทองมิตรภาพที่ 180,Watsanamtong school,นายชัยรัตน์ ชวนรัมย์,อนุบาล-ประถมศึกษา,,หมู่ 3 สนามทอง,หนองไม้ซุง,อุทัย,พระนครศรีอยุธยา,13210,,,หนองไม้ซุง,0-3525-5244,35255244,พ.ศ. 2482,32,15,ขนาดเล็ก,มีไฟฟ้า,8,60,8,17 มิถุนายน 2562 เวลา 10:17:47 น.
160,1014310386,14010186,310386,วัดโคกช้าง(ราษฎร์บำรุง),Khokchang school,นายวีรพรรณ์ บุษราคำ,อนุบาล-ประถมศึกษา,,หมู่ 1 สามง่าม,อุทัย,อุทัย,พระนครศรีอยุธยา,13210,Chokchang072@gmail.com,,อุทัย,0-3535-6243,35356243,1 /5/2466,12,0.5,ขนาดกลาง,มีไฟฟ้า,18,324,10,17 ธันวาคม 2562 เวลา 13:08:11 น.
161,1014310387,14010187,310387,วัดจำปา,Watchampa,นายนพคุณ ลัคนาวิเชียร,อนุบาล-ประถมศึกษา,,หมู่ 13 บ้านชายสิงห์,อุทัย,อุทัย,พระนครศรีอยุธยา,13210,watchampa523@gmail.com,data.bopp-obec.info/web/?School_ID=1014310387,อุทัย,035-356044,035-356044,2497,17,2.6,ขนาดกลาง,มีไฟฟ้า,19,376,16,18 มิถุนายน 2562 เวลา 09:34:33 น.
162,1014310388,14010188,310388,วัดโตนดเตี้ย,Wattanodtia,นายเจต เจริญสุข,อนุบาล-ประถมศึกษา,,หมู่ 4 โตนดเตี้ย,อุทัย,อุทัย,พระนครศรีอยุธยา,13210,tanotiaschool@hotmail.com,,อุทัย,0-3571-1657,0-3571-1657,28 ตุลาคม 2477,20,5,ขนาดกลาง,มีไฟฟ้า,21,409,16,11 กรกฎาคม 2560 เวลา 04:19:35 น.
163,1014310271,14010189,310271,วัดตะบอง (ธรรมาภิรมอุปถัมภ์),Wattabong school,นายชัยพร บัวผัน,อนุบาล-ประถมศึกษา,,หมู่ 2 กะทุ่ม,กะทุ่ม,มหาราช,พระนครศรีอยุธยา,13150,apussanun2527@hotmail.com,,กะทุ่ม,817956660,,1/08/2478,25,3,ขนาดเล็ก,มีไฟฟ้า,5,71,8,05 มิถุนายน 2562 เวลา 10:00:11 น.
164,1014310274,14010191,310274,วัดโบสถ์อนุกูลสังฆกิจ,watbostanukoonsangkakit,-,อนุบาล-มัธยมศึกษาตอนต้น,,หมู่ 2 ปากคลองช้าง,เจ้าปลุก,มหาราช,พระนครศรีอยุธยา,13150,watbote.wba@gmail.com,www.wba.ac.th,เทศบาลตำบลโรงช้าง,0-35776419,0-35776419,พ.ศ.2480,32,10,ขนาดกลาง,มีไฟฟ้า,18,231,11,07 มิถุนายน 2562 เวลา 14:11:40 น.
165,1014310282,14010192,310282,วัดเจ้าปลุก (เติมรัฐประชาสรรค์),WATCHAOPLUK,นางสาวศิริรัตน์ สุคันธพฤกษ์,อนุบาล-ประถมศึกษา,,หมู่ 4 เจ้าปลุก,เจ้าปลุก,มหาราช,พระนครศรีอยุธยา,13150,watchaopluk_2477@hotmail.com,http://data.bopp-obec.info/web/?School_ID=1014310282,เจ้าปลุก,035-769580,,01/12/2477,28,ุ6,ขนาดเล็ก,มีไฟฟ้า,10,102,8,18 ตุลาคม 2562 เวลา 09:18:35 น.
166,1014310278,14010193,310278,วัดท่าตอเลิศบุญยงค์วิทยา,Watthatooraetbunyongwitthaya,นางณัทธมณกาญจน์ บุญลาภสุขสกุล,อนุบาล-มัธยมศึกษาตอนต้น,,หมู่ 3 ท่าตอ,ท่าตอ,มหาราช,พระนครศรีอยุธยา,13150,,,ท่าตอ,945416932,,1 กรกฎาคม 2477,32,7,ขนาดกลาง,มีไฟฟ้า,14,119,11,04 มิถุนายน 2562 เวลา 18:00:53 น.
167,1014310273,14010196,310273,วัดบางสงบ (กองวารีวิทยานุสรณ์),watbangsagob,นายศักดิ์สิทธิ์ เลิศรัตนาวดี,อนุบาล-มัธยมศึกษาตอนต้น,,หมู่ 4 บางนา,บางนา,มหาราช,พระนครศรีอยุธยา,13150,,www.bangsangob.com,บางนา,"0-3539-0667,0-3",,พ.ศ.2472,40,11,ขนาดกลาง,มีไฟฟ้า,16,155,11,26 มิถุนายน 2562 เวลา 00:58:46 น.
168,1014310277,14010197,310277,วัดสุวรรณเจดีย์เลิศบุญยงค์อนุสรณ์,suwanjadeeleabooyaanusorn,นางอมรทิพย์ เกษรอินทร์,อนุบาล-มัธยมศึกษาตอนต้น,,หมู่ 2 บ้านขวาง,บ้านขวาง,มหาราช,พระนครศรีอยุธยา,13150,,,บ้านขวาง,035-902668,,14 กุมภาพันธ์ 2475,1,7,ขนาดเล็ก,มีไฟฟ้า,11,90,11,18 มิถุนายน 2562 เวลา 08:33:58 น.
169,1014310281,14010199,310281,วัดโพธิ์ประสิทธิ์ (วิบูลย์บำรุง),poprasit(,นางสุชีลา สุดสังเกตุ,อนุบาล-มัธยมศึกษาตอนต้น,,หมู่ 4 บ้านโพธิ์,บ้านนา,มหาราช,พระนครศรีอยุธยา,13150,poprasit.s@hotmail.com,http://data.bopp-obec.info/web/?School_ID=1014310281,บ้านนา,35769269,35768048,18 มิถุนายน 2481,1,12,ขนาดกลาง,มีไฟฟ้า,18,187,11,12 มิถุนายน 2561 เวลา 14:41:50 น.
170,1014310269,14010201,310269,ชุมชนวัดสุเมธ,Chumchonwatsumet,นายนฤพงษ์ พิมพ์ทอง,อนุบาล-มัธยมศึกษาตอนต้น,,หมู่ 4 บ้านใหม่,บ้านใหม่,มหาราช,พระนครศรีอยุธยา,13150,Chumchonwatsumet @gmail.com,,บ้านใหม่,0-35337087,-,2482,25,5,ขนาดกลาง,มีไฟฟ้า,16,176,11,25 มิถุนายน 2562 เวลา 20:02:32 น.
171,1014310268,14010203,310268,วัดอุโลม (วิสูตรอนุสรณ์),watulom(wisutanuson) school,นายละออง สีนิล,อนุบาล-ประถมศึกษา,,หมู่ 3 3มหาราช,มหาราช,มหาราช,พระนครศรีอยุธยา,13150,chonsalasin7@gmail.com,http://data.bopp-obec.info/web/index.php?School_ID=1014310268,มหาราช,0-3538-9215,0-3538-9215,พ.ศ.2472,22,1.5,ขนาดเล็ก,มีไฟฟ้า,7,57,8,14 มกราคม 2563 เวลา 16:36:39 น.
172,1014310275,14010204,310275,วัดโพธิ์,WATPHO,นางสาวภฤตยา ศิริพันธ์,อนุบาล-ประถมศึกษา,,หมู่ 4 โรงช้าง,โรงช้าง,มหาราช,พระนครศรีอยุธยา,13150,jumsomarom@gmail.com,http://data.bopp-obec.info/web/?School_ID=1014310275,เทศบาลโรงช้าง,0-3590-2479,-,7 สิงหาคา 2477,45,12,ขนาดเล็ก,มีไฟฟ้า,5,49,8,20 มิถุนายน 2562 เวลา 09:42:40 น.
173,1014310266,14010205,310266,วัดปากคลอง (ประชามหาราช),Wat Pakklong Primary School,นางสาวปัทมา โพธิ์ยั่งยืน,อนุบาล-ประถมศึกษา,,หมู่ 6 หัวไผ่,หัวไผ่,มหาราช,พระนครศรีอยุธยา,13150,,www.facebook.com/watpakklong,เทศบาลตำบลมหาราช,0-3538-9156,0-3538-9156,2472,20,0.5,ขนาดกลาง,มีไฟฟ้า,12,147,8,01 มิถุนายน 2560 เวลา 09:34:05 น.
174,1014310219,14010206,310219,วัดนครโปรดสัตว์,Watnakhonprodsut,-,อนุบาล-ประถมศึกษา,,หมู่ 3 คลองน้อย,คลองน้อย,บ้านแพรก,พระนครศรีอยุธยา,13240,nakhonpodsat@hotmail.com,www.facebook.com/sompon.tabsingkhla.3,,35768609,35768609,1 พฤศจิกายน 2481,55,7,ขนาดเล็ก,มีไฟฟ้า,3,80,8,05 มิถุนายน 2562 เวลา 09:06:42 น.
175,1014310220,14010207,310220,วัดไก่เตี้ย,Kaitia School,นางสาวธิดารัตน์ ชัยพิพัฒน์,อนุบาล-ประถมศึกษา,,หมู่ 5 ท้องลาด,คลองน้อย,บ้านแพรก,พระนครศรีอยุธยา,13240,direk2496@gmail.com,-,คลองน้อย,"0-3538-6498,0-3",35386498,17/04/2477,55,5,ขนาดเล็ก,มีไฟฟ้า,6,33,8,04 มิถุนายน 2562 เวลา 10:28:36 น.
176,1014310218,14010208,310218,วัดโบสถ์,watbot,นางสาวพิชชาพร คำกังวาฬ,อนุบาล-ประถมศึกษา,,หมู่ 1 บ้านแพรก,บ้านแพรก,บ้านแพรก,พระนครศรีอยุธยา,13240,,,บ้านแพรก,0-3538-6114,0-3538-6114,2485,50,1,ขนาดเล็ก,มีไฟฟ้า,6,42,8,18 มิถุนายน 2562 เวลา 13:13:32 น.
177,1014310217,14010210,310217,วัดท้าวอู่ทอง,Wattouwouthong school,นายชมแสง คำชมภู,อนุบาล-ประถมศึกษา,,หมู่ 4 บ้านใหม่,บ้านใหม่,บ้านแพรก,พระนครศรีอยุธยา,13240,-,Wat Wot@hotmail.go.th,สำพะเนียง,"0-3538-6122, 0-",-,10 มิถุนายน 2472,40,1.8,ขนาดเล็ก,มีไฟฟ้า,9,107,8,17 มิถุนายน 2562 เวลา 10:32:28 น.
178,1014310221,14010211,310221,โพธิ์ราษฎร์บำรุง,PRORACHBUMRUNG,นายจรัญศิริ ศรีรักษา,อนุบาล-มัธยมศึกษาตอนต้น,,หมู่ 5 สองห้อง,สองห้อง,บ้านแพรก,พระนครศรีอยุธยา,13240,prbr_school@yahoo.co.th,http://data.bopp-obec.info/web/?School_ID=1014310221,ตำบลคลองน้อย,0-3576-9058,35769058,4 พ.ค.2482,40,13,ขนาดเล็ก,มีไฟฟ้า,12,103,11,12 มิถุนายน 2562 เวลา 10:11:35 น.
179,1014310214,14010212,310214,ชุมชนวัดสำพะเนียง (แร่ผดุงวิทยา),Wat SamPhaniang Community School,นายณรงค์ เรืองเกษม,อนุบาล-ประถมศึกษา,,หมู่ 6 สำพะเนียง,สำพะเนียง,บ้านแพรก,พระนครศรีอยุธยา,13240,spn2477@hotmail.com,http://data.bopp-obec.info/web/?School_ID=1014310214,สำพะเนียง,"0-3538-6118, 0-",,20 พฤษภาคม 2477,53,4.5,ขนาดเล็ก,มีไฟฟ้า,8,68,8,25 มิถุนายน 2562 เวลา 11:18:15 น.
