99,1030200855,30070103,200855,บ้านหนองปรือ(รัฐราษฎร์พัฒนา),bannongpru,นายบัวโฮม โพธิพันไม้,อนุบาล-มัธยมศึกษาตอนต้น,,หมู่ 4 หนองปรือ,โบสถ์,พิมาย,นครราชสีมา,30110,,www.nongprue.ac.th,โบสถ์,0-4448-2996,0-4448-2996,พ.ศ.2466,20,19,ขนาดกลาง,มีไฟฟ้า,22,262,11,24 ธันวาคม 2562 เวลา 09:31:15 น.
100,1030200848,30070105,200848,ชุมชนบ้านหนองจิก,Choomchonbannongjik school,นายอาณัชร์ ศรีทอง,อนุบาล-มัธยมศึกษาตอนต้น,,หมู่ 10 บ้านหนองจิก,โบสถ์,พิมาย,นครราชสีมา,30110,4289pensiri@gmail.com,http://nongjik.ac.th,โบสถ์,0-4496-5050,0-4496-5053,26 เมษายน 2479,16,20,ขนาดกลาง,มีไฟฟ้า,24,344,12,15 สิงหาคม 2562 เวลา 13:20:14 น.
101,1030200850,30070106,200850,บ้านโคกขาม(นาคพัฒนา),kokkham,นายอภินันท์ บุญศรี,อนุบาล-มัธยมศึกษาตอนต้น,ชุมช้างบ้านผือ,หมู่ 12 บ้านโคกขาม,โบสถ์,พิมาย,นครราชสีมา,30110,adun7152.-@gmail.com,,โบสถ์,818777641,44249738,16 พฤษภาคม 2516,32,21,ขนาดกลาง,มีไฟฟ้า,19,193,11,28 มิถุนายน 2562 เวลา 11:11:09 น.
102,1030200851,30070107,200851,บ้านตะคร้อ,BANTHAKRO,นายจิรวัฒน์ เยี่ยมรัมย์,อนุบาล-ประถมศึกษา,,หมู่ 8 บ้านตะครัอ,โบสถ์,พิมาย,นครราชสีมา,30110,,,โบสถ์,0-4443-0073,44430073,26 มิถุนายน 2506,25,28,ขนาดเล็ก,มีไฟฟ้า,9,95,8,01 กรกฎาคม 2562 เวลา 14:47:37 น.
103,1030200852,30070108,200852,บ้านตะบอง,Baantabong School,นางฉันทนา โรจน์บูรณาวงศ์,อนุบาล-มัธยมศึกษาตอนต้น,,หมู่ 3 บ้านตะบอง,โบสถ์,พิมาย,นครราชสีมา,30110,tabongschool7@gmail.com,,โบสถ์,44482634,44482634,2477,25,20,ขนาดกลาง,มีไฟฟ้า,24,391,17,15 สิงหาคม 2562 เวลา 12:47:19 น.
104,1030200853,30070109,200853,บ้านลุงตามัน,Banlungtaman,นางขวัญใจ กาศก้อง,อนุบาล-มัธยมศึกษาตอนต้น,,หมู่ 2 บ้านลุงตามัน,โบสถ์,พิมาย,นครราชสีมา,30110,70109@korat7.go.th,,โบสถ์,44000960,,พ.ศ. 2483,35,25,ขนาดกลาง,มีไฟฟ้า,22,378,14,28 มิถุนายน 2562 เวลา 22:06:17 น.
105,1030200854,30070110,200854,บ้านหนองขาม,NONGKAM,นางสาวดวงนภา ขาวสุข,อนุบาล-มัธยมศึกษาตอนต้น,,หมู่ 7 บ้านหนองขาม,โบสถ์,พิมาย,นครราชสีมา,30110,chanin2309@gmail.com,www.nongkham.ac.th,โบสถ์,851529703,-,25/07/2483,8,27,ขนาดกลาง,มีไฟฟ้า,18,213,11,19 มิถุนายน 2562 เวลา 10:19:10 น.
106,1030200860,30070111,200860,บ้านฉกาจช่องโค,BANCHAKATCHONGKO SCHOOL,นางสาวกิตติมา งามจันทร์,อนุบาล-ประถมศึกษา,รัตนวาปี,หมู่ 2 บ้านฉกาจ,รังกาใหญ่,พิมาย,นครราชสีมา,30110,,,รังกาใหญ่,0-4447-1237,,21/04/2494,35,5,ขนาดเล็ก,มีไฟฟ้า,10,108,8,04 มิถุนายน 2562 เวลา 12:44:32 น.
107,1030200862,30070112,200862,บ้านพุทรา,Ban Phutsa,นายวิรัส ภูบุญศรี,อนุบาล-ประถมศึกษา,เปงจานนคร,หมู่ 9 บ้านพุทรา,รังกาใหญ่,พิมาย,นครราชสีมา,30110,phutsa.sch@hotmail.com,phutsa.ac.th,เทศบาลตำบลรังกาใหญ่,0-4448-2776,0-4448-2776,2475,28,12,ขนาดกลาง,มีไฟฟ้า,19,335,16,11 มิถุนายน 2562 เวลา 08:09:12 น.
108,1030200864,30070113,200864,พิมายสามัคคี ๑,Phimaimaisamakkeenueng,นายวัชระ นรินทร์นอก,อนุบาล-มัธยมศึกษาตอนต้น,เปงจานนคร,หมู่ 16 รังกาใหญ่,รังกาใหญ่,พิมาย,นครราชสีมา,30110,phimai1_th@hotmail.com,www.pms1.ac.th,รังกาใหญ่,870159961,,1/10/2494,22,7,ขนาดใหญ่,มีไฟฟ้า,37,579,19,28 มิถุนายน 2562 เวลา 09:37:26 น.
109,1030200841,30070114,200841,นิคมสร้างตนเองพิมาย 5,Nikomsangtonang phimai 5,นายสุวรรณ กลางสวัสดิ์,อนุบาล-ประถมศึกษา,รัตนวาปี,หมู่ 11 บ้านนิคมพัฒนา,รังกาใหญ่,พิมาย,นครราชสีมา,30110,,,รังกาใหญ่,,,3 พฤษภาคม 2508,42,13,ขนาดกลาง,มีไฟฟ้า,12,128,8,19 สิงหาคม 2562 เวลา 10:11:23 น.
110,1030200872,30070115,200872,วัดวังน้ำ,Wadwangnam,นายณรงค์ ถนัดค้า,อนุบาล-ประถมศึกษา,ชุมช้างบ้านผือ,หมู่ 7 บ้านหัวทำนบ,สัมฤทธิ์,พิมาย,นครราชสีมา,30110,wwn@hotmail.co.th,https://www.facebook.com/wadwangnamschool,องค์การบริหารส่วนตำบลสัมฤทธิ์,08-1725-3135,-,17 มิถุนายน 2500,50,7,ขนาดกลาง,มีไฟฟ้า,12,161,8,13 มิถุนายน 2561 เวลา 14:45:38 น.
111,1030200866,30070116,200866,บ้านคล้า,bankla,นายอำพร ขานกระโทก,อนุบาล-ประถมศึกษา,,หมู่ 8 คล้า,สัมฤทธิ์,พิมาย,นครราชสีมา,30110,,,สัมฤทธิ์,087-9601332,-,2 มิถุนายน 2482,60,10,ขนาดเล็ก,มีไฟฟ้า,8,54,8,12 มิถุนายน 2562 เวลา 13:15:48 น.
112,1030200867,30070117,200867,บ้านซึม(ศีลราษฎร์นุเคราะห์),ฺBanceum School,นายบัญชร พันธุ์ชัยเพชร,อนุบาล-มัธยมศึกษาตอนต้น,,หมู่ 10 บ้านสินสมบูรณ์,สัมฤทธิ์,พิมาย,นครราชสีมา,30110,"banceum@gmail.com,banceum@bc.ac.th",bc.ac.th,องค์การบริหารส่วนตำบลสัมฤทธิ์,0-4448-2926,44482926,28 มิถุนายน 2466,50,5,ขนาดกลาง,มีไฟฟ้า,19,200,11,07 ตุลาคม 2562 เวลา 13:15:57 น.
113,1030200868,30070118,200868,บ้านท่าแดง,Thadang,นางปิยะพร ถนัดค้า,อนุบาล-ประถมศึกษา,,หมู่ 3 บ้านท่าแดง,สัมฤทธิ์,พิมาย,นครราชสีมา,30110,-,-,สัมฤทธิ์,0-4400-7181,-,2524,60,7,ขนาดเล็ก,มีไฟฟ้า,4,49,8,06 เมษายน 2560 เวลา 14:24:22 น.
114,1030200869,30070119,200869,บ้านสัมฤทธิ์,ban samrit,นางสาววิภาพร สอบเหล็ก,อนุบาล-มัธยมศึกษาตอนต้น,นาหนัง,หมู่ 12 บ้านสัมฤทธิ์,สัมฤทธิ์,พิมาย,นครราชสีมา,30110,,,สัมฤทธิ์,0-4440-1501,,2476,50,13,ขนาดกลาง,มีไฟฟ้า,20,196,11,15 สิงหาคม 2562 เวลา 13:27:26 น.
115,1030200874,30070120,200874,นิคมสร้างตนเองพิมาย 4,NIKOMSANGTONENGPHIMAI4,นายวิรัตน์ กะตะศิลา,อนุบาล-มัธยมศึกษาตอนต้น,,หมู่ 6 บ้านหนองระเวียง,หนองระเวียง,พิมาย,นครราชสีมา,30110,,,หนองระเวียง,,,22 มิถุนายน 2506,51,16,ขนาดกลาง,มีไฟฟ้า,21,324,11,28 มิถุนายน 2562 เวลา 18:17:07 น.
116,1030200879,30070121,200879,หนองบัวลอย,NONGBUALOY,นายไพศาล สุขสุมนต์ศิลป์,อนุบาล-ประถมศึกษา,,หมู่ 9 บ้านนาตาหิน,หนองระเวียง,พิมาย,นครราชสีมา,30110,-,-,หนองระเวียง,44756947,-,25 กรกฎาคม 2485,60,15,ขนาดเล็ก,มีไฟฟ้า,8,83,8,04 พฤศจิกายน 2562 เวลา 10:38:29 น.
117,1030200875,30070122,200875,บ้านดอนหวาย,Ban Donwai,นายถวิล เดือนกระจ่าง,อนุบาล-ประถมศึกษา,,หมู่ 3 บ้านดอนหวาย,หนองระเวียง,พิมาย,นครราชสีมา,30110,schoolbandonwai@gmail.com,,หนองระเวียง,,,1 พ.ย 2484,45,28,ขนาดเล็ก,มีไฟฟ้า,9,78,9,03 กรกฎาคม 2561 เวลา 13:31:52 น.
118,1030200876,30070123,200876,บ้านหนองบัวคำ,BANNONGBUAKAM,นางณัฐชญา ดาโม้,อนุบาล-ประถมศึกษา,รัตนวาปี,หมู่ 5 บ้านหนองบัวคำ,หนองระเวียง,พิมาย,นครราชสีมา,30110,,,หนองระเวียง,44430166,,12 พฤษภาคม 2514,50,25,ขนาดเล็ก,มีไฟฟ้า,10,65,8,27 เมษายน 2562 เวลา 20:26:44 น.
119,1030200877,30070124,200877,บ้านหนองโสน,BANNONGSANO,นางปนารีย์ เทนอิสสระ,อนุบาล-ประถมศึกษา,,หมู่ 11 บ้านหนองโสน,หนองระเวียง,พิมาย,นครราชสีมา,30110,-,-,หนองระเวียง,862571824,-,20 พ.ค. 2521,65,25,ขนาดเล็ก,มีไฟฟ้า,9,54,8,10 ตุลาคม 2562 เวลา 04:48:50 น.
120,1030200878,30070125,200878,เพชรหนองขาม,Petchnongkam,นายนายอุทัย ชารัญจ่า,อนุบาล-มัธยมศึกษาตอนปลาย,,หมู่ 2 หนองขาม,หนองระเวียง,พิมาย,นครราชสีมา,30110,-,www.petchnongkamschool.com,หนองระเวียง,044-965623,-,29/11/2442,59.4,21.9,ขนาดกลาง,มีไฟฟ้า,28,493,22,27 มิถุนายน 2562 เวลา 15:44:08 น.
121,1030200230,30070126,200230,พิกุลทอง,pikultong,นายธนาดุลย์ รถเพ็ชร,อนุบาล-มัธยมศึกษาตอนต้น,,หมู่ 4 บ้านโนนทอง,ชุมพวง,ชุมพวง,นครราชสีมา,30270,my_pt@hotmail.com,pikultong.ac.th,เทศบาลตำบลชุมพวง,0-4447-7012,44477012,5 มิถุนายน 2482,2,1,ขนาดกลาง,มีไฟฟ้า,28,515,22,28 มิถุนายน 2561 เวลา 13:39:11 น.
122,1030200231,30070127,200231,หนองบัวรีราษฎร์อุทิศ,NONGBUAREE,นายกิตติภพ สระสงครามภู,อนุบาล-ประถมศึกษา,,หมู่ 2 บ้านขนาก,ชุมพวง,ชุมพวง,นครราชสีมา,30270,70127@korat7.go.th,www.nbrkorat7.com,เทศบาลชุมพวง,0-4407-5011,,07/01/2469,3,2,ขนาดกลาง,มีไฟฟ้า,20,291,14,29 พฤศจิกายน 2562 เวลา 20:30:24 น.
123,1030200233,30070128,200233,ตลาดไทรโนนดู่หนองจิกวิทยา,TALADSAINONDOONONGJIKWITAYA,นายพันศักดิ์ อ่อนหนองหว้า,อนุบาล-ประถมศึกษา,กลุ่มเครือข่ายการศึกษาช่อแฮนาจักร,หมู่ 1 ตลาดไทร,ตลาดไทร,ชุมพวง,นครราชสีมา,30270,,,ตลาดไทร,084-8257253,,3 ตุลาคม 2481,25,25,ขนาดกลาง,มีไฟฟ้า,13,135,8,07 มิถุนายน 2562 เวลา 11:17:16 น.
124,1030200234,30070129,200234,สองห้องแวงน้อยวิทยา,sonhhongweangnoiwittaya,นางชูศรี บุญเที่ยง,อนุบาล-ประถมศึกษา,กลุ่มเครือข่ายการศึกษาช่อแฮนาจักร,หมู่ 9 สองห้อง,ตลาดไทร,ชุมพวง,นครราชสีมา,30270,,,ตลาดไทร,0-44430714,,23 กรกฎาคม 2523,20,20,ขนาดเล็ก,มีไฟฟ้า,10,92,8,30 มิถุนายน 2561 เวลา 19:49:10 น.
125,1030200235,30070130,200235,บ้านหนองบัว,BANNONGBUA,นายยุทธศาสตร์ วาดวงศรี,อนุบาล-ประถมศึกษา,กลุ่มเครือข่ายการศึกษาช่อแฮนาจักร,หมู่ 4 หนองบัว-สระปทุม,ตลาดไทร,ชุมพวง,นครราชสีมา,30270,,,ตลาดไทร,044-430075,-,25 กรกฎาคม 2483,24,24,ขนาดกลาง,มีไฟฟ้า,12,170,8,28 มิถุนายน 2562 เวลา 10:41:53 น.
126,1030200236,30070131,200236,บ้านหนองแวงสามัคคี,Bannongwangsamukkee,นายเสนีย์ สมรูป,อนุบาล-ประถมศึกษา,กลุ่มเครือข่ายการศึกษาช่อแฮนาจักร,หมู่ 2 หนองแวง,ตลาดไทร,ชุมพวง,นครราชสีมา,30270,-,-,ตลาดไทร,-,-,25 กรกฎาคม 2483,28,28,ขนาดเล็ก,มีไฟฟ้า,8,97,8,03 กรกฎาคม 2561 เวลา 11:15:51 น.
127,1030200237,30070132,200237,วัดเจริญราษฎร์บำรุง,Watcharoenratbamrung,นายธานินทร์ สุขมา,อนุบาล-มัธยมศึกษาตอนต้น,,หมู่ 15 บูรพา,ตลาดไทร,ชุมพวง,นครราชสีมา,30270,watcharoenratschool@gmail.com,,ตลาดไทร,862627780,,2480,40,37,ขนาดกลาง,มีไฟฟ้า,18,166,11,14 พฤศจิกายน 2560 เวลา 05:53:38 น.
128,1030200238,30070133,200238,วัดโพธิ์ศรีบรรจง,Watphosribanjong School,นายปิยะ ประกอบผล,อนุบาล-มัธยมศึกษาตอนต้น,,หมู่ 5 บ้านตาจง,ตลาดไทร,ชุมพวง,นครราชสีมา,30270,phosribanjongschool@gmail.com,http://school.obec.go.th/posribanjong/,ตลาดไทร,,,5 มิถุนายน 2482,38,34,ขนาดกลาง,มีไฟฟ้า,18,188,11,31 มกราคม 2563 เวลา 15:34:53 น.
129,1030200239,30070134,200239,บ้านหนองหว้าประชาสามัคคี,Nongwhaprachasamakkey,นายศิริชัย ปิ่นศิริ,อนุบาล-ประถมศึกษา,,หมู่ 11 บ้านหนองหว้า,ตลาดไทร,ชุมพวง,นครราชสีมา,30270,nw.samakkee@gmail.com,gg.gg/npschool,อบต.ตลาดไทร,44082124,,28 พฤษภาคม พ.ศ.2523,28,28,ขนาดกลาง,มีไฟฟ้า,11,121,8,26 กุมภาพันธ์ 2563 เวลา 17:04:23 น.
130,1030200251,30070135,200251,บ้านหนองตาด,BANNONGTAD,-,อนุบาล-ประถมศึกษา,กลุ่มเครือข่ายการศึกษาช่อแฮนาจักร,หมู่ 19 บ้านหนองตาดพัฒนา,ตลาดไทร,ชุมพวง,นครราชสีมา,30270,-,-,ตลาดไทร,044-082121,-,2499,23,18,ขนาดเล็ก,มีไฟฟ้า,9,109,8,01 กรกฎาคม 2562 เวลา 14:43:11 น.
131,1030200241,30070136,200241,ท่าลาด,Thalad,นายทรงศิลป์ ธรรมวิภารัตน์,อนุบาล-มัธยมศึกษาตอนปลาย,,หมู่ 1 ท่าลาด,ท่าลาด,ชุมพวง,นครราชสีมา,30270,nuttachan19@gmail.com,thalad.ac.th,ท่าลาด,44082127,,3 มิถุนายน พ.ศ.2482,18,21,ขนาดกลาง,มีไฟฟ้า,35,510,25,27 พฤศจิกายน 2562 เวลา 15:22:49 น.
132,1030200242,30070137,200242,บ้านพะงาดวิทยา,Pangadwittaya School,นายถนอม วรรณพงศ์เจริญ,อนุบาล-มัธยมศึกษาตอนต้น,วังหลวงหนองหลวง,หมู่ 2 โคกพะงาด,ท่าลาด,ชุมพวง,นครราชสีมา,30270,pvschool2481@gmail.com,pvschool.atwebpages.com,ท่าลาด,0-4443-0190,,2481,22,23,ขนาดกลาง,มีไฟฟ้า,20,258,11,24 มิถุนายน 2562 เวลา 14:26:46 น.
133,1030200243,30070138,200243,บ้านลุงประดู่,Banlungpradoo School,นายสฤษดิ์ มลาศรี,อนุบาล-ประถมศึกษา,วังหลวงหนองหลวง,หมู่ 7 บ้านลุงประดู่,ท่าลาด,ชุมพวง,นครราชสีมา,30270,banlungpradoo@gmail.com,banlungpradooschool.com,ท่าลาด,-,-,2504,17.7,2.8,ขนาดเล็ก,มีไฟฟ้า,4,38,7,24 มิถุนายน 2562 เวลา 22:49:04 น.
134,1030200244,30070139,200244,บ้านหนองตะคลอง,Ban Nongtaklong,นายพิศาล ลาภยิ่งยง,อนุบาล-ประถมศึกษา,วังหลวงหนองหลวง,หมู่ 10 หนองตะคลอง,ท่าลาด,ชุมพวง,นครราชสีมา,30270,-,-,องค์การบริหารส่วนตำบลท่าลาด,44082130,-,2515,15,20,ขนาดเล็ก,มีไฟฟ้า,10,83,9,28 มิถุนายน 2562 เวลา 10:57:17 น.
135,1030200245,30070140,200245,บ้านหนองนกคู่,NONGNOKKU SCHOOL,นายประยุทธ ผลาทิพย์,อนุบาล-มัธยมศึกษาตอนต้น,,หมู่ 3 บ้านหนองนกคู่,ท่าลาด,ชุมพวง,นครราชสีมา,30270,70140@korat7.go.th,,อบต.ท่าลาด,0-4475-1760,44762014,2515,18,18,ขนาดกลาง,มีไฟฟ้า,17,146,11,04 มิถุนายน 2562 เวลา 15:02:18 น.
136,1030200246,30070141,200246,บ้านหนองปรือแก้ว,Bannongpruegaew school,นายไพศาล สง่าศรี,อนุบาล-ประถมศึกษา,,หมู่ 8 บ้านหนองปรือแก้ว,ท่าลาด,ชุมพวง,นครราชสีมา,30270,,,ท่าลาด,,,21 พฤษภาคม 2505,18,18,ขนาดเล็ก,มีไฟฟ้า,3,37,8,07 มิถุนายน 2562 เวลา 10:11:15 น.
137,1030200226,30070142,200226,ไทยรัฐวิทยา82(โคกตองเจริญ),Thairathwitthaya82 Khoktongcharern,นายสุรพล ชัยวงษ์,อนุบาล-มัธยมศึกษาตอนต้น,,หมู่ 17 อุดมสุข,ท่าลาด,ชุมพวง,นครราชสีมา,30270,-,data.bopp-obec.info/web/?School_ID=1030200226,ท่าลาด,18761298,-,12 กรกฎาคม 2506,5,10,ขนาดกลาง,มีไฟฟ้า,20,245,12,27 มกราคม 2563 เวลา 15:22:58 น.
138,1030200232,30070143,200232,ห้วยบงวิทยา,huaibongwittaya,นายไตรภพ พุฒนอก,อนุบาล-มัธยมศึกษาตอนต้น,,หมู่ 11 หนองทุ่ม,ท่าลาด,ชุมพวง,นครราชสีมา,30270,70143@korat.go.th,,ท่าลาด,956163298,,18 มีนาคม 2523,8,8,ขนาดกลาง,มีไฟฟ้า,17,150,11,04 กันยายน 2562 เวลา 20:44:30 น.
139,1030200240,30070144,200240,บ้านโคกหินช้าง,BanKhokhinchang,นายธานี ศิริคุณ,อนุบาล-ประถมศึกษา,,หมู่ 4 บ้านโคกหินช้าง,สาหร่าย,ชุมพวง,นครราชสีมา,30270,khokhinchang@gmail.com,hinchang.korat7.go.th,สาหร่าย,62474773,,15 มิถุนายน 2485,23.6,23.6,ขนาดเล็ก,มีไฟฟ้า,8,57,8,15 สิงหาคม 2562 เวลา 16:09:39 น.
140,1030200265,30070145,200265,"โนนตูม ""รัฐราษฎร์รังสรรค์""",noontomrattarachrungsun,นายสนธยา เมยมงคล,อนุบาล-ประถมศึกษา,วังหลวงหนองหลวง,หมู่ 13 ตูมใหญ่,โนนตูม,ชุมพวง,นครราชสีมา,30270,,,โนนตูม,0-4424-9479,0-4424-9479,01/07/2469,35,35,ขนาดกลาง,มีไฟฟ้า,13,144,8,15 สิงหาคม 2562 เวลา 10:36:07 น.
141,1030200266,30070146,200266,บ้านสว่างนาดี,SAWANG NADEE,นางแสงเดือน สาสีดา,อนุบาล-ประถมศึกษา,วังหลวงหนองหลวง,หมู่ 8 บ้านทุ่งสว่าง,โนนตูม,ชุมพวง,นครราชสีมา,30270,,school.obec.go.th/sawangnadee/,โนนตูม,0-44430161,,4 กรกฎาคม 2483,29,29,ขนาดเล็ก,มีไฟฟ้า,6,41,8,10 กรกฎาคม 2562 เวลา 08:34:01 น.
142,1030200267,30070147,200267,บ้านสาหร่ายวิทยา,bansaraiwittayaschool,นายวินัย เจริญรัมย์,อนุบาล-มัธยมศึกษาตอนต้น,,หมู่ 2 หนองเจ้าเรือน,โนนตูม,ชุมพวง,นครราชสีมา,30270,saraiwittaya@hotmail.com,bansaraiwittayaschool.com,โนนตูม,882632622,,07/06/2482,40,40,ขนาดกลาง,มีไฟฟ้า,19,199,11,22 สิงหาคม 2562 เวลา 12:14:45 น.
143,1030200268,30070148,200268,บ้านหนองโดนรกฟ้า,ฺBan Nongdonrokfa,นางเกยูร ศิริคุณ,อนุบาล-ประถมศึกษา,วังหลวงหนองหลวง,หมู่ 5 บ้านหนองโดน,โนนตูม,ชุมพวง,นครราชสีมา,30270,kungking00_@hotmail.com,nongdonrokfa.ac.th/,โนนตูม,44082136,-,18 กรกฎาคม 2500,40,40,ขนาดเล็ก,มีไฟฟ้า,10,81,9,04 กรกฎาคม 2561 เวลา 09:48:42 น.
144,1030200269,30070149,200269,บ้านหนองหว้าตาดำ,Bannongwahtadam,นางสาวหนูเดือน พาแกดำ,อนุบาล-มัธยมศึกษาตอนต้น,,หมู่ 6 บ้านหนองหว้าสีชมพู,สาหร่าย,ชุมพวง,นครราชสีมา,30270,,,สาหร่าย,,,25 กรกฎาคม 2483,36,36,ขนาดกลาง,มีไฟฟ้า,17,243,12,15 สิงหาคม 2562 เวลา 13:02:33 น.
