145,1030200270,30070150,200270,วัดสองพี่น้อง,watsongpeenong,นายสมุทร อินทลี,อนุบาล-มัธยมศึกษาตอนต้น,,หมู่ 7 สองพี่น้อง,โนนตูม,ชุมพวง,นครราชสีมา,30270,spn_school@hotmail.com,,โนนตูม,0-4424-9519,0-4424-9519,28/07/2548,40,40,ขนาดกลาง,มีไฟฟ้า,19,221,11,14 มิถุนายน 2562 เวลา 14:18:48 น.
146,1030200271,30070151,200271,หนองปรือแดง(ศิริราษฎร์ปการ),Nongphaedeang Siriratphakarn,นายอัคเดช รูปสูง,อนุบาล-ประถมศึกษา,,หมู่ 1 บ้านหนองแดง,สาหร่าย,ชุมพวง,นครราชสีมา,30270,npd2500school@gmail.com,,สาหร่าย,810674760,,2 พฤษภาคม พ.ศ.2500,28,28,ขนาดเล็ก,มีไฟฟ้า,12,48,8,29 มิถุนายน 2562 เวลา 04:26:03 น.
147,1030200259,30070152,200259,บ้านโนนยอ,BANNONYO,นายณัฐพล กล้าหาญ,อนุบาล-มัธยมศึกษาตอนปลาย,เฝ้าไร่,หมู่ 6 โนนยอพัฒนา,โนนยอ,ชุมพวง,นครราชสีมา,30270,nonyo.acth@gmail.com,www.nonyo.ac.th,องค์การบริหารส่วนตําบลโนนยอ,817251476,,4 พฤษภาคม 2514,13,10,ขนาดกลาง,มีไฟฟ้า,28,369,16,28 มิถุนายน 2562 เวลา 14:19:29 น.
148,1030200228,30070153,200228,บ้านยางวิทยา,Banyang wittaya,นายชยพล ระดมผล,อนุบาล-มัธยมศึกษาตอนต้น,เฝ้าไร่,หมู่ 2 บ้านยาง,โนนยอ,ชุมพวง,นครราชสีมา,30270,,,โนนยอ,0-44487960,0-44487960,14 ก.ค. 2483,8,8,ขนาดกลาง,มีไฟฟ้า,22,290,12,10 มิถุนายน 2562 เวลา 07:50:04 น.
149,1030200227,30070154,200227,อนุบาลชุมพวงวิทยา,Anubanchumphuangwittaya,นายเดชา มีศิลป์,อนุบาล-มัธยมศึกษาตอนต้น,เฝ้าไร่,หมู่ 11 บ้านชุมพวง,ชุมพวง,ชุมพวง,นครราชสีมา,30270,school.acw@gmail.com,acw.ac.th,ชุมพวง,0-4447-7383,0-4447-7383,1 มิถุนายน 2502,2,2,ขนาดใหญ่,มีไฟฟ้า,27,563,23,18 มิถุนายน 2561 เวลา 13:54:42 น.
150,1030200247,30070155,200247,บ้านโคกเพชร,BANKOKPED,นายธีรภัทร มูลเทพ,อนุบาล-ประถมศึกษา,กลุ่มเครือข่ายการศึกษาช่อแฮนาจักร,หมู่ 4 บ้านโคกเพชร,โนนรัง,ชุมพวง,นครราชสีมา,30270,,,โนนรัง,,,2518,19,19,ขนาดเล็ก,มีไฟฟ้า,8,96,8,30 มิถุนายน 2562 เวลา 18:33:29 น.
151,1030200248,30070156,200248,บ้านดงบัง(สว่างวิทยา),,นายวุฒิศักดิ์ อนุวรรณ์,อนุบาล-ประถมศึกษา,,หมู่ 9 ดงบัง,โนนรัง,ชุมพวง,นครราชสีมา,30270,,,โนนรัง,,,,12,12,ขนาดกลาง,มีไฟฟ้า,20,251,11,28 มิถุนายน 2562 เวลา 11:42:09 น.
152,1030200249,30070157,200249,บ้านโนนรัง,Nonrangschool,นายประมวล ผาสุข,อนุบาล-มัธยมศึกษาตอนต้น,กลุ่มเครือข่ายการศึกษาช่อแฮนาจักร,หมู่ 3 บ้านโนนรัง,โนนรัง,ชุมพวง,นครราชสีมา,30270,nonrangschool@yahoo.com,,โนนรัง,,,1 สิงหาคม 2481,20,20,ขนาดกลาง,มีไฟฟ้า,20,296,12,27 มิถุนายน 2562 เวลา 10:27:21 น.
153,1030200250,30070158,200250,บ้านหนองข่าวิทยานุสรณ์,Bannongkhawittayanusorn,นางศิวกานท์ ศักดานุศาสน์,อนุบาล-ประถมศึกษา,,หมู่ 8 บ้านหนองข่า,โนนรัง,ชุมพวง,นครราชสีมา,30270,bannongkha2@gmail.com,,โนนรัง,833782514,,1 พฤษภาคม 2504,18,15,ขนาดเล็ก,มีไฟฟ้า,9,68,9,25 มิถุนายน 2561 เวลา 13:36:30 น.
154,1030200252,30070159,200252,บ้านหนองทุ่มโนนหาดวิทยา,BANNONGTOOMNONHAD,-,อนุบาล-ประถมศึกษา,,หมู่ 7 หนองทุ่ม,โนนรัง,ชุมพวง,นครราชสีมา,30270,bannongtoom2008@hotmail.com,-,โนนรัง,44082141,-,21 เมษายน 2494,24,24,ขนาดเล็ก,มีไฟฟ้า,9,102,8,17 สิงหาคม 2562 เวลา 09:20:13 น.
155,1030200253,30070160,200253,บ้านใหม่พัฒนา,Banmaipattana School,นางปฐมาวดี ศรีคราม,อนุบาล-ประถมศึกษา,,หมู่ 13 บ้านใหม่พัฒนา,โนนรัง,ชุมพวง,นครราชสีมา,30270,banmaipattana220@gmail.com,-http://schoolweb.eduzones.com/Banmaipattana13/,โนนรัง,-,-,26 มิถุนายน 2533,16,13,ขนาดเล็ก,มีไฟฟ้า,7,82,9,12 พฤศจิกายน 2562 เวลา 14:48:12 น.
156,1030200254,30070161,200254,บ้านใหม่ปฎิรูป,BANMAIPATIROOP SCHOOL,นายวัฒนา ขันแข็ง,อนุบาล-มัธยมศึกษาตอนต้น,กลุ่มเครือข่ายการศึกษาช่อแฮนาจักร,หมู่ 12 บ้านใหม่ปฎิรูป,โนนรัง,ชุมพวง,นครราชสีมา,30270,maipatiroop@hotmail.com,maipatiroop.ac.th,โนนรัง,872485599,-,02/09/2523,14,11,ขนาดกลาง,มีไฟฟ้า,20,206,11,17 สิงหาคม 2562 เวลา 12:28:46 น.
157,1030200229,30070162,200229,บ้านละโว้,Lawo,ว่าที่ ร.ต.สิริวัส ชนะค้าโชติ์สิริ,อนุบาล-มัธยมศึกษาตอนต้น,เฝ้าไร่,หมู่ 21 บ้านละโว้,ประสุข,ชุมพวง,นครราชสีมา,30270,nontanokya@gmail.com,http://www.banlawo.com,ประสุข,816008947,-,12 ตุลาคม 2499,1,5,ขนาดกลาง,มีไฟฟ้า,21,238,12,16 สิงหาคม 2562 เวลา 11:33:26 น.
158,1030200260,30070163,200260,บ้านขามขุนร่ม,bankamkhunrom-prachasamukky,นางณัฐพร ธรรมโส,อนุบาล-ประถมศึกษา,,หมู่ 14 บ้านขามใหม่,ประสุข,ชุมพวง,นครราชสีมา,30270,,,ประสุข,,,1 ก.ย. 2501,8,14,ขนาดเล็ก,มีไฟฟ้า,10,87,9,24 มิถุนายน 2562 เวลา 11:00:28 น.
159,1030200261,30070164,200261,บ้านดอนลำดวน,BANDORNLAMDUAN,นายจักรี บุญเที่ยง,อนุบาล-ประถมศึกษา,,หมู่ 10 บ้านดอนลำดวน,ประสุข,ชุมพวง,นครราชสีมา,30270,bandornlamduan@gmail.com,,องค์การบริหารส่วนตำบลประสุข,44082145,-,01/09/2503,7.2,3.3,ขนาดกลาง,มีไฟฟ้า,13,128,9,15 กรกฎาคม 2562 เวลา 13:04:24 น.
160,1030200262,30070165,200262,บ้านประสุข,banprasuk,นายเพชร กล้าหาญ,อนุบาล-มัธยมศึกษาตอนปลาย,,หมู่ 13 โนนยาง,ประสุข,ชุมพวง,นครราชสีมา,30270,prasukschool.korat7@gmail.com,,อบต.ประสุข,,,28 พ.ค. 2478,16,16,ขนาดกลาง,มีไฟฟ้า,27,347,15,10 มกราคม 2563 เวลา 09:22:22 น.
161,1030200263,30070166,200263,วัดโชติการาม,Watchotikaram,นายประภาส ร่มสุข,อนุบาล-มัธยมศึกษาตอนต้น,เฝ้าไร่,หมู่ 8 บ้านเขว้า,ประสุข,ชุมพวง,นครราชสีมา,30270,watchotikaram@hotmail.com,www.watchotikaram.ac.th,ประสุข,0-4424-9519,44249334,20 เมษายน 2497,13,15,ขนาดกลาง,มีไฟฟ้า,23,421,22,30 มิถุนายน 2561 เวลา 18:55:06 น.
162,1030200264,30070167,200264,อาสนาราม (เปล่งอุปถัมภ์),asnaram,นายเกรียงไกร ไพราม,อนุบาล-ประถมศึกษา,,หมู่ 11 บ้านแท่น,ประสุข,ชุมพวง,นครราชสีมา,30270,-,-,ประสุข,44001811,-,25 กรกฏาคม 2483,7,7,ขนาดกลาง,มีไฟฟ้า,14,138,9,06 พฤศจิกายน 2562 เวลา 15:33:18 น.
163,1030200258,30070168,200258,ประโดกสามัคคี,Pradoksamakee,นายสมศักดิ์ นวลประเสริฐ,อนุบาล-ประถมศึกษา,,หมู่ 5 บ้านประโดก,หนองหลัก,ชุมพวง,นครราชสีมา,30270,,Pradoksamakee.com,หนองหลัก,0-4443-0221,,2487,14,14,ขนาดเล็ก,มีไฟฟ้า,8,69,8,17 สิงหาคม 2562 เวลา 11:11:33 น.
164,1030200256,30070169,200256,บ้านเมืองไผ่,BANMUANGPHAI SCHOOL,นางชนมิกา ผาดไธสง,อนุบาล-ประถมศึกษา,,หมู่ 7 เมืองไผ่,หนองหลัก,ชุมพวง,นครราชสีมา,30270,muangphaischool@gmail.com,,หนองหลัก,902877343,-,15 มิถุนายน 2484,15,15,ขนาดเล็ก,มีไฟฟ้า,9,72,9,20 มกราคม 2563 เวลา 09:13:15 น.
165,1030200257,30070170,200257,บ้านหนองหลักสามัคคี,Bannonglaksamakkee,นางทิปกา ระดมผล,อนุบาล-มัธยมศึกษาตอนต้น,,หมู่ 8 โนนสวน,ชุมพวง,ชุมพวง,นครราชสีมา,30270,b.nonglakschool@gmailcom,data.bopp-obec.info/web/?School_ID=1030200257,????????,-,-,24 กรกฎาคม 2483,8.5,8.5,ขนาดกลาง,มีไฟฟ้า,21,167,12,28 สิงหาคม 2562 เวลา 10:07:09 น.
166,1030200255,30070171,200255,โนนขุยสามัคคี,NOONKUISAMAKKEE,นายมงคล สาสีดา,อนุบาล-ประถมศึกษา,,หมู่ 1 โนนขุย,หนองหลัก,ชุมพวง,นครราชสีมา,30270,noonkui88@gmail.com,,หนองหลัก,44082150,,13 กรกฎาคม 2483,11,11,ขนาดเล็ก,มีไฟฟ้า,8,74,8,19 มิถุนายน 2562 เวลา 22:39:42 น.
167,1030200409,30070172,200409,บ้านโกรกสำโรง,BANKROKSAMRONG,นายสิริวิชัย มีระหันนอก,อนุบาล-มัธยมศึกษาตอนต้น,,หมู่ 9 บ้านสำโรง,ดอนยาวใหญ่,โนนแดง,นครราชสีมา,30360,kroksamrong@gmail.com,,ดอนยาวใหญ่,92955993,-,2470,65,18,ขนาดกลาง,มีไฟฟ้า,14,124,12,18 มิถุนายน 2562 เวลา 13:27:14 น.
168,1030200410,30070173,200410,บ้านดอนยาว,BANDONYAO,นายทองรวม สถิตย์พงษ์,อนุบาล-มัธยมศึกษาตอนต้น,,หมู่ 6 บ้านศรีวัฒนา,ดอนยาวใหญ่,โนนแดง,นครราชสีมา,30360,donyao2013@gmail.com,,ดอนยาวใหญ่,044-977225,-,1 กันยายน 2465,54,7,ขนาดกลาง,มีไฟฟ้า,19,167,11,28 มิถุนายน 2562 เวลา 10:23:59 น.
169,1030200411,30070174,200411,บ้านนาดี,Bannadee,นางสาวกันยารัตน์ เกษรเทียน,อนุบาล-ประถมศึกษา,กุดบง,หมู่ 10 บ้านนาดี,ดอนยาวใหญ่,โนนแดง,นครราชสีมา,30360,lung111_pink@hotmail.com,-,ดอนยาวใหญ่,-,-,พ.ศ.2484,72,12,ขนาดเล็ก,มีไฟฟ้า,6,43,9,06 มิถุนายน 2562 เวลา 22:39:06 น.
170,1030200413,30070175,200413,บ้านป่าตะแบง,patabang,นายวิริทธิ์พล พลสม,อนุบาล-มัธยมศึกษาตอนต้น,,หมู่ 8 บ้านป่าตะแบง,ดอนยาวใหญ่,โนนแดง,นครราชสีมา,30360,phatabaeng.school@gmail.com,-,ดอนยาวใหญ่,44430661,-,5 กันยายน 2527,50,7,ขนาดกลาง,มีไฟฟ้า,12,83,11,16 สิงหาคม 2562 เวลา 13:13:12 น.
171,1030200403,30070176,200403,ชุมชนโนนแดง,Chumchonnondaeng,นายถวิล รัตนพร,อนุบาล-มัธยมศึกษาตอนต้น,กุดบง,หมู่ 15 ชุมชนตลาดโนนแดง,โนนแดง,โนนแดง,นครราชสีมา,30360,cnd_school@hotmail.co.th,www.cndschool.ac.th,โนนแดง,0-4448-5104,0-4448-5104,1 กันยายน 2481,47,1.5,ขนาดใหญ่,มีไฟฟ้า,37,652,24,16 สิงหาคม 2562 เวลา 09:39:56 น.
172,1030200404,30070177,200404,บ้านจาบ,Banjab,นายเกษม สมมาตย์,อนุบาล-ประถมศึกษา,,หมู่ 9 บ้านจาบ,โนนแดง,โนนแดง,นครราชสีมา,30360,-,-,โนนแดง,-,-,20 ตุลาคม 2488,60,5,ขนาดเล็ก,มีไฟฟ้า,8,69,9,02 มิถุนายน 2560 เวลา 11:32:39 น.
173,1030200405,30070178,200405,บ้านดอนตัดเรือ,Dontudrua,นายชัยวัตร เลิศนา,อนุบาล-มัธยมศึกษาตอนต้น,,หมู่ 6 ดอนตัดเรือ,โนนแดง,โนนแดง,นครราชสีมา,30360,dontudria@gmail.com,www.dontudrua.com,โนนแดง,0-4447-5249,475249,พ.ศ. 2475,50,3,ขนาดกลาง,มีไฟฟ้า,16,145,12,30 มิถุนายน 2562 เวลา 10:57:46 น.
174,1030200407,30070179,200407,บ้านหนองบง,Bannongbong,นายบุญยก งานฉมัง,อนุบาล-ประถมศึกษา,กุดบง,หมู่ 8 บ้านหนองบง,โนนแดง,โนนแดง,นครราชสีมา,30360,-,-,-,96053290,-,1/06/2482,50,3,ขนาดเล็ก,มีไฟฟ้า,7,48,9,17 สิงหาคม 2562 เวลา 12:11:48 น.
175,1030200408,30070180,200408,วัดบ้านตะเภาหนุน,WATBANTAPAONOON,นายสุวิทย์ แก้วไพทูรย์,อนุบาล-ประถมศึกษา,,หมู่ 2 บ้านตะเภาหนุน,โนนแดง,โนนแดง,นครราชสีมา,30360,subanpet@live.com,,โนนแดง,0-4448-5072,,10/06/2483,57,6,ขนาดเล็ก,มีไฟฟ้า,6,83,9,14 มิถุนายน 2562 เวลา 08:45:25 น.
176,1030200414,30070181,200414,บ้านหนองม่วง,Ban Nongmuang,นายปัญญา สิทธิจันทร์เสน,อนุบาล-ประถมศึกษา,กุดบง,หมู่ 6 บ้านหนองม่วง,โนนตาเถร,โนนแดง,นครราชสีมา,30360,,www.bnmschool.com,โนนตาเถร,,,1 มิ.ย. 2482,65,12,ขนาดเล็ก,มีไฟฟ้า,7,42,8,05 กรกฎาคม 2560 เวลา 02:17:44 น.
177,1030200415,30070182,200415,วัดบ้านโคกหนองแวง,WATBANKOKNONGWANG,นายพร้อม นาสวาสดิ์,อนุบาล-มัธยมศึกษาตอนปลาย,,หมู่ 2 โคกหนองแวง,โนนตาเถร,โนนแดง,นครราชสีมา,30360,,,????????,,-,25 กันยายน 2481,70,13,ขนาดกลาง,มีไฟฟ้า,22,270,14,24 กุมภาพันธ์ 2563 เวลา 15:24:37 น.
178,1030200412,30070183,200412,บ้านโนนตาเถร,Bannontatain,นายเจนุวัตร จงเจือกลาง,อนุบาล-ประถมศึกษา,,หมู่ 9 บ้านโนนตาเถร,โนนตาเถร,โนนแดง,นครราชสีมา,30360,-,-,โนนตาเถร,44430340,-,1 มิถุนายน 2482,60,8,ขนาดเล็ก,มีไฟฟ้า,8,47,8,13 มิถุนายน 2562 เวลา 12:58:09 น.
179,1030200421,30070184,200421,วัดบ้านทุ่งรี,watbantungree,นายเกรียงศักดิ์ พลดงนอก,อนุบาล-ประถมศึกษา,,หมู่ 7 บ้านทุ่งรี,วังหิน,โนนแดง,นครราชสีมา,30360,watbantungree_school@hotmail.com,Watbantungreeschool.com,เทศบาลตำบลวังหิน,44082216,-,2515,50,15,ขนาดเล็ก,มีไฟฟ้า,9,79,8,03 กรกฎาคม 2562 เวลา 15:02:04 น.
180,1030200422,30070185,200422,วัดบ้านหินตั้ง,Watbanhintung School,นายเอนก สังมาตร,อนุบาล-ประถมศึกษา,,หมู่ 9 บ้านหินตั้ง,วังหิน,โนนแดง,นครราชสีมา,30360,hintung.2558@gmail.com,-,เทศบาลตำบลวังหิน,44230421,-,2484,52,14,ขนาดเล็ก,มีไฟฟ้า,7,57,9,16 มิถุนายน 2560 เวลา 06:37:20 น.
181,1030200419,30070186,200419,วังหินประชาสรรค์,wanghinprachasun,นายวิธาร ช่างทอง,อนุบาล-มัธยมศึกษาตอนต้น,,หมู่ 4 หนองขี้เหล็ก,วังหิน,โนนแดง,นครราชสีมา,30360,wunghin119@gmail.com,www.wunghin.ac.th,วังหิน,0-4432-9386,,พ.ศ.2482,50,9,ขนาดกลาง,มีไฟฟ้า,22,262,12,11 มิถุนายน 2562 เวลา 08:37:25 น.
182,1030200420,30070187,200420,แกสำโรงวิทยา,Kaesamrongwittaya School,นางสาวมฆพร เกษนอก,อนุบาล-ประถมศึกษา,,หมู่ 3 บ้านแก,วังหิน,โนนแดง,นครราชสีมา,30360,70187@korat7.go.th,-,เทศบาลตำบลวังหิน,846062544,-,2493,50,14,ขนาดเล็ก,มีไฟฟ้า,9,74,9,25 มิถุนายน 2562 เวลา 14:37:41 น.
183,1030200417,30070188,200417,บ้านฝาง,banfang,ว่าที่ร้อยตรีธรณินทร์ ชมภู่,อนุบาล-ประถมศึกษา,,หมู่ 2 ฝาง,สำพะเนียง,โนนแดง,นครราชสีมา,30360,,,สำพะเนียง,,,,60,10,ขนาดเล็ก,มีไฟฟ้า,6,33,8,12 กันยายน 2562 เวลา 11:26:04 น.
184,1030200418,30070189,200418,บ้านหนองหญ้าขาว,Nongyakaow,นายทองพูน จอดนอก,อนุบาล-ประถมศึกษา,,หมู่ 5 บ้านหนองหญ้าขาว,สำพะเนียง,โนนแดง,นครราชสีมา,30360,70189@korat7.go.th,,อบต.สำพะเนียง,0-4443-0194,-,24มิถุนายน 2484,50,10,ขนาดเล็ก,มีไฟฟ้า,8,72,8,18 มิถุนายน 2562 เวลา 09:11:12 น.
185,1030200406,30070190,200406,บ้านสำพะเนียง,Bansampaniang,นายอำนวย ดงนอก,อนุบาล-มัธยมศึกษาตอนปลาย,,หมู่ 3 บ้านสำพะเนียง,สำพะเนียง,โนนแดง,นครราชสีมา,30360,sampaniang2018@gmail.com,data.bopp-obec.info/web/index_view.php?School_ID=1030200406&page=info,อบต.สำพะเนียง,986328473,-,2464,40,7,ขนาดกลาง,มีไฟฟ้า,25,168,14,16 สิงหาคม 2562 เวลา 19:15:51 น.
186,1030200416,30070191,200416,คูเตยราษฎร์สามัคคี,kutey school,นายจักรพัฒน์ พรมศิริ,อนุบาล-ประถมศึกษา,กุดบง,หมู่ 1 คูและบ้านเตย,สำพะเนียง,โนนแดง,นครราชสีมา,30360,jenuwat@hotmail.com,-,สำพะเนียง,0-4443-0004,-,7 กุมภาพันธ์ 2520,60,10,ขนาดเล็ก,มีไฟฟ้า,7,62,8,20 มิถุนายน 2562 เวลา 10:33:20 น.
187,1030201221,30070192,201221,บ้านกระเบื้องวิทยาคาร,bangrabuangvittayakan,นายอรรถพล พลึกรุ่งโรจน์,อนุบาล-ประถมศึกษา,,หมู่ 5 ยาง,กระเบื้องนอก,เมืองยาง,นครราชสีมา,30270,Grabuangvit53@hotmail.com,,กระเบื้องนอก,,,7 มกราคม 2469,38,12,ขนาดกลาง,มีไฟฟ้า,10,155,8,18 มิถุนายน 2562 เวลา 20:52:16 น.
188,1030201226,30070193,201226,ท่าเรือวิทยา,thareuwitthaya,นายชยุททร ชูหนู,อนุบาล-ประถมศึกษา,,หมู่ 2 ดอนใหญ่,กระเบื้องนอก,เมืองยาง,นครราชสีมา,30270,trwitthaya@gmail.com,http://data.bopp-obec.info/web/index_view.php?School_ID=1030201226&page=info,กระเบื้องนอก,๐๔๔-๐๘๒๔๘๕,-,๒๓ กรกฎาคม พ.ศ. ๒๔๘๓,40,12,ขนาดเล็ก,มีไฟฟ้า,12,107,8,09 มิถุนายน 2562 เวลา 10:58:10 น.
189,1030201219,30070194,201219,บ้านท่าเยี่ยมวิทยายล,Ban tayaim wittayayol,นายวิชิต วงคำจันทร์,อนุบาล-ประถมศึกษา,วัดหลวงสร้างนางขาว,หมู่ 9 พุทรา,กระเบื้องนอก,เมืองยาง,นครราชสีมา,30270,,,กระเบื้องนอก,,,2497,30,6,ขนาดกลาง,มีไฟฟ้า,16,140,11,11 กรกฎาคม 2560 เวลา 02:46:08 น.
190,1030201220,30070195,201220,จตุคามพิทยาคม,Jatukampittayakom,นางสาววันวิสาข์ ศรีภูมิ,อนุบาล-ประถมศึกษา,,หมู่ 7 หนองหัวคน,กระเบื้องนอก,เมืองยาง,นครราชสีมา,30270,,,กระเบื้องนอก,44082484,,2520,34,12,ขนาดเล็ก,มีไฟฟ้า,11,88,8,05 กรกฎาคม 2560 เวลา 05:41:10 น.
191,1030201227,30070196,201227,บ้านโนนอุดมนภดลอุปถัมภ์,Bannon-udomnoppadon ooppathump school,นายประทวน ด่านแก้ว,อนุบาล-มัธยมศึกษาตอนต้น,,หมู่ 1 โนนอุดม,โนนอุดม,เมืองยาง,นครราชสีมา,30270,nonudom_npd@hotmail.com,,โนนอุดม,0-4443-0269,,6 เมษายน 2512,12,12,ขนาดกลาง,มีไฟฟ้า,21,220,11,16 สิงหาคม 2562 เวลา 09:56:41 น.
