51,1030200658,30070053,200658,วัดบ้านโคกเพ็ดหนองไม้ตายพิทยา,watbankokpednongmaitaipitaya,นางจิรภรณ์ ส่งเสริม,อนุบาล-ประถมศึกษา,,หมู่ 6 บ้านโคกเพ็ด,หนองค่าย,ประทาย,นครราชสีมา,30180,,,หนองค่าย,0-4443-0234,,24 ตุลาคม 2484,30,9,ขนาดเล็ก,มีไฟฟ้า,7,48,8,20 มิถุนายน 2562 เวลา 10:08:56 น.
52,1030200659,30070054,200659,วัดบ้านตำแย,WADBANTUMYAE SCHOOL,นายอารมณ์ วัดไธสง,อนุบาล-มัธยมศึกษาตอนต้น,,หมู่ 3 ตำแย,หนองค่าย,ประทาย,นครราชสีมา,30180,,30108410.thaischool.in.th,หนองค่าย,089-845-1193,,5 ต.ค. 2448,38,14,ขนาดกลาง,มีไฟฟ้า,17,172,11,18 สิงหาคม 2562 เวลา 11:27:55 น.
53,1030200657,30070055,200657,บ้านหนองพลวง,Bannongpluang,นางสาวปฐมา เทพามาตย์,อนุบาล-มัธยมศึกษาตอนต้น,ชุมช้างบ้านผือ,หมู่ 4 หัวหนอง,หนองพลวง,ประทาย,นครราชสีมา,30180,,,อบต.หนองพลวง,,,16 มกราคม 2475,30,11,ขนาดกลาง,มีไฟฟ้า,17,133,11,18 สิงหาคม 2562 เวลา 11:01:34 น.
54,1030200661,30070056,200661,วัดบ้านหนองขาม,Watbannongkham,นายประมวล เซ็นนอก,อนุบาล-ประถมศึกษา,ชุมช้างบ้านผือ,หมู่ 10 บ้านหนองขาม,หนองพลวง,ประทาย,นครราชสีมา,30180,mualmek@gmail.com,,หนองพลวง,804692282,-,2499,40,15,ขนาดเล็ก,มีไฟฟ้า,9,51,9,30 พฤษภาคม 2562 เวลา 14:08:22 น.
55,1030200662,30070057,200662,วัดบ้านหนองคึม,WATBANNONGKUM SCHOOL,นางปิ่นมุก สมน้อย,อนุบาล-มัธยมศึกษาตอนต้น,,หมู่ 9 โนนสำราญ,หนองพลวง,ประทาย,นครราชสีมา,30180,70057@korat7.go.th,,หนองพลวง,,,1 มิถุนายน 2482,30,5,ขนาดกลาง,มีไฟฟ้า,15,139,11,27 มิถุนายน 2562 เวลา 22:38:50 น.
56,1030200663,30070058,200663,หนองกุงวันชาติ,nongkungvanchat,นายจีรพันธ์ อัยลา,อนุบาล-ประถมศึกษา,ชุมช้างบ้านผือ,หมู่ 1 บ้านหนองกุง,หนองพลวง,ประทาย,นครราชสีมา,30180,kruaom.pw@gmail.com,-,หนองพลวง,081-8765941,-,1 พ.ค. 2517,34,10,ขนาดเล็ก,มีไฟฟ้า,8,51,9,05 กรกฎาคม 2560 เวลา 15:39:15 น.
57,1030200655,30070059,200655,ดอนกอกเกตสมบูรณ์สามัคคี,Donkokketsomboonsamukki,นางสาววันเพ็ญ ชานอก,อนุบาล-ประถมศึกษา,ชุมช้างบ้านผือ,หมู่ 2 ดอนกอก,หนองพลวง,ประทาย,นครราชสีมา,30180,,,หนองพลวง,,,24/10/2489,30,12,ขนาดเล็ก,มีไฟฟ้า,9,50,8,04 กรกฎาคม 2560 เวลา 04:30:08 น.
58,1030200664,30070060,200664,คมเพชรวิทยาคาร,Komphaitvittayakarn,นางสาววนิดา สุนพคุณศรี,อนุบาล-มัธยมศึกษาตอนต้น,เซิมโพธิ์,หมู่ 3 เพ็ดน้อย,หันห้วยทราย,ประทาย,นครราชสีมา,30180,-,-,หันห้วยทราย,0-4408-2345,-,2484,46,14,ขนาดเล็ก,มีไฟฟ้า,9,77,11,30 มิถุนายน 2562 เวลา 14:56:46 น.
59,1030200667,30070061,200667,บ้านหันห้วยทราย(คุรุสังฆประชาบำรุง),Banhunhuaysai School,นายเอกสรรค์ บุญฮวด,อนุบาล-มัธยมศึกษาตอนต้น,เซิมโพธิ์,หมู่ 2 หนองช่องแมว,หันห้วยทราย,ประทาย,นครราชสีมา,30180,banhunhuaysai@gmail.com,-,,44981011,-,10 กรกฎาคม 2476,46,17,ขนาดกลาง,มีไฟฟ้า,19,121,11,27 มิถุนายน 2562 เวลา 10:10:14 น.
60,1030200668,30070062,200668,สัมพันธมิตรวิทยา,samphantamitvittaya,นายนิพนธ์ รมณ์ชิต,อนุบาล-ประถมศึกษา,เซิมโพธิ์,หมู่ 4 โนนหญ้านาง,หันห้วยทราย,ประทาย,นครราชสีมา,30180,-,-,หันห้วยทราย,-,-,2476,34,11,ขนาดเล็ก,มีไฟฟ้า,9,43,8,14 มิถุนายน 2561 เวลา 10:42:13 น.
61,1030200669,30070063,200669,สี่แยกศรีอรัญวิทยา,seeyaksiarunvittaya,นางกนิษฐา ช่างถม,อนุบาล-มัธยมศึกษาตอนต้น,เซิมโพธิ์,หมู่ 8 โกรกหิน,หันห้วยทราย,ประทาย,นครราชสีมา,30180,sosowo66@gmail.com,,องค์การบริหารส่วนตำบลหันห้วยทราย,637656453,,28/11/2442,36,14,ขนาดเล็ก,มีไฟฟ้า,15,110,11,20 มิถุนายน 2562 เวลา 14:59:17 น.
62,1030200670,30070064,200670,อัมพวันวิทยา,Umpawanvittaya,นายชยพล จันทีนอก,อนุบาล-ประถมศึกษา,,หมู่ 5 หนองม่วงใหญ่,หันห้วยทราย,ประทาย,นครราชสีมา,30180,Umpawanvittaya@gmail.com,,หันห้วยทราย,,,10 มิถุนายน 2483,33,11,ขนาดเล็ก,มีไฟฟ้า,7,27,8,19 สิงหาคม 2562 เวลา 14:48:56 น.
63,1030200827,30070066,200827,บ้านกระเบื้อง,BANKRABAUNG,นายวีระ สงึมรัมย์,อนุบาล-ประถมศึกษา,เปงจานนคร,หมู่ 4 บ้านกระเบื้อง,กระชอน,พิมาย,นครราชสีมา,30110,,,กระชอน,,,23/07/2502,32,50,ขนาดเล็ก,มีไฟฟ้า,9,47,8,15 สิงหาคม 2562 เวลา 11:53:21 น.
64,1030200830,30070067,200830,บ้านตลาดประดู่,Taladpradoo,นายเกรียงไกร ชนากลาง,อนุบาล-ประถมศึกษา,,หมู่ 3 บ้านตลาดประดู่,กระชอน,พิมาย,นครราชสีมา,30110,,,กระชอน,,,25 ก.ค.2483,50,27,ขนาดเล็ก,มีไฟฟ้า,7,35,8,15 พฤษภาคม 2562 เวลา 13:00:33 น.
65,1030200833,30070068,200833,บ้านโนนตะแบก,Bannontabak,นางสาวสายรุ้ง ไม้กลาง,อนุบาล-ประถมศึกษา,,หมู่ 5 บ้านโนนตะแบก,กระชอน,พิมาย,นครราชสีมา,30110,,,กระชอน,,,2503,65,25,ขนาดเล็ก,มีไฟฟ้า,10,58,8,15 สิงหาคม 2562 เวลา 11:26:42 น.
66,1030200834,30070069,200834,บ้านโนนพุทรา,BANNONPUTSA SCHOOL,ว่าที่ร้อยตรีสุชาติวุฒิ ตู้จำนงค์,อนุบาล-ประถมศึกษา,,หมู่ 6 บ้านโนนพุทรา,กระชอน,พิมาย,นครราชสีมา,30110,nonputsa_101@hotmail.com,-,กระชอน,-,-,12 กรกฎาคม 2505,69,31,ขนาดเล็ก,มีไฟฟ้า,13,112,8,15 สิงหาคม 2562 เวลา 09:40:36 น.
67,1030200837,30070070,200837,ราษฎร์สโมสร,Rassamosorn,นายเกษม สมมาตย์,อนุบาล-มัธยมศึกษาตอนต้น,เปงจานนคร,หมู่ 1 กระชอน,กระชอน,พิมาย,นครราชสีมา,30110,rassamosor@gmail.com,data.bopp-obec.info/web/?School_ID=1030200837,กระชอน,0-4400-1247,,28 กรกฎาคม 2481,150,42,ขนาดกลาง,มีไฟฟ้า,21,338,12,15 สิงหาคม 2562 เวลา 12:24:47 น.
68,1030200859,30070071,200859,บ้านกระเบื้องใหญ่,Ban krabuang yai,-,อนุบาล-มัธยมศึกษาตอนต้น,นาหนัง,หมู่ 8 บ้านวัด,กระเบื้องใหญ่,พิมาย,นครราชสีมา,30110,,data.bopp-obec.info/web/?School_ID=1030200859,กระเบื้องใหญ่,0-4447-1473,044-96620,2454,50,3,ขนาดกลาง,มีไฟฟ้า,19,285,12,03 กรกฎาคม 2560 เวลา 07:16:09 น.
69,1030200861,30070072,200861,บ้านเตยประชาบำรุง,Bantieyprachabumrung,นายวิชาญ จตุพรม,อนุบาล-ประถมศึกษา,นาหนัง,หมู่ 1 บ้านเตย,กระเบื้องใหญ่,พิมาย,นครราชสีมา,30110,bt30070072l@gmail.com,,กระเบื้องใหญ่,0-4440-3006,,2459,48,10,ขนาดกลาง,มีไฟฟ้า,12,159,8,14 มิถุนายน 2562 เวลา 09:33:39 น.
70,1030200824,30070073,200824,บ้านทับควาย,BanThapkhwai,นางสาวฐิติมา บุไธสง,อนุบาล-ประถมศึกษา,,หมู่ 5 บ้านทับควาย,ชีวาน,พิมาย,นครราชสีมา,30110,,,ชีวาน,,,14 กรกฎาคม 2518,65,18,ขนาดเล็ก,มีไฟฟ้า,8,41,7,04 มิถุนายน 2562 เวลา 10:44:06 น.
71,1030200820,30070074,200820,บ้านชีวาน,Bancheewan,นายตระกูล เสนานอก,อนุบาล-ประถมศึกษา,,หมู่ 1 บ้านชีวาน,ชีวาน,พิมาย,นครราชสีมา,30110,,,ชีวาน,091-0619492,,,53,13,ขนาดเล็ก,มีไฟฟ้า,8,85,8,15 สิงหาคม 2562 เวลา 10:18:27 น.
72,1030200821,30070075,200821,บ้านซาด,Bansad,นางสาวศิริวรรณ กิตติทองวิรักษ์,อนุบาล-ประถมศึกษา,,หมู่ 6 บ้านซาด,ชีวาน,พิมาย,นครราชสีมา,30110,PKLadklang@Gmail.com,-,ชีวาน,812828302,-,24 เมษายน 2494,50,10,ขนาดเล็ก,มีไฟฟ้า,8,55,8,29 สิงหาคม 2562 เวลา 08:08:48 น.
73,1030200822,30070076,200822,บ้านดอนเขว้า,Ban Donkwao,นายสุภีร์ สีพาย,อนุบาล-มัธยมศึกษาตอนต้น,นาหนัง,หมู่ 2 ดอนเขว้า,ชีวาน,พิมาย,นครราชสีมา,30110,donkwaoschool@gmail.com,dkwschool.wordpress.com/,ชีวาน,862516021,,พ.ศ.2500,50,18,ขนาดกลาง,มีไฟฟ้า,19,244,12,12 มิถุนายน 2562 เวลา 21:19:53 น.
74,1030200828,30070077,200828,บ้านขามใต้,Bankamtai,นายผจญ ขยันงาน,อนุบาล-ประถมศึกษา,เปงจานนคร,หมู่ 6 บ้านขามใต้,ดงใหญ่,พิมาย,นครราชสีมา,30110,,,ดงใหญ่,,,2506,28,19,ขนาดเล็ก,มีไฟฟ้า,5,34,7,19 มิถุนายน 2562 เวลา 12:12:46 น.
75,1030200829,30070078,200829,บ้านดงประชานุกูล,Bandongprachanukul,นายบุญยัง จันทร์แก้ว,อนุบาล-มัธยมศึกษาตอนต้น,เปงจานนคร,หมู่ 1 บ้านดงใหญ่,ดงใหญ่,พิมาย,นครราชสีมา,30110,,www.dongphacha.ac.th,ดงใหญ่,44966000,44966000,26 ก.ค. 2461,30,30,ขนาดกลาง,มีไฟฟ้า,28,384,15,15 สิงหาคม 2562 เวลา 11:02:55 น.
76,1030200832,30070079,200832,บ้านโนนโชงโลง,Ban Nonchonglong,นายศุภณัฐ กัณนอก,อนุบาล-มัธยมศึกษาตอนต้น,,หมู่ 2 บ้านโนนโชงโลง,ดงใหญ่,พิมาย,นครราชสีมา,30110,30070079@korat.go.th,,ดงใหญ่,98487351,44082452,2493,15,35,ขนาดกลาง,มีไฟฟ้า,20,245,11,24 มกราคม 2561 เวลา 14:56:55 น.
77,1030200835,30070080,200835,บ้านมะกอก,Banmakok,นายอนุชิต แก้วคูนอก,อนุบาล-มัธยมศึกษาตอนต้น,,หมู่ 9 บ้านมะกอก,ดงใหญ่,พิมาย,นครราชสีมา,30110,-,www.makok.ac.th,องค์การบริหารส่วนตำบลดงใหญ่,-,-,2483,15,30,ขนาดกลาง,มีไฟฟ้า,17,157,11,18 สิงหาคม 2562 เวลา 13:16:40 น.
78,1030200836,30070081,200836,บ้านศาลา,ban-sala,นายมงคล พรศักดิ์หาญ,อนุบาล-ประถมศึกษา,,หมู่ 3 บ้านศาลา,ดงใหญ่,พิมาย,นครราชสีมา,30110,schoolbansala@gmail.com,,ดงใหญ่,044-430558,,25 กรกฎาคม 2483,31,26,ขนาดเล็ก,มีไฟฟ้า,10,78,8,28 มกราคม 2563 เวลา 13:56:34 น.
79,1030200849,30070082,200849,บ้านกล้วย,Bankluay School,นางณัฐพร พันธ์รักษา,อนุบาล-มัธยมศึกษาตอนต้น,,หมู่ 7 บ้านกล้วย,ดงใหญ่,พิมาย,นครราชสีมา,30110,,,อบต.ดงใหญ่,,,พ.ศ. 2478,16.2,24.7,ขนาดกลาง,มีไฟฟ้า,16,208,11,13 มิถุนายน 2562 เวลา 08:28:39 น.
80,1030200826,30070083,200826,บ้านโนนม่วง,Bannonmuang,นางราตรี เกาะโค้ง,อนุบาล-ประถมศึกษา,,หมู่ 4 บ้านโนนม่วง,ท่าหลวง,พิมาย,นครราชสีมา,30110,apinanboonsri1@gmail.com,,ท่าหลวง,081-8777641,,13 มิถุนายน 2500,35,12,ขนาดเล็ก,มีไฟฟ้า,6,51,8,01 กรกฎาคม 2562 เวลา 11:13:05 น.
81,1030200825,30070084,200825,บ้านท่าหลวง,Ban Thalaung,นางนัชชา ชาญชัยภูวดล,อนุบาล-ประถมศึกษา,,หมู่ 1 บ้านท่าหลวง,ท่าหลวง,พิมาย,นครราชสีมา,30110,thalaung@hotmail.com,,ท่าหลวง,0-4448-2481,,2458,45,7,ขนาดกลาง,มีไฟฟ้า,13,138,8,13 พฤศจิกายน 2562 เวลา 11:06:05 น.
82,1030200823,30070085,200823,บ้านถนน,BANTANON,นางสาวมะลิวรรณ ระฆังทอง,อนุบาล-ประถมศึกษา,นาหนัง,หมู่ 6 บ้านสนุ่น,ท่าหลวง,พิมาย,นครราชสีมา,30110,tanonsc@gmail.com,,ท่าหลวง,868647155,,25 กรกฎาคม 2483,48,8,ขนาดเล็ก,มีไฟฟ้า,7,53,8,14 มิถุนายน 2562 เวลา 10:11:47 น.
83,1030200819,30070086,200819,จารย์ตำรา,jantumra,นางสาวพิสมัย ขวัญมา,อนุบาล-มัธยมศึกษาตอนต้น,,หมู่ 5 บ้านจารย์ตำรา,ท่าหลวง,พิมาย,นครราชสีมา,30110,jantamra999@hotmail.com,www.jantumraschool.com/,ท่าหลวง,44082455,,3 มิถุนายน 2482,32,15,ขนาดกลาง,มีไฟฟ้า,19,183,12,28 มิถุนายน 2561 เวลา 12:33:40 น.
84,1030200870,30070087,200870,บ้านหวายโนนโพธิ์,Ban Wainonpo School,นายสานิตย์ ถนอมกลาง,อนุบาล-ประถมศึกษา,นาหนัง,หมู่ 7 บ้านหวาย,ธารละหลอด,พิมาย,นครราชสีมา,30110,wnpschool@gmail.com,wnpschool.wordpress.com/,ธารละหลอด,44082456,,25/7/2483,50,14,ขนาดเล็ก,มีไฟฟ้า,12,91,8,15 สิงหาคม 2562 เวลา 22:47:50 น.
85,1030200871,30070088,200871,มะค่าสามัคคี,MAKASAMAKEE,นายวินัย อริยะเดช,อนุบาล-มัธยมศึกษาตอนต้น,นาหนัง,หมู่ 12 โนนกราด,ธารละหลอด,พิมาย,นครราชสีมา,30110,makaphimai@gmail.com,,อบต.ธารละหลอด,-,-,2475,51,11,ขนาดกลาง,มีไฟฟ้า,17,257,11,23 สิงหาคม 2562 เวลา 14:40:39 น.
86,1030200840,30070090,200840,นิคมสร้างตนเองพิมาย 3,NikomSangTonEngPhimai 3,นายธเนศ ทองน้อย,อนุบาล-ประถมศึกษา,,หมู่ 4 บ้านจำนงค์ภูมิเวศน์,นิคมสร้างตนเอง,พิมาย,นครราชสีมา,30110,nikom3_school@hotmail.com,,องค์การบริหารส่วนตำบลนิคมสร้างตนเอง,044 082457,,7 กันยายน 2504,45,15,ขนาดกลาง,มีไฟฟ้า,13,137,8,29 มิถุนายน 2562 เวลา 09:17:38 น.
87,1030200842,30070091,200842,นิคมสร้างตนเองพิมาย ๖,Nikomsangtonengphimai 6,นายอำนวย เยี่ยงเสือ,อนุบาล-ประถมศึกษา,,หมู่ 3 ทวีสงเคราะห์,นิคมสร้างตนเอง,พิมาย,นครราชสีมา,30110,schnikom6@gmail.com,-,นิคมสร้างตนเอง,44082458,-,22/07/2520,43,11,ขนาดเล็ก,มีไฟฟ้า,9,113,8,20 พฤศจิกายน 2562 เวลา 12:53:20 น.
88,1030200844,30070092,200844,บ้านโนนกระเบื้องหนองหัวช้างสามัคคี,bannonkrabeangnonghuachangsamackee,นายวุฒิศักดิ์ ถนัดค้า,อนุบาล-มัธยมศึกษาตอนต้น,,หมู่ 7 บ้านโนนกระเบื้องหนองหัวช้างฯ,นิคมสร้างตนเอง,พิมาย,นครราชสีมา,30110,nkbschool@hotmail.co.th,-,นิคมสร้างตนเอง,-,-,25 กรกฎาคม 2483,50,13,ขนาดกลาง,มีไฟฟ้า,15,153,11,20 มิถุนายน 2561 เวลา 14:05:46 น.
89,1030200845,30070093,200845,บ้านโพธิ์งามหนองหญ้าขาววิทยา,Banphongamnongyakhawwittaya,นายณัฐชาญ ยางเครือ,อนุบาล-ประถมศึกษา,รัตนวาปี,หมู่ 11 บ้านหนองหญ้าขาว,นิคมสร้างตนเอง,พิมาย,นครราชสีมา,30110,,,นิคมสร้างตนเอง,044-430560,,15 กรกฎาคม 2503,50,17,ขนาดเล็ก,มีไฟฟ้า,12,109,8,04 มิถุนายน 2562 เวลา 10:05:03 น.
90,1030200846,30070094,200846,บ้านสะแกงาม,Bansakaengam,นางสาวพิมพ์ญาดา นาชัยฤทธิ์,อนุบาล-ประถมศึกษา,รัตนวาปี,หมู่ 10 บ้านสะแกงาม,นิคมสร้างตนเอง,พิมาย,นครราชสีมา,30110,,,นิคมสร้างตนเอง,44082461,,17 พฤษภาคม 2514,52,24,ขนาดเล็ก,มีไฟฟ้า,12,113,8,28 มิถุนายน 2562 เวลา 15:33:03 น.
91,1030200847,30070095,200847,บ้านใหม่ฉมวก,BANMAICHAMUAK,นายวันชัย ปานสาลี,อนุบาล-มัธยมศึกษาตอนต้น,รัตนวาปี,หมู่ 16 บ้านใหม่ฉมวกเหนือ,นิคมสร้างตนเอง,พิมาย,นครราชสีมา,30110,,,นิคมสร้างตนเอง,,,15 มิถุนายน 2484,60,16,ขนาดกลาง,มีไฟฟ้า,16,147,11,27 มิถุนายน 2562 เวลา 22:35:03 น.
92,1030200873,30070096,200873,นิคมสร้างตนเองพิมาย 2,ืNIKOMSARNGTONANGPHIMAI 2 SCHOOL,นายวิเชียร ขุนภักดี,อนุบาล-ประถมศึกษา,รัตนวาปี,หมู่ 5 บ้านเทพหัสดินทร์,นิคมสร้างตนเอง,พิมาย,นครราชสีมา,30110,,,นิคมสร้างตนเอง,,,2504,40,12,ขนาดกลาง,มีไฟฟ้า,19,242,9,15 สิงหาคม 2562 เวลา 11:11:32 น.
93,1030200857,30070097,200857,กุลโน,kulno,นายกรช โพธิสม,อนุบาล-ประถมศึกษา,นาหนัง,หมู่ 2 สระมะค่า,ในเมือง,พิมาย,นครราชสีมา,30110,kulnoschool@gmail.com,www.kulno.ac.th,ในเมือง,089-8447134,44471478,01/04/2457,38,5,ขนาดใหญ่,มีไฟฟ้า,43,883,30,04 มิถุนายน 2562 เวลา 14:38:10 น.
94,1030200858,30070098,200858,ท้าวสุรนารี(ระดมอนุสรณ์),Taosuranaree(Radomanusorn),นายวุฒิชาติ มวยดี,อนุบาล-ประถมศึกษา,,หมู่ 15 น้อย,ในเมือง,พิมาย,นครราชสีมา,30110,,,ในเมือง,044-481008,,,40,5,ขนาดเล็ก,มีไฟฟ้า,20,220,13,12 มิถุนายน 2560 เวลา 08:39:01 น.
95,1030200863,30070099,200863,บ้านม่วงขามประชารักษ์,Bannmuangkhampracharak,นางวัชรี ค้าขาย,อนุบาล-ประถมศึกษา,,หมู่ 7 บ้านม่วง,ในเมือง,พิมาย,นครราชสีมา,30110,,,ในเมือง,,,-,50,2,ขนาดเล็ก,มีไฟฟ้า,6,50,9,15 สิงหาคม 2562 เวลา 12:59:47 น.
96,1030200865,30070100,200865,อนุบาลสุริยาอุทัยพิมาย,Anubansuriyauthaiphimai,นายธีรวุฒิ เอื้อสุวรรณ,อนุบาล-ประถมศึกษา,นาหนัง,หมู่ 17 บ้านพรมทัต,ในเมือง,พิมาย,นครราชสีมา,30110,s30070100@gmail.com,www.suriya.ac.th,ในเมือง,44471987,44471686,2484,35,3,ขนาดใหญ่,มีไฟฟ้า,58,1168,34,08 มิถุนายน 2560 เวลา 20:15:04 น.
97,1030200838,30070101,200838,ชุมชนบ้านวังหิน,chumchonbanwanghin,นางประคอง ลัดกลาง,อนุบาล-ประถมศึกษา,นาหนัง,หมู่ 8 บ้านวังหิน,ในเมือง,พิมาย,นครราชสีมา,30110,min_boonruang@hotmail.com,-,ในเมือง,0-4447-1208,-,25 กรกฎาคม 2483,30,5,ขนาดกลาง,มีไฟฟ้า,13,195,8,27 มิถุนายน 2562 เวลา 13:10:10 น.
98,1030200843,30070102,200843,บ้านดอนแซะ,Bandonsae,นายมงคล อินทร์ทอง,อนุบาล-ประถมศึกษา,,หมู่ 9 บ้านดอนแซะ,ในเมือง,พิมาย,นครราชสีมา,30110,artsuk2522@hotmail.com,,ในเมือง,930688711,-,23 กรกฎาคม 2464,40,6,ขนาดกลาง,มีไฟฟ้า,11,147,8,21 มิถุนายน 2562 เวลา 09:36:15 น.
