98,1046030284,46020105,30284,กุดจิกวิทยาคาร,KUDJIKWITTAYAKARN,นายชาญ ยอดประทุม,อนุบาล-มัธยมศึกษาตอนต้น,,หมู่ 3 กุดจิก,กุดจิก,ท่าคันโท,กาฬสินธุ์,46190,kudjik_shool2013@hotmail.com,-,กุดจิก,-,-,01/01/2482,66,16,ขนาดกลาง,มีไฟฟ้า,21,256,12,14 มีนาคม 2562 เวลา 21:25:05 น.
99,1046030285,46020106,30285,บ้านโคกกลาง,Bankhokklang,นายพยุงค์ ทองคำ,อนุบาล-ประถมศึกษา,,หมู่ 6 โคกกลาง,กุดจิก,ท่าคันโท,กาฬสินธุ์,46190,malisajino@gmail.com,-,กุดจิก,092-2514295,-,2498,56.6,13.7,ขนาดกลาง,มีไฟฟ้า,10,98,8,20 มิถุนายน 2561 เวลา 12:40:37 น.
100,1046030286,46020107,30286,บ้านแสนสุข,Bansansuk school,นายสมใจ คัสกรณ์,อนุบาล-ประถมศึกษา,,หมู่ 7 แสนสุข,กุดจิก,ท่าคันโท,กาฬสินธุ์,46190,Sansukschool2556@hotmail.com,gg.gg/bansansukschool,กุดจิก,621598403,-,26 มิถุนายน 2510,75,25,ขนาดเล็ก,มีไฟฟ้า,9,77,8,13 ตุลาคม 2562 เวลา 12:52:54 น.
101,1046030294,46020108,30294,ดงสวรรค์อุดมมิตร(สาขาบ้านดงจันทร์),Dongsawanudommitsakhadongjan,-,อนุบาล-ประถมศึกษา,,หมู่ 7 ดงจันทร์,ท่าคันโท,ท่าคันโท,กาฬสินธุ์,46190,Jintana251514@hotmail.com,-,ดงสมบูรณ์,810585643,-,16 พ.ค. 2536,50,25,ขนาดเล็ก,ไม่มีไฟฟ้า,1,0,0,18 มิถุนายน 2562 เวลา 13:55:56 น.
102,1046030289,46020109,30289,ดงบังอำนวยวิทย์,Dongbangumnuywit,นายธานินทร์ วรรณสาร,อนุบาล-ประถมศึกษา,,หมู่ 3 ดงกลาง,ดงสมบูรณ์,ท่าคันโท,กาฬสินธุ์,46190,puna09777@gmail.com,-,ดงสมบูรณ์,043-890088/087-7706725,-,19 พ.ค. 2519,49,16,ขนาดกลาง,มีไฟฟ้า,15,193,8,18 มิถุนายน 2562 เวลา 13:47:55 น.
103,1046030290,46020110,30290,ดงสมบูรณ์ประชารัฐ,DONGSOMBOONPRACHARAT,นายจรัญ มุสิกา,อนุบาล-มัธยมศึกษาตอนต้น,,หมู่ 2 ดงสมบูรณ์,ดงสมบูรณ์,ท่าคันโท,กาฬสินธุ์,46190,nobitatongh4@hotmail.com,gg.gg/Dongsomboon,ดงสมบูรณ์,043814283/088-5388297,-,15 พฤศจิกายน 2511,70,16,ขนาดกลาง,มีไฟฟ้า,18,150,11,20 มีนาคม 2562 เวลา 14:13:10 น.
104,1046030291,46020111,30291,ดงสวรรค์อุดมมิตร,Dongsawanudommit,นางจินตนา คำก้อน,อนุบาล-ประถมศึกษา,,หมู่ 6 ดงสวรรค์,ดงสมบูรณ์,ท่าคันโท,กาฬสินธุ์,46190,Jintana251514@hotmail.com,,ดงสมบูรณ์,810585643,-,19 พ.ค. 2519,45,20,ขนาดเล็ก,มีไฟฟ้า,9,79,8,05 กุมภาพันธ์ 2562 เวลา 15:46:48 น.
105,1046030274,46020113,30274,นาตาลวิทยาคม,Natanwittayakom,นายวัลลภ ภูจอมจิตร,อนุบาล-ประถมศึกษา,,หมู่ 1 นาตาล,นาตาล,ท่าคันโท,กาฬสินธุ์,46190,natanschool@yahoo.com,http://school.obec.go.th,ท่าคันโท,043877324/062-1956908/087-770-5600,-,ปี พ.ศ.2482,53,0.1,ขนาดกลาง,มีไฟฟ้า,11,131,8,07 มกราคม 2563 เวลา 22:50:50 น.
106,1046030272,46020114,30272,ท่าคันโทวิทยายน,Thakhanthowittayayon,นายดาวเรือง สิงหราช,อนุบาล-มัธยมศึกษาตอนต้น,,หมู่ 3 ท่าคันโท,ท่าคันโท,ท่าคันโท,กาฬสินธุ์,46190,thakhanto_yon@hotmail.co.th,www.thakhantho.ac.th,ท่าคันโท,-,-,8 มกราคม 2464,65,2,ขนาดกลาง,มีไฟฟ้า,25,373,18,25 มิถุนายน 2562 เวลา 10:25:07 น.
107,1046030273,46020115,30273,ท่าเมืองสำราญวิทย์,thamueang,-,อนุบาล-ประถมศึกษา,,หมู่ 6 โนนสำราญ,ท่าคันโท,ท่าคันโท,กาฬสินธุ์,46190,kupiya16@gmail.com,202.143.174.14/web/?School_ID=1046030273,ท่าคันโท,043890089/089-9434837,-,พ.ศ. 2482,60,4,ขนาดเล็ก,มีไฟฟ้า,5,28,8,14 มีนาคม 2562 เวลา 10:00:04 น.
108,1046030275,46020116,30275,บ้านเกิ้ง(สลากกินแบ่งสงเคราะห์-170),BANKERG,-,อนุบาล-ประถมศึกษา,,หมู่ 5 เกิ้ง,นาตาล,ท่าคันโท,กาฬสินธุ์,46190,-,gg.gg/baankoeng_ka2,นาตาล,043890090/085-6495852,-,05เมษายน 2506,55,3,ขนาดเล็ก,มีไฟฟ้า,5,38,8,16 ตุลาคม 2562 เวลา 16:22:42 น.
109,1046030276,46020117,30276,บ้านหนองแซง,Bannongsaeng School,นายสุวรรณ มูลปลา,อนุบาล-มัธยมศึกษาตอนต้น,,หมู่ 11 หนองแซง,นาตาล,ท่าคันโท,กาฬสินธุ์,46190,bns46020117@gmail.com,http://data.bopp-obec.info/web/?School_ID=1046030276,นาตาล,089-7105676,-,16 พฤษภาคม 2518,50,10,ขนาดกลาง,มีไฟฟ้า,28,472,20,27 มกราคม 2563 เวลา 09:28:27 น.
110,1046030277,46020118,30277,บ้านโนนอำนวย,bannonamnoy,จ.ส.อ.นพพร นวลจันทร์,อนุบาล-ประถมศึกษา,,หมู่ 8 โนนอำนวย,นาตาล,ท่าคันโท,กาฬสินธุ์,46190,-,-,นาตาล,043814260/087-7745536,-,12 เมษายน 2525,40,16,ขนาดกลาง,มีไฟฟ้า,14,126,8,16 ตุลาคม 2562 เวลา 06:41:34 น.
111,1046030287,46020119,30287,ยางอู้มวิทยาคาร,yangoomwittayakan,นางพนาพร ภูจอมจิตร,อนุบาล-มัธยมศึกษาตอนต้น,,หมู่ 4 ยางอู้ม,ยางอู้ม,ท่าคันโท,กาฬสินธุ์,46190,yangoom139@gmail.com,yangoom.ac.th,ยางอู้ม,877706725,-,2477,60,5,ขนาดกลาง,มีไฟฟ้า,25,341,19,14 มกราคม 2563 เวลา 20:59:30 น.
112,1046030288,46020120,30288,คำบอนวิทยาสรรพ์,Khombonwittayason,นายนิยม สวัสดี,อนุบาล-ประถมศึกษา,,หมู่ 3 คำบอน,ยางอู้ม,ท่าคันโท,กาฬสินธุ์,46190,Khambonwithayasan@gmail.com,khumbon.th.gs,ยางอู้ม,804291696,-,1 พฤษภาคม 2519,55,12,ขนาดเล็ก,มีไฟฟ้า,7,30,8,12 มีนาคม 2562 เวลา 09:06:32 น.
113,1046030293,46020121,30293,บ้านชัยศรีสุข,Banchaisrisuk,นายปัญญา สนองเดช,อนุบาล-ประถมศึกษา,,หมู่ 6 ชัยศรีสุข,ยางอู้ม,ท่าคันโท,กาฬสินธุ์,46190,banchaisrisuk.46190@gmail.com,https://data.bopp-obec.info/emis/schooldata-view.php?School_ID=1046030293&Area_CODE=4602,ยางอู้ม,043890092/094-4468134,-,1 พฤษภาคม 2528,60,16,ขนาดเล็ก,มีไฟฟ้า,7,60,8,12 ธันวาคม 2562 เวลา 15:39:06 น.
114,1046030419,46020122,30419,ประชารัฐศึกษา,Pracharatsuksa,นายสุรเนตร เนตรมุข,อนุบาล-ประถมศึกษา,,หมู่ 15 บ้านหนองไม้ตาย,โคกเครือ,หนองกุงศรี,กาฬสินธุ์,46220,pracharat2561@gmail.com,gg.gg/pracharat2561,โคกเครือ,043890335/088-5196634,-,1 พฤษภาคม 2519,20,8,ขนาดเล็ก,มีไฟฟ้า,7,41,8,28 ตุลาคม 2562 เวลา 11:00:19 น.
115,1046030420,46020123,30420,โคกเครือวิทยา,kokkruawittaya,นายสาคร คำแสน,อนุบาล-มัธยมศึกษาตอนต้น,,หมู่ 1 บ้านโคกเครือ,โคกเครือ,หนองกุงศรี,กาฬสินธุ์,46220,-,gg.gg/kokkruawittaya,โคกเครือ,-,-,16 สิงหาคม 2478,25,8,ขนาดกลาง,มีไฟฟ้า,14,142,11,06 มิถุนายน 2562 เวลา 23:13:07 น.
116,1046030421,46020124,30421,หนองโนวิทยา,Nongnowittaya,นายอภิชัย ดาวดึงษ์,อนุบาล-ประถมศึกษา,,หมู่ 13 บ้านหนองโน,โคกเครือ,หนองกุงศรี,กาฬสินธุ์,46220,-,-,โคกเครือ,043890217/087-8545592,-,22 มิถุนายน 2482,25,5,ขนาดเล็ก,มีไฟฟ้า,10,99,8,17 มิถุนายน 2562 เวลา 09:22:17 น.
117,1046030451,46020126,30451,ห้วยยางดงวิทยา,Huayyangdongwittaya,นายสุพจน์ นาสมบัติ,อนุบาล-ประถมศึกษา,,หมู่ 14 ห้วยยางดง,โคกเครือ,หนองกุงศรี,กาฬสินธุ์,46220,-,Huaiyangdong.com,โคกเครือ,043814392/087-9462082,-,1 พฤษภาคม 2501,25,12,ขนาดเล็ก,มีไฟฟ้า,11,96,8,20 ตุลาคม 2562 เวลา 07:30:04 น.
118,1046030455,46020127,30455,สายปัญญาสมาคม,Saipanyasamakhom,ว่าที่ ร.ต.วิชัย เนตรมุข,อนุบาล-มัธยมศึกษาตอนต้น,,หมู่ 11 หนองกบ,โคกเครือ,หนองกุงศรี,กาฬสินธุ์,46220,saypanya@hotmail.com,http:/school.obec.go.th,โคกเครือ,081-0582748,-,25 มกราคม 2524,40,15,ขนาดกลาง,มีไฟฟ้า,23,248,11,19 มีนาคม 2562 เวลา 13:17:24 น.
119,1046030453,46020128,30453,ภูฮังวิทยาคาร,Poohungwittayakarn,-,อนุบาล-ประถมศึกษา,,หมู่ 3 ภูฮัง,ดงมูล,หนองกุงศรี,กาฬสินธุ์,46220,-,-,ดงมูล,043814389/099-3646915,-,พ.ศ.2518,40,22,ขนาดกลาง,มีไฟฟ้า,11,168,9,14 มีนาคม 2562 เวลา 09:30:18 น.
120,1046030454,46020129,30454,สำราญ - ประภาศรี,SAMRAN-PRAPHASRI,-,อนุบาล-ประถมศึกษา,,หมู่ 14 โคกกลาง,ดงมูล,หนองกุงศรี,กาฬสินธุ์,46220,samranpraphasi@gmail.com,-,ดงมูล,043890219/093-5636059,-,14 พฤษภาคม 2524,30,18,ขนาดเล็ก,มีไฟฟ้า,8,88,8,22 ตุลาคม 2562 เวลา 11:17:44 น.
121,1046030456,46020130,30456,ไทรทองวิทยาคาร,Saithongwittayakarn,นายวาทิตย์ คำสิงห์,อนุบาล-ประถมศึกษา,,หมู่ 10 ไทรทอง,ดงมูล,หนองกุงศรี,กาฬสินธุ์,46220,-,-,ดงมูล,-,-,02/09/2532,42.8,28.2,ขนาดเล็ก,มีไฟฟ้า,8,53,8,24 มิถุนายน 2562 เวลา 14:15:53 น.
122,1046030452,46020131,30452,คำขามวิทยา,Khamkamwittaya,จ.ส.ต.รัศมี ศรีหงษ์ทอง,อนุบาล-ประถมศึกษา,,หมู่ 1 คำขาม,ดงมูล,หนองกุงศรี,กาฬสินธุ์,46220,-,-,ดงมูล,-,-,3 พฤษภาคม 2506,30,15,ขนาดเล็ก,มีไฟฟ้า,9,97,8,22 กันยายน 2562 เวลา 17:32:53 น.
123,1046030424,46020132,30424,สว่างกิจวิทยา,sawangkitvittaya,นางกาญจนา วรพันธ์,อนุบาล-ประถมศึกษา,,"หมู่ 9,10 โนนสว่าง ,โนนมีกิจ",เสาเล้า,หนองกุงศรี,กาฬสินธุ์,46220,sawangkit@gmail.com,-,เสาเล้า,043890222/081-3808267,-,1 พฤษภาคม 2519,20,7,ขนาดเล็ก,มีไฟฟ้า,10,61,8,17 ตุลาคม 2562 เวลา 13:45:30 น.
124,1046030425,46020133,30425,คำถาวรเจริญวิทย์,Kamthawornjareonwith,นางแสงไทย ดวงปากดี,อนุบาล-ประถมศึกษา,,หมู่ 1 คำถาวร,เสาเล้า,หนองกุงศรี,กาฬสินธุ์,46220,Kamthaworn.wit@chaiyo.co,,เสาเล้า,081-0593371,-,8 มิถุนายน 2502,16,5,ขนาดเล็ก,มีไฟฟ้า,6,61,8,18 มีนาคม 2562 เวลา 10:10:22 น.
125,1046030426,46020134,30426,เสริมเสาเล้าวิทยา,Sermsaolaowitthaya,นายพิพัฒน์ ปารมีชัย,อนุบาล-ประถมศึกษา,,หมู่ 2 หนองโนทอง,เสาเล้า,หนองกุงศรี,กาฬสินธุ์,46220,Sermsaolao@hotmail.com,-,เสาเล้า,093 - 3356998,-,13/05/2465,20,8.5,ขนาดเล็ก,มีไฟฟ้า,6,37,8,29 มีนาคม 2562 เวลา 10:56:16 น.
126,1046030427,46020135,30427,หนองมันปลาวิทยา,Nongmunplawittaya,นายเฉลิม คงแสนคำ,อนุบาล-ประถมศึกษา,,หมู่ 5 ศรีบุญเรือง,เสาเล้า,หนองกุงศรี,กาฬสินธุ์,46220,-,data.bopp-obec.info/web/index.php?School_ID=104603042,เสาเล้า,-,-,2511,30,10,ขนาดเล็ก,มีไฟฟ้า,15,114,11,20 มีนาคม 2562 เวลา 12:35:56 น.
127,1046030428,46020136,30428,หนองแฝกหนองหว้าวิทยา,NONGFAGNONGWAVITTAYA,นายทินกร ดีพลงาม,อนุบาล-ประถมศึกษา,,หมู่ 8 หนองหว้า,เสาเล้า,หนองกุงศรี,กาฬสินธุ์,46220,-,-,เสาเล้า,043890225/091-8652203,-,13/07/2513,30,18,ขนาดเล็ก,มีไฟฟ้า,10,101,8,21 มิถุนายน 2562 เวลา 09:24:07 น.
128,1046030429,46020137,30429,บ้านหนองไผ่,BANNONGPHAI,นายวสันต์ ภูคงคา,อนุบาล-ประถมศึกษา,,หมู่ 14 หนองไผ่,เสาเล้า,หนองกุงศรี,กาฬสินธุ์,46220,Bannongphaischool.2019@gmail.com,http://www. Bannongpai. Ob.tc.,เสาเล้า,043890336/089-2782516,-,10 ตุลาคม 2495,32,14,ขนาดเล็ก,มีไฟฟ้า,6,62,8,27 มีนาคม 2562 เวลา 10:17:09 น.
129,1046030430,46020138,30430,บ้านโนนสมบูรณ์วิทยา,bannonsomboonwittaya,นายสว่าง ชินโคตร,อนุบาล-ประถมศึกษา,,หมู่ 7 โนนสมบูรณ์,เสาเล้า,หนองกุงศรี,กาฬสินธุ์,46220,nonsomboonwittaya@gmail.com,nonsomboon.net,เสาเล้า,918643417,-,19 พฤษภาคม 2524,30,13,ขนาดเล็ก,มีไฟฟ้า,6,29,8,17 มิถุนายน 2562 เวลา 09:22:27 น.
130,1046030418,46020140,30418,โคกเจริญวิทยา,kokcharean,นายสราวุฒิ ประเสริฐสังข์,อนุบาล-ประถมศึกษา,,หมู่ 3 โคกเจริญ,หนองกุงศรี,หนองกุงศรี,กาฬสินธุ์,46220,kokcharean@hotmail.com,www.kjw.ac.th.,คำก้าว,043890310/088-3473426,,17 /12/2476,18,6,ขนาดเล็ก,มีไฟฟ้า,10,71,8,15 มีนาคม 2562 เวลา 11:59:13 น.
131,1046030423,46020141,30423,หนองหอไตรราษฎร์บำรุง,Nonghotrairasbumrung,นายฐิติพงษ์ ข่วงสิมมา,อนุบาล-ประถมศึกษา,,หมู่ 8 หนองหอไตร,ลำหนองแสน,หนองกุงศรี,กาฬสินธุ์,46220,Nonghotrairasbumrung_school@hotmail.com,HNONGHOTRAI.CO.TH,หนองกุงศรี,043881126/089-2782516,-,2495,17,5,ขนาดเล็ก,มีไฟฟ้า,7,49,8,16 มิถุนายน 2562 เวลา 21:38:06 น.
132,1046030413,46020142,30413,หนองกุงศรีวิทยาคม,NONGKUNGSRIWITTAYAKOM,นายสวัสดิ์ เวียงอินทร์,อนุบาล-มัธยมศึกษาตอนต้น,,หมู่ 12 หนองกุงศรี,หนองกุงศรี,หนองกุงศรี,กาฬสินธุ์,46220,Nongkugsriwittayakom@yahoo.co.th,data.bopp-obec.info/web/?School_ID=1046030413,หนองกุงศรี,043881113/082-1303891,-,2472,15,0,ขนาดกลาง,มีไฟฟ้า,19,260,11,13 มิถุนายน 2562 เวลา 13:10:42 น.
133,1046030414,46020143,30414,ชุมชนสามัคคีราษฎร์บำรุง,chumchonsamakkeeratbamrung,นายพิจิตร ชินมาตร,อนุบาล-มัธยมศึกษาตอนต้น,,หมู่ 3 หนองกุงเผือก,ลำหนองแสน,หนองกุงศรี,กาฬสินธุ์,46220,samakkees.2561@gmail.com,-http://data.bopp-obec.info/web/?School_ID=1046030414,หนองกุงศรี,043881620/087-9470707,-,2465,20,5,ขนาดกลาง,มีไฟฟ้า,15,222,11,21 ตุลาคม 2562 เวลา 16:49:24 น.
134,1046030415,46020144,30415,สะอาดนาดีศิลาวิทย์,saartnadeesilavit school,-,อนุบาล-ประถมศึกษา,,หมู่ 5 บ้านสะอาดนาดี,หนองกุงศรี,หนองกุงศรี,กาฬสินธุ์,46220,saatnadee@outlook.co.th,-,หนองกุงศรี,043881619/081-3694852,-,18 ธันวาคม 2494,15,2,ขนาดเล็ก,มีไฟฟ้า,7,80,8,27 มีนาคม 2562 เวลา 10:10:46 น.
135,1046030416,46020145,30416,คำไฮวิทยา,Kamhaiwittaya,นายนิกร นามโส,อนุบาล-ประถมศึกษา,,หมู่ 8 บ้านคำไฮ,หนองกุงศรี,หนองกุงศรี,กาฬสินธุ์,46220,kamhaiwittayaschool@hotmail.com,-,หนองกุงศรี,043019575/085-7500415,-,2475,10,5,ขนาดเล็ก,มีไฟฟ้า,9,59,8,18 มิถุนายน 2562 เวลา 14:26:53 น.
136,1046030417,46020146,30417,สระแก้ววิทยานุกูล,srakaewwitayanukool School.,-,ประถมศึกษา,,หมู่ 7 บ้านสระแก้ว,หนองกุงศรี,หนองกุงศรี,กาฬสินธุ์,46220,srakaewwitayanukool@Gmail.com,-,คำก้าว,854631615,-,16 พฤษภาคม 2498,ึ7,11,ขนาดเล็ก,มีไฟฟ้า,4,6,2,18 มีนาคม 2562 เวลา 10:15:22 น.
137,1046030432,46020147,30432,ไชยวารวิทยาคม,Chaiwanwittayakom,นายธีระพงษ์ โชติจำลอง,อนุบาล-ประถมศึกษา,,หมู่ 6 ไชยวาร,หนองบัว,หนองกุงศรี,กาฬสินธุ์,46220,Theeraphong2010@hotmail.co.th,https://data.bopp-obec.info/emis/schooldata-view.php?School_ID=1046030432&Area_CODE=4602,หนองบัว,043890229/081-3807548,-,พ.ศ.2465,28,10,ขนาดเล็ก,มีไฟฟ้า,9,84,8,25 ตุลาคม 2562 เวลา 22:33:33 น.
138,1046030433,46020148,30433,พรมลีศรีสว่าง,PROMLISRISAWANG,นางบุษบา นรินทร์รัมย์,อนุบาล-ประถมศึกษา,,หมู่ 1 ศรีสว่าง,หนองบัว,หนองกุงศรี,กาฬสินธุ์,46220,Bhrommali@hotmail.com,-,หนองบัว,043890230/087-2243894,-,2510,38,18,ขนาดเล็ก,มีไฟฟ้า,9,74,8,12 ตุลาคม 2562 เวลา 10:17:42 น.
139,1046030434,46020149,30434,หนองบัวคุรุรัฐประชาสรรพ์,NONGBUAKURURATPRACHASAN,นายนิพนธ์ ภูคงคา,อนุบาล-มัธยมศึกษาตอนต้น,,หมู่ 4 หนองบัว,หนองบัว,หนองกุงศรี,กาฬสินธุ์,46220,,http://data.bopp-obec.info/emis/schooldata-view.php?School_ID=1046030434&Area_CODE=4602,หนองบัว,092-5493560,0,2475,35,15,ขนาดกลาง,มีไฟฟ้า,16,152,11,26 มิถุนายน 2561 เวลา 15:28:56 น.
140,1046030435,46020150,30435,ท่อนสังข์วิทยา,Thonsungwittaya School,นายประเมธ ภูคงคา,อนุบาล-ประถมศึกษา,,หมู่ 13 คำศรี,หนองบัว,หนองกุงศรี,กาฬสินธุ์,46220,,-,หนองบัว,085-4528129,,2510,35,20,ขนาดเล็ก,มีไฟฟ้า,9,55,8,22 ตุลาคม 2562 เวลา 12:30:24 น.
141,1046030436,46020151,30436,ไชยศรีเรืองวิทย์วิทย์,chaisriruangwit school,นายชัชวาล ทัพพันธ์,อนุบาล-ประถมศึกษา,,หมู่ 5 หนองสามขา,หนองบัว,หนองกุงศรี,กาฬสินธุ์,46220,chaisriruangwitschool62@gmail.com,-,หนองบัว,043890231/081-9643837,-,17 กันยายน 2511,35,20,ขนาดเล็ก,มีไฟฟ้า,8,84,8,18 ตุลาคม 2562 เวลา 10:49:42 น.
142,1046030441,46020153,30441,นาบงวิทยา,Nabongwittaya,นายสมนึก ไทยแท้,อนุบาล-ประถมศึกษา,,หมู่ 3 นาบง,หนองสรวง,หนองกุงศรี,กาฬสินธุ์,46220,-,-,หนองสรวง,-,-,16 มิ.ย. 2494,45,20,ขนาดกลาง,มีไฟฟ้า,12,127,8,18 มิถุนายน 2562 เวลา 14:17:25 น.
143,1046030442,46020154,30442,หนองสวงวิทยาคม,nongsuangwittayakhom,นายวีระชัย มูลรัตน์,อนุบาล-มัธยมศึกษาตอนต้น,,หมู่ 2 หนองสรวง,หนองสรวง,หนองกุงศรี,กาฬสินธุ์,46220,-,-,หนองสรวง,9552609968,-,20/1/2477,46,26,ขนาดกลาง,มีไฟฟ้า,20,239,11,20 สิงหาคม 2562 เวลา 13:21:53 น.
144,1046030443,46020155,30443,คำโองวิทยา,Kam-ong wittaya,นายณัฐวุฒิ อุ่นสำโรง,อนุบาล-ประถมศึกษา,,หมู่ 6 คำโอง,หนองสรวง,หนองกุงศรี,กาฬสินธุ์,46220,nuththawuth6544@gmail.com,www.school.obec.go.th/comvit/,หนองสรวง,985852916,-,5 มิถุนายน 2515,43,30,ขนาดเล็ก,มีไฟฟ้า,11,85,8,17 มิถุนายน 2562 เวลา 20:06:42 น.
145,1046030444,46020156,30444,นาอวนวิทยาสิทธิ์,nauanwittayasit,นางสาวสุธาสินี ประสานวงศ์,อนุบาล-ประถมศึกษา,,หมู่ 5 นาอวน,หนองสรวง,หนองกุงศรี,กาฬสินธุ์,46220,nauanwittayasit@gmail.com,data.bopp-obec.info/web/?School_ID=1046030444,หนองสรวง,830527351,-,18 มิถุนายน 2508,50,30,ขนาดเล็ก,มีไฟฟ้า,8,38,8,13 มีนาคม 2562 เวลา 09:52:15 น.
