49,1046030091,46020052,30091,โคกคันจ้องหนองแต้สามัคคี,kokkunjongnongtaesamukkee,นายวิวัฒพงษ์ พัทโท,อนุบาล-ประถมศึกษา,,หมู่ 11 โคกคันจ้อง,หัวงัว,ยางตลาด,กาฬสินธุ์,46120,kokkunjong@hotmail.com,http://data.bopp-obec.info/web/?School_ID=1046030091,หัวงัว,043 849 090/087-8626600,-,01/05/2484,52,14,ขนาดเล็ก,มีไฟฟ้า,6,38,8,18 มิถุนายน 2562 เวลา 13:22:44 น.
50,1046030097,46020053,30097,หัวนาคำจรูญศิลป์,Huanakhamjaroonsil,นายวิสันต์ ไชยพิมพ์,อนุบาล-มัธยมศึกษาตอนต้น,,หมู่ 13 หัวนาคำ,หัวนาคำ,ยางตลาด,กาฬสินธุ์,46120,-,,เทศบาลตำบลหัวนาคำ,43864273,43864273,2464,30,18,ขนาดกลาง,มีไฟฟ้า,17,212,11,21 ตุลาคม 2562 เวลา 18:43:38 น.
51,1046030098,46020054,30098,ดงบังวิทยา,dongbanngwittaya,นายกิตติชัย ไกรพินิจ,อนุบาล-มัธยมศึกษาตอนต้น,,หมู่ 9 ดงบัง,หัวนาคำ,ยางตลาด,กาฬสินธุ์,46120,dongbangwittaya@hotmail.com,www.dongbangwittaya.com,เทศบาลตำบลหัวนาคำ,043124085/061-1126149,43124085,มิถุนายน 2464,30,17,ขนาดกลาง,มีไฟฟ้า,16,144,11,03 มีนาคม 2561 เวลา 09:20:15 น.
52,1046030099,46020055,30099,โคกค่ายโคกใหญ่วิทยา,Kokkaykokyaiwithaya,นายอนันต์ ทิพย์อาสน์,อนุบาล-มัธยมศึกษาตอนต้น,,หมู่ 10 โคกใหญ่,หัวนาคำ,ยางตลาด,กาฬสินธุ์,46120,-,-,หัวนาคำ,043864226/081-9341436,-,,28,22,ขนาดกลาง,มีไฟฟ้า,16,148,11,21 มีนาคม 2562 เวลา 09:03:17 น.
53,1046030102,46020056,30102,บ้านหนองหัวช้าง,Bannonghuachang,นางสาววรรณกานต์ สิมมา,อนุบาล-ประถมศึกษา,,หมู่ 6 หนองหัวช้าง,หัวนาคำ,ยางตลาด,กาฬสินธุ์,46120,naicc@windowslive.com,-,เทศบาลตำบลหัวนาคำ,095-6687880,-,1 มิถุนายน พ.ศ. 2490,28,19,ขนาดเล็ก,มีไฟฟ้า,6,35,7,17 มิถุนายน 2562 เวลา 12:25:06 น.
54,1046030100,46020057,30100,โพนสิมอนุเคราะห์,ponsimanukro,ดร.ปิยะกุล อุทโท,อนุบาล-มัธยมศึกษาตอนต้น,,หมู่ 7 โพนสิม,หัวนาคำ,ยางตลาด,กาฬสินธุ์,46120,-,www.facebook.com/โรงเรียนโพนสิมอนุเคราะห์-454184288105314/,หัวนาคำ,043-019513,-,2497,20,23,ขนาดกลาง,มีไฟฟ้า,18,251,11,28 มีนาคม 2562 เวลา 21:33:04 น.
55,1046030101,46020058,30101,วัดบ้านดอนกลาง,Wat ban donglang,นายพนานต์ อัมรานนท์,อนุบาล-ประถมศึกษา,,หมู่ 8 ดอนกลาง,หัวนาคำ,ยางตลาด,กาฬสินธุ์,46120,donglang1@hotmail.com,-,เทศบาลตำบลหัวนาคำ,043890162/093-3505948,-,19/06/2487,30,11,ขนาดเล็ก,มีไฟฟ้า,4,36,8,21 มิถุนายน 2562 เวลา 14:34:20 น.
56,1046030131,46020060,30131,ยางคำวิทยา,yangkhamwittaya,นายเขตรัตน์ ภูกองไชย,อนุบาล-มัธยมศึกษาตอนต้น,,หมู่ 12 ยางคำเหนือ,อิตื้อ,ยางตลาด,กาฬสินธุ์,46120,yangkham54@gmail.com,gg.gg/yangkhamwittayaschool,อิตื้อ,43890165,,1เมษายน 2479,25,20,ขนาดเล็ก,มีไฟฟ้า,15,104,11,09 ตุลาคม 2562 เวลา 09:45:39 น.
57,1046030124,46020061,30124,บ้านแกวิทยาคม,bankaewittayakhom,นายขวัญใจ อุดมรัตน์,อนุบาล-มัธยมศึกษาตอนต้น,,หมู่ 1 แก,อิตื้อ,ยางตลาด,กาฬสินธุ์,46120,ิbankaewitt@gmail.com,http://school.obec.go.t,อิตื้อ,043890303/084-2005599,-,พ.ศ.2464,18,15,ขนาดกลาง,มีไฟฟ้า,19,227,11,27 มิถุนายน 2562 เวลา 09:16:53 น.
58,1046030128,46020062,30128,บ้านหนองแวงบ่อแก้ว,BANNONGWANGBOKEAW,นายประดิษฐ์ นันทสมบูรณ์,อนุบาล-มัธยมศึกษาตอนต้น,,หมู่ 10 หนองแวงใต้,อิตื้อ,ยางตลาด,กาฬสินธุ์,46120,nv2468@hotmail.com,WANG.COM,อิตื้อ,093-4282299,-,2471,22,20,ขนาดกลาง,มีไฟฟ้า,14,120,11,21 มิถุนายน 2562 เวลา 14:46:41 น.
59,1046030129,46020063,30129,ดอนขีวิทยา,DONKHEEWITTAYA SCHOOL,นายนิวัฒน์ พิมแสง,อนุบาล-ประถมศึกษา,,หมู่ 6 ดอนขี,อิตื้อ,ยางตลาด,กาฬสินธุ์,46120,Donkheewittaya001@gmail.com,-,อิตื้อ,086-8549310,-,1 พฤษภาคม 2484,25,21,ขนาดเล็ก,มีไฟฟ้า,10,105,8,18 มิถุนายน 2562 เวลา 09:34:40 น.
60,1046030113,46020064,30113,อุ่มเม่าวิทยา,UMMAOWITTAYA,นายธัชพล ใจศิริ,อนุบาล-ประถมศึกษา,,หมู่ 8 อุ่มเม่า,อุ่มเม่า,ยางตลาด,กาฬสินธุ์,46120,ummaowittaya@gmail.com,-,อุ่มเม่า,043601522/063-0103937,-,1 ธ.ค.2457,47,13,ขนาดเล็ก,มีไฟฟ้า,7,101,8,23 ตุลาคม 2562 เวลา 13:00:29 น.
61,1046030111,46020065,30111,โคกศรีวิทยายน,KHOKSRIWITTHAYAYON,นายสุพเมธ พลเสน,อนุบาล-ประถมศึกษา,,หมู่ 5 โคกศรี,อุ่มเม่า,ยางตลาด,กาฬสินธุ์,46120,-,-,โคกศรี,985856205,-,30/11/ 2465,40,9,ขนาดเล็ก,มีไฟฟ้า,8,90,8,25 มีนาคม 2562 เวลา 19:02:47 น.
62,1046030115,46020066,30115,ชุมชนดอนม่วงงาม,Chumchondonmaungngam,นางรุ้งเพ็ชร หัตถามาศ,อนุบาล-ประถมศึกษา,,หมู่ 9 คำม่วง,อุ่มเม่า,ยางตลาด,กาฬสินธุ์,46120,khammaung789@gmail.com - donmaungngam28@gmail.com,http://school.obec.go.t,อุ่มเม่า,043890304/0811178198,43890304,2465,45,18,ขนาดกลาง,มีไฟฟ้า,13,124,8,21 มีนาคม 2562 เวลา 13:34:15 น.
63,1046030362,46020067,30362,ชุมชนกุดโดนวิทยาคม,Chumchon Kuddon Wittayakom,ดร.วิโรจน์ ค้อไผ่,อนุบาล-มัธยมศึกษาตอนต้น,,หมู่ 1 กุดโดน,กุดโดน,ห้วยเม็ก,กาฬสินธุ์,46710,rote.research@gmail.com,https://data.bopp-obec.info/emis/schooldata-view.php?School,กุดโดน,43889966,-,29/11/2465,6,5,ขนาดกลาง,มีไฟฟ้า,18,137,11,25 ตุลาคม 2562 เวลา 10:36:05 น.
64,1046030363,46020068,30363,หนองแวงประชาสรรพ์,Nongvangphachasan,นายเคน อาจดวงดี,อนุบาล-มัธยมศึกษาตอนต้น,,"หมู่ 4 หนองแวงดง,หนองแวงศรีสวัสดิ์",กุดโดน,ห้วยเม็ก,กาฬสินธุ์,46710,nongwangprachasan@gmail.com,gg.gg/nongvangprachasan,กุดโดน,043890248/086-2381991,-,10/06/2477,10.2,9,ขนาดกลาง,มีไฟฟ้า,18,162,11,17 ตุลาคม 2562 เวลา 10:05:16 น.
65,1046030364,46020069,30364,หนองแวงม่วง,Nongwaengmuang,นายบัญญัติ ปรีพูล,อนุบาล-ประถมศึกษา,,หมู่ 3 หนองแวงม่วง,กุดโดน,ห้วยเม็ก,กาฬสินธุ์,46710,-,http://data.bopp-obec.info/emis/admin.php,กุดโดน,043890249/093-4470460,-,พ.ศ.2485,3,5,ขนาดเล็ก,มีไฟฟ้า,8,50,8,25 ตุลาคม 2562 เวลา 14:02:09 น.
66,1046030365,46020070,30365,นาค้อวิทยาคม,NAKORWITTAYAKOM,นายสุนทรา กุลาสา,อนุบาล-มัธยมศึกษาตอนต้น,,หมู่ 5 นาค้อ,กุดโดน,ห้วยเม็ก,กาฬสินธุ์,46170,-,-,กุดโดน,0819541698/081-9541698,-,0/0/2471,10,10,ขนาดกลาง,มีไฟฟ้า,17,159,11,29 ตุลาคม 2562 เวลา 11:19:29 น.
67,1046030366,46020071,30366,หนองปะโอประชาอุทิศ,nongpaoprachautis,นายสุริยา สุเพ็ญศิลป์,อนุบาล-ประถมศึกษา,,หมู่ 9 คำปะโอ,กุดโดน,ห้วยเม็ก,กาฬสินธุ์,46170,-,-,กุดโดน,043890251/081-3805955,-,พ.ศ. 2514,17,16,ขนาดกลาง,มีไฟฟ้า,13,159,8,13 มีนาคม 2562 เวลา 10:48:01 น.
68,1046030367,46020072,30367,คุรุชนประสิทธิ์ศิลป์,kuruchonprasitsil,นางกัญญาภัค แก้วกลางเมือง,อนุบาล-ประถมศึกษา,,หมู่ 7 คำมะโฮ,คำเหมือดแก้ว,ห้วยเม็ก,กาฬสินธุ์,46710,-,,คำเหมือดแก้ว,043890253/088-3269543,-,1/11/2482,13,12,ขนาดเล็ก,มีไฟฟ้า,6,37,8,22 ตุลาคม 2562 เวลา 11:28:46 น.
69,1046030368,46020073,30368,คำมันปลาผดุงวิทย์,kummunplaphadungwit,-,อนุบาล-ประถมศึกษา,,หมู่ 6 คำมันปลา,คำเหมือดแก้ว,ห้วยเม็ก,กาฬสินธุ์,46170,-,-,คำเหมือดแก้ว,872369148,-,1 เมษายน พ.ศ. 2478,15,13,ขนาดเล็ก,มีไฟฟ้า,6,30,7,14 พฤศจิกายน 2562 เวลา 10:33:44 น.
70,1046030359,46020074,30359,คำเหมือดแก้วบำเพ็ญวิทยา,kammuardkaewbumpenwittaya,นายธานี ภูสดศรี,อนุบาล-มัธยมศึกษาตอนต้น,,หมู่ 2 โนนศิลาอาสน์,คำเหมือดแก้ว,ห้วยเม็ก,กาฬสินธุ์,46170,-,-,คำเหมือดแก้ว,043890252/095-7742648,43890252,2467,8,6,ขนาดกลาง,มีไฟฟ้า,22,282,13,20 มกราคม 2563 เวลา 09:32:12 น.
71,1046030361,46020075,30361,ป่าหวายศึกษา,Paway school,-,อนุบาล-ประถมศึกษา,,หมู่ 4 บ้านป่าหวาย,คำเหมือดแก้ว,ห้วยเม็ก,กาฬสินธุ์,46170,yutthachat.nasawat@gmail.com,-,คำเหมือดแก้ว,945205741,-,1 พ.ค.2501,15,12,ขนาดเล็ก,มีไฟฟ้า,3,14,7,14 สิงหาคม 2562 เวลา 10:03:59 น.
72,1046030379,46020076,30379,คำใหญ่วิทยา,khamyaiwittaya,นายสมหวัง อ่อนราษฎร์,อนุบาล-ประถมศึกษา,,หมู่ 12 คำใหญ่,คำใหญ่,ห้วยเม็ก,กาฬสินธุ์,46710,-,gg.gg/khamyaiwitaya,เทศบาลตำบลคำใหญ่,0847853648/084-785364,-,2465,8,9,ขนาดกลาง,มีไฟฟ้า,12,90,7,20 มิถุนายน 2562 เวลา 12:45:13 น.
73,1046030380,46020077,30380,ชุมชนสะอาดผดุงศิลป์,choomchonsaardpadungsin,นายบัญชา เสนาคูณ,อนุบาล-มัธยมศึกษาตอนต้น,,หมู่ 5 บ้านห้วยยาง,คำใหญ่,ห้วยเม็ก,กาฬสินธุ์,46170,saard2005@yahoo.co.th,http://202.143.147.101/,คำใหญ่,043882169/089-2749166,-,2478,12,9,ขนาดกลาง,มีไฟฟ้า,10,101,11,11 มิถุนายน 2561 เวลา 10:33:14 น.
74,1046030382,46020078,30382,บ้านชัยศรี,banchaisri,นายอรรถสิทธิ์ อุดรรัตน์,อนุบาล-ประถมศึกษา,,หมู่ 3 บ้านชัยศรี,คำใหญ่,ห้วยเม็ก,กาฬสินธุ์,46710,schoolchaisri@gmail.com,,คำใหญ่,43890255,-,1 ก.ค.2507,12,12,ขนาดเล็ก,มีไฟฟ้า,8,65,8,27 มีนาคม 2562 เวลา 09:54:14 น.
75,1046030384,46020079,30384,โนนเตาไหหนองแก,nontaohainongkae,นายบวร ภูแสงศรี,อนุบาล-มัธยมศึกษาตอนต้น,,หมู่ 6 บ้านหนองแก,ทรายทอง,ห้วยเม็ก,กาฬสินธุ์,46710,-,-,ทรายทอง,043890256/086-2260371,-,15/06/2501,19,20,ขนาดเล็ก,มีไฟฟ้า,9,46,11,20 มีนาคม 2562 เวลา 14:36:48 น.
76,1046030386,46020080,30386,บ้านทรายทองวิทยาคม,bansaithogwitthayakhom,นายมานิตย์ ทิพย์พันธุ์,อนุบาล-มัธยมศึกษาตอนต้น,,หมู่ 5 บ้านทรายทอง,ทรายทอง,ห้วยเม็ก,กาฬสินธุ์,46710,-,bansaithong.ob.tc,ทรายทอง,043890256/062-3474014,-,15 พฤษภาคม 2526,22,23,ขนาดเล็ก,มีไฟฟ้า,17,116,11,17 ตุลาคม 2562 เวลา 13:08:53 น.
77,1046030376,46020081,30376,หนองกุงไทยวิทยาคม,Nongkungthaiwittayakom,-,อนุบาล-ประถมศึกษา,,หมู่ 4 หนองกุงไทย,โนนสะอาด,ห้วยเม็ก,กาฬสินธุ์,46710,nongkungthai@gmail.com,www.thai,โนนสะอาดschool.in.th/46104082,043890258/081-8734108,-,1 / 9 /2477,17,16,ขนาดเล็ก,มีไฟฟ้า,8,105,8,19 ตุลาคม 2562 เวลา 11:01:02 น.
78,1046030374,46020082,30374,โนนสะอาดราษฎร์อำนวย,Nonsa ardradamnuay,นางประสพสุข ศรีหงษ์ทอง,อนุบาล-มัธยมศึกษาตอนต้น,,หมู่ 1 โนนสวัสดี,โนนสะอาด,ห้วยเม็ก,กาฬสินธุ์,46170,nsa.9689@gmail.com,http://gg.gg/nsa-sfc,โนนสะอาด,0900280619/098-1942581,-,พ.ศ. 2478,13,14,ขนาดกลาง,มีไฟฟ้า,18,171,11,14 มิถุนายน 2562 เวลา 12:16:40 น.
79,1046030369,46020083,30369,หนองแสงวิทยา,nongsangwittaya,นางสาวธัญพร เทพสิงห์,อนุบาล-ประถมศึกษา,,หมู่ 5 หนองแสง,บึงนาเรียง,ห้วยเม็ก,กาฬสินธุ์,46710,nongsang_school@hotmail.com,,อบต.บึงนาเรียง,942864690,-,2514,7,6,ขนาดเล็ก,มีไฟฟ้า,6,76,8,29 ตุลาคม 2562 เวลา 19:24:14 น.
80,1046030371,46020085,30371,หนองบัววิทยาเสริม,Nongbuavittayaserm,นายนรากร เสนฤทธิ์,อนุบาล-ประถมศึกษา,,หมู่ 6 หนองบัว,บึงนาเรียง,ห้วยเม็ก,กาฬสินธุ์,46710,nongbua169@hotmail.com,-,บึงนาเรียง,043840845/063-4640230,-,พ.ศ.. 2464,8,8,ขนาดเล็ก,มีไฟฟ้า,10,78,11,12 มิถุนายน 2562 เวลา 09:15:23 น.
81,1046030372,46020086,30372,นาสีนวลอุดมเวศม์,Nasinuel Udomwet,-,อนุบาล-ประถมศึกษา,,หมู่ 2 นาสีนวล,บึงนาเรียง,ห้วยเม็ก,กาฬสินธุ์,46170,"sunet1010@hotmail,com",www.Nasinuel.1046030372,บึงนาเรียง,087-2160588,-,15 เม.ย. 2515,9,8,ขนาดเล็ก,มีไฟฟ้า,4,39,7,12 ตุลาคม 2562 เวลา 16:47:43 น.
82,1046030385,46020087,30385,เดชอุดมพิทยาคม,detaudompitayakom,-,อนุบาล-ประถมศึกษา,,หมู่ 1 บ้านเดชอุดม,ทรายทอง,ห้วยเม็ก,กาฬสินธุ์,46710,,,พิมูล,,,5 ต.ค.2522,19,20,ขนาดเล็ก,มีไฟฟ้า,2,5,3,28 มีนาคม 2562 เวลา 12:13:20 น.
83,1046030383,46020088,30383,พิมูลวิทยา,pimoonwitthaya,-,อนุบาล-ประถมศึกษา,,หมู่ 2 บ้านพิมูล,พิมูล,ห้วยเม็ก,กาฬสินธุ์,46710,pimoonwittaya@gmail.com,-,พิมูล,043890264/088-3499882,-,2464,21,20,ขนาดเล็ก,มีไฟฟ้า,2,20,8,22 ตุลาคม 2562 เวลา 12:56:33 น.
84,1046030381,46020089,30381,บ้านหาดทรายมูล,banhadsaimoon,นายทองใส จันทะรัตน์,อนุบาล-ประถมศึกษา,,หมู่ 4 บ้านหาดทรายมูล,พิมูล,ห้วยเม็ก,กาฬสินธุ์,46170,-,?http://school.obec.go.,พิมูล,081-0500806,-,1 ก.ย.2498,12,10,ขนาดเล็ก,มีไฟฟ้า,7,70,8,20 มิถุนายน 2562 เวลา 13:22:21 น.
85,1046030360,46020090,30360,หน่อคำประชานุเคราะห์,norkampachanukror,นายเดชฤทธิ์ วรรณทอง,อนุบาล-ประถมศึกษา,,หมู่ 3 หน่อคำ,ห้วยเม็ก,ห้วยเม็ก,กาฬสินธุ์,46170,norkom_school@cgd.go.th,http://gg.gg/norkompachanukror,ห้วยเม็ก,043889098/093-4905788,-,1 เดือนพฤษภาคม 2521,2,1,ขนาดเล็ก,มีไฟฟ้า,9,72,8,23 ตุลาคม 2562 เวลา 14:21:11 น.
86,1046030358,46020091,30358,เนินลาดวิทยา,Neonlatwitaya,นายนวมินทร์ นันตะริ,อนุบาล-ประถมศึกษา,,หมู่ 9 เนินลาด,ห้วยเม็ก,ห้วยเม็ก,กาฬสินธุ์,46170,-,-,ท่าลาดดงยาง,043890265/084-5797998,-,24 เดือนพฤษภาคม พ.ศ. 2494,1.5,2.5,ขนาดเล็ก,มีไฟฟ้า,8,47,8,06 มิถุนายน 2560 เวลา 13:54:40 น.
87,1046030355,46020092,30355,ห้วยเม็กราษฎร์นุกูล,huaimekratnukul,นายอภิชัย ศรีโท,อนุบาล-ประถมศึกษา,,หมู่ 4 พิทักษ์,ห้วยเม็ก,ห้วยเม็ก,กาฬสินธุ์,46170,-,-,ห้วยเม็ก,061-1570478,-,01/07/2478,0.5,1,ขนาดเล็ก,มีไฟฟ้า,10,116,8,19 เมษายน 2562 เวลา 09:16:02 น.
88,1046030356,46020093,30356,บ้านกุดท่าลือ,BANKUDTHALUE,-,อนุบาล-ประถมศึกษา,,หมู่ 12 กุดท่าลือ,ห้วยเม็ก,ห้วยเม็ก,กาฬสินธุ์,46170,-,-,ท่าลาดดงยาง,-,-,พ.ศ.2477,2.5,2.5,ขนาดเล็ก,มีไฟฟ้า,10,111,8,12 มิถุนายน 2560 เวลา 11:12:01 น.
89,1046030357,46020094,30357,หัวดงวิทยา,huadongwittaya,-,อนุบาล-ประถมศึกษา,,หมู่ 8 หัวดง,ห้วยเม็ก,ห้วยเม็ก,กาฬสินธุ์,46170,-,-,ท่าลาดดงยาง,043890265/087-9136507,-,11/06/2501,5.5,4.5,ขนาดเล็ก,มีไฟฟ้า,3,0,0,19 มีนาคม 2562 เวลา 13:02:50 น.
90,1046030378,46020095,30378,โคกกลางเหนือพิทยาสรรพ์,khokklangnueaphittayasan,นายวิศูตร์ เรืองเลิศ,อนุบาล-ประถมศึกษา,,หมู่ 5 โคกกลางเหนือ,หัวหิน,ห้วยเม็ก,กาฬสินธุ์,46170,khokklang030378@gmail.com,http://gg.gg/khokklangn,หัวหิน,081-9643693,-,2524,19,17,ขนาดกลาง,มีไฟฟ้า,12,133,8,18 มีนาคม 2562 เวลา 14:00:49 น.
91,1046030373,46020096,30373,ห้วยมะทอโคกล่ามวิทยา,Huaymathorkhoklamwittaya,นางสาวภทรภรณ์ พลขันธ์,อนุบาล-ประถมศึกษา,,หมู่ 2 ห้วยมะทอ,หัวหิน,ห้วยเม็ก,กาฬสินธุ์,46710,Huay.373@gmail.com,-,หัวหิน,064-1942696,-,23 พฤษภาคม 2481,12,11,ขนาดเล็ก,มีไฟฟ้า,10,85,8,18 มีนาคม 2562 เวลา 13:12:33 น.
92,1046030375,46020097,30375,หนองโนวิทยาคม,Nongnowittayakom,นายเฉลิมชัย หนูชื่น,อนุบาล-ประถมศึกษา,,หมู่ 7 หนองโน,หัวหิน,ห้วยเม็ก,กาฬสินธุ์,46170,nongnosite@gmail.com,data.bopp-obec.info/web/?School_ID=1046030375,หัวหิน,981029452,43813901,พ.ศ.2477,9,9,ขนาดเล็ก,มีไฟฟ้า,8,73,8,24 ตุลาคม 2562 เวลา 12:32:52 น.
93,1046030377,46020098,30377,หัวหินราษฎร์บำรุง,huahinratbumroong,-,อนุบาล-ประถมศึกษา,,หมู่ 4 โคกกลาง,หัวหิน,ห้วยเม็ก,กาฬสินธุ์,46710,krujaae0004@hotmail.com,-,หัวหิน,086-2211761,-,1 มิถุนายน 2481,16,16,ขนาดเล็ก,มีไฟฟ้า,2,4,2,13 มีนาคม 2562 เวลา 12:34:25 น.
94,1046030278,46020099,30278,ชุมชนกุงเก่าราษฎร์ประสิทธิ์,CHOOMCHONKUNGKAORADPRASIT,นายศรายุทธ เชื้ออัญ,อนุบาล-มัธยมศึกษาตอนต้น,,หมู่ 11 กุงเก่า,กุงเก่า,ท่าคันโท,กาฬสินธุ์,46190,-,http://data.bopp-obec.info/web/?School_ID=1046030278,กุงเก่า,083-4183339,-,29/11/2442,55,10,ขนาดกลาง,มีไฟฟ้า,20,134,10,13 มีนาคม 2562 เวลา 14:49:26 น.
95,1046030279,46020100,30279,สร้างแก้วรัฐราษฎร์บำรุง,sangkawrudradbumrung,นายทองสุข วงษ์อนันท์,อนุบาล-ประถมศึกษา,,หมู่ 2 สร้างแก้ว,กุงเก่า,ท่าคันโท,กาฬสินธุ์,46190,sangkaewrutrad@gmail.com,gg.gg/sangkaw,กุงเก่า,933804976,-,พ.ศ.2500,60,5,ขนาดเล็ก,มีไฟฟ้า,7,40,8,07 มกราคม 2563 เวลา 11:09:53 น.
96,1046030281,46020102,30281,ขอนแก่นวิทยาเสริม,Khonkaenwittayaserm,นายสดใส ภูเนตร,อนุบาล-มัธยมศึกษาตอนต้น,,หมู่ 9 กุดขอนแก่น,กุงเก่า,ท่าคันโท,กาฬสินธุ์,46190,sodsai049@gmail.com,WWW. KKWS.GS.TH,กุงเก่า,819646997,-,17 พฤษภาคม 2465,53,6,ขนาดกลาง,มีไฟฟ้า,20,272,11,29 มีนาคม 2562 เวลา 14:00:18 น.
97,1046030283,46020103,30283,บ้านคำแคน,kamkan,-,อนุบาล-ประถมศึกษา,,หมู่ 7 คำแคน,กุงเก่า,ท่าคันโท,กาฬสินธุ์,46190,kamkanschool@gmail.com,http://202.143.147.101/,กุงเก่า,043890085/087-6438819,-,2515,60,10,ขนาดเล็ก,มีไฟฟ้า,6,38,8,20 มิถุนายน 2562 เวลา 11:07:59 น.
