146,1046030445,46020157,30445,หนองแข้วิทยา,Nongkaewittaya,นายคม เอกพันธ์,อนุบาล-มัธยมศึกษาตอนต้น,,หมู่ 2 หนองแขั,ดงมูล,หนองกุงศรี,กาฬสินธุ์,46220,-,http://school.obec.go.th/nkvit/,เทศบาลตำบลหนองหิน,847858443,-,30 เมษายน 2500,35,20,ขนาดกลาง,มีไฟฟ้า,17,164,11,29 มิถุนายน 2560 เวลา 01:48:34 น.
147,1046030438,46020159,30438,หนองบัวชุม,Nongbuachum,นางสาวเจศิกา เจฒิภัทรกุล,อนุบาล-ประถมศึกษา,,หมู่ 2 หนองบัวชุม,หนองหิน,หนองกุงศรี,กาฬสินธุ์,46220,nongbuachum.62@gmail.com,-,หนองหิน,0864330154/0953211489,-,พ.ศ.2514,40,28,ขนาดเล็ก,มีไฟฟ้า,7,48,8,24 ตุลาคม 2562 เวลา 11:45:15 น.
148,1046030439,46020160,30439,ชุมชนหนองหินวิทยาคาร,CHUMCHONNONGHINWITTAYAKHAN,นายภวัฒน์ มูลสาร,อนุบาล-มัธยมศึกษาตอนต้น,,หมู่ 4 หนองหิน,หนองหิน,หนองกุงศรี,กาฬสินธุ์,46220,chnwk.ac.th@gmail.com,www.chnwk.ac.th,หนองหิน,081-2600645,-,พ.ศ. 2482,48,26,ขนาดกลาง,มีไฟฟ้า,25,349,20,22 มีนาคม 2562 เวลา 11:46:30 น.
149,1046030446,46020161,30446,หนองใหญ่วิทยา,Nong Yai Witthaya School,-,อนุบาล-ประถมศึกษา,,หมู่ 1 หนองใหญ่,หนองใหญ่,หนองกุงศรี,กาฬสินธุ์,46220,-,http://data.bopp-obec.info/web/?School_ID=1046030446,เทศบาลตำบลหนองใหญ่,043890234/085-7413087,-,2 พฤษภาคม 2501,25,10,ขนาดเล็ก,มีไฟฟ้า,3,17,7,20 มีนาคม 2562 เวลา 09:39:13 น.
150,1046030450,46020163,30450,จินดาสินธวานนท์,jindasintawanon,นายทักษิน เชื้อสูง,อนุบาล-มัธยมศึกษาตอนต้น,,หมู่ 9 คำน้อย,หนองใหญ่,หนองกุงศรี,กาฬสินธุ์,46220,-,-,หนองใหญ่,043890338/081-3804868,-,1 ตุลาคม 2523,30,20,ขนาดกลาง,มีไฟฟ้า,22,264,11,17 มิถุนายน 2562 เวลา 19:53:24 น.
151,1046030448,46020164,30448,นามูลสมบูรณ์วิทย์,namoonsomboonwit,นางวนิดา ศรีคำมูล,อนุบาล-ประถมศึกษา,,หมู่ 3 นามูล,หนองใหญ่,หนองกุงศรี,กาฬสินธุ์,46220,nam00n2562@gmail.com,www.namoon2502,หนองใหญ่,043890236/084-9575012,-,8 มิถุนายน 2502,18,13,ขนาดเล็ก,มีไฟฟ้า,10,65,8,20 มิถุนายน 2562 เวลา 09:45:42 น.
152,1046030449,46020165,30449,บ้านหนองชุมแสง,Bannongchumsang school,นางยุพิน เมืองฮาม,อนุบาล-มัธยมศึกษาตอนต้น,,หมู่ 8 หนองชุมแสง,หนองใหญ่,หนองกุงศรี,กาฬสินธุ์,46220,-,-,หนองใหญ่,0,-,1 พฤษภาคม 2513,26,13,ขนาดกลาง,มีไฟฟ้า,19,207,11,13 มีนาคม 2562 เวลา 10:00:37 น.
153,1046030578,46020166,30578,เหล่ากลางร่วมวงศ์วิทยา,Laoklangrumwongwittaya,-,อนุบาล-ประถมศึกษา,,หมู่ 8 บ้านโนนทัน,เหล่ากลาง,ฆ้องชัย,กาฬสินธุ์,46130,laoklang2512@gmail.com,,เหล่ากลาง,086-4504315/097-3028651,-,1ม.ค.2512,75,8,ขนาดกลาง,มีไฟฟ้า,11,194,8,22 มีนาคม 2562 เวลา 15:15:12 น.
154,1046030577,46020167,30577,กุดฆ้องชัยวิทยา,Kudkhongchaivittaya,นายธนา กมลตรี,อนุบาล-ประถมศึกษา,,หมู่ 3 กุดฆ้องชัย,ฆ้องชัยพัฒนา,ฆ้องชัย,กาฬสินธุ์,46130,-,-,ฆ้องชัยพัฒนา,043131199/081-9645284,-,พ.ศ.2479,63,3,ขนาดเล็ก,มีไฟฟ้า,9,85,8,18 มิถุนายน 2561 เวลา 14:41:56 น.
155,1046030565,46020168,30565,น้อยดอนข่าประชาสามัคคี,Noidonkhaprachasamudkhee,นายนุกูล ทรงมงคลรัตน์,อนุบาล-ประถมศึกษา,,"หมู่ 6, น้อยดอนข่า",โคกสะอาด,ฆ้องชัย,กาฬสินธุ์,46130,-,-,โคกสะอาด,043899964/081-0617741,-,6 มิ.ย.2520,60,4,ขนาดเล็ก,มีไฟฟ้า,8,60,8,11 มิถุนายน 2562 เวลา 13:31:21 น.
156,1046030566,46020169,30566,โคกประสิทธิ์วิทยา,KOKPRASITWITTAYA,นายฤทธิรงค์ นาถมทอง,อนุบาล-มัธยมศึกษาตอนต้น,,หมู่ 12 โคกประสิทธิ์,โคกสะอาด,ฆ้องชัย,กาฬสินธุ์,46130,kogprasitschool@hotmail.com,-,โคกสะอาด,043899960/081-8732562,43899960,15 มิถุนายน 2465,50,8,ขนาดกลาง,มีไฟฟ้า,16,151,11,13 มีนาคม 2562 เวลา 14:42:06 น.
157,1046030567,46020170,30567,โนนชัยประชาสรรค์,Nonchaiprachason,นางจิราพร นาจรูญ,อนุบาล-ประถมศึกษา,,หมู่ 1 โนนชัย,โคกสะอาด,ฆ้องชัย,กาฬสินธุ์,46130,noonchai.prachasan@gmail.com,-,โคกสะอาด,812612262,-,19 พ.ค. 2519,54,10,ขนาดเล็ก,มีไฟฟ้า,7,48,8,24 ตุลาคม 2562 เวลา 21:08:08 น.
158,1046030568,46020171,30568,หนองเม็กวิทยา,nongmekwittaya,นางสุพรรณิการ์ นาชัยฤทธฺ์,อนุบาล-ประถมศึกษา,,หมู่ 4 บ้านหนองเม็ก,โคกสะอาด,ฆ้องชัย,กาฬสินธุ์,46130,nongmekwitthaya@gmail.com,-,โคกสะอาด,43019229,-,30 มิถุนายน 2481,50,10,ขนาดเล็ก,มีไฟฟ้า,8,51,8,20 มิถุนายน 2562 เวลา 13:08:27 น.
159,1046030569,46020172,30569,บัวสะอาดส่งเสริม,buasaardsongserm,นายอวิรุทธ์ มูลเอก,อนุบาล-มัธยมศึกษาตอนต้น,,หมู่ 11 หนองบัว,โคกสะอาด,ฆ้องชัย,กาฬสินธุ์,46130,threerapong.pat@obecmail.obec.go.th,,โคกสะอาด,043890341/081-6701447,-,10/06/2465,45,15,ขนาดเล็ก,มีไฟฟ้า,9,48,11,19 ตุลาคม 2562 เวลา 14:51:34 น.
160,1046030564,46020173,30564,บ้านชาดวิทยาคาร,Banchatvittayakarn,นายเทิดชัย บัวอาจ,อนุบาล-ประถมศึกษา,,หมู่ 11 ชาด,ฆ้องชัยพัฒนา,ฆ้องชัย,กาฬสินธุ์,46130,Banchatvittayakhan@hotmail.com,-,เทศบาลตำบลฆ้องชัยพัฒนา,0438890005/085-7430598,-,18 มิ.ย. 2465,60,5,ขนาดเล็ก,มีไฟฟ้า,8,50,8,22 ตุลาคม 2562 เวลา 19:53:32 น.
161,1046030573,46020174,30573,ท่าแห่วิทยาคม,TAHAEWITTAYAKOM,นายสำเริง สุจิตตกุล,อนุบาล-ประถมศึกษา,,หมู่ 10 บ้านท่าแห่,ฆ้องชัยพัฒนา,ฆ้องชัย,กาฬสินธุ์,46130,-,สพฐ.,ฆ้องชัยพัฒนา,043848161/089-2751895,-,พ.ศ. 2465,63,5,ขนาดกลาง,มีไฟฟ้า,12,116,8,21 มิถุนายน 2562 เวลา 11:09:06 น.
162,1046030579,46020175,30579,ดอนแคนโนนเปลือยวิทยา,Donkaennonpleaywittaya,นายเทอดเกียรติ ขูรูรักษ์,อนุบาล-ประถมศึกษา,,หมู่ 2 ดอนแคน,ฆ้องชัยพัฒนา,ฆ้องชัย,กาฬสินธุ์,46130,-doomkan2510@gmail.com,-,ฆ้องชัยพัฒนา,086-8828676,-,01/05/2521,65,5,ขนาดกลาง,มีไฟฟ้า,12,147,8,19 พฤศจิกายน 2562 เวลา 14:11:31 น.
163,1046030580,46020176,30580,โนนเขวาเหล่าใหญ่ราษฎร์ส่งเสริม,Nonkaowlaoyairatsongserm,นางเกศรา ทะรังศรี,อนุบาล-ประถมศึกษา,,หมู่ 4 โนนเขวา,ฆ้องชัยพัฒนา,ฆ้องชัย,กาฬสินธุ์,46130,nonkhow2481@gmail.com,,ฆ้องชัยพัฒนา,981023964,-,1 ตุลาคม 2481,65,5,ขนาดเล็ก,มีไฟฟ้า,7,93,8,22 มีนาคม 2562 เวลา 11:32:53 น.
164,1046030572,46020178,30572,โนนศิลาสว่างวิทย์,Nonsilasawangwit School,นายอารมณ์ จารุทรัพย์สดใส,อนุบาล-ประถมศึกษา,,หมู่ 1 บ้านโนนศิลาเลิง,โนนศิลาเลิง,ฆ้องชัย,กาฬสินธุ์,46130,-,data.bopp-obec.info/web/?School_ID=10460305,โนนศิลาเลิง,089-9486409,-,ปี 2456,60,12,ขนาดกลาง,มีไฟฟ้า,11,131,9,14 มิถุนายน 2562 เวลา 14:04:12 น.
165,1046030570,46020179,30570,หนองคูวังเดือนห้าวิทยา,Nongkhoo Wangduanhawittaga,นายวีรเดช นรินทร์รัมย์,อนุบาล-ประถมศึกษา,,หมู่ 5 บ้านหนองคู,โนนศิลาเลิง,ฆ้องชัย,กาฬสินธุ์,46130,nongkoo570@gmail.com,-,โนนศิลาเลิง,043890007/089-5782481,-,18 พฤษภาคม 2477,50,10,ขนาดเล็ก,มีไฟฟ้า,5,39,7,24 มกราคม 2563 เวลา 13:23:51 น.
166,1046030575,46020180,30575,วังยางวิทยาคาร,wangyangwitthayakan,นายสมควร ศรีชมภู,อนุบาล-มัธยมศึกษาตอนต้น,,หมู่ 5 วังยาง,ลำชี,ฆ้องชัย,กาฬสินธุ์,46130,wangyang – ๑๔๒ @ hotmail.com,-,ลำชี,043890008/086-2279908,-,7 มิถุนายน 2465,90,15,ขนาดกลาง,มีไฟฟ้า,18,128,11,16 ตุลาคม 2562 เวลา 22:03:57 น.
167,1046030576,46020181,30576,ท่าเยี่ยมหนองคล้าประชาส่งเสริม,Thayiamnongkhlaprachasongserm,-,อนุบาล-ประถมศึกษา,,หมู่ 6 ท่าเยี่ยม,ลำชี,ฆ้องชัย,กาฬสินธุ์,46130,-,-,องค์การบริหารส่วนตำบลลำชี,043890009/085-4523225,-,พ.ศ.2465,80,15,ขนาดเล็ก,มีไฟฟ้า,2,22,7,16 ตุลาคม 2562 เวลา 22:10:46 น.
168,1046030574,46020182,30574,โนนแดงราษฎร์ประสิทธิ์,NONDANGRATPRASIT,นายพิทักษ์ สุจิตตกุล,อนุบาล-มัธยมศึกษาตอนต้น,,หมู่ 2 โนนแดง,ลำชี,ฆ้องชัย,กาฬสินธุ์,46130,Nondang_school@hotmail.com,www.nondang.ac.th,ลำชี,43890266,-,2465,70,6,ขนาดเล็ก,มีไฟฟ้า,10,65,11,16 ตุลาคม 2562 เวลา 21:49:30 น.
