92,1047540106,47010094,540106,บ้านโคกสะอาด,Ban Khok sa -ard School,นายดาวิทย์ พุทธิไสย,อนุบาล-ประถมศึกษา,,หมู่ 4 บ้านโคกสะอาด,อุ่มจาน,กุสุมาลย์,สกลนคร,47230,Koksa _ard@hotmail.com,,อบต.อุ่มจาน,042-704891,,1 พ.ค.2501,28,36,ขนาดเล็ก,มีไฟฟ้า,7,41,9,24 กันยายน 2562 เวลา 14:14:58 น.
93,1047540107,47010095,540107,แก้งคำประชาสามัคคี,Kaeng Kham Pracha Samakkhi,นางจูรีรัตน์ คำเมือง,อนุบาล-ประถมศึกษา,กุสุมาลย์ 2,หมู่ 3 แก้งท่าลับ,อุ่มจาน,กุสุมาลย์,สกลนคร,47230,KPSsc95@hotmail.com,,อบต.อุ่มจาน,983989365,,06/08/2489,38,43,ขนาดเล็ก,มีไฟฟ้า,8,69,8,27 กันยายน 2562 เวลา 12:53:51 น.
94,1047540102,47010096,540102,ชุมชนบ่อแสนพันมิตรภาพที่211,Chumchonbosenphanmittraphapthi 211,นางพรรมาหา เพชรพรรณ,อนุบาล-ประถมศึกษา,,หมู่ 14 แสนพัน,อุ่มจาน,กุสุมาลย์,สกลนคร,47230,bor21147230@gmail.com,-,-,812665890,-,2475,25,30,ขนาดกลาง,มีไฟฟ้า,16,293,9,21 กรกฎาคม 2562 เวลา 08:58:59 น.
95,1047540103,47010097,540103,บ้านสนามบิน,Sanambin,นายสุรชาติ กำลังฤทธิ์,อนุบาล-ประถมศึกษา,กุสุมาลย์ 2,หมู่ 8 สนามบิน,อุ่มจาน,กุสุมาลย์,สกลนคร,47230,Rakkhana956@gmail.com,,อุ่มจาน,042-701666,042-701666,16 สิงหาคม พ.ศ. 2497,30,23,ขนาดเล็ก,มีไฟฟ้า,5,37,8,01 ตุลาคม 2562 เวลา 11:13:45 น.
96,1047540104,47010098,540104,บ้านหนองบัวสร้างวิทยาคาร,Bannongbuasangwittayakan,นายผดุง ประพันธ์,อนุบาล-มัธยมศึกษาตอนต้น,,หมู่ 7 หหนองบัวสร้าง,อุ่มจาน,กุสุมาลย์,สกลนคร,47230,nbs2481@hotmail.com,data.bopp-obec.info/web/?School_ID=1047540104,อุ่มจาน,042-720000,,2481,23,30,ขนาดกลาง,มีไฟฟ้า,21,247,11,25 กันยายน 2562 เวลา 14:57:53 น.
97,1047540105,47010099,540105,บ้านงิ้วศิริราษฎร์บำรุง,Banngiosiriratbumrung school,นางปิ่นเกศ มณีเนตร,อนุบาล-ประถมศึกษา,กุสุมาลย์ 2,หมู่ 5 บ้านงิ้ว,อุ่มจาน,กุสุมาลย์,สกลนคร,47230,Ngiewschool@outlook.co.th,http://bit.ly/385wnF6,อุ่มจาน,042-756355,,พ.ศ.2481,30,30,ขนาดกลาง,มีไฟฟ้า,14,148,8,14 มกราคม 2563 เวลา 14:09:07 น.
98,1047540533,47010100,540533,บ้านจันทร์เพ็ญ,Banchanphen,-,อนุบาล-มัธยมศึกษาตอนต้น,,หมู่ 7 จันทร์เพ็ญ,จันทร์เพ็ญ,เต่างอย,สกลนคร,47260,banchanphenschool@gmail.com,gg.gg/banchanphenschool,อบต.จันทร์เพ็ญ,042-761132,,2521,30,3,ขนาดกลาง,มีไฟฟ้า,13,191,11,21 กรกฎาคม 2562 เวลา 15:10:53 น.
99,1047540534,47010101,540534,บ้านห้วยหวด,hauyhaud,-,อนุบาล-ประถมศึกษา,,หมู่ 4 ห้วยหวด,จันทร์เพ็ญ,เต่างอย,สกลนคร,47260,,,จันทร์เพ็ญ,042-761333,,22มิถุนายน 2500,30,7,ขนาดเล็ก,มีไฟฟ้า,5,26,7,24 กันยายน 2562 เวลา 14:16:34 น.
100,1047540535,47010102,540535,บ้านกวนบุ่น,kuanboon,นายฐานุพงศ์ เลิศวรรณวัชร์,อนุบาล-ประถมศึกษา,เต่างอย,หมู่ 5 บ้านกวนบุ่น,จันทร์เพ็ญ,เต่างอย,สกลนคร,47260,tanintaraajsn@hotmail.co.th,gg.gg/kuanboon,อบต.จันทร์เพ็ญ,807527989,,04/01/2486,45,15,ขนาดเล็ก,มีไฟฟ้า,6,66,9,25 กันยายน 2562 เวลา 20:45:53 น.
101,1047540537,47010103,540537,บ้านโคกกลาง,kokklang,นายชัชวาลย์ ไตรธิเลน,อนุบาล-มัธยมศึกษาตอนต้น,,หมู่ 6 บ้านโคกกลาง,จันทร์เพ็ญ,เต่างอย,สกลนคร,47260,,Http:school.obec.go.th,จันทร์เพ็ญ,844649662,,01/07/2523,55,22,ขนาดกลาง,มีไฟฟ้า,18,139,11,24 กันยายน 2562 เวลา 14:12:07 น.
102,1047540536,47010104,540536,นางอยโพนปลาโหล,nangoiponplalo,นายสมเกียรติ นามเสาร์,อนุบาล-ประถมศึกษา,เต่างอย,หมู่ 4 บ้านนางอย,เต่างอย,เต่างอย,สกลนคร,47260,,-,-,042-720130,,2 เมษายน 2525,25,3,ขนาดกลาง,มีไฟฟ้า,10,125,8,24 กันยายน 2562 เวลา 15:49:53 น.
103,1047540532,47010105,540532,อนุบาลเต่างอย,Anubantaongoi,นายวัยพจน์ ปัญญะ,อนุบาล-ประถมศึกษา,,หมู่ 3 โคกงอย,เต่างอย,เต่างอย,สกลนคร,47260,anubantaongoi@gmail.com,gg.gg/abt02,เต่างอย,042-761046,42761046,12 กุมภาพนธ์ 2484,30,2,ขนาดกลาง,มีไฟฟ้า,25,508,14,21 กรกฎาคม 2562 เวลา 13:45:18 น.
104,1047540538,47010106,540538,บ้านนาอ่างม่วงคำ,Naangmuangkham,นายยุทธพงษ์ พรหมเชษฐา,อนุบาล-มัธยมศึกษาตอนต้น,,หมู่ 4 บ้านม่วงคำ,นาตาล,เต่างอย,สกลนคร,47260,nmschool2561@gmail.com,,นาตาล,042-761333,,พ.ศ.2482,35,6,ขนาดกลาง,มีไฟฟ้า,22,327,11,21 กรกฎาคม 2562 เวลา 13:30:05 น.
105,1047540539,47010107,540539,บ้านนาตาลคำข่า,Bannatankumkha,นางวนิดา ภูชำนิ,อนุบาล-มัธยมศึกษาตอนต้น,เต่างอย,หมู่ 3 นาตาล,นาตาล,เต่างอย,สกลนคร,47260,natalkumka@gmail.com,www.Ntk.ac.th,นาตาล,42761334,-,16 /04/2466,30,3,ขนาดกลาง,มีไฟฟ้า,21,307,11,21 กุมภาพันธ์ 2563 เวลา 10:13:41 น.
106,1047540540,47010108,540540,บ้านหนองบึงทวาย,BEUNGTAWAI,นายเทพชินพัฒน์ หาดทวายกาญจน์,อนุบาล-ประถมศึกษา,,หมู่ 9 หนองสลาม,บึงทวาย,เต่างอย,สกลนคร,47260,,gg.gg/NBT-com,บึงทวาย,081-9665182,,5 มิถุนายน 2468,22,3,ขนาดกลาง,มีไฟฟ้า,13,172,8,25 กันยายน 2562 เวลา 15:09:42 น.
107,1047540541,47010109,540541,บ้านดงหลวง,Dougloung,ว่าที่ร้อยโทศุภวัฒน์ พิมพ์มีลาย,อนุบาล-มัธยมศึกษาตอนต้น,,หมู่ 7 บ้านดงหลวง,บึงทวาย,เต่างอย,สกลนคร,47260,,data.bopp-obec.info/web/?School_ID=1047540541,องค์การบริหารส่วนตำบลบึงทวาย,042-973292,,20/02/2499,24,8,ขนาดกลาง,มีไฟฟ้า,22,389,11,20 กรกฎาคม 2562 เวลา 13:36:51 น.
108,1047540555,47010110,540555,บ้านด่านม่วงคำ,Bandanmoungkam,นายธีรพล ภูโทถ้ำ,อนุบาล-ประถมศึกษา,แมดด่านพลังวิทย์,หมู่ 1 บ้านด่านม่วงคำ,ด่านม่วงคำ,โคกศรีสุพรรณ,สกลนคร,47280,-,http://school.obec.go.t,ด่านม่วงคำ,042-701712,-,08/06/2464,50,18,ขนาดเล็ก,มีไฟฟ้า,8,92,8,27 กันยายน 2562 เวลา 22:14:03 น.
109,1047540556,47010111,540556,บ้านลาดค้อ,Ban Lad Kho,นายปริญญามิตร ลีนาลาด,อนุบาล-ประถมศึกษา,แมดด่านพลังวิทย์,หมู่ 3 ลาดค้อ,ด่านม่วงคำ,โคกศรีสุพรรณ,สกลนคร,47280,ladkho039@gmail.com,,-,,,1ตุลาคม2464,40,15,ขนาดเล็ก,มีไฟฟ้า,8,46,7,24 กันยายน 2562 เวลา 21:21:38 น.
110,1047540557,47010112,540557,บ้านป่าปอสหพัฒนศึกษา,paposahapattanasuksa,นายสุมิตรชัย ด่านลาพล,อนุบาล-ประถมศึกษา,แมดด่านพลังวิทย์,หมู่ 8 ป่าปอ,ด่านม่วงคำ,โคกศรีสุพรรณ,สกลนคร,47280,paposchool.47010112@gmail.com,data.bopp-obec.info/web/?School_ID=1047540557,ด่านม่วงคำ,-,,24 เมษายน 2502,40,15,ขนาดเล็ก,มีไฟฟ้า,2,34,8,26 กันยายน 2562 เวลา 14:15:24 น.
111,1047540558,47010113,540558,บ้านหนองกอมป่าขาว,,นายชัยณรงค์ คำภูษา,อนุบาล-ประถมศึกษา,,หมู่ 6 หนองนางกอม,ด่านม่วงคำ,โคกศรีสุพรรณ,สกลนคร,47280,,,ด่านม่วงคำ,042-701701,,,32,8,ขนาดกลาง,มีไฟฟ้า,11,141,8,18 มิถุนายน 2562 เวลา 13:02:08 น.
112,1047540559,47010114,540559,บ้านม่วงไข่ประชาราษฎร์สงเคราะห์,Ban Muangkhaipracharatsongkhraw,นายวิสิฐศักดิ์ บุ่งทวย,อนุบาล-มัธยมศึกษาตอนต้น,,หมู่ 5 บ้านม่วงไข่,ด่านม่วงคำ,โคกศรีสุพรรณ,สกลนคร,47280,visitsak02@hotmail.com,www.Muangkha.info,ด่านม่วงคำ,042-170212,,9 เมษายน 2475,31,30,ขนาดกลาง,มีไฟฟ้า,20,181,11,01 มิถุนายน 2561 เวลา 13:53:10 น.
113,1047540544,47010115,540544,บ้านนามนประชาสามัคคี,namonprachasamakkee,นางนิรัติศัย นารถพลายพันธุ์,อนุบาล-ประถมศึกษา,ตองโขบเหล่าโพนค้อสามัคคี,หมู่ 4 บ้านนามน,ตองโขบ,โคกศรีสุพรรณ,สกลนคร,47280,namon59school@gmail.com,bit.ly/บ้านนามนประชาสามัคคี,เทศบาลตำบลตองโขบ,898940781,-,19/10/2522,33,3,ขนาดเล็ก,มีไฟฟ้า,9,62,8,08 มกราคม 2563 เวลา 13:17:26 น.
114,1047540545,47010116,540545,บ้านห้วยหีบวิทยาธาร,banhauyhibvittayathan,นางสาวเพ็ญแข นาถโกษา,อนุบาล-มัธยมศึกษาตอนต้น,,หมู่ 11 บ้านห้วยหีบเหนือ,ตองโขบ,โคกศรีสุพรรณ,สกลนคร,47280,vittayathan@windowslive.com,http://gg.gg/huaiyhipschool-sakol1,ตองโขบ,42766454,42766221,2475,38,5,ขนาดกลาง,มีไฟฟ้า,19,204,11,26 กันยายน 2562 เวลา 11:53:16 น.
115,1047540546,47010117,540546,บ้านนาสีนวล,Bannasinuan,นายวีระศักดิ์ แก้วกิ่ง,อนุบาล-ประถมศึกษา,,หมู่ 3 บ้านนาสีนวล,ตองโขบ,โคกศรีสุพรรณ,สกลนคร,47280,bannasinuan@gmail.com,,ตองโขบ,,,17052517,38,6,ขนาดเล็ก,มีไฟฟ้า,12,109,8,24 กันยายน 2562 เวลา 15:53:48 น.
116,1047540547,47010118,540547,บ้านห้วยแคน,houycan,นายนัฐพงษ์ โพนพันธ์,อนุบาล-ประถมศึกษา,,หมู่ 9 ห้วยแคน,ตองโขบ,โคกศรีสุพรรณ,สกลนคร,47280,huaican.2484@gmail.com,www.school.obec.go.th/h,ตองโขบ,042-701630,,พ.ศ.2484,25,8,ขนาดเล็ก,มีไฟฟ้า,6,86,8,24 กันยายน 2562 เวลา 13:54:05 น.
117,1047540548,47010119,540548,บ้านหนองแข้โนนมาลา,Nongkaenonmala,นางรินทร มลาวาสน์,อนุบาล-ประถมศึกษา,,หมู่ 5 หนองแข้,ตองโขบ,โคกศรีสุพรรณ,สกลนคร,47280,์NKschool888@gmail.com,https://data.bopp-obec.info/web/?School_ID=1047540548,ตองโขบ,885508685,-,21 มิถุนายน พศ.2482,28,5,ขนาดเล็ก,มีไฟฟ้า,11,112,8,20 ตุลาคม 2562 เวลา 20:40:29 น.
118,1047540542,47010120,540542,บ้านตองโขบ,Tongkhop School,นายประยงค์ อินธิกาย,อนุบาล-ประถมศึกษา,,หมู่ 8 ตองโขบ,ตองโขบ,โคกศรีสุพรรณ,สกลนคร,47280,tongkhop_tk@hotmial.co.th,,ตองโขบ,-,,30/11/ 2484,28,2.5,ขนาดกลาง,มีไฟฟ้า,13,142,8,29 พฤษภาคม 2562 เวลา 10:20:19 น.
119,1047540543,47010121,540543,อนุบาลโคกศรีสุพรรณ,ANUBANKHOKSISUPAN,นางสาวสำรวย พิมพ์มีลาย,อนุบาล-ประถมศึกษา,,หมู่ 10 ใหม่ศรีสุพรรณ,ตองโขบ,โคกศรีสุพรรณ,สกลนคร,47280,anuban_koksri@hotmail.co.th,,ตองโขบ,042-766258,,7 กันยายน 2465,30,1,ขนาดกลาง,มีไฟฟ้า,28,525,18,25 มิถุนายน 2562 เวลา 18:06:10 น.
120,1047540550,47010122,540550,บ้านแมดนาท่ม,Madnathom,นายสงวนศักดิ์ ราชแผ้ว,อนุบาล-มัธยมศึกษาตอนต้น,,หมู่ 1 แมดนาท่ม,แมดนาท่ม,โคกศรีสุพรรณ,สกลนคร,47280,Madnathom@hotmail.com,http://gg.gg/mntschool,แมดนาท่ม,42704978,42704978,15/08/2481,38,10,ขนาดกลาง,มีไฟฟ้า,21,337,11,21 กรกฎาคม 2562 เวลา 13:33:32 น.
121,1047540551,47010123,540551,บ้านโพนทองประชาอุทิศ,Ban Phonthong Pracha-uthit School,นายอุเทน ทองสวัสดิ์,อนุบาล-ประถมศึกษา,,หมู่ 4 โพนทอง,แมดนาท่ม,โคกศรีสุพรรณ,สกลนคร,47280,Phonthong.school@gmail.com,www.phonthong.ac.th,แมดนาท่ม,42766277,42766277,19 พฤศจิกายน 2464,33,4,ขนาดกลาง,มีไฟฟ้า,12,172,8,24 กันยายน 2562 เวลา 13:44:53 น.
122,1047540552,47010124,540552,บ้านไร่นาดี,BAN RAINADEE,นายเกษมสันติ์ ศรีคำแซง,อนุบาล-มัธยมศึกษาตอนต้น,แมดด่านพลังวิทย์,หมู่ 6 โคกนาดี,แมดนาท่ม,โคกศรีสุพรรณ,สกลนคร,47280,rainadee@hotmail.com,http://www.sakonarea1.g,แมดนาท่ม,42170052,-,19 เมษายน 2511,45,12,ขนาดกลาง,มีไฟฟ้า,18,124,11,24 กุมภาพันธ์ 2563 เวลา 14:36:40 น.
123,1047540553,47010125,540553,บ้านห้วยยาง,Ban Huayyang School,นางสุนันท์ หลวงศรี,อนุบาล-มัธยมศึกษาตอนต้น,,หมู่ 6 ห้วยยาง,เหล่าโพนค้อ,โคกศรีสุพรรณ,สกลนคร,47280,sunan25071964@gmail.com,www.huayyangschool.com,เหล่าโพนค้อ,973024975,42720072,2475,40,18,ขนาดกลาง,มีไฟฟ้า,17,236,11,21 กรกฎาคม 2562 เวลา 13:37:35 น.
124,1047540554,47010126,540554,บ้านดงหนองเหียน,Bandongnonghian,นายนิติรักษ์ ไชยเพ็ชร,อนุบาล-ประถมศึกษา,,หมู่ 4 บ้านหนองเหียน,เหล่าโพนค้อ,โคกศรีสุพรรณ,สกลนคร,47280,,,อบต.เหล่าโพนค้อ,042-756341,,พ.ศ.2465,40,7,ขนาดเล็ก,มีไฟฟ้า,9,70,8,24 กันยายน 2562 เวลา 13:46:35 น.
125,1047540549,47010127,540549,บ้านเหล่าโพนค้อเหล่าราษฎร์วิทยา,Loaphonkoh loarajwittaya,นายเวศ กุตระแสง,อนุบาล-มัธยมศึกษาตอนต้น,,หมู่ 5 บ้านเหล่า,เหล่าโพนค้อ,โคกศรีสุพรรณ,สกลนคร,47280,laophonkoh @yahoo.com,http://school.obec.go.t,เหล่าโพนค้อ,-,42701557,8 มกราคม 2480,40,12,ขนาดกลาง,มีไฟฟ้า,22,152,11,21 ตุลาคม 2562 เวลา 08:18:09 น.
126,1047540587,47010128,540587,บ้านโนนกุง,BANNONKUNG,นายกิจพงศ์ สุรันนา,อนุบาล-มัธยมศึกษาตอนต้น,,หมู่ 3 บ้านโนนกุง,เชียงสือ,โพนนาแก้ว,สกลนคร,47230,bannonkung@gmail.com,www.http://school.obec.,เชียงสือ,042-701712,,20/08/2497,50,15,ขนาดกลาง,มีไฟฟ้า,21,231,11,21 กรกฎาคม 2562 เวลา 08:51:35 น.
127,1047540590,47010129,540590,บ้านเชียงสือราษฎร์อำนวย,ฺBancheangsuerajumnuai school,นายเศกสรร เพียสา,อนุบาล-มัธยมศึกษาตอนต้น,โพนสามัคคี,หมู่ 5 อุดมวัฒนา,เชียงสือ,โพนนาแก้ว,สกลนคร,47230,bancheangsue@gmail.com,gg.gg/cheangsueschool,เทศบาลตำบลเชียงสือ,042-707033,,พ.ศ.2477,42,18,ขนาดกลาง,มีไฟฟ้า,19,216,11,26 พฤศจิกายน 2562 เวลา 10:17:42 น.
128,1047540596,47010130,540596,นาแก้วพิทยาคม,Nakaewpittayakhom,นายสำรอง เภาโพธ์ิ,อนุบาล-ประถมศึกษา,,หมู่ 1 บ้านนาแก้ว,นาแก้ว,โพนนาแก้ว,สกลนคร,47230,nakaew@outlook.co.th,gg.gg/nakaewpit,นาแก้ว,042-704-675,042-704-675,01/05/2460,20,14,ขนาดกลาง,มีไฟฟ้า,20,256,11,13 มิถุนายน 2562 เวลา 10:44:04 น.
129,1047540600,47010131,540600,บ้านกลางนาเดื่อ,klangnadua,นางกษมน มังคละคีรี,อนุบาล-มัธยมศึกษาตอนต้น,,หมู่ 3 บ้านกลาง,นาแก้ว,โพนนาแก้ว,สกลนคร,47230,klangnadua@klang.ac.th,www.klang.ac.th/,นาแก้ว,081-739-0095,-,9 พฤษภาคม 2473,38,4,ขนาดกลาง,มีไฟฟ้า,20,319,11,21 กรกฎาคม 2562 เวลา 23:40:21 น.
130,1047540603,47010132,540603,บ้านหนองกระบอกราษฎร์อุทิศวิทยา,Nongkrabok,นางสาวอรัญญา ชนะเพีย,อนุบาล-มัธยมศึกษาตอนต้น,,หมู่ 12 บ้านหนองกระบอก,นาแก้ว,โพนนาแก้ว,สกลนคร,47230,nbk2498@hotmail.com,data.bopp-obec.info/web/?School_ID=1047540603,นาแก้ว,042-703414,-,2498,18,13,ขนาดกลาง,มีไฟฟ้า,19,244,11,20 กุมภาพันธ์ 2563 เวลา 10:15:00 น.
131,1047540604,47010133,540604,หนองผือเทพนิมิต,nongphuethepnimit,นายสุปัน วงษ์อุ่น,อนุบาล-มัธยมศึกษาตอนต้น,นาแก้วบ้านแป้น,หมู่ 7 บ้านเทพนิมิต,นาแก้ว,โพนนาแก้ว,สกลนคร,47230,nongphue2554@hotmail.com,gg.gg/nt-school2019,นาแก้ว,812606603,,2477,30,10,ขนาดกลาง,มีไฟฟ้า,24,309,12,25 กันยายน 2562 เวลา 15:23:51 น.
132,1047540605,47010134,540605,บ้านโคกแก้ว,,นายศรีทัศน์ วิรัสวา,อนุบาล-ประถมศึกษา,,หมู่ 6 บ้านโคกแก้ว,นาแก้ว,โพนนาแก้ว,สกลนคร,47230,,,นาแก้ว,,,,30,20,ขนาดเล็ก,มีไฟฟ้า,7,38,8,23 พฤษภาคม 2561 เวลา 14:10:40 น.
133,1047540606,47010135,540606,บ้านนาเดื่อ,Bannadua School,นางนิภาพร อุปพงษ์,อนุบาล-ประถมศึกษา,,หมู่ 11 บ้านนาเดื่อน้อย,นาแก้ว,โพนนาแก้ว,สกลนคร,47230,,,เทศบาลตำบลนาแก้ว,958914956,,25/10/2548,30,4,ขนาดกลาง,มีไฟฟ้า,16,149,8,24 มิถุนายน 2562 เวลา 09:57:12 น.
134,1047540591,47010136,540591,บ้านนาตงสหราษฎร์อุทิศ,,ว่าที่พันตรีกิตติศักดิ์ นามวงศ์,อนุบาล-มัธยมศึกษาตอนต้น,,หมู่ 1 บ้านนาตงใหญ่,นาตงวัฒนา,โพนนาแก้ว,สกลนคร,47230,natongschool2562@gmail.com,?http//school.obec.go.t,นาตงวัฒนา,042-756339,,,35,6,ขนาดกลาง,มีไฟฟ้า,18,230,11,25 มิถุนายน 2562 เวลา 09:56:16 น.
135,1047540592,47010137,540592,บ้านป่าผาง,Paphang,นายนิรุตติ์ พลบุตร,อนุบาล-มัธยมศึกษาตอนต้น,,หมู่ 7 บ้านป่าผาง,นาตงวัฒนา,โพนนาแก้ว,สกลนคร,47230,Paphangschool@hotmail.com,http://school.obec.go.t,นาตงวัฒนา,042-701706,-,13 ตุลาคม 2476,40,17,ขนาดกลาง,มีไฟฟ้า,16,266,11,24 กันยายน 2562 เวลา 13:51:58 น.
136,1047540595,47010138,540595,บ้านปุ่งสหราษฎร์บำรุง,Banpungsaharasbamrung,นายพิทักษ์ ไชยโคตร,อนุบาล-ประถมศึกษา,,หมู่ 4 บ้านปุ่งน้อย,นาตงวัฒนา,โพนนาแก้ว,สกลนคร,47230,Banpungsc0138@gmail.com,http://www.babpungschool.ac.th,นาตงวัฒนา,042-720139,-,1 พฤษภาคม 2531,34,5,ขนาดกลาง,มีไฟฟ้า,14,210,8,01 ตุลาคม 2562 เวลา 11:44:23 น.
137,1047540602,47010139,540602,โพนงามโคกวิทยาคาร,Pon Ngam Kok Vittayakan,นางสาวรัชนีวรรณ ศิริพันธ์,อนุบาล-ประถมศึกษา,,หมู่ 2 บ้านโพนงามโคก,บ้านแป้น,โพนนาแก้ว,สกลนคร,47230,ponngamkok@gmail.com,gg.gg/ponngamkok,บ้านแป้น,042-703367,42707090,10/02/2520,30,25,ขนาดเล็ก,มีไฟฟ้า,7,78,8,24 กันยายน 2562 เวลา 16:23:51 น.
