138,1047540597,47010140,540597,บ้านแป้นสามัคคีราษฎร์บำรุง,banphansamakeerajbumrung,นายธุระกิจ พิมพ์แพง,อนุบาล-มัธยมศึกษาตอนต้น,,หมู่ 5 บ้านแป้น,บ้านแป้น,โพนนาแก้ว,สกลนคร,47230,banpans@gmail.com,http://school.obec.go.th,องค์การบริหารส่วนตำบลบ้านแป้น,,,17 สิงหาคม 2475,35,8,ขนาดกลาง,มีไฟฟ้า,16,125,11,20 กรกฎาคม 2562 เวลา 10:56:02 น.
139,1047540598,47010141,540598,ท่าศาลาราษฎร์วิทยา,tasalaratwittaya,นายว่าที่ร้อยตรีอภิสิทธิ์ ดาโอภา,อนุบาล-มัธยมศึกษาตอนต้น,,หมู่ 1 บ้านท่าศาลา,บ้านแป้น,โพนนาแก้ว,สกลนคร,47230,tasalareb@yahoo.com,http://gg.gg/tasala,บ้านแป้น,042-701710,-,"28 ,มิถุนายน 2454",43,11,ขนาดกลาง,มีไฟฟ้า,18,199,11,24 กันยายน 2562 เวลา 14:11:30 น.
140,1047540599,47010142,540599,บ้านน้ำพุคุรุราษฎร์สงเคราะห์,Ban Namphu Khuru Rat Songkhro,นายอุทัน วงศ์ศรียา,อนุบาล-ประถมศึกษา,,หมู่ 4 บ้านน้ำพุ,บ้านแป้น,โพนนาแก้ว,สกลนคร,47230,numpukururad.2019@gmail.com,http://school.obec.go.th,บ้านแป้น,042-099247,,6 สิงหาคม 2486,35,5,ขนาดเล็ก,มีไฟฟ้า,6,95,8,24 กันยายน 2562 เวลา 16:13:35 น.
141,1047540601,47010143,540601,โพนบกผดุงศาสตร์,Phonbokpadungsad,นายศุภชัย ยศตะโคตร,อนุบาล-ประถมศึกษา,,หมู่ 6 โพนบก,บ้านแป้น,โพนนาแก้ว,สกลนคร,47230,-,gg.gg/Phonbokschool,บ้านแป้น,872356400,-,2482,30,20,ขนาดเล็ก,มีไฟฟ้า,7,75,8,02 ตุลาคม 2562 เวลา 11:15:08 น.
142,1047540588,47010144,540588,อนุบาลโพนนาแก้ว,Anubanphonnakaew,นางสาวญาสุมินทร์ นนทมาตร,อนุบาล-ประถมศึกษา,,หมู่ 1 บ้านอ้อมแก้ว,บ้านโพน,โพนนาแก้ว,สกลนคร,47230,,www.facebook.com/anubanphonnagaewSchool,บ้านโพน,042-170423,,2483,40,10,ขนาดกลาง,มีไฟฟ้า,15,227,8,24 กันยายน 2562 เวลา 14:15:43 น.
143,1047540589,47010145,540589,บ้านโพนวัฒนาวิทยา,ฺBANPHONWATTHANAWITTHAYA,นายอุทัย อินธิแสง,อนุบาล-มัธยมศึกษาตอนต้น,,หมู่ 4 บ้านโพนใหญ่,บ้านโพน,โพนนาแก้ว,สกลนคร,47230,banphon@gmail.com,http://school.obec.go.t,บ้านโพน,042-756338,,19 พฤษภาคม 2482,45,9,ขนาดกลาง,มีไฟฟ้า,21,310,11,24 กันยายน 2562 เวลา 15:50:12 น.
144,1047540593,47010146,540593,บ้านวังปลาเซือม,banwungplaseum,นายปัญญา พันเพียง,อนุบาล-ประถมศึกษา,,หมู่ 5 บ้านวังปลาเซือม,บ้านโพน,โพนนาแก้ว,สกลนคร,47230,wungplaseum.@chaiyo.com,http://gg.gg/f9d7u,บ้านโพน,611536363,,21 พ.ค.2511,58,19,ขนาดเล็ก,มีไฟฟ้า,7,69,8,24 กันยายน 2562 เวลา 15:20:14 น.
145,1047540594,47010147,540594,บ้านนาจาน,Ban Najan,นายลือชัย รัชอินทร์,อนุบาล-มัธยมศึกษาตอนต้น,,หมู่ 6 บ้านนาจาน,บ้านโพน,โพนนาแก้ว,สกลนคร,47230,bannajanschool47010147@gmail.com,https://data.bopp-obec.info/web/index_view_history.php?School_ID=1047540594&page=kk_sch,บ้านโพน,-,,พ.ศ.2483,54.4,18.6,ขนาดเล็ก,มีไฟฟ้า,20,195,11,21 มกราคม 2563 เวลา 09:34:16 น.
146,1047540615,47010148,540615,บ้านกกปลาซิวนาโด่,Bankokplazilnado,นายสราวุฒิ ศิริวรรณ,อนุบาล-มัธยมศึกษาตอนต้น,,หมู่ 4 กกโด่,กกปลาซิว,ภูพาน,สกลนคร,47310,kokplazilnado@gmail.com,www.kokplasiwnado.ac.th,กกปลาซิว,042-704941,,29/11/2442,48,15,ขนาดกลาง,มีไฟฟ้า,20,291,11,27 กรกฎาคม 2562 เวลา 10:20:52 น.
147,1047540616,47010149,540616,บ้านหนองครองราษฎร์ประสงค์,bannongkrongradprasong,นายทินกร ประเสริฐหล้า,อนุบาล-ประถมศึกษา,,หมู่ 3 หนองครอง,กกปลาซิว,ภูพาน,สกลนคร,47180,,,กกปลาซิว,834077116,,02/09/2502,50,12,ขนาดกลาง,มีไฟฟ้า,10,132,8,25 กันยายน 2562 เวลา 10:23:14 น.
148,1047540614,47010151,540614,บ้านโคกภู,bankokphu,นายวรพงษ์ บุญรักษา,อนุบาล-ประถมศึกษา,ภูผายล,หมู่ 17 โคกภูสามัคคี,โคกภู,ภูพาน,สกลนคร,47310,bankokpu@thaimail.com,data.bopp-obec.info/web/?School_ID=1047540614,โคกภู,042-703372,-,2482,50,16,ขนาดกลาง,มีไฟฟ้า,13,177,8,22 ตุลาคม 2562 เวลา 12:09:24 น.
149,1047540611,47010153,540611,บ้านบ่อเดือนห้า,banbodunha,นายสมจิตร ชูอารมณ์,อนุบาล-ประถมศึกษา,ภูผายล,หมู่ 10 บ้านบ่อเดือนห้า,โคกภู,ภูพาน,สกลนคร,47180,Boduenha540611@gmail.com,,โคกภู,042-708148,,09/03/2536,44,1,ขนาดเล็ก,มีไฟฟ้า,16,230,8,25 กันยายน 2562 เวลา 09:32:21 น.
150,1047540612,47010154,540612,อนุบาลภูพาน,Anuban Phuphan,นายศักดิ์ชาย แก้วดี,อนุบาล-มัธยมศึกษาตอนต้น,,หมู่ 11 หนองส่าน,โคกภู,ภูพาน,สกลนคร,47310,anubanphuphan@gmail.com,gg.gg/anppschool,โคกภู,830267380,,2465,40,7,ขนาดกลาง,มีไฟฟ้า,22,295,11,24 กันยายน 2562 เวลา 14:28:53 น.
151,1047540613,47010155,540613,บ้านยางโล้นเจริญราษฎรไพบูลย์,yanglonjarenradpiaboon,นายศุภชัย บุญสิทธิ์,อนุบาล-มัธยมศึกษาตอนต้น,,หมู่ 3 ยางโล้น,โคกภู,ภูพาน,สกลนคร,47310,yanglon2561@gmail.com,Facebook,โคกภู,-,-,1 พฤษภาคม 2469,50,12,ขนาดกลาง,มีไฟฟ้า,20,302,12,24 กันยายน 2562 เวลา 15:47:49 น.
152,1047540607,47010156,540607,เขื่อนน้ำพุง,khuennumpung,นางสกลรัตน์ มุกดา,อนุบาล-ประถมศึกษา,,หมู่ 6 คำเพิ่ม,โคกภู,ภูพาน,สกลนคร,47180,kuennumpung@gmail.com,http:// school. obec.go,โคกภู,042-708121,,15/06/2508,42,1,ขนาดกลาง,มีไฟฟ้า,25,348,15,30 พฤษภาคม 2561 เวลา 12:02:44 น.
153,1047540618,47010157,540618,บ้านสร้างแก้วราษฎร์พัฒนา,ฺBansrangkaewratphattana school,นายชาญณรงค์ โพธิ,อนุบาล-ประถมศึกษา,ภูพานทอง,หมู่ 5 สร้างแก้ว,สร้างค้อ,ภูพาน,สกลนคร,47180,srangkaewschool2019@hotmail.com,gg.gg/bansrangkaew,เทศบาลตำบลสร้างค้อ,088-563-6030,,2509,65,25,ขนาดเล็ก,มีไฟฟ้า,9,71,8,27 กันยายน 2562 เวลา 14:26:09 น.
154,1047540619,47010158,540619,ชุมชนบ้านสร้างค้อ,sangkho,นายบรรพต พิมพ์รส,อนุบาล-มัธยมศึกษาตอนต้น,,หมู่ 12 สร้างค้อ,สร้างค้อ,ภูพาน,สกลนคร,47310,tonpai2549@hotmail.com,https://data.bopp-obec.info/web/?School_ID=1047540619,สร้างค้อ,042-163581,42163581,14/06/2486,56,20,ขนาดกลาง,มีไฟฟ้า,22,365,17,24 กันยายน 2562 เวลา 15:11:22 น.
155,1047540621,47010159,540621,บ้านชมภูพาน,chompupan,นายวิสูตร สวนไผ่,อนุบาล-ประถมศึกษา,,หมู่ 16 ชมภูพานเหนือ,สร้างค้อ,ภูพาน,สกลนคร,47180,chompupan@gmail.com,,สร้างค้อ,042-701649,,22มีนาคม 2528,54,18,ขนาดกลาง,มีไฟฟ้า,11,173,8,20 กรกฎาคม 2562 เวลา 10:56:32 น.
156,1047540622,47010160,540622,บ้านสะพานสาม,SAPANSAM,นายประเด็จ ชมพุด,อนุบาล-ประถมศึกษา,ภูพานทอง,หมู่ 13 สะพานสาม,สร้างค้อ,ภูพาน,สกลนคร,47180,sapan 3 @ hotmail.com,www.sakonarea 1.go.th/b,สรัางค้อ,042-769056,-,1 พฤษภาคม 2525,50,20,ขนาดเล็ก,มีไฟฟ้า,8,85,8,26 กันยายน 2562 เวลา 11:51:56 น.
157,1047540623,47010161,540623,บ้านใหม่พัฒนา,Banmaipattana,-,อนุบาล-มัธยมศึกษาตอนต้น,,หมู่ 7 บ้านใหม่พัฒนา,สร้างค้อ,ภูพาน,สกลนคร,47310,,,สร้างค้อ,042-099708,,พฤษภาคม2514,55,14,ขนาดเล็ก,มีไฟฟ้า,11,99,11,24 กันยายน 2562 เวลา 13:44:45 น.
158,1047540609,47010163,540609,บ้านต้อนราษฎร์ดำรงวิทย์,ฺBanthonratdhamrongwit,นายภานุพงษ์ คำภูษา,อนุบาล-มัธยมศึกษาตอนต้น,,หมู่ 17 บ้านไทรทอง,สร้างค้อ,ภูพาน,สกลนคร,47310,bantonschool2562@gmail.com,https://data.bopp-obec.info/web/?School_ID=1047540609,สร้างค้อ,-,-,2500,55,15,ขนาดกลาง,มีไฟฟ้า,17,160,11,05 กรกฎาคม 2562 เวลา 18:14:23 น.
159,1047540610,47010164,540610,น้ำพุงจัดระเบียบวิทยา,nampungjudrabiabwittaya,นางพิชญ์สินี ศรีลารักษ์,อนุบาล-ประถมศึกษา,,หมู่ 6 บ้านจัดระเบียบ,หลุบเลา,ภูพาน,สกลนคร,47310,nampungschool62@gmail.com,gg.gg/nampungs,อบต.หลุบเลา,-,-,1 สิงหาคม 2533,40,7,ขนาดกลาง,มีไฟฟ้า,12,195,8,04 ตุลาคม 2562 เวลา 10:31:18 น.
160,1047540625,47010165,540625,บ้านฮ่องสิมประชาสรร,Banhongsimprachasanschool,นายขุนชิต ละราคี,อนุบาล-มัธยมศึกษาตอนต้น,ภูพานทอง,หมู่ 3 ฮ่องสิม,หลุบเลา,ภูพาน,สกลนคร,47310,hongsimschool@hotmail.com,sites.google.com/hongsim.ac.th/hongsim,หลุบเลา,042-766063-4,,7 มิถุนายน 2525,50,12,ขนาดกลาง,มีไฟฟ้า,19,232,11,30 กันยายน 2562 เวลา 13:35:50 น.
161,1047540620,47010166,540620,บ้านหลุบเลา,Banlublao School,นายทองอยู่ เพียรภายลุน,อนุบาล-มัธยมศึกษาตอนต้น,ภูพานทอง,หมู่ 1 หลุบเลา,หลุบเลา,ภูพาน,สกลนคร,47180,banluplao.school61@gmail.com,,หลุบเลา,-,-,,62,24,ขนาดกลาง,มีไฟฟ้า,16,276,11,03 ตุลาคม 2562 เวลา 09:31:05 น.
162,1047540074,47020001,540074,กุดบากราษฎร์บำรุง,Kutbkaratbumrung School,นายถนอม แพงคำฮัก,อนุบาล-ประถมศึกษา,,หมู่ 1 บ้านกุดบาก,กุดบาก,กุดบาก,สกลนคร,47180,kutbak2@hotmail.com,182.93.195.181,เทศบาลตำบลกุดบาก,42784031,-,พ.ศ. 2472,46.2,1,ขนาดกลาง,มีไฟฟ้า,26,557,21,24 กันยายน 2562 เวลา 14:25:39 น.
163,1047540087,47020002,540087,บ้านกุดแฮดวัฒนราษฎร์ผดุง,bankudhadwattanaradpadung,นายครรชิต วงค์แเต้ม,อนุบาล-มัธยมศึกษาตอนต้น,,หมู่ 4 บ้านกุดแฮด,กุดบาก,กุดบาก,สกลนคร,47180,NULL,data.bopp-obec.info/web/?School_ID=1047540087,เทศบาลตำบลกุดแฮด,NULL,NULL,1 กรกฎาคม 2464,50,4,ขนาดกลาง,มีไฟฟ้า,19,286,11,21 กรกฎาคม 2562 เวลา 10:20:12 น.
164,1047540088,47020003,540088,บ้านบัวคุรุราษฎร์สามัคคี,BANBUAKURURATSAMAKKEE,นายวัฒนา เติมทานาม,อนุบาล-มัธยมศึกษาตอนต้น,กุดบาก,หมู่ 8 บ้านบัว,กุดบาก,กุดบาก,สกลนคร,47180,buakuru@gmail.com,gg.gg/bkrskn1,เทศบาลกุดแฮด,NULL,NULL,29 05 2481,50,7,ขนาดกลาง,มีไฟฟ้า,17,301,18,24 กันยายน 2562 เวลา 16:14:55 น.
165,1047540082,47020004,540082,ชุมชนบ้านกุดไห,chumchonbankuthai,นายเสงี่ยม ถึงนามลี,อนุบาล-มัธยมศึกษาตอนต้น,กุดบาก,หมู่ 6 บ้านกุดไห,กุดไห,กุดบาก,สกลนคร,47180,chumchonbankudhai@gmail.com,gg.gg/chumchonbankudhaischool,เทศบาลตำบลกุดไห,42784011,NULL,พ.ศ.2466,55,5,ขนาดกลาง,มีไฟฟ้า,20,340,19,27 กันยายน 2562 เวลา 03:51:40 น.
166,1047540083,47020005,540083,บ้านกลาง (ผดุงราษฎร์วิทยา),Banklangpadungratwittaya,นายอุดมศักดิ์ ศรีด้วง,อนุบาล-มัธยมศึกษาตอนต้น,กุดบาก,หมู่ 10 บ้านกลาง,กุดไห,กุดบาก,สกลนคร,47180,-,gg.gg/banklangpadungratwittaya,เทศบาลตำบลกุดไห,-,-,2465,55,10,ขนาดกลาง,มีไฟฟ้า,22,294,11,04 ตุลาคม 2562 เวลา 11:06:53 น.
167,1047540084,47020006,540084,บ้านค้อน้อย,Bankhonoi,นายอนุรักษ์ บุญจันทร์,อนุบาล-ประถมศึกษา,,หมู่ 5 บ้านค้อน้อย,กุดไห,กุดบาก,สกลนคร,47180,NULL,bankhonoi.wordpress.com,เทศบาลตำบลกุดไห,NULL,NULL,8 พฤษภาคม 2482,ุ65,10,ขนาดกลาง,มีไฟฟ้า,9,101,8,11 กรกฎาคม 2560 เวลา 04:29:29 น.
168,1047540085,47020007,540085,บ้านค้อใหญ่,Bankhoyai school,นางสุคนธ์ จีนคำ,อนุบาล-มัธยมศึกษาตอนต้น,,หมู่ 7 บ้านค้อใหญ่,กุดไห,กุดบาก,สกลนคร,47180,bankhoyai2561@gmail.com,data.bopp-obec.info/web/?School_ID=1047540085,,981021106,NULL,27 พฤษภาคม 2482,50,9,ขนาดกลาง,มีไฟฟ้า,17,183,11,21 กรกฎาคม 2562 เวลา 12:18:17 น.
169,1047540081,47020009,540081,บ้านนาม่องดงนิมิตวิทยา,Bannamongdongnimitvittaya,นายสุวิทย์ ขันติทอง,อนุบาล-ประถมศึกษา,,หมู่ 7 บ้านดงนิมิต,นาม่อง,กุดบาก,สกลนคร,47180,NULL,http://,,42703379,NULL,,45,7,ขนาดกลาง,มีไฟฟ้า,20,131,11,10 มิถุนายน 2557 เวลา 21:50:18 น.
170,1047540079,47020010,540079,บ้านกุดน้ำใส,Bankudnamsai,นายปราโมทย์ วงศ์รำพันธ์,อนุบาล-ประถมศึกษา,กุดบาก,หมู่ 8 บ้านกุดน้ำใส,นาม่อง,กุดบาก,สกลนคร,47180,numsai2560@gmail.com,https://data.bopp-obec.info/web/?School_ID=1047540079,นาม่อง,NULL,NULL,9มิถุนายน 2496,46.5,9.5,ขนาดเล็ก,มีไฟฟ้า,9,62,8,14 มกราคม 2563 เวลา 11:06:07 น.
171,1047540080,47020011,540080,บ้านหนองค้าดารกานนท์วิทยา,Bannhonkadarakanonwittaya,นายนิธิพงศ์ เถายะบุตร,อนุบาล-มัธยมศึกษาตอนต้น,กุดบาก,หมู่ 12 บ้านหนองค้าพัฒนา,นาม่อง,กุดบาก,สกลนคร,47180,NULL,gg.gg/nongka,,NULL,NULL,,37,13,ขนาดกลาง,มีไฟฟ้า,18,160,11,26 กันยายน 2562 เวลา 13:47:53 น.
172,1047540075,47020012,540075,บ้านนาขาม,bannakam,นางสาวเพลินพิศ ดาศักดิ์,อนุบาล-ประถมศึกษา,กุดบาก,หมู่ 9 นาขาม,นาม่อง,กุดบาก,สกลนคร,47180,bannakam.kutbak@gmail.com,bit.do/fb7aD,เทศบาลตำบลนาม่อง,089-943-4598,NULL,พ.ศ. 2475,43,3,ขนาดกลาง,มีไฟฟ้า,13,182,8,30 มกราคม 2563 เวลา 10:21:53 น.
173,1047540076,47020013,540076,บ้านโพนงามคุรุราษฎร์วิทยา,Phonngam,นางศิริพร คำสงค์,อนุบาล-ประถมศึกษา,,หมู่ 5 บ้านโพนงาม,นาม่อง,กุดบาก,สกลนคร,47180,-,-,อบต.นาม่อง,095-437-9882,-,29/09/2484,41,9,ขนาดกลาง,มีไฟฟ้า,13,126,8,24 กันยายน 2562 เวลา 15:43:16 น.
174,1047540077,47020014,540077,บ้านหนองสะไนราษฎร์รังสฤษฎ์,nongsanai,นายชินวัฒน์ โถบำรุง,อนุบาล-มัธยมศึกษาตอนต้น,,หมู่ 11 บ้านหนองสะไน,นาม่อง,กุดบาก,สกลนคร,47180,scnnr.2562@gmail.com,gg.gg/nongsanai,,NULL,NULL,2480,40,15,ขนาดกลาง,มีไฟฟ้า,16,232,11,24 กันยายน 2562 เวลา 15:02:11 น.
175,1047540078,47020015,540078,บ้านเชิงดอย,Ban Cheungdoi,นายภาสกร มั่งสวัสดิ์,อนุบาล-ประถมศึกษา,,หมู่ 6 บ้านเชิงดอย,นาม่อง,กุดบาก,สกลนคร,47180,Cheungdoi-kutbak@hotmail.com,https://data.bopp-obec.info/web/?School_ID=1047540078,นาม่อง,801990135,-,พ.ศ. 2510,50,18,ขนาดเล็ก,มีไฟฟ้า,7,30,8,24 กันยายน 2562 เวลา 15:30:05 น.
