46,1047540073,47010048,540073,บ้านโนนสวรรค์สมบูรณ์วิทย์,BANNONSAWANSOMBOONWIT,นางสาวจารุวรรณ บุ่งวิเศษ,อนุบาล-ประถมศึกษา,,หมู่ 8 บ้านโนนสวรรค์,พังขว้าง,เมืองสกลนคร,สกลนคร,47000,wushasit@hotmail.com,https://data.bopp-obec.info/web/?School_ID=1047540073,พังขว้าง,,,2526,12,12,ขนาดเล็ก,มีไฟฟ้า,8,50,8,25 กันยายน 2562 เวลา 15:05:52 น.
47,1047540017,47010049,540017,บ้านพังขว้างเหนือ 909 กรป.กลางอุปถัมภ์,BAN PHANGKHWANGNUA 909 KRP. KLANGOOPATHAM,ดร.ศิริพร กุลสานต์,อนุบาล-ประถมศึกษา,,หมู่ 2 บ้านพังขว้างเหนือ,พังขว้าง,เมืองสกลนคร,สกลนคร,47000,p.n.909@hotmail.com,www.facebook.com/pangkwang909,องค์การบริหารส่วนตำบลพังขว้าง,042-743609,42743609,20 มิถุนายน 2516,6,11,ขนาดเล็ก,มีไฟฟ้า,7,106,8,25 กันยายน 2562 เวลา 09:44:24 น.
48,1047540018,47010050,540018,ห้วยทรายวิทยา,Huaysai Witthaya,นางวาสนา เทศนา,อนุบาล-ประถมศึกษา,,หมู่ 7 โนนชลประทาน,พังขว้าง,เมืองสกลนคร,สกลนคร,47000,,www.huaysai.ac.th,องค์การบริหารส่วนตำบลพังขว้าง,042-707846,-,15/03/2517,7,13,ขนาดกลาง,มีไฟฟ้า,13,125,8,25 กันยายน 2562 เวลา 15:01:28 น.
49,1047540045,47010051,540045,บ้านหนองนาเลิศ,Nongnalert,นายสำราญ คำชมภู,อนุบาล-มัธยมศึกษาตอนต้น,,หมู่ 3 บ้านอีเลิศ,ม่วงลาย,เมืองสกลนคร,สกลนคร,47000,,,ม่วงลาย,042-756367,,2482,30,22,ขนาดกลาง,มีไฟฟ้า,16,157,11,24 กันยายน 2562 เวลา 14:11:26 น.
50,1047540042,47010052,540042,บ้านม่วงลายราษฎร์ผดุงศิลป์,Muanglairatphadungsin,ดร.เชิดศักดิ์ สิงห์สุพรรณ,อนุบาล-มัธยมศึกษาตอนต้น,,หมู่ 7 บ้านม่วงลาย,ม่วงลาย,เมืองสกลนคร,สกลนคร,47000,,,ม่วงลาย,042-756334,,01/01/2464,25,20,ขนาดกลาง,มีไฟฟ้า,21,302,11,08 เมษายน 2562 เวลา 13:58:04 น.
51,1047540026,47010053,540026,บ้านนา(คุรุราษฎรอุทิศวิทยายน),bannakururadautiswitayayon,นายกิตติภาคย์ ผางละมัย,อนุบาล-ประถมศึกษา,,หมู่ 1 บ้านนาหมาโป้,หนองลาด,เมืองสกลนคร,สกลนคร,47220,timrat2508@hotmail.com,,หนองลาด,042-720036,,6/8/2486,25,30,ขนาดเล็ก,มีไฟฟ้า,8,98,9,20 พฤษภาคม 2561 เวลา 07:18:05 น.
52,1047540027,47010054,540027,บ้านดอนแคน,Bandonkhan kururadpadungvit,นายณรงศักดิ์ จันทรังษี,อนุบาล-มัธยมศึกษาตอนต้น,,หมู่ 10 บ้านดอนแคน,หนองลาด,เมืองสกลนคร,สกลนคร,47220,Dcw2559@gmail.com,,ขมิ้นหนองลาด,042-701653,,2496,25,30,ขนาดกลาง,มีไฟฟ้า,17,194,11,25 กรกฎาคม 2562 เวลา 15:20:38 น.
53,1047540028,47010055,540028,บ้านท่าม่วง,Ban Tamuang school,นายประกอบ ตันมูล,อนุบาล-ประถมศึกษา,,หมู่ 3 บ้านทุ่งมั่ง,หนองลาด,เมืองสกลนคร,สกลนคร,47220,Banthamuang@hotmail.com,http://www.sakonarea1.g,หนองลาด,042-701652,,พ.ศ. ๒๔๗๖,26,30,ขนาดเล็ก,มีไฟฟ้า,8,101,9,22 พฤษภาคม 2561 เวลา 09:22:09 น.
54,1047540031,47010056,540031,บ้านดอนสัมพันธ์,Ban Donsumphan,นายสะอาด เจริญชัยไธสงค์,อนุบาล-ประถมศึกษา,,หมู่ 9 บ้านดอนสัมพันธ์,หนองลาด,เมืองสกลนคร,สกลนคร,47220,,,หนองลาด,,,10 กรกฎาคา 2524,27,33,ขนาดเล็ก,มีไฟฟ้า,7,41,9,05 พฤศจิกายน 2562 เวลา 09:48:16 น.
55,1047540029,47010057,540029,บ้านหนองลาด(ราษฎร์อุทิศวิทยาคม),bannonglad,นายวิษณุ ซ้ายสุพรรณ,อนุบาล-มัธยมศึกษาตอนต้น,ขมิ้นหนองลาด,หมู่ 7 หนองลาด,หนองลาด,เมืองสกลนคร,สกลนคร,47220,nongladschool47010057@gmail.com,gg.gg/BanNonglad-School,หนองลาด,042-701654,,2489,30,36,ขนาดกลาง,มีไฟฟ้า,25,292,11,25 กันยายน 2562 เวลา 20:55:56 น.
56,1047540030,47010058,540030,บ้านสายปลาหลาย (คุรุราษฎร์ผดุง),saipalai school,ว่าที่ร้อยเอกวีระศักดิ์ บัวโค,อนุบาล-ประถมศึกษา,ขมิ้นหนองลาด,หมู่ 5 บ้านสายปลาหลาย,หนองลาด,เมืองสกลนคร,สกลนคร,47220,wilai2507@hotmail.com,gg.gg/spl-ac-th,หนองลาด,042-706263,-,01/08/2498,13,23,ขนาดเล็ก,มีไฟฟ้า,8,61,8,24 กันยายน 2562 เวลา 15:45:21 น.
57,1047540069,47010059,540069,บ้านศรีวิชา คุรุราษฎร์อุทิศ,Ban Sriwicha Khururat uthit,นายกุศล ชุมปัญญา,อนุบาล-ประถมศึกษา,,หมู่ 1 บ้านศรีวิชา,ห้วยยาง,เมืองสกลนคร,สกลนคร,47000,,gg.gg/srivicha,ห้วยยาง,42163026,,2491,10,5,ขนาดกลาง,มีไฟฟ้า,11,195,8,24 กันยายน 2562 เวลา 14:14:20 น.
58,1047540066,47010060,540066,บ้านพะเนาว์ราษฏร์บำรุง สาขาบ้านนาขาม,Banpanom sakabannakam,-,อนุบาล-ประถมศึกษา,ห้วยยางพังขว้าง,หมู่ 3 บ้านนาขาม,ห้วยยาง,เมืองสกลนคร,สกลนคร,47000,panidamoo@hotmail.com,http://gg.gg/f9qus,ห้วยยาง,042-747069,-,2530,17,14,ขนาดเล็ก,มีไฟฟ้า,7,69,8,25 กันยายน 2562 เวลา 15:02:24 น.
59,1047540070,47010061,540070,บ้านนาคำวิทยาคาร,NAKAMWITTAYAKAN,นายสงวน หงษ์สิงห์,อนุบาล-มัธยมศึกษาตอนต้น,,หมู่ 4 บ้านนาคำ,ห้วยยาง,เมืองสกลนคร,สกลนคร,47000,nakamwittayakan@gmail.com,,ห้วยยาง,042-747230,-,พ.ศ.2484,15,12,ขนาดกลาง,มีไฟฟ้า,17,204,11,21 กรกฎาคม 2562 เวลา 13:23:31 น.
60,1047540071,47010062,540071,บ้านลาดกะเฌอ(คุรุราษฎร์ชูวิทย์),ฺBanladkachur(Kururajchoowit),นายบุญทรง สุนทรส,อนุบาล-มัธยมศึกษาตอนต้น,,หมู่ 8 บ้านลาดกะเฌอ,ห้วยยาง,เมืองสกลนคร,สกลนคร,47000,ladkachoe@thaimail.com,,ห้วยยาง,042-720080,,,23,20,ขนาดกลาง,มีไฟฟ้า,24,387,21,01 มิถุนายน 2561 เวลา 14:14:02 น.
61,1047540072,47010063,540072,บ้านพะเนาว์ราษฎร์บำรุง,Banpanaowradbumrung,นายไพศาล สมบูรณ์,อนุบาล-มัธยมศึกษาตอนต้น,,หมู่ 7 บ้านพะเนาว์,ห้วยยาง,เมืองสกลนคร,สกลนคร,47000,,,ห้วยยาง,042-769025,,2508,13,10,ขนาดกลาง,มีไฟฟ้า,15,147,11,24 กรกฎาคม 2562 เวลา 12:14:36 น.
62,1047540062,47010064,540062,บ้านบอนสหราษฎร์บำรุง,Banbonsaharatbumrong,นายปรีชา สวัสดี,อนุบาล-มัธยมศึกษาตอนต้น,,หมู่ 5 บ้านบอน,ห้วยยาง,เมืองสกลนคร,สกลนคร,47000,wbs_bo@yahoo.co.th,www.school.obec.go.th/banborn/,ห้วยยาง,042-720083,-,15 สิงหาคม 2475,20,11,ขนาดกลาง,มีไฟฟ้า,23,302,11,24 กันยายน 2562 เวลา 13:44:48 น.
63,1047540047,47010065,540047,บ้านหนองแคนสหราษฎร์วิทยา,ฺBannongkhansaharatwitthaya,นายวัฒนา ขัดสี,อนุบาล-ประถมศึกษา,,หมู่ 1 บ้านหนองแคน,เหล่าปอแดง,เมืองสกลนคร,สกลนคร,47000,nongkhanschool@gmail.com,gg.gg/nongkhan,เทศบาลตำบลเหล่าปอแดง,042-160247,,24/02/2473,20,15,ขนาดเล็ก,มีไฟฟ้า,8,56,8,24 กันยายน 2562 เวลา 14:14:43 น.
64,1047540048,47010066,540048,บ้านหนองสระ,nongsra,นางนพมาศ วรผาบ,อนุบาล-ประถมศึกษา,,หมู่ 5 บ้านหนองสระ,เหล่าปอแดง,เมืองสกลนคร,สกลนคร,47000,watgap@gmail.com,http://data.bopp-obec.info/web/?School_ID=1047540048,เหล่าปอแดง,042-720066,,2506,17,17,ขนาดเล็ก,มีไฟฟ้า,8,75,8,24 กันยายน 2562 เวลา 15:56:28 น.
65,1047540049,47010067,540049,บ้านดอนยาง(สหราษฎร์บำรุงวิทย์),Bandonyang(saharajbumrungvit),นายสงัด งอยผาลา,อนุบาล-ประถมศึกษา,หนองหารหลวง,หมู่ 11 บ้านดอนยางใต้,เหล่าปอแดง,เมืองสกลนคร,สกลนคร,47000,donyangschool1@gmail.com,gg.gg/donyangschool,เหล่าปอแดง,817087439,,26/06/2486,25,18,ขนาดกลาง,มีไฟฟ้า,11,125,8,25 กันยายน 2562 เวลา 09:39:32 น.
66,1047540057,47010068,540057,บ้านหนองปลาน้อย(สุทธะเรืองศิลป์),Ban Nongplanoi School,นางอัคครา ไชยยงค์,อนุบาล-ประถมศึกษา,หนองหารหลวง,หมู่ 7 บ้านหนองปลาน้อย,เหล่าปอแดง,เมืองสกลนคร,สกลนคร,47000,,https://data.bopp-obec.info/web/?School_ID=1047540057,เหล่าปอแดง,042-160270,,,22,19,ขนาดกลาง,มีไฟฟ้า,13,182,8,30 ตุลาคม 2562 เวลา 14:12:06 น.
67,1047540050,47010069,540050,บ้านท่าวัดคุรุราษฎร์บำรุงวิทย์,ิban thawatkururatbumrungwit school,นางศิริวรรณ พลเศษ,อนุบาล-มัธยมศึกษาตอนต้น,หนองหารหลวง,หมู่ 3 บ้านท่าวัดเหนือ,เหล่าปอแดง,เมืองสกลนคร,สกลนคร,47000,thawatschool-2014@hotmail.com,https://data.bopp-obec.info/web/?School_ID=1047540050,เหล่าปอแดง,042-720032,42720032,12 เมษายน 2466,30,20,ขนาดกลาง,มีไฟฟ้า,21,198,11,25 กันยายน 2562 เวลา 05:08:47 น.
68,1047540011,47010070,540011,บ้านหนองศาลาราษฎร์บำรุง,BANNONGSALARAJBUMROONG,นายอุทิศ ขันเงิน,อนุบาล-มัธยมศึกษาตอนต้น,ไตรศิลา,หมู่ 9 หนองศาลา,ฮางโฮง,เมืองสกลนคร,สกลนคร,47000,,gg.gg/nsrsc,อบต.ฮางโฮง,,,2485,6,11,ขนาดกลาง,มีไฟฟ้า,19,222,11,14 มกราคม 2563 เวลา 09:55:01 น.
69,1047540012,47010071,540012,บ้านนาดอกไม้ผดุงวิทยา,Bannadokmaipadungwittwya,นายพรชัย เถื่อนนาดี,อนุบาล-ประถมศึกษา,,หมู่ 6 บ้านนาดอกไม้,ฮางโฮง,เมืองสกลนคร,สกลนคร,47000,baannadokmai@gmail.com,,ฮางโฮง,042-981178,,2482,6,9,ขนาดกลาง,มีไฟฟ้า,12,122,9,24 กันยายน 2562 เวลา 16:01:41 น.
70,1047540009,47010072,540009,บ้านน้อยจอมศรี,Bannoijomsri,นายธีรพงษ์ วาทะวัฒนะ,อนุบาล-ประถมศึกษา,ไตรศิลา,หมู่ 10 บ้านน้อยจอมศรี,ฮางโฮง,เมืองสกลนคร,สกลนคร,47000,bannoijomsri@gmail.com,gg.gg/Noijomsri,ฮางโฮง,042-743569,-,01/05/2517,4,8,ขนาดกลาง,มีไฟฟ้า,14,137,8,24 กันยายน 2562 เวลา 16:09:29 น.
71,1047540010,47010073,540010,บ้านฮางโฮงประชาอุทิศ,Baan Hanghong Pracha Utid,นายสมเจตน์ งอยจันทร์ศรี,อนุบาล-ประถมศึกษา,,หมู่ 5 บ้านฮางโฮง,ฮางโฮง,เมืองสกลนคร,สกลนคร,47000,,,ฮางโฮง,042-720074,,พ.ศ.2497,5.5,8,ขนาดเล็ก,มีไฟฟ้า,10,102,8,22 มกราคม 2563 เวลา 15:14:33 น.
72,1047540089,47010074,540089,อนุบาลกุสุมาลย์,anubankusumal,นายสุทัศน์ ชุณห์วิจิตรา,อนุบาล-ประถมศึกษา,,หมู่ 1 กุสุมาลย์,กุสุมาลย์,กุสุมาลย์,สกลนคร,47210,kusumanschool@hotmail.com,,กุสุมาลย์,801799974,-,2457,38,1.5,ขนาดใหญ่,มีไฟฟ้า,32,748,24,29 พฤษภาคม 2562 เวลา 10:26:20 น.
73,1047540090,47010075,540090,บ้านอีกุด,banekut,นายสนอง ศรีธรรมา,อนุบาล-มัธยมศึกษาตอนต้น,กุสุมาลย์ 1,หมู่ 13 บ้านอีกุด,กุสุมาลย์,กุสุมาลย์,สกลนคร,47210,banektschool1@hotmail.com,gg.gg/ekutschool,กุสุมาลย์,,,25/11/2475,40,6,ขนาดกลาง,มีไฟฟ้า,22,302,12,15 ตุลาคม 2562 เวลา 18:59:24 น.
74,1047540095,47010076,540095,ชุมชนนิรมัย,chumchonniramai,นายณอนรรฆ์ สุขรี,อนุบาล-ประถมศึกษา,กุสุมาลย์ 1,หมู่ 10 บ้านโนนคำ,โพธิไพศาล,กุสุมาลย์,สกลนคร,47210,,,โพธิไพศาล,042-701698,,2501,45,7,ขนาดกลาง,มีไฟฟ้า,14,294,8,14 มกราคม 2563 เวลา 13:35:08 น.
75,1047540108,47010077,540108,นาเพียงสว่างวิทยานุกูล,Napiengsawangwittayanukun,นายสราวุธ พาเสน่ห์,อนุบาล-มัธยมศึกษาตอนต้น,กุสุมาลย์ 2,หมู่ 3 นาเพียงใหม่,นาเพียง,กุสุมาลย์,สกลนคร,47230,napieng@hotmail.com,,นาเพียง,042-756350,,พ.ศ.2464,40,20,ขนาดกลาง,มีไฟฟ้า,37,488,20,24 มกราคม 2563 เวลา 11:39:48 น.
76,1047540109,47010078,540109,บ้านซ่งเต่า,Bansongtao,นายภาณุพงศ์ ศรีวรกุล,อนุบาล-ประถมศึกษา,,หมู่ 6 บ้านซ่งเต่า,นาเพียง,กุสุมาลย์,สกลนคร,47230,Bansongtao@gmail.com,,อบต.นาเพียง,-,-,2507,45,42,ขนาดเล็ก,มีไฟฟ้า,13,82,8,26 กันยายน 2562 เวลา 17:18:11 น.
77,1047540110,47010079,540110,บ้านกุงศรี,BanKungSri School,นายสุริยศักดิ์ ประทุมรัตน์,อนุบาล-ประถมศึกษา,,หมู่ 1 บ้านกุงศรี,นาเพียง,กุสุมาลย์,สกลนคร,47230,kungsrischool@hotmail.com,,นาเพียง,,,22/05/2482,27,28,ขนาดกลาง,มีไฟฟ้า,12,119,8,20 กรกฎาคม 2560 เวลา 03:14:43 น.
78,1047540111,47010080,540111,บ้านหนองปลาตอง(ประชาวิทยาคาร),Bannongplatong(Prachawittayakhan),นายวชิรเมษฐ์ บำรุงผดุงวิทย์,อนุบาล-ประถมศึกษา,กุสุมาลย์ 2,หมู่ 7 บ้านหนองปลาตอง,นาเพียง,กุสุมาลย์,สกลนคร,47230,platongschool@hotmail.com,,นาเพียง,042-099841,-,1 พฤศจิกายน 2481,34,20,ขนาดกลาง,มีไฟฟ้า,13,122,8,24 กันยายน 2562 เวลา 16:04:01 น.
79,1047540113,47010081,540113,นาเพียงสว่างวิทยานุกูล (สาขาศรีคงคำ),,-,อนุบาล-ประถมศึกษา,,หมู่ 5 ศรีคงคำ,นาเพียง,กุสุมาลย์,สกลนคร,47230,napieng2464@gmail.com,,นาเพียง,042-761132,-,,42,22,ขนาดเล็ก,มีไฟฟ้า,0,20,3,25 มิถุนายน 2562 เวลา 10:25:33 น.
80,1047540114,47010082,540114,บ้านนาเพียงเก่าสนธิราษฎร์สามัคคี,Baannapiangkaozonthiraatsamakkhi school,นายขจรศักดิ์ โสรินทร์,อนุบาล-ประถมศึกษา,กุสุมาลย์ 2,หมู่ 2 นาเพียงเก่า,นาเพียง,กุสุมาลย์,สกลนคร,47230,napiangkao​@hotmail.com,http://www.นาเพียงเก่า.blogspot.com,นาเพียง,42720123,-,2535,35,32,ขนาดกลาง,มีไฟฟ้า,11,122,8,16 ตุลาคม 2562 เวลา 19:58:27 น.
81,1047540094,47010083,540094,บ้านโคกม่วง,khokmogg,นายอิสเรศ เสงี่ยมวัฒนะ,อนุบาล-ประถมศึกษา,,หมู่ 2 โคกม่วง,นาโพธิ์,กุสุมาลย์,สกลนคร,47210,,,กุสุมาลย์,ไม่มี,,2,60,10,ขนาดกลาง,มีไฟฟ้า,12,122,8,14 มกราคม 2563 เวลา 10:48:55 น.
82,1047540091,47010084,540091,บ้านนาโพธิ์คุรุราษฎร์พัฒนา,Bannapokururatpattana,นายสายสมร พุทธิไสย,อนุบาล-ประถมศึกษา,กุสุมาลย์ 1,หมู่ 11 บ้านนาโพธิ์,นาโพธิ์,กุสุมาลย์,สกลนคร,47210,naphosk1@gmail.com,data.bopp-obec.info/web/?School_ID=1047540091,นาโพธิ์,,,พ.ศ.2464,30,3,ขนาดกลาง,มีไฟฟ้า,13,215,8,25 กันยายน 2562 เวลา 11:47:46 น.
83,1047540092,47010085,540092,บ้านบอนสหราษฎร์อุทิศ,Banbonsaharajutid,นายยุทธชัย จริตน้อม,อนุบาล-ประถมศึกษา,กุสุมาลย์ 1,หมู่ 3 บ้านบอน,นาโพธิ์,กุสุมาลย์,สกลนคร,47210,ฺBanbonsaharajutid@gmail.com,้https://data.bopp-obec.info/web/?School_ID=1047540092,นาโพธิ์,-,-,17/10/2475,48,7,ขนาดกลาง,มีไฟฟ้า,11,121,9,02 พฤศจิกายน 2562 เวลา 12:17:21 น.
84,1047540093,47010086,540093,บ้านม่วงวิทยา,BanMuangwittaya,นางสิริรัตน์ งิ้วโสม,อนุบาล-มัธยมศึกษาตอนต้น,,หมู่ 5 บ้านม่วง,นาโพธิ์,กุสุมาลย์,สกลนคร,47210,bm_@hotmail.com,,นาโพธิ์,042-720095,42701660,2502,45,5,ขนาดกลาง,มีไฟฟ้า,20,302,12,11 กันยายน 2562 เวลา 15:22:27 น.
85,1047540096,47010087,540096,บ้านนาดี,BANNADEE,นายอดิศักดิ์ วงศรีชู,อนุบาล-ประถมศึกษา,,หมู่ 1 บ้านนาดี,โพธิไพศาล,กุสุมาลย์,สกลนคร,47210,potiya7996@gmail.com,,โพธิไพศาล,42099817,,2475,56,10,ขนาดเล็ก,มีไฟฟ้า,11,106,8,08 เมษายน 2562 เวลา 10:35:18 น.
86,1047540097,47010088,540097,ไพศาลวิทยา,PHAISANWITTAYA,นางกนกวรรณ ภูศรีฐาน,อนุบาล-ประถมศึกษา,,หมู่ 3 โพธิไพศาล,โพธิไพศาล,กุสุมาลย์,สกลนคร,47210,-,-,โพธิไพศาล,-,-,พ.ศ. 2482,42,6,ขนาดกลาง,มีไฟฟ้า,10,159,8,19 มิถุนายน 2562 เวลา 14:15:28 น.
87,1047540098,47010089,540098,บ้านโพนแพง เจียรวนนท์อุทิศ 5,Banphonphang Chiarawanonuthit 5,ดร.วิชัย มั่นพลศรี,อนุบาล-มัธยมศึกษาตอนปลาย,,หมู่ 6 บ้านโพนแพง,โพธิไพศาล,กุสุมาลย์,สกลนคร,47210,phonpang.cp5@gmail.com,gg.gg/ppjcp5,โพธิไพศาล,-,-,20 เมษายน 2482,48,8,ขนาดกลาง,มีไฟฟ้า,43,579,21,25 กันยายน 2562 เวลา 11:47:10 น.
88,1047540101,47010090,540101,บ้านกุดฮู,gudhoo,นายสิรวิชญ์ เขียวดี,อนุบาล-ประถมศึกษา,,หมู่ 4 กุดฮู,โพธิไพศาล,กุสุมาลย์,สกลนคร,47210,kudhooschool@gmail.com,gg.gg/gudhooschool,โพธิไพศาล,042-701661,,27 ตุลาคม พ.ศ.2477,55,15,ขนาดกลาง,มีไฟฟ้า,12,158,8,24 กันยายน 2562 เวลา 14:11:18 น.
89,1047540099,47010091,540099,บ้านห้วยกอกหนองเค็ม,huaikok nongkhem,นายปิยะพันธ์ ชัยเสนา,อนุบาล-ประถมศึกษา,,หมู่ 8 บ้านห้วยกอก,โพธิไพศาล,กุสุมาลย์,สกลนคร,47210,,,อบต.โพธิไพศาล,042-756352,,2 มิถุนายน 2512,52,10,ขนาดกลาง,มีไฟฟ้า,13,129,8,24 กันยายน 2562 เวลา 14:14:12 น.
90,1047540100,47010092,540100,บ้านกุดสะกอย,kudsakoy,นายปุญญพัฒน์ ชาปากดี,อนุบาล-ประถมศึกษา,กุสุมาลย์ 1,หมู่ 7 กุดสะกอย,โพธิไพศาล,กุสุมาลย์,สกลนคร,47210,koko_sakonnakorn@outlook.co.th,http://gg.gg/kudsakoy,โพธิไพศาล,087-2370635,-,19 พฤษภาคม 2519,57,13,ขนาดกลาง,มีไฟฟ้า,13,136,8,01 พฤศจิกายน 2562 เวลา 20:12:46 น.
91,1047540112,47010093,540112,บ้านอุ่มจาน,Banumchan,นายวิรัน บุญหงษ์,อนุบาล-ประถมศึกษา,,หมู่ 13 อุ่มจาน,อุ่มจาน,กุสุมาลย์,สกลนคร,47230,banumchan@hotmail.com,http://gg.gg/buc-ac-th,อุ่มจาน,812615600,-,22 พฤษภาคม 2482,26,37,ขนาดเล็ก,มีไฟฟ้า,12,105,8,24 กันยายน 2562 เวลา 15:46:49 น.
