1,1047540020,47010001,540020,บ้านพานสหราษฎร์บำรุง,BANPANSAHARADBUMRUNG,นายประสบชัย บุญแสง,อนุบาล-มัธยมศึกษาตอนต้น,,หมู่ 8 บ้านพานทอง,ขมิ้น,เมืองสกลนคร,สกลนคร,47220,banpan47010001@gmail.com,,ขมิ้น,,,25/11/2442,10,16,ขนาดกลาง,มีไฟฟ้า,17,207,12,25 กันยายน 2562 เวลา 09:34:24 น.
2,1047540021,47010002,540021,บ้านประชาสุขสันติ์,pracharsuksan,นางอุทุมพร ทองวงษา,อนุบาล-ประถมศึกษา,,หมู่ 9 ประชาสุขสันติ์,ขมิ้น,เมืองสกลนคร,สกลนคร,47220,pracharsuksan@hotmail.co.th,gg.gg/pracharsuksan,ขมิ้น,042-720048,-,01/04/2507,20,20,ขนาดกลาง,มีไฟฟ้า,12,141,9,24 กันยายน 2562 เวลา 14:46:39 น.
3,1047540022,47010003,540022,โคกเลาะวิทยาคาร,Khoklorvittayakan,นายพงษ์ศักดิ์ ระเวงวรรณ,อนุบาล-มัธยมศึกษาตอนต้น,,หมู่ 4 บ้านโคกเลาะ,ขมิ้น,เมืองสกลนคร,สกลนคร,47220,khoklor@hotmail.com,gg.gg/klw278,ขมิ้น,042-701641,-,30/11/2464,20,25,ขนาดกลาง,มีไฟฟ้า,20,203,11,25 กันยายน 2562 เวลา 14:39:33 น.
4,1047540023,47010004,540023,บ้านโพนบกสหราษฎร์วิทยา,Banphonboksaharatwittaya,นางกรุณา โถชารี,อนุบาล-ประถมศึกษา,,หมู่ 6 บ้านโพนบก,ขมิ้น,เมืองสกลนคร,สกลนคร,47220,Ponbok_school@yahoo.com,https://data.bopp-obec.info/web/?School_ID=1047540023,องค์การบริหารส่วนตำบลขมิ้น,042-476369,,1 พ.ค.2505,17,20,ขนาดเล็ก,มีไฟฟ้า,7,44,8,28 กุมภาพันธ์ 2563 เวลา 13:42:19 น.
5,1047540024,47010005,540024,ชุมชนดงมะไฟเจริญศิลป์,chumchondongmafai,นายสัมภาษณ์ นรภาร,อนุบาล-ประถมศึกษา,,หมู่ 1 บ้านดงมะไฟ,ขมิ้น,เมืองสกลนคร,สกลนคร,47220,ch_dongmafai2454@hotmail.com,,เทศบาลตำบลดงมะไฟ,042-759122,42759122,2454,15.5,16,ขนาดกลาง,มีไฟฟ้า,26,409,17,20 กรกฎาคม 2562 เวลา 11:12:05 น.
6,1047540025,47010006,540025,ศรีบุญเรืองวิทยาคาร,,นายธนุวัฒน์ สุภาอ้วน,ประถมศึกษา-มัธยมศึกษาตอนต้น,,หมู่ 2 บ้านขมิ้น,ขมิ้น,เมืองสกลนคร,สกลนคร,47220,,,องค์การบริหารส่วนตำบลขมิ้น,042-746366,,2484,17,20,ขนาดกลาง,มีไฟฟ้า,24,365,12,27 มิถุนายน 2562 เวลา 13:39:24 น.
7,1047540043,47010007,540043,บ้านโคกก่องสหมิตรวิทยาคาร,,นายทวีเดช แสนชนม์,อนุบาล-มัธยมศึกษาตอนต้น,,หมู่ 8 บ้านโคกก่อง,โคกก่อง,เมืองสกลนคร,สกลนคร,47000,,WWW.kok.ac.th,อบต.โคกก่อง,042-160461,,16 กันยายน 2463,35,30,ขนาดกลาง,มีไฟฟ้า,24,315,11,20 กรกฎาคม 2562 เวลา 11:05:28 น.
8,1047540044,47010008,540044,บ้านโคกสูง (สหราษฎร์บำรุง),Khoksung(saharatbamrung),นายวุฒิศักดิ์ บุญยืน,อนุบาล-ประถมศึกษา,,หมู่ 5 โคกสูง,โคกก่อง,เมืองสกลนคร,สกลนคร,47000,koksung_49@hotmail.com,,โคกก่อง,042-720114,-,6 สิงหาคม 2489,35,30,ขนาดกลาง,มีไฟฟ้า,8,125,8,08 เมษายน 2562 เวลา 13:36:13 น.
9,1047540004,47010009,540004,นายอวัฒนา,Nayorwattana School,นายสุนทร หนูอินทร์,อนุบาล-ประถมศึกษา,ธาตุเชิงชุม,หมู่ 10 บ้านนามน,งิ้วด่อน,เมืองสกลนคร,สกลนคร,47000,nayowattanaschool@gmail.com,,งิ้วด่อน,042-160076,42160076,2482,15,10,ขนาดกลาง,มีไฟฟ้า,16,198,8,23 มกราคม 2563 เวลา 10:36:06 น.
10,1047540005,47010010,540005,งิ้วด่อนราษฎร์สามัคคีบำรุง,Ngewdonratsamakeebumrung,นายปัญญาฤทธิ์ โพธิราช,อนุบาล-ประถมศึกษา,ธาตุเชิงชุม,หมู่ 1 งิ้วด่อน,งิ้วด่อน,เมืองสกลนคร,สกลนคร,47000,ngewdon.school@gmail.com,gg.gg/ngdschool,ตำบลงิ้วด่อน,-,-,29/11/2442,15,3,ขนาดกลาง,มีไฟฟ้า,12,153,8,26 กันยายน 2562 เวลา 10:31:58 น.
11,1047540006,47010011,540006,บ้านดอนหมูโพธิ์ศรี (ชุมชนพัฒนา),bandonmooposri chumchonpattana,นางอ้อย คำปัญโญ,อนุบาล-ประถมศึกษา,ธาตุเชิงชุม,หมู่ 7 บ้านโพธิ์ศรี,งิ้วด่อน,เมืองสกลนคร,สกลนคร,47000,otakachi@hotmail.com,,งิ้วด่อน,817087509,,19 กันยายน 2502,15,10,ขนาดเล็ก,มีไฟฟ้า,9,54,8,25 กันยายน 2562 เวลา 08:30:03 น.
12,1047540037,47010012,540037,ดอนเชียงบาลราษฎร์บำรุงศิลป์,donchiangbanrajbumrungsil,นายปานพันธุ์ กาญจนพันธุ์,อนุบาล-ประถมศึกษา,ไตรศิลา,หมู่ 3 ดอนเชียงบาน,เชียงเครือ,เมืองสกลนคร,สกลนคร,47000,itpong.itpong@gmail.com,,เทศบาลตำบลเชียงเครือ,922521394,,,16,18,ขนาดเล็ก,มีไฟฟ้า,8,98,9,24 กันยายน 2562 เวลา 16:14:24 น.
13,1047540040,47010013,540040,ทุ่งมนพิทยาคาร,tungmonpittayakarn school,นายอิสรภาพ นามละคร,อนุบาล-มัธยมศึกษาตอนต้น,,หมู่ 8 บ้านทุ่งมน,เชียงเครือ,เมืองสกลนคร,สกลนคร,47000,tongmon13@gmail.com,http://gg.gg/tungmon13,เชียงเครือ,042-720084,,12 สิงหาคม 2482,18,24,ขนาดกลาง,มีไฟฟ้า,17,181,11,21 กรกฎาคม 2562 เวลา 13:34:02 น.
14,1047540032,47010014,540032,ชุมชนเชียงเครือราษฎร์รังสรรค์,,นางนัทธมน ทวีกิตติเกษม,อนุบาล-ประถมศึกษา,,หมู่ 363 หมู่14 เชียงเครือ,เชียงเครือ,เมืองสกลนคร,สกลนคร,47000,,,เทศบาลตำบลเชียงเครือ,042-754117,,8 มิถุนายน 2467,12,18,ขนาดเล็ก,มีไฟฟ้า,10,110,8,29 พฤษภาคม 2562 เวลา 10:13:19 น.
15,1047540033,47010015,540033,บ้านป่าหว้าน,BANPAWAN,นางศิรพัชร์ รพีพัฒนวงศ์,อนุบาล-ประถมศึกษา,ไตรศิลา,หมู่ 7 บ้านป่าหว้าน,เชียงเครือ,เมืองสกลนคร,สกลนคร,47000,phawan@thai.com,,เชียงเครือ,933962002,,21 เมษายน 2498,8,15,ขนาดกลาง,มีไฟฟ้า,12,127,8,24 กันยายน 2562 เวลา 15:27:12 น.
16,1047540034,47010016,540034,บ้านหนองหอย,Bannonghoy,นางสาววราภัสร์ แก้วเมืองพัชรกุล,ประถมศึกษา-มัธยมศึกษาตอนต้น,,หมู่ 4 หนองหอย,เชียงเครือ,เมืองสกลนคร,สกลนคร,47000,,,เชียงเครือ,042-981237,42701655,,12,20,ขนาดกลาง,มีไฟฟ้า,26,423,17,27 กันยายน 2562 เวลา 08:25:37 น.
17,1047540035,47010017,540035,ศิริราษฎร์วิทยาคาร,Siri Rat Witthayakan School,นายสุนทร ไพคำนาม,อนุบาล-มัธยมศึกษาตอนต้น,,หมู่ 11 บ้านโนนเบ็ญ,เชียงเครือ,เมืองสกลนคร,สกลนคร,47000,siriras59@outlook.co.th,-,??????????,625956397,-,2464,10,19,ขนาดกลาง,มีไฟฟ้า,22,319,16,24 กันยายน 2562 เวลา 14:24:40 น.
18,1047540036,47010018,540036,บ้านดอนเชียงคูณ,Ban Don Chiang Khoon,นายชัยวัฒน์ แก้วหล่อ,อนุบาล-ประถมศึกษา,,หมู่ 5 บ้านดอนเชียงคูณ,เชียงเครือ,เมืองสกลนคร,สกลนคร,47000,dck.school@gmail.com,,เชียงเครือ,980961948,-,13 กันยายน 2498,8,12,ขนาดเล็ก,มีไฟฟ้า,5,57,8,24 กันยายน 2562 เวลา 13:44:47 น.
19,1047540046,47010019,540046,ดงชนเหล่าแมดบำรุงวิทย์,Dongchonlaomaetbamrungwithop,นายมุงคุณ สีหามาตย์,อนุบาล-ประถมศึกษา,หนองหารหลวง,หมู่ 2 บ้านดงชน,ดงชน,เมืองสกลนคร,สกลนคร,47000,akkapor.mju@gmail.com,gg.gg/dongchon,ดงชน,862322437,-,19/06/2482,25,17,ขนาดเล็ก,มีไฟฟ้า,7,92,8,24 กันยายน 2562 เวลา 15:51:18 น.
20,1047540051,47010020,540051,บ้านหนองมะเกลือ,Nongmaklua School,นางจินตนา หลานเศรษฐา,อนุบาล-ประถมศึกษา,,หมู่ 6 บ้านหนองมะเกลือ,ดงชน,เมืองสกลนคร,สกลนคร,47000,,,ดงชน,042-981154,,1 มกราคม 2479,25,20,ขนาดเล็ก,มีไฟฟ้า,18,125,11,20 กรกฎาคม 2562 เวลา 10:53:46 น.
21,1047540058,47010021,540058,บ้านกุดแข้,,นางพัชราภรณ์ จรุงเกียรติสกล,อนุบาล-ประถมศึกษา,,หมู่ 4 บ้านกุดแข้,ดงชน,เมืองสกลนคร,สกลนคร,47000,kudphonlamong@gmail.com,gg.gg/kudkae-snk21,ดงชน,042-720037,,2456,25,20,ขนาดเล็ก,มีไฟฟ้า,7,63,8,25 กันยายน 2562 เวลา 15:02:38 น.
22,1047540059,47010022,540059,บ้านนาแก,Ban Nakae,นางสาวฤทัยทรัพย์ ดอกคำ,อนุบาล-ประถมศึกษา,ถิ่นภูไท,หมู่ 4 นาแก,ดงมะไฟ,เมืองสกลนคร,สกลนคร,47000,nakaesakol@gmail.com,sites.google.com/site/rongreiynbannakae/home,ดงมะไฟ,042-163193,-,2466,8,7,ขนาดเล็ก,มีไฟฟ้า,8,99,9,30 กันยายน 2562 เวลา 10:20:47 น.
23,1047540060,47010023,540060,บ้านดงขวาง,DONGKWANG,นายจักรทิพย์ ทอนฮามแก้ว,อนุบาล-ประถมศึกษา,ถิ่นภูไท,หมู่ 3 บ้านดงขวาง,ดงมะไฟ,เมืองสกลนคร,สกลนคร,47000,school-dk@hotmail.com,gg.gg/dongkwang,ดงมะไฟ,042-756329,-,2501,21,16,ขนาดเล็ก,มีไฟฟ้า,7,57,8,25 กันยายน 2562 เวลา 14:36:22 น.
24,1047540061,47010024,540061,บ้านดงมะไฟสามัคคีราษฎร์อุทิศ,BANDONGMAFAISAMUKKEERAT-UTIT,นายชัยดำรงค์ เอกสุภาพันธุ์,อนุบาล-มัธยมศึกษาตอนต้น,ถิ่นภูไท,หมู่ 1 บ้านดงมะไฟ,ดงมะไฟ,เมืองสกลนคร,สกลนคร,47000,dmf@dmfschool.ac.th,gg.gg/dmfschool,ดงมะไฟ,042-707522,,20 ตุลาคม 2476,14,12,ขนาดกลาง,มีไฟฟ้า,14,178,11,08 ตุลาคม 2562 เวลา 15:45:07 น.
25,1047540063,47010025,540063,บ้านโพนก้างปลาโนนสมบูรณ์,phonkangplaNonSomboon,นายวชิรพงศ์ วงศ์มหาชัย,อนุบาล-ประถมศึกษา,,หมู่ 2 บ้านโพนก้างปลา,ดงมะไฟ,เมืองสกลนคร,สกลนคร,47000,,,ดงมะไฟ,,,ปี พ.ศ.2465,20,15,ขนาดเล็ก,มีไฟฟ้า,6,86,8,24 กันยายน 2562 เวลา 14:02:21 น.
26,1047540064,47010026,540064,บ้านนากับแก้,Bannakabkae,นายชัยศักดิ์ แสงวงศ์,อนุบาล-ประถมศึกษา,,หมู่ 5 บ้านนากับแก้,ดงมะไฟ,เมืองสกลนคร,สกลนคร,47000,nakabkae@hotmail.com,-,ดงมะไฟ,042-701677,,2486,22,16,ขนาดเล็ก,มีไฟฟ้า,3,68,8,22 พฤศจิกายน 2560 เวลา 03:50:04 น.
27,1047540065,47010027,540065,บ้านหนองไผ่,BANNONGPHAI,นายยุธยา เทอำรุง,อนุบาล-มัธยมศึกษาตอนต้น,,หมู่ 7 บ้านหนองไผ่,ดงมะไฟ,เมืองสกลนคร,สกลนคร,47000,,www.htpp//obec.go.th/sc,ดงมะไฟ,42090305,,2476,25,20,ขนาดกลาง,มีไฟฟ้า,20,256,11,11 มิถุนายน 2562 เวลา 11:10:10 น.
28,1047540039,47010029,540039,บ้านพะโค,phakoo school,นางสุพรทิพย์ เกษมสิน,อนุบาล-ประถมศึกษา,ไตรศิลา,หมู่ 2 บ้านพะโค,ท่าแร่,เมืองสกลนคร,สกลนคร,47230,phakoo1@hotmail.com,https://data.bopp-obec.info/web/?School_ID=1047540039,ท่าแร่,-,-,,23,25,ขนาดเล็ก,มีไฟฟ้า,7,66,8,13 มกราคม 2563 เวลา 09:26:20 น.
29,1047540038,47010030,540038,ท่าแร่วิทยา,tharewitaya school,นายอนุสิทธิ์ นามโยธา,อนุบาล-ประถมศึกษา,,หมู่ 8 บ้านท่าแร่,ท่าแร่,เมืองสกลนคร,สกลนคร,47230,t_rv@live.com,school.obec.go.th/tw/,เทศบาลตำบลท่าแร่,042-751211,42751211,2516,16,20,ขนาดกลาง,มีไฟฟ้า,27,523,22,20 กรกฎาคม 2562 เวลา 10:17:32 น.
30,1047540001,47010032,540001,อนุบาลสกลนคร,Anubansakonnakhon School,นายชัญโญ ใครบุตร,อนุบาล-ประถมศึกษา,ธาตุเชิงชุม,หมู่ 2 ในเขตเทศบาลเมืองสกลนคร,ธาตุเชิงชุม,เมืองสกลนคร,สกลนคร,47000,abs.ac.th@hotmail.com,www.abs.ac.th,สกลนคร,042-711283,42173094,7 กุมภาพันธ์ พ.ศ.2506,7,3,ขนาดใหญ่พิเศษ,มีไฟฟ้า,88,2136,54,24 กันยายน 2562 เวลา 14:52:26 น.
31,1047540002,47010033,540002,เชิงชุมราษฎร์นุกูล,Cherngchomrajnukul,นายชัยวัฒน์ วาทะวัฒนะ,อนุบาล-ประถมศึกษา,ธาตุเชิงชุม,หมู่ - เลขที่ 1843 ถนนใสสว่าง,ธาตุเชิงชุม,เมืองสกลนคร,สกลนคร,47000,crk.sakon1@gmail.com,www.crk.ac.th/index.php,สกลนคร,042-711734,042-707886,1 ตุลาคม 2485,9,3,ขนาดใหญ่พิเศษ,มีไฟฟ้า,111,1945,54,14 มกราคม 2563 เวลา 14:22:51 น.
32,1047540003,47010034,540003,สกลนคร(วันครู2501),Sakon Nakhorn Wankhru 2501 School,-,อนุบาล-ประถมศึกษา,,หมู่ 0 บ้านกกส้มโฮง,ธาตุเชิงชุม,เมืองสกลนคร,สกลนคร,47000,wankru1@thaimail.com,gg.gg/SWK2501,เทศบาลนครสกลนคร,042-711561,,16 มกราคม 2501,5,0.5,ขนาดเล็ก,มีไฟฟ้า,13,115,9,25 กันยายน 2562 เวลา 13:49:11 น.
33,1047540007,47010035,540007,นาอ้อยคำสะอาด,naooykamsa-ad,นางสาวจันทร์สุดา จันทะพรหม,อนุบาล-ประถมศึกษา,,หมู่ 9 บ้านนาอ้อย,ธาตุเชิงชุม,เมืองสกลนคร,สกลนคร,47000,naooy.kom1@gmail.com,gg.naooykom1,สกลนคร,042-971020,-,1 สิงหาคม 2489,5,3,ขนาดเล็ก,มีไฟฟ้า,10,103,8,25 กันยายน 2562 เวลา 15:10:34 น.
34,1047540008,47010036,540008,เมืองสกลนคร(ธาตุนารายณ์เจงเวง),Mueangsakonnakhon School,นายปารณทัตต์ แสนวิเศษ,อนุบาล-ประถมศึกษา,,หมู่ 1 บ้านธาตุนาเวง,ธาตุเชิงชุม,เมืองสกลนคร,สกลนคร,47000,mueangskn47010036@gmail.com,gg.gg/ekwnv,เมืองสกลนคร,42970136,42970136,2480,0.5,7,ขนาดใหญ่,มีไฟฟ้า,32,742,23,21 กรกฎาคม 2562 เวลา 14:01:06 น.
35,1047540013,47010037,540013,บ้านกกส้มโฮง,Koksomhong,นายอภิชาติ แสนภูวา,อนุบาล-ประถมศึกษา,,หมู่ 3 ชุมชนกกส้มโฮง,ธาตุเชิงชุม,เมืองสกลนคร,สกลนคร,47000,KSHS@chaiyo.com,gg.gg/kshs540013,เทศบาลนครสกลนคร,042-714795,,2521,5,5,ขนาดกลาง,มีไฟฟ้า,11,135,8,25 กันยายน 2562 เวลา 14:54:50 น.
36,1047540015,47010038,540015,ธาตุนาเวงวิทยา,thatnawengvittaya,นายจารึก ชาวันดี,อนุบาล-ประถมศึกษา,ธาตุเชิงชุม,หมู่ 1 ธาตุนาเวง,ธาตุเชิงชุม,เมืองสกลนคร,สกลนคร,47000,-,-,เทศบาลเมืองสกลนคร,042-730400,-,2526,3,3,ขนาดกลาง,มีไฟฟ้า,9,111,8,24 กันยายน 2562 เวลา 15:27:34 น.
37,1047540052,47010039,540052,ชุมชนโนนหอมไผ่ล้อม,Choomchonnonhormpailom,นายบุรินทร์ บุรัตน์,อนุบาล-มัธยมศึกษาตอนต้น,,หมู่ 2 บ้านโนนหอม,โนนหอม,เมืองสกลนคร,สกลนคร,47000,nonhorm_school@hotmail.com,www.cnl.ac.th,โนนหอม,042-170673,,ปี พ.ศ.2485,22,16,ขนาดกลาง,มีไฟฟ้า,14,205,11,11 สิงหาคม 2562 เวลา 09:26:56 น.
38,1047540053,47010040,540053,ห้วยปลาใยผดุงวิทยา,Huayprayai Padungvitaya,นายวิระชาติ ยาทองไชย,อนุบาล-ประถมศึกษา,ถิ่นภูไท,หมู่ 4 บ้านห้วยปลาใย,โนนหอม,เมืองสกลนคร,สกลนคร,47000,sekmath125@gmail.com,huayprayaischool.ac.th,โนนหอม,856423194,-,2475,20,15,ขนาดเล็ก,มีไฟฟ้า,10,85,9,20 มกราคม 2563 เวลา 11:13:03 น.
39,1047540054,47010041,540054,ผักแพวบำรุงวิทยา,Phakphawbumrungwitthaya school,นางอรวรรณ อุ่นวิเศษ,อนุบาล-ประถมศึกษา,,หมู่ 9 บ้านคำผักแพว,โนนหอม,เมืองสกลนคร,สกลนคร,47000,auraviva14@gmail.com,www.phw.ac.th,โนนหอม,885659770,,2471,18,12,ขนาดเล็ก,มีไฟฟ้า,10,77,8,29 พฤษภาคม 2562 เวลา 10:13:28 น.
40,1047540055,47010042,540055,บ้านโพนยางคำ กรป.กลางพัฒนา,Phonyangkum,นายยุธยา เทอำรุง,อนุบาล-ประถมศึกษา,,หมู่ 10 โพนยางคำ,โนนหอม,เมืองสกลนคร,สกลนคร,47000,Phonyangkum @ Thaimail.,https://data.bopp-obec.info/emis/admin.php,โนนหอม,042-701672,-,1 พ.ค. 2518,17,11,ขนาดเล็ก,มีไฟฟ้า,7,58,7,14 มกราคม 2563 เวลา 13:13:20 น.
41,1047540056,47010043,540056,บ้านท่าเยี่ยมน้ำพุง,tayeamnampung,สิบเอกประสาท อุระภา,อนุบาล-ประถมศึกษา,,หมู่ 1 บ้านท่าเยี่ยมน้ำพุง,โนนหอม,เมืองสกลนคร,สกลนคร,47000,,,โนนหอม,-,,2482,35,25,ขนาดเล็ก,มีไฟฟ้า,10,53,8,30 เมษายน 2562 เวลา 11:14:49 น.
42,1047540019,47010044,540019,บ้านหนองปลาดุกศรีวิทยา,Nongpladooksriwittaya,นายพรรณา มาตเลียง,อนุบาล-ประถมศึกษา,,หมู่ 9 บ้านหนองปลาดุก,พังขว้าง,เมืองสกลนคร,สกลนคร,47000,nongpladooksriwittaya44@gmail.com,http://gg.gg/nongpladook,พังขว้าง,042-712481,,,9,15,ขนาดเล็ก,มีไฟฟ้า,10,89,8,24 กันยายน 2562 เวลา 14:14:43 น.
43,1047540014,47010045,540014,บ้านพังขว้างวัฒนศิลป์,ฺBanPangKhwaangWattanasrin,นายเอกนรินทร์ ต่อวงษ์,อนุบาล-ประถมศึกษา,,หมู่ 12 บ้านพังขว้างกลาง,พังขว้าง,เมืองสกลนคร,สกลนคร,47000,,data.bopp-obec.info/web/index_view.php?School_ID=1047540014&page,พังขว้าง,042-743304,,1 เมษายน 2455,3,3,ขนาดกลาง,มีไฟฟ้า,11,117,8,24 กันยายน 2562 เวลา 21:56:12 น.
44,1047540016,47010046,540016,บ้านดงยอสามัคคีพิทยาศิลป์,BANDONGYOO,นายนพดล แสนบัณฑิต,อนุบาล-ประถมศึกษา,,หมู่ 6 บ้านดงยอ,พังขว้าง,เมืองสกลนคร,สกลนคร,47000,-,-,พังขว้าง,095-1924986,-,3 พฤษภาคม 2524,6,10,ขนาดเล็ก,มีไฟฟ้า,11,103,9,25 กันยายน 2562 เวลา 08:37:17 น.
45,1047540068,47010047,540068,บ้านดงขุมข้าว (คุรุราษฎร์รังสรรค์ 2),Dongkhumkhao,นายเดชชัย เหมะธุรินทร์,อนุบาล-ประถมศึกษา,,หมู่ 3 บ้านดงขุมข้าว,พังขว้าง,เมืองสกลนคร,สกลนคร,47000,dkk2_school@hotmail.co.th,www.dkk2.thaischool.in.th,องค์การบริหารส่วนตำบลพังขว้าง,042-747069,42747069,20/10/2476,12,10,ขนาดกลาง,มีไฟฟ้า,15,220,8,21 กรกฎาคม 2562 เวลา 16:41:11 น.
