99,1057120420,57020145,120420,บ้านทุ่งพร้าว (เพ็คกี้ฮิทค็อก),Ban Thoong Prao School (Peky Hitchcock),นายวิชา สมบุญ,อนุบาล-มัธยมศึกษาตอนต้น,,หมู่ 7 บ้านทุ่งพร้าว,วาวี,แม่สรวย,เชียงราย,57180,thoongprao2@gmail.com,www.thoongprao.ac.th,วาวี,652798294,-,14/02/2514,39.6,17,ขนาดกลาง,มีไฟฟ้า,21,224,11,21 มกราคม 2563 เวลา 14:44:56 น.
100,1057120421,57020146,120421,บ้านแสนเจริญ,sanjareanschool,นางอุทัยทิพย์ จันต๊ะวงษ์,อนุบาล-ประถมศึกษา,,หมู่ 10 แสนเจริญ,วาวี,แม่สรวย,เชียงราย,57180,sanjareansc@gmai.com,,องค์การบริหารส่วนตำบลวาวี,093-3104176,,2525,30,12,ขนาดเล็ก,มีไฟฟ้า,7,72,6,09 มกราคม 2563 เวลา 15:47:22 น.
101,1057120422,57020147,120422,บ้านดอยช้าง,Ban Doichang,นายสวง กองจักร,อนุบาล-มัธยมศึกษาตอนต้น,,หมู่ 26 ดอยช้าง,วาวี,แม่สรวย,เชียงราย,57180,doichangschool@gmail.com,www.doichangschool.ac.th,วาวี,53160844,53160844,2488,55,30,ขนาดกลาง,มีไฟฟ้า,38,563,26,22 มกราคม 2563 เวลา 12:03:56 น.
102,1057120423,57020148,120423,บ้านห้วยมะซาง,huaimasangschool,นายเอนก กันหา,อนุบาล-ประถมศึกษา,,หมู่ 5 ห้วยมะซาง,วาวี,แม่สรวย,เชียงราย,57180,huaimasangschool@gmail.com,-,วาวี,052-029356,-,2525,42,19,ขนาดกลาง,มีไฟฟ้า,19,272,11,27 มิถุนายน 2562 เวลา 13:37:27 น.
103,1057120425,57020149,120425,บ้านห้วยขี้เหล็ก,Ban Huai Khilek,-,อนุบาล-ประถมศึกษา,,หมู่ 9 ห้วยขี้เหล็ก,วาวี,แม่สรวย,เชียงราย,57180,hkl9ms50@gmail.com,,วาวี,53160137,,16 มิถุนายน 2524,51,25,ขนาดเล็ก,มีไฟฟ้า,0,0,0,02 กรกฎาคม 2558 เวลา 11:00:21 น.
104,1057120401,57020150,120401,ศรีถ้อยสุนทรราษฎร์วิทยา,sritoysoontornratwittayaschool,นายภิญโญ ยอดกระโทก,อนุบาล-มัธยมศึกษาตอนต้น,,หมู่ 7 บ้านทุ่งยาว,ศรีถ้อย,แม่สรวย,เชียงราย,57180,bansritoy@gmail.com,-,ตำบลศรีถ้อย,53602722,-,1 พ.ค. 2466,27,5,ขนาดกลาง,มีไฟฟ้า,15,150,11,27 มิถุนายน 2561 เวลา 14:50:17 น.
105,1057120402,57020151,120402,บ้านห้วยเฮี้ย,banhuayhia,นายอุดม บุญทา,อนุบาล-ประถมศึกษา,,หมู่ 5 บ้านห้วยเฮี้ย,ศรีถ้อย,แม่สรวย,เชียงราย,57180,huayhia@gmail.com,-,ศรีถ้อย,53605929,-,07/04/2570,43,10,ขนาดกลาง,มีไฟฟ้า,13,121,9,10 กรกฎาคม 2562 เวลา 10:50:12 น.
106,1057120403,57020152,120403,บ้านแม่ยางมิ้น,maeyangminshool,นายบัญชร เตปินยะ,อนุบาล-ประถมศึกษา,,หมู่ 11 บ้านสันติ,ศรีถ้อย,แม่สรวย,เชียงราย,57180,maeyangmin@gmail.com,maeyangmin.com,ศรีถ้อย,53160073,-,พ.ศ.2525,46.3,12,ขนาดเล็ก,มีไฟฟ้า,11,110,9,16 สิงหาคม 2562 เวลา 14:39:28 น.
107,1057120405,57020153,120405,เวียงผาวิทยา,wiangphawittaya,นายนิเรก หอมรส,อนุบาล-มัธยมศึกษาตอนต้น,,หมู่ 6 พญากองดี,ศรีถ้อย,แม่สรวย,เชียงราย,57180,wiangpha@gmail.com,http://wiangpha.ac.th,ศรีถ้อย,096-5505570,,๒๐ กันยายน พ.ศ. ๒๕๓๑,49,27,ขนาดใหญ่,มีไฟฟ้า,23,581,28,05 มิถุนายน 2561 เวลา 12:06:14 น.
108,1057120481,57020154,120481,บ้านสัน,Bansun,ว่าที่ร.ต.มงคล กันติ๊บ,อนุบาล-ประถมศึกษา,,หมู่ 3 บ้านสัน,บ้านโป่ง,เวียงป่าเป้า,เชียงราย,57170,bansun98@gmail.com,,บ้านโป่ง,861152198,,2500,72,6,ขนาดเล็ก,มีไฟฟ้า,5,66,9,31 กรกฎาคม 2560 เวลา 14:37:27 น.
109,1057120482,57020155,120482,บ้านลังกา,Baanlungka,นายชูเกียรติ เมืองงาม,อนุบาล-ประถมศึกษา,,หมู่ 4 ลังกา,บ้านโป่ง,เวียงป่าเป้า,เชียงราย,57170,lungka85@gmail.com,http://data.bopp-obec.info/web/index.php?School_ID=1057120482,บ้านโป่ง,53781222,,30 เมษายน 2498,70,5,ขนาดเล็ก,มีไฟฟ้า,8,71,8,21 มกราคม 2563 เวลา 14:22:08 น.
110,1057120483,57020156,120483,บ้านโป่งเทวี,pongtewee,นายอิ่นคำ ใจกันทะ,อนุบาล-มัธยมศึกษาตอนต้น,,หมู่ 5 บ้านโป่ง,บ้านโป่ง,เวียงป่าเป้า,เชียงราย,57170,pongtewee@gmail.com,,บ้านโป่ง,53782111,53782111,2464,70,5,ขนาดกลาง,มีไฟฟ้า,24,210,12,11 มิถุนายน 2562 เวลา 09:46:47 น.
111,1057120492,57020157,120492,บ้านป่าตึง,patungschool,นายพงษ์ศักดิ์ ภัทรพาณิชย์กุล,อนุบาล-ประถมศึกษา,,หมู่ 5 ป่าตึง,บ้านโป่ง,เวียงป่าเป้า,เชียงราย,57170,ptschool54@gmail.com,-,บ้านโป่ง,52029386,-,16 ต.ค. 2530,84,18,ขนาดเล็ก,มีไฟฟ้า,9,89,8,25 พฤศจิกายน 2562 เวลา 16:08:09 น.
112,1057120493,57020158,120493,บ้านห้วยหินลาดใน,school hinladnai,นายถวิล วงษา,อนุบาล-ประถมศึกษา,,หมู่ 7 บ้านห้วยหินลาดใน,บ้านโป่ง,เวียงป่าเป้า,เชียงราย,57170,hinladnai@gmail.com,,-,-,,12 พฤษภาคม 2530,105,20,ขนาดเล็ก,ไม่มีไฟฟ้า,6,25,8,23 มิถุนายน 2562 เวลา 13:05:47 น.
113,1057120484,57020160,120484,บ้านป่าสัก,pasak,นายฤทธิไกร ใจคำ,อนุบาล-ประถมศึกษา,,หมู่ 2 ป่าสัก,ป่างิ้ว,เวียงป่าเป้า,เชียงราย,57170,pasak5@gmail.com,-,ป่างิ้ว,531821971,-,30 พฤศจิกายน 2442,74,15,ขนาดเล็ก,มีไฟฟ้า,6,81,8,16 สิงหาคม 2562 เวลา 16:06:02 น.
114,1057120485,57020161,120485,บ้านฮ่างต่ำ,Banhangtum,นายชูชาติ ชัยศรี,อนุบาล-ประถมศึกษา,,หมู่ 12 ฮ่างต่ำเหนือ,ป่างิ้ว,เวียงป่าเป้า,เชียงราย,57170,htschool5@gmail.com,www.hangtamschool.ac.th,ป่างิ้ว,,,4 มิถุนาย 2482,80,10,ขนาดกลาง,มีไฟฟ้า,21,244,11,31 มกราคม 2563 เวลา 09:13:31 น.
115,1057120488,57020164,120488,ป่างิ้ววิทยา,Pa-Ngiu Wittaya,นายบุญฤทธิ์ ภู่ไพศาล,อนุบาล-มัธยมศึกษาตอนต้น,,หมู่ 1 ป่างิ้ว,ป่างิ้ว,เวียงป่าเป้า,เชียงราย,57170,png.wit@gmail.com,www.Png-wit.ac.th,เทศบาลตำบลป่างิ้ว,083-2752325,-,1 พฤษภาคม 2464,72,6,ขนาดกลาง,มีไฟฟ้า,21,303,13,01 กุมภาพันธ์ 2563 เวลา 14:49:42 น.
116,1057120509,57020167,120509,ไทยรัฐวิทยา ๓๒(บ้านสาขันหอม),thairathwitya๓๒,นางสาวนฤมล เกิดมูล,อนุบาล-มัธยมศึกษาตอนต้น,,หมู่ 3 สา,แม่เจดีย์,เวียงป่าเป้า,เชียงราย,57260,thairat32@gmail.com,-,แม่เจดีย์,53789353,-,2481,85,15,ขนาดกลาง,มีไฟฟ้า,21,191,13,31 มกราคม 2563 เวลา 18:17:26 น.
117,1057120510,57020168,120510,อนุบาลแม่ขะจาน,Anuban Mae Kha Chan,นายทวี กันทะ,อนุบาล-ประถมศึกษา,,หมู่ 1 แม่ขะจาน,แม่เจดีย์,เวียงป่าเป้า,เชียงราย,57260,mkcschool@gmail.com,data.bopp-obec.info/web/?School_ID=1057120510,แม่ขะจาน,53789464,-,-,80,15,ขนาดกลาง,มีไฟฟ้า,12,256,13,01 พฤศจิกายน 2562 เวลา 10:26:06 น.
118,1057120511,57020169,120511,บ้านป่าแงะ,Banpangae School,นางพัฒนา กิติลือ,อนุบาล-ประถมศึกษา,,หมู่ 109/1 หมู่ 5 ป่าแงะ,แม่เจดีย์,เวียงป่าเป้า,เชียงราย,57260,pangae01wpp@gmail.com,data.bopp-obec.info/web/index.php?School_ID=1057120511,แม่เจดีย์,"081-0313582,093-3026788",,พ.ศ.2513,90,15,ขนาดเล็ก,มีไฟฟ้า,7,42,8,31 มกราคม 2563 เวลา 11:52:19 น.
119,1057120512,57020170,120512,บ้านทุ่งยาว,bantungyao,นายเศกสรรพ์ มณีรัตน์,อนุบาล-ประถมศึกษา,,หมู่ 7 ทุ่งยาว,แม่เจดีย์,เวียงป่าเป้า,เชียงราย,57260,tungyao4@gmail.com,data.bopp-obec.info/web/?School_ID=1057120512,แม่เจดีย์,910717989,,01/05/2512,110,50,ขนาดเล็ก,มีไฟฟ้า,7,28,8,24 มิถุนายน 2562 เวลา 10:36:25 น.
120,1057120513,57020171,120513,ปางมะกาดวิทยา,pangmakad,นายสุวิต ชอบจิต,อนุบาล-มัธยมศึกษาตอนต้น,,หมู่ 8 ปางมะกาด,แม่เจดีย์,เวียงป่าเป้า,เชียงราย,57260,pangmakad@gmail.com,https://data.bopp-obec.info/web/index_view.php?School_ID=1057120513&page=info,แม่เจดีย์,864309521,-,1/5/2500,117,68,ขนาดเล็ก,มีไฟฟ้า,12,92,11,17 มกราคม 2563 เวลา 10:52:07 น.
121,1057120506,57020172,120506,บ้านห้วยโป่ง,huaipong,นายสุรินทร์ กิติลือ,อนุบาล-ประถมศึกษา,,หมู่ 13 ห้วยโป่ง,แม่เจดีย์ใหม่,เวียงป่าเป้า,เชียงราย,57260,huaipong@gmail.com,,แม่เจดีย์ใหม่,53727292,,3 กรกฎาคม 2530,108,34,ขนาดเล็ก,มีไฟฟ้า,9,61,8,28 มกราคม 2563 เวลา 12:04:04 น.
122,1057120507,57020173,120507,บ้านห้วยม่วง,banhuaimuang,นางสาวพุธดา ชัยชมภู,อนุบาล-ประถมศึกษา,,หมู่ 10 ห้วยม่วง,แม่เจดีย์ใหม่,เวียงป่าเป้า,เชียงราย,57260,huaimuang@gmail.com,https://data.bopp-obec.info/emis/schooldata-view.php?School_ID=1057120507&Area_CODE=5702,แม่เจดีย์ใหม่,899556969,,มิ.ย. 2532,110,35,ขนาดเล็ก,มีไฟฟ้า,6,106,8,24 มิถุนายน 2562 เวลา 13:24:40 น.
123,1057120502,57020174,120502,บ้านปางอ่ายห้วยชมภู,banpangaihuaichompoo,นายประยูร สุจริง,อนุบาล-มัธยมศึกษาตอนต้น,,หมู่ 4 ปางอ่าย,แม่เจดีย์ใหม่,เวียงป่าเป้า,เชียงราย,57260,banpangai@gmail.com,banpangai.wordpress.com,แม่เจดีย์ใหม่,53679297,53679297,2499,96,25,ขนาดเล็ก,มีไฟฟ้า,12,110,12,24 พฤษภาคม 2561 เวลา 13:12:15 น.
124,1057120503,57020175,120503,โป่งน้ำร้อนวิทยา,pongnamronwittaya,นายทวีชาติ พันธ์สกูล,อนุบาล-มัธยมศึกษาตอนต้น,,หมู่ 6 โป่งน้ำร้อน,แม่เจดีย์ใหม่,เวียงป่าเป้า,เชียงราย,57260,pongnamwittaya@gmail.com,http://data.bopp-obec.info/web/index_kru.php?School_ID=1057120503,แม่เจดีย์ใหม่,53679035,53679035,1 มิถุนายน 2482,98,31,ขนาดเล็ก,มีไฟฟ้า,18,197,11,11 มิถุนายน 2562 เวลา 15:15:54 น.
125,1057120504,57020176,120504,บ้านเมืองน้อย(นิมมานเหมินทานุสรณ์),muangnoi,นายจรูญ ปาต๊ะ,อนุบาล-ประถมศึกษา,,หมู่ 8 เมืองน้อย,แม่เจดีย์ใหม่,เวียงป่าเป้า,เชียงราย,57260,muangnoi@hotmail.com,,แม่เจดีย์ใหม่,053-160157,,20 มิถุนายน 2520,115,41,ขนาดกลาง,มีไฟฟ้า,10,125,8,10 กรกฎาคม 2562 เวลา 15:41:57 น.
126,1057120505,57020177,120505,บ้านขุนลาว,khunlaw,นายชัยวัฒน์ สกุลวิไล,อนุบาล-ประถมศึกษา,,หมู่ 7 ขุนลาว,แม่เจดีย์ใหม่,เวียงป่าเป้า,เชียงราย,57260,khunlaw@gmail.com,https://data.bopp-obec.info/web/?School_ID=1057120505,แม่เจดีย์ใหม่,-,-,27 พ.ค. 2497,108,50,ขนาดเล็ก,มีไฟฟ้า,6,30,8,31 ตุลาคม 2562 เวลา 11:20:06 น.
127,1057120500,57020178,120500,บ้านแม่เจดีย์,Banmaejadee,นายดิลก ผ่องอักษร,อนุบาล-ประถมศึกษา,,หมู่ 3 แม่เจดีย์,แม่เจดีย์ใหม่,เวียงป่าเป้า,เชียงราย,57260,banmaechedi@gmail.com,,แม่เจดีย์ใหม่,53679089,,1 พ.ค. 2483,92,20,ขนาดเล็ก,มีไฟฟ้า,2,0,0,22 มิถุนายน 2559 เวลา 12:16:31 น.
128,1057120501,57020179,120501,บ้านโฮ่ง,banhong,นายสมจิต จันต๊ะบุญ,อนุบาล-มัธยมศึกษาตอนต้น,,หมู่ 1 บ้านโฮ่ง,แม่เจดีย์ใหม่,เวียงป่าเป้า,เชียงราย,57260,banhong87@gmail.com,,แม่เจดีย์ใหม่,53679276,53679276,2466,93,25,ขนาดกลาง,มีไฟฟ้า,17,121,11,01 พฤศจิกายน 2562 เวลา 10:55:44 น.
129,1057120474,57020180,120474,อนุบาลเวียงป่าเป้า,anubanweangpapao,นายวิโรจน์ มหาวรรณ,อนุบาล-ประถมศึกษา,,หมู่ 2 ในเวียง,เวียง,เวียงป่าเป้า,เชียงราย,57170,wppschool2@gmail.com,awp.cri2.go.th/,เทศบาลตำบลเวียงป่าเป้า,53781458,53781458,,71.4,3,ขนาดกลาง,มีไฟฟ้า,29,600,26,26 มิถุนายน 2562 เวลา 11:05:17 น.
130,1057120475,57020181,120475,ชุมชนบ้านกู่(ป่าเป้าประชานุเคราะห์),chumchonbankou school,นายสุมน ถาเตรียม,อนุบาล-ประถมศึกษา,,หมู่ 11 บ้านกู่,เวียง,เวียงป่าเป้า,เชียงราย,57170,chumchonbankou@gmail.com,,ตำบลเวียง,-,-,30 พ.ย. 2442,69,1,ขนาดกลาง,มีไฟฟ้า,15,158,10,22 มกราคม 2563 เวลา 08:21:55 น.
131,1057120476,57020182,120476,บ้านหนองยาว,Nhongyao school,นายธีรพล เกียรติเจริญ,อนุบาล-ประถมศึกษา,,หมู่ 4 หนองยาว,เวียง,เวียงป่าเป้า,เชียงราย,57170,nhongyao@gmail.com,data.bopp-obec.info/web/?School_ID=1057120476,เวียง,53649042,-,1 พฤษภาคม 2464,67,2,ขนาดกลาง,มีไฟฟ้า,13,127,9,09 กรกฎาคม 2562 เวลา 12:58:35 น.
132,1057120479,57020183,120479,ดอยเวียงผาพิทยา,doiwiangphapittaya,นายพิษณุกร แก้วนาค,อนุบาล-มัธยมศึกษาตอนต้น,,หมู่ 9 แม่ปูนล่าง,เวียง,เวียงป่าเป้า,เชียงราย,57170,doiwiangphapittaya@gmail.com,,ตำบลเวียง,53160898,-,12 ธันวาคม 2532,73,17,ขนาดกลาง,มีไฟฟ้า,23,414,17,13 ธันวาคม 2562 เวลา 02:27:57 น.
133,1057120490,57020184,120490,บ้านแม่ปูนหลวง,school maepoonluang,นายจิตร์สุรโชติ สิงห์แก้ว,อนุบาล-มัธยมศึกษาตอนต้น,,หมู่ 8 แม่ปูนหลวง,เวียง,เวียงป่าเป้า,เชียงราย,57170,mapoon11@gmail.com,-,-,861914010,-,4 เมษายน 2522,155,50,ขนาดกลาง,มีไฟฟ้า,24,287,13,10 กรกฎาคม 2562 เวลา 09:39:10 น.
134,1057120498,57020186,120498,เวียงกาหลงวิทยา,wianggalongwittaya,นายสงกรานต์ พรมมินทร์,อนุบาล-มัธยมศึกษาตอนต้น,,หมู่ 10 แม่ห่างเหนือ,เวียงกาหลง,เวียงป่าเป้า,เชียงราย,57260,wianggalong.wit@gmail.com,-,เทศบาลตำบลเวียงกาหลง,,,ปี พ.ศ. 2481,78,12,ขนาดกลาง,มีไฟฟ้า,17,125,11,21 มกราคม 2563 เวลา 15:56:58 น.
135,1057120499,57020187,120499,บ้านป่าจั่น,Banpajun,นางปรานอม จรเกตุ,อนุบาล-ประถมศึกษา,,หมู่ 7 ป่าจั่น,เวียงกาหลง,เวียงป่าเป้า,เชียงราย,57260,prajun93@gmail.com,http://data.bopp-obec.info/web/index_view.php?School_ID=1057120499&page=info,เวียงกาหลง,-,-,1 พ.ค. 2500,82,15,ขนาดเล็ก,มีไฟฟ้า,11,97,9,31 ตุลาคม 2562 เวลา 10:53:00 น.
136,1057120495,57020188,120495,บ้านสันมะเค็ดสันขี้เหล็กหัวฝายพัฒนา,Bansanmaked sankheelel huafaipattana school,นายสิทธิศักดิ์ สมใจมาก,อนุบาล-ประถมศึกษา,,หมู่ 1 สันมะเค็ด,เวียงกาหลง,เวียงป่าเป้า,เชียงราย,57260,sanmaked@gmail.com,,เทศบาลตำบลเวียงกาหลง,53952249,53952249,,90,15,ขนาดเล็ก,มีไฟฟ้า,8,97,9,23 มิถุนายน 2562 เวลา 13:25:03 น.
137,1057120496,57020189,120496,โรงเรียนบ้านทุ่งม่าน,thungman school,นายจัตุพล นันทโภคิน,อนุบาล-มัธยมศึกษาตอนต้น,,หมู่ 3 ทุ่งม่าน,เวียงกาหลง,เวียงป่าเป้า,เชียงราย,57260,thungman@gmail.com,,,53789354,53789354,,82,15,ขนาดกลาง,มีไฟฟ้า,19,174,12,17 มิถุนายน 2562 เวลา 15:15:55 น.
138,1057120497,57020190,120497,บ้านดงป่าส้านใหม่เจริญ,Dongpasanmaijarern,นายสมบุญ เสาร์ปา,อนุบาล-ประถมศึกษา,,หมู่ 14 ใหม่เจริญ,เวียงกาหลง,เวียงป่าเป้า,เชียงราย,57260,dongpasan@gmail.com,http://data.bopp-obec.info/web/?School_ID=1057120497,เทศบาลตำบลเวียงกาหลง,947099119,,1 พฤษภาคม 2481,90,20,ขนาดเล็ก,มีไฟฟ้า,11,56,9,15 มกราคม 2563 เวลา 14:20:36 น.
139,1057120473,57020191,120473,บ้านเด่นศาลา,bandensala,นายอุดร สมฤทธิ์,อนุบาล-ประถมศึกษา,,หมู่ 3 เด่นศาลา,เวียง,เวียงป่าเป้า,เชียงราย,57170,bandensala@gmail.com,,สันสลี,810218249,,,62,3,ขนาดกลาง,มีไฟฟ้า,13,219,11,11 ธันวาคม 2562 เวลา 14:16:55 น.
140,1057120477,57020192,120477,แม่ตะละวิทยา,maetalawittaya,นายรชฏ อิ่นคำ,อนุบาล-มัธยมศึกษาตอนต้น,,หมู่ 7 แม่ตะละ,สันสลี,เวียงป่าเป้า,เชียงราย,57170,banmaetala@gmail.com,www.facebook.com/meatalaschool/,สันสลี,989428912,-,2520,63,22,ขนาดกลาง,ไม่มีไฟฟ้า,16,144,11,23 มิถุนายน 2562 เวลา 13:04:25 น.
141,1057120478,57020193,120478,บ้านปางมะขามป้อม,Banpangmakhampom,นายศักดา อะทะจา,อนุบาล-ประถมศึกษา,,หมู่ 8 บ้านปางมะขามป้อม,สันสลี,เวียงป่าเป้า,เชียงราย,57170,makam.cri2@gmail.com,data.bopp-obec.info/web/?School_ID=1057120478,สันสลี,895528933,-,2532,70,21,ขนาดเล็ก,ไม่มีไฟฟ้า,6,22,8,22 มกราคม 2563 เวลา 10:18:39 น.
142,1057120480,57020194,120480,บ้านโป่งนก,pongnokschool,นายสนิท สายปินตา,อนุบาล-มัธยมศึกษาตอนต้น,,หมู่ 6 โป่งนก,สันสลี,เวียงป่าเป้า,เชียงราย,57170,pongnokschool@gmail.com,,องค์การบริหารส่วนตำบลสันสลี,53781366,53781366,2533,65,14,ขนาดกลาง,มีไฟฟ้า,22,285,12,31 มกราคม 2563 เวลา 09:37:06 น.
143,1057120470,57020195,120470,บ้านโป่งเหนือ,pongnuaschool,นายทวี จันทร์เขียว,อนุบาล-มัธยมศึกษาตอนต้น,,หมู่ 1 โป่งเหนือ,สันสลี,เวียงป่าเป้า,เชียงราย,57170,pongnuaschool@gmail.com,,องค์การบริหารส่วนตำบลสันสลี,53602556,,0,57,8,ขนาดกลาง,มีไฟฟ้า,18,168,11,31 มกราคม 2563 เวลา 16:14:31 น.
144,1057120471,57020196,120471,ทุ่งห้าราษฏร์สามัคคีวิทยา,Tungharajsamukkeewittaya school,นายบุญธรรม บุญมา,อนุบาล-มัธยมศึกษาตอนต้น,,หมู่ 2 ทุ่งห้า,สันสลี,เวียงป่าเป้า,เชียงราย,57170,tungharaj.wit@gmail.com,,สันสลี,53605506,-,2483,64,8,ขนาดกลาง,มีไฟฟ้า,18,128,12,20 มกราคม 2563 เวลา 09:43:10 น.
