1,1057120247,57020001,120247,เจริญเมืองวิทยา,๋่Jaroen Muang Wittaya,นายสงกรานต์ ตั๋นคำ,อนุบาล-ประถมศึกษา,,หมู่ 14 เจริญเมือง,เจริญเมือง,พาน,เชียงราย,57120,jmvsch@gmail.com,,เจริญเมือง,53738356,,พ.ศ. 2481,17,7,ขนาดกลาง,มีไฟฟ้า,12,100,8,30 มกราคม 2563 เวลา 11:44:34 น.
2,1057120248,57020002,120248,บ้านเจริญเมือง,Banjaroenmaung,นายประเสริฐ คำน้อย,อนุบาล-ประถมศึกษา,,หมู่ 19 บ้านศรีทรายทอง,เจริญเมือง,พาน,เชียงราย,57120,crm-phan@hotmail.com,-,เจริญเมือง,53738258,-,15 มิถุนายน พ.ศ.2510,19,9,ขนาดเล็ก,มีไฟฟ้า,4,37,8,24 พฤษภาคม 2561 เวลา 13:02:17 น.
3,1057120249,57020003,120249,บ้านป่าตึง,phatoung,-,อนุบาล-ประถมศึกษา,,หมู่ 5 บ้านป่าตึง,เจริญเมือง,พาน,เชียงราย,57120,Jervon0105@obecmail.obec.go.th,,เจริญเมือง,53738264,,พ.ศ.2508,22,14,ขนาดเล็ก,มีไฟฟ้า,1,49,8,25 มิถุนายน 2561 เวลา 14:16:36 น.
4,1057120250,57020004,120250,บ้านป่าบง,BanPabong,นายมานพ เลี่ยมสุวรรณ,อนุบาล-มัธยมศึกษาตอนต้น,,หมู่ 9 บ้านป่าบง,เจริญเมือง,พาน,เชียงราย,57120,Jervon0105@obecmail.obec.go.th,phabong.cri2.go.th,เจริญเมือง,53738252,,2482,25,12,ขนาดกลาง,มีไฟฟ้า,17,152,11,12 ธันวาคม 2562 เวลา 09:37:12 น.
5,1057120302,57020005,120302,บ้านสิบสอง,bansibsong,จ.ส.อ.สงวน มาลัย,อนุบาล-ประถมศึกษา,,หมู่ 1 สันทราย,ดอยงาม,พาน,เชียงราย,57120,bansibsong@gmail.com,https://data.bopp-obec.info/web/?School_ID=1057120302,องค์การบริหารส่วนตำบลดอยงาม,53186089,,1 มิถุนายน 2508,30.4,13,ขนาดเล็ก,มีไฟฟ้า,3,38,9,21 มกราคม 2563 เวลา 16:14:41 น.
6,1057120303,57020006,120303,บ้านจำคาวตอง,JUMKOWATHONG,-,อนุบาล-ประถมศึกษา,,หมู่ 2 จำคาวตอง,ดอยงาม,พาน,เชียงราย,57120,jumkowathong@gmail.com,http://data.bopp-obec.info/web/index_view.php?School_ID=1057120303,ดอยงาม,53605223,,พ.ศ.2586,31.9,16.6,ขนาดเล็ก,มีไฟฟ้า,2,12,5,26 มิถุนายน 2562 เวลา 09:34:23 น.
7,1057120304,57020007,120304,สันหนองควาย,Sunnongkwai,นายเกศ ปาณะการ,อนุบาล-มัธยมศึกษาตอนต้น,,หมู่ 4 สันหนองควาย,ดอยงาม,พาน,เชียงราย,57120,snk2551@gmail.com,snk.cri2.go.th/,ดอยงาม,53185607,53185607,พุทธศักราช 2482,31.5,10,ขนาดเล็ก,มีไฟฟ้า,9,42,10,23 มิถุนายน 2562 เวลา 13:04:21 น.
8,1057120242,57020010,120242,ร่องธารวิทยา,Rongtharnwittaya,นางทองพูน ปัญจมา,อนุบาล-มัธยมศึกษาตอนต้น,,หมู่ 3 บ้านร่องธาร,ทรายขาว,พาน,เชียงราย,57120,rongtharn@gmail.com,http://rongtharn.cri2.go.th,อบต.ทรายขาว,0-5318-6788,0-5318-6788,1 มิถุนายน พ.ศ.2481,13.2,23,ขนาดกลาง,มีไฟฟ้า,16,194,11,30 ตุลาคม 2562 เวลา 22:58:50 น.
9,1057120245,57020013,120245,บ้านโป่งแดง,Banpongdang,นายชัย สันกว๊าน,อนุบาล-มัธยมศึกษาตอนต้น,,หมู่ 12 บ้านโป่งแดง,ทรายขาว,พาน,เชียงราย,57120,pongdang2008@gmail.com,data.bopp-obec.info/web/?School_ID=1057120245,ทรายขาว,53958086,53958086,2494,12,10,ขนาดกลาง,มีไฟฟ้า,14,167,11,30 มกราคม 2563 เวลา 15:49:13 น.
10,1057120282,57020017,120282,ทานตะวันวิทยา(ห้วยบง-ดงเจริญ),tantawanwittaya school,นางวรวีร์ ด่านทอง,อนุบาล-มัธยมศึกษาตอนต้น,,หมู่ 7 ห้วยบง,ทานตะวัน,พาน,เชียงราย,57280,tantawan.school@gmail.com,data.bopp-obec.info/web/?School_ID=1057120282,อบต.ทานตะวัน,53762100,-,4 กันยายน 2497,40,20,ขนาดเล็ก,มีไฟฟ้า,12,80,12,23 มิถุนายน 2562 เวลา 13:19:44 น.
11,1057120239,57020021,120239,ธารทองวิทยา(ป่ารวก),Tantongwittaya,นายกวงจักร์ จันต๊ะคาด,อนุบาล-มัธยมศึกษาตอนต้น,,หมู่ 9 ป่ารวกใต้,ธารทอง,พาน,เชียงราย,57250,tantongwit@gmail.com,,ธารทอง,53666844,53666844,พ.ศ. 2483,13,20,ขนาดกลาง,มีไฟฟ้า,17,313,15,29 มกราคม 2563 เวลา 01:13:23 น.
12,1057120285,57020023,120285,ชุมชนบ้านทุ่งป่าแดด,toopardad,นายอภิสิทธิ์ ดำรงไทย,อนุบาล-ประถมศึกษา,,หมู่ 4 ทุ่งป่าแดด,ป่าหุ่ง,พาน,เชียงราย,57120,toopardad@gmail.com,,ป่าหุ่ง,53727324,,พ.ศ.2475,28,4,ขนาดเล็ก,มีไฟฟ้า,5,11,3,11 ธันวาคม 2562 เวลา 21:24:26 น.
13,1057120286,57020024,120286,บ้านป่าหัดป่าแขม,pahadpakam,นายเกศ ปาณะการ,อนุบาล-ประถมศึกษา,,หมู่ 2 ป่าหัด,ป่าหุ่ง,พาน,เชียงราย,57120,pahadpakamgmail.com,,ป่าหุ่ง,53676612,,1 มิถุนายน 2482,29,3,ขนาดเล็ก,มีไฟฟ้า,7,10,10,19 กันยายน 2560 เวลา 06:00:31 น.
14,1057120289,57020027,120289,บ้านศาลา,Bansala,-,อนุบาล-ประถมศึกษา,,หมู่ 14 ศาลาวังโค้ง,ป่าหุ่ง,พาน,เชียงราย,57120,bansala2@gmail.com,,ป่าหุ่ง,53676312,-,1 กุมภาพันธ์ 2463,25,5,ขนาดเล็ก,มีไฟฟ้า,5,28,6,19 กันยายน 2560 เวลา 06:18:57 น.
15,1057120290,57020028,120290,บ้านปางเกาะทราย,pangkosai,นายประสิทธิ์ จินะธรรม,ประถมศึกษา,,หมู่ 6 ปางเกาะทราย,ป่าหุ่ง,พาน,เชียงราย,57120,pangkosai2@gmail.com,data.bopp-obec.info/web/?School_ID=1057120290,อบต.ป่าหุ่ง,-,-,8 พฤษภาคม 2505,38.6,17.7,ขนาดเล็ก,มีไฟฟ้า,6,49,6,20 มกราคม 2563 เวลา 07:45:05 น.
16,1057120291,57020029,120291,ริมวัง ๑,rimvang 1,นายอมรชัย ปงลังกา,อนุบาล-ประถมศึกษา,,หมู่ 7 งิ้วเฒ่า,ป่าหุ่ง,พาน,เชียงราย,57120,rimvang1@gmail.com,data.bopp-obec.info/web/?School_ID=1057120291,ป่าหุ่ง,-,-,1 มิถุนายน 2508,48.4,24.4,ขนาดเล็ก,มีไฟฟ้า,6,31,7,16 สิงหาคม 2562 เวลา 09:30:13 น.
17,1057120292,57020030,120292,ริมวัง ๒,rimwang2,นายมานิตย์ แก้วกันธะ,อนุบาล-ประถมศึกษา,,หมู่ 8 ผาวี,ป่าหุ่ง,พาน,เชียงราย,57120,rimwang2@gmail.com,data.bopp-obec.info/web/index.php?School_ID=1057120292,อบต.ป่าหุ่ง,091-0795852,-,2506,58,29,ขนาดเล็ก,มีไฟฟ้า,3,22,8,05 มิถุนายน 2560 เวลา 11:22:10 น.
18,1057120269,57020034,120269,บ้านม่วงคำ,Muangkham school,นายศักดิ์ชัย กาวี,อนุบาล-ประถมศึกษา,,หมู่ 17 บ้านม่วงทอง,ม่วงคำ,พาน,เชียงราย,57120,maungkhamschool@gmail.com,https://data.bopp-obec.info/web/?School_ID=1057120269,ม่วงคำ,53721777,,พ.ศ.2470,30,8,ขนาดเล็ก,มีไฟฟ้า,10,84,8,16 สิงหาคม 2562 เวลา 14:22:01 น.
19,1057120270,57020035,120270,บ้านสันต้นผึ้ง,BanSantonpueng,-,อนุบาล-ประถมศึกษา,,หมู่ 7 สันต้นผึ้ง,ม่วงคำ,พาน,เชียงราย,57120,santonwoug@gmail.com,,ม่วงคำ,-,,วันที่ 1 กรกฎาคม พ.ศ. 2482,29,8,ขนาดเล็ก,มีไฟฟ้า,0,0,0,28 มิถุนายน 2561 เวลา 10:18:34 น.
20,1057120271,57020036,120271,บ้านฝั่งตื้น,BANFUNGTUEN,นายสมัย อิ่มอก,อนุบาล-ประถมศึกษา,,หมู่ 8 บ้านฝั่งตื้น,ม่วงคำ,พาน,เชียงราย,57120,banfungtuen@gmail.com,http://data.bopp-obec.info/web/?School_ID=1057120271,อบต.ม่วงคำ,861907383,,26 ธันวาคม 2489,35.7,7,ขนาดกลาง,มีไฟฟ้า,22,193,12,24 มิถุนายน 2562 เวลา 11:21:15 น.
21,1057120265,57020038,120265,บ้านหนองบัว,BANNONGBUA,นายวิธวิทย์ ทิพย์นพคุณ,อนุบาล-ประถมศึกษา,,หมู่ 20 บ้านหนองบัวใต้,เมืองพาน,พาน,เชียงราย,57120,nongbour@gmail.com,,เมืองพาน,53722657,,27/04/2484,25.2,1.5,ขนาดเล็ก,มีไฟฟ้า,9,61,8,05 มิถุนายน 2560 เวลา 11:19:49 น.
22,1057120266,57020039,120266,บ้านป่าส้าน,banpasan,ดร.เอก กนกพิชญ์กุล,อนุบาล-ประถมศึกษา,,หมู่ 21 บ้านป่าส้านทรายมูล,เมืองพาน,พาน,เชียงราย,57120,pasanchool50@gmail.com,-,เมืองพาน,53658844,-,2 กรกฎาคม 2482,26.4,3,ขนาดเล็ก,มีไฟฟ้า,3,48,8,13 ธันวาคม 2562 เวลา 08:18:41 น.
23,1057120264,57020042,120264,อนุบาลพาน(ป่ากว๋าวมิตรภาพที่ ๖๘),Phan Kindergarten,นางสาวลาภิสรา ภูวุฒิ,อนุบาล-ประถมศึกษา,,หมู่ 17 ป่ากว๋าวเหนือ,เมืองพาน,พาน,เชียงราย,57120,anubanphan1@gmail.com,,อบต.เมืองพาน,53721700,53721700,1 มีนาคม 2481,32,3,ขนาดกลาง,มีไฟฟ้า,15,186,8,23 มิถุนายน 2562 เวลา 19:02:15 น.
24,1057120256,57020043,120256,พานพสกสวัสดิ์,phanpasoksawad,นายศรีวรรณ เชื้อเมืองพาน,อนุบาล-ประถมศึกษา,,หมู่ 1 บ้านเด่น,เมืองพาน,พาน,เชียงราย,57120,phanpasoksawad@gmail.com,www.ppsw.ac.th,เทศบาลตำบลเมืองพาน,53722139,53722139,1/5/2468,24,0.5,ขนาดใหญ่,มีไฟฟ้า,51,833,28,01 พฤศจิกายน 2562 เวลา 14:15:38 น.
25,1057120275,57020044,120275,ปูแกง(อินทราราษฎร์อุปถัมภ์),pukaeng (Intraratuppatham) school,นายสฤษดิ์ ตาคำ,อนุบาล-มัธยมศึกษาตอนต้น,,หมู่ 9 สุขสันติ,แม่เย็น,พาน,เชียงราย,57280,pukeangschool@gmail.com,,อบต.แม่เย็น,53957306,53957306,2471,34.2,11.4,ขนาดกลาง,มีไฟฟ้า,24,327,13,20 กรกฎาคม 2562 เวลา 15:32:47 น.
26,1057120293,57020049,120293,บ้านจำผักกูดทรายทอง,champakkutchaitong,นายเจริญศักดิ์ คำพุฒ,อนุบาล-ประถมศึกษา,,หมู่ 5 จำผักกูด,แม่อ้อ,พาน,เชียงราย,57120,champakkut@gmail.com,,แม่อ้อ,53605294,,1 พฤษภาคม 2500,30.8,16,ขนาดเล็ก,มีไฟฟ้า,3,5,4,17 มกราคม 2563 เวลา 14:05:26 น.
27,1057120294,57020050,120294,โป่งทะลายใหม่เจริญ,Pongtalaimaijarern,นายประพันธ์ ไทยกรรณ์,อนุบาล-ประถมศึกษา,,หมู่ 4 ้โป่งทะลาย,แม่อ้อ,พาน,เชียงราย,57120,pongtalai@gmail.com,https://data.bopp-obec.info/web/?School_ID=1057120294,แม่อ้อ,53671210,-,1 เมษายน 2486,35,23,ขนาดเล็ก,มีไฟฟ้า,6,32,9,23 มิถุนายน 2562 เวลา 13:19:37 น.
28,1057120295,57020051,120295,บ้านแม่แก้วเด่นชัย,Banmaekaewdenchai,-,อนุบาล-ประถมศึกษา,,หมู่ 9 เด่นชัย,แม่อ้อ,พาน,เชียงราย,57120,phandenchai4@gmail.com,data.bopp-obec.info/web/?School_ID=1057120295,อบต.แม่อ้อ,53671018,-,พ.ศ.2518,50,20,ขนาดเล็ก,มีไฟฟ้า,4,10,5,27 มิถุนายน 2561 เวลา 12:58:20 น.
29,1057120297,57020053,120297,แม่อ้อประชารัฐ,mae oo pracharath,นายสันต์ คำมะนาม,อนุบาล-ประถมศึกษา,,หมู่ 19 แม่แก้ว,แม่อ้อ,พาน,เชียงราย,57120,maekaew@gmail.com,www.Maekaew.th.gs,แม่อ้อ,53671636,53671636,01/05/2471,40,25,ขนาดเล็ก,มีไฟฟ้า,12,145,9,23 มิถุนายน 2562 เวลา 13:00:45 น.
30,1057120298,57020054,120298,บ้านแม่แก้วใต้,BANMAEKAEWTAI,นายเชษฐ์สาทร อินทา,อนุบาล-ประถมศึกษา,,หมู่ 14 แม่แก้วรุ่งเรือง,แม่อ้อ,พาน,เชียงราย,57120,maekeawtai@gmail.com,https://data.bopp-obec.info/web/?School_ID=1057120298,องค์การบริหารส่วนตำบลแม่อ้อ,53671208,-,17 สิงหาคม พ.ศ.2497,40,18,ขนาดเล็ก,มีไฟฟ้า,6,28,8,23 มิถุนายน 2562 เวลา 13:20:10 น.
31,1057120299,57020056,120299,บ้านแม่อ้อนอก,banmaeoonok,นายกิตติ โพธิสิทธิ์,อนุบาล-ประถมศึกษา,,หมู่ 13 สันป่าเมา,แม่อ้อ,พาน,เชียงราย,57120,maeoonok@gmail.com,,แม่อ้อ,53605110,,1922,42,27,ขนาดเล็ก,มีไฟฟ้า,12,106,9,31 มกราคม 2563 เวลา 18:21:30 น.
32,1057120316,57020058,120316,เวียงห้าววิทยา,wianghaowittaya school,นายประเมต นันตาเครือ,อนุบาล-มัธยมศึกษาตอนต้น,,หมู่ 7 ร่มโพธิ์งาม,เวียงห้าว,พาน,เชียงราย,57120,wianghao@gmail.com,wianghaowittaya.cri2.go.th,อบต.เวียงห้าว,53605145,,พ.ศ. 2485,38,15,ขนาดเล็ก,มีไฟฟ้า,10,111,11,25 มิถุนายน 2562 เวลา 08:29:18 น.
33,1057120255,57020061,120255,บ้านแม่คาวหลวง,Banmaekawloung,-,อนุบาล-ประถมศึกษา,,หมู่ 15 บ้านแม่คาวดวงดี,สันกลาง,พาน,เชียงราย,57120,maekawloung@gmail.com,-,สันกลาง,53770223,-,12 พฤษภาคม 2484,23.7,15,ขนาดเล็ก,มีไฟฟ้า,0,0,0,30 สิงหาคม 2560 เวลา 05:48:23 น.
34,1057120253,57020062,120253,สันกลางวิทยา,Sanklangvittaya School,นายธวัท ธรรมสิทธิ์,อนุบาล-มัธยมศึกษาตอนต้น,,หมู่ 4 บ้านป่าข่า,สันกลาง,พาน,เชียงราย,57120,Sanklangvittaya9@gmail.com,,สันกลาง,934383322,-,1 กันยายน 2483,25,8,ขนาดกลาง,มีไฟฟ้า,19,166,12,21 มกราคม 2563 เวลา 09:17:43 น.
35,1057120254,57020063,120254,บ้านถ้ำ,bantum,-,อนุบาล-ประถมศึกษา,,หมู่ 3 บ้านถ้ำ,สันกลาง,พาน,เชียงราย,57120,bantum8@gmail.com,htrtp://members.thai.ne,สันกลาง,979745131,-,11/05/2484,27.7,12,ขนาดเล็ก,มีไฟฟ้า,10,92,9,24 มิถุนายน 2562 เวลา 14:18:28 น.
36,1057120252,57020065,120252,บ้านป่าต้าก,banpatak,นายวิเชียร คำตุ้ย,อนุบาล-ประถมศึกษา,,หมู่ 5 บ้านป่าต้าก,สันกลาง,พาน,เชียงราย,57120,pataksc@gmail.com,https://data.bopp-obec.info/web/?School_ID=1057120252,สันกลาง,53770221,-,12/05/2010,19.9,10,ขนาดกลาง,มีไฟฟ้า,15,159,9,08 พฤศจิกายน 2562 เวลา 12:24:51 น.
37,1057120261,57020066,120261,บ้านเหมืองง่า,banmuangnga,นายธาดา ยาวังเสน,ประถมศึกษา,,หมู่ 6 บ้านเหมืองง่า,สันติสุข,พาน,เชียงราย,57120,banmuangnga@gmaill.com,data.bopp-obec.info/web/?School_ID=1057120261,สันติสุข,967962836,-,1 ก.ค 2502,25,7.6,ขนาดเล็ก,มีไฟฟ้า,7,51,6,21 มกราคม 2563 เวลา 15:30:40 น.
38,1057120258,57020068,120258,บ้านสันติวัน,BANSANTIWAN,นายไชยา วงค์เวียน,อนุบาล-ประถมศึกษา,,หมู่ 1 บ้านดอยชัยมงคล,สันติสุข,พาน,เชียงราย,57120,santiwanumperphan@gmail.com,,สันติสุข,53721070,-,21 เมษายน 2481,22.5,3,ขนาดเล็ก,มีไฟฟ้า,10,80,9,12 ธันวาคม 2562 เวลา 10:42:36 น.
39,1057120306,57020071,120306,บ้านใหม่ท่าต้นเกี๋ยง,Banmai Thathonkeing,นายสมพจน์ อินทจักร์,อนุบาล-ประถมศึกษา,,หมู่ 9 บ้านใหมใน,สันมะเค็ด,พาน,เชียงราย,57120,banmai11@gmail.com,,สันมะเค็ด,53677630,53677630,2501,35,16,ขนาดกลาง,มีไฟฟ้า,18,134,12,31 มกราคม 2563 เวลา 15:54:59 น.
40,1057120309,57020074,120309,บ้านสันต้นดู่,santondoo,-,อนุบาล-ประถมศึกษา,,หมู่ 19 สันป่าสักทอง,สันมะเค็ด,พาน,เชียงราย,57120,santondoo@gmail.com,data.bopp-obec.info/web/?School_ID=1057120309,สันมะเค็ด,53677182,53677182,16 ธันวาคม 2486,38,18,ขนาดเล็ก,มีไฟฟ้า,9,79,9,17 มกราคม 2563 เวลา 09:48:15 น.
41,1057120310,57020075,120310,บ้านกล้วย,bankluay,นายจำนง ไชยประเสริฐ,อนุบาล-ประถมศึกษา,,หมู่ 12 บ้านกล้วยทรายงาม,สันมะเค็ด,พาน,เชียงราย,57120,bankluay@gmil.com,data.bopp-obec.info/web/?School_ID=1057120310,สันมะเค็ด,53677180,,1 กรกฎาคม 2483,40.1,20,ขนาดกลาง,มีไฟฟ้า,13,168,8,17 มกราคม 2563 เวลา 10:51:11 น.
42,1057120312,57020077,120312,บ้านป่าแดงงาม,banpadangngam,-,อนุบาล-มัธยมศึกษาตอนต้น,,หมู่ 8 ป่าแดงงาม,สันมะเค็ด,พาน,เชียงราย,57120,taifapadang@gmail.com,https://data.bopp-obec.info/web/index_view.php?Sch,สันมะเค็ด,871880414,-,2508,38,18,ขนาดเล็ก,มีไฟฟ้า,11,81,11,20 พฤศจิกายน 2562 เวลา 15:36:06 น.
43,1057120314,57020078,120314,บ้านหนองฮ่างสันหลวง,Nonghang-Sanluang,-,อนุบาล-ประถมศึกษา,,หมู่ 4 หนองฮ่าง,หัวง้ม,พาน,เชียงราย,57120,nonghang0@gmail.com,,หัวง้ม,53762245,,1 มิถุนายน 2482,35,10,ขนาดเล็ก,มีไฟฟ้า,0,0,0,30 สิงหาคม 2560 เวลา 06:22:16 น.
44,1057120315,57020079,120315,บ้านป่าคา,Paka,-,อนุบาล-ประถมศึกษา,,หมู่ 2 บ้านป่าคา,หัวง้ม,พาน,เชียงราย,57120,pakaschool@gmail.com,,อบต.หัวง้ม,53721101,,11 สิงหาคม 2501,28,6,ขนาดเล็ก,มีไฟฟ้า,0,0,0,03 สิงหาคม 2561 เวลา 15:21:05 น.
45,1057120313,57020080,120313,ป่าแดงวิทยา,Padaengwittaya,นายราชัน มานะกิจ,อนุบาล-มัธยมศึกษาตอนต้น,,หมู่ 6 บ้านป่าแดง,หัวง้ม,พาน,เชียงราย,57120,padaengwit@gmail.com,https://data.bopp-obec.info/web/?School_ID=1057120313,หัวง้ม,53659020,53659020,พ.ศ.2467,27,5.4,ขนาดกลาง,มีไฟฟ้า,17,249,11,20 มกราคม 2563 เวลา 07:52:08 น.
46,1057120228,57020082,120228,ป่าแงะวิทยา,Pangaewittaya School,นายทิวา สุริยะ,อนุบาล-มัธยมศึกษาตอนต้น,,หมู่ 1 บ้านป่าแงะ,ป่าแงะ,ป่าแดด,เชียงราย,57190,ipangae6@gmail.com,data.bopp-obec.info/web/?School_ID=1057120228,เทศบาลตำบลป่าแงะ,53186405,,1 พ.ค. 2495,50,8,ขนาดกลาง,มีไฟฟ้า,23,226,12,20 สิงหาคม 2562 เวลา 14:09:54 น.
47,1057120230,57020084,120230,บ้านใหม่พัฒนา,Maipattana School,-,อนุบาล-ประถมศึกษา,,หมู่ 3 บ้านใหม่พัฒนา,ป่าแงะ,ป่าแดด,เชียงราย,57190,maipattana@gmail.com,-,เทศบาลตำบลป่าแงะ,-,-,7 พ.ค. 2513,47,10,ขนาดเล็ก,มีไฟฟ้า,1,0,0,22 พฤศจิกายน 2556 เวลา 13:56:12 น.
48,1057120226,57020087,120226,บ้านใหม่ใต้,Banmaitai School,นางรุ่งจิตร ลือยศ,อนุบาล-ประถมศึกษา,,หมู่ 6 บ้านใหม่ใต้,ป่าแดด,ป่าแดด,เชียงราย,57190,banmaitai@gmail.com,,เทศบาลตำบลป่าแดด,53761007,53761007,2502,55.9,2.9,ขนาดเล็ก,มีไฟฟ้า,3,0,0,26 มกราคม 2560 เวลา 13:46:11 น.
49,1057120222,57020089,120222,บ้านสักพัฒนา,Bansakpattana,นายสุริยัน ยารวง,อนุบาล-ประถมศึกษา,,หมู่ 10 บ้านสักใต้,ป่าแดด,ป่าแดด,เชียงราย,57190,bansak7@gmail.com,http://data.bopp-obec.info/web/?School_ID=1057120222,เทศบาลตำบลป่าแดด,53761450,,พ.ศ. 2519,55.2,1.5,ขนาดเล็ก,มีไฟฟ้า,11,91,9,27 พฤศจิกายน 2562 เวลา 14:15:21 น.
