145,1057120472,57020197,120472,บ้านสันสลี,Bansansalee,นายสราวุธ พรมเทพ,อนุบาล-ประถมศึกษา,,หมู่ 5 สันสลี,สันสลี,เวียงป่าเป้า,เชียงราย,57170,sansalee42@gmail.com,,บ้านสันสลี,53781792,,20 สิงหาคม 2483,61.6,5,ขนาดเล็ก,มีไฟฟ้า,8,48,8,19 พฤศจิกายน 2562 เวลา 14:31:44 น.
146,1057120641,57020198,120641,อนุบาลจอมหมอกแก้ว,Anubanjommokkeaw School,นายปฏิพล ดำรงศุภปัญญา,อนุบาล-ประถมศึกษา,,หมู่ 2 บ้านสันต้อม,จอมหมอกแก้ว,แม่ลาว,เชียงราย,57250,jommok@gmail.com,http://www.jmk.ac.th,องค์การบริหารส่วนตำบลจอมหมอกแก้ว,53666117,53666117,1 กันยายน พ.ศ.2482,2,10,ขนาดกลาง,มีไฟฟ้า,14,121,9,31 มกราคม 2563 เวลา 09:16:06 น.
147,1057120643,57020200,120643,บ้านท่ามะโอ,bantamao,นายชัชวาล ปัญญาไชย,อนุบาล-ประถมศึกษา,,หมู่ 8 ท่ามะโอ,จอมหมอกแก้ว,แม่ลาว,เชียงราย,57250,bantamao2007@gmail.com,,จอมหมอกแก้ว,53184200,53184200,3 พฤษภาคม 2481,8.7,4.1,ขนาดเล็ก,มีไฟฟ้า,5,48,9,07 มิถุนายน 2561 เวลา 04:19:25 น.
148,1057120634,57020203,120634,บ้านดงมะดะ,bandongmada,จ.ส.อ.สมจิตร หวายคำ,อนุบาล-ประถมศึกษา,,หมู่ 7 ดงมะดะ,ดงมะดะ,แม่ลาว,เชียงราย,57250,dongmada@gmail.com,,ดงมะดะ,53729418,53729418,1 มิ.ย. 2482,7,2,ขนาดเล็ก,มีไฟฟ้า,10,87,9,23 มกราคม 2563 เวลา 10:01:54 น.
149,1057120635,57020204,120635,อนุบาลแม่ลาว,anubanmaelao,นายสุรศักดิ์ เบญจพลาภรณ์,อนุบาล-ประถมศึกษา,,หมู่ 4 แม่ลาว,ดงมะดะ,แม่ลาว,เชียงราย,57250,anubanmaelao@gmail.com,anubanmaelao@gmail.com,เทศบาลตำบลแม่ลาว,53729109,53666840,1052461,3,10,ขนาดกลาง,มีไฟฟ้า,9,136,8,01 พฤศจิกายน 2562 เวลา 08:19:57 น.
150,1057120636,57020205,120636,บ้านผาบ่อง(คุรุราษฎร์สามัคคี),Banphabong,นายวีระศักดิ์ น้อยหมอ,อนุบาล-ประถมศึกษา,,หมู่ 8 ห้วยส้านผาบ่อง,ดงมะดะ,แม่ลาว,เชียงราย,57250,phabong@gmail.com,data.bopp-obec.info/web/?School_ID=1057120636,ดงมะดะ,กรุณาติดต่อผ่านอีเมล์,,20 เมษายน 2500,6.9,11.8,ขนาดกลาง,มีไฟฟ้า,13,125,8,01 มิถุนายน 2562 เวลา 12:55:12 น.
151,1057120637,57020206,120637,ห้วยส้านยาววิทยา,huaysanyaowittaya,นางสาวอัญชิษฐา เทพท้าว,อนุบาล-มัธยมศึกษาตอนต้น,,หมู่ 13 ห้วยส้านยาว,ดงมะดะ,แม่ลาว,เชียงราย,57250,้huaysanyaowittaya@gmail.com,,ดงมะดะ,-,-,-,10.1,13,ขนาดกลาง,มีไฟฟ้า,13,206,11,17 มกราคม 2563 เวลา 12:28:00 น.
152,1057120638,57020207,120638,บ้านหนองเก้าห้อง,Bannongkaohong,นางสาวดอกรัก สมบัติหลาย,อนุบาล-ประถมศึกษา,,หมู่ 12 หนองเก้าห้อง,ดงมะดะ,แม่ลาว,เชียงราย,57250,nong9hong@gmail.com,,ดงมะดะ,53184148,53184148,1 เมษายน 2482,8.7,7.8,ขนาดเล็ก,มีไฟฟ้า,7,47,9,01 พฤศจิกายน 2562 เวลา 11:32:00 น.
153,1057120652,57020209,120652,บ้านต้นง้าว,bantonngao,นางถนอมศรี มหาชัย,อนุบาล-ประถมศึกษา,,หมู่ 2 บ้านต้นง้าว,บัวสลี,แม่ลาว,เชียงราย,57250,tonngao.sch@gmail.com,https://data.bopp-obec.info/web/?School_ID=1057120652,บัวสลี,-,-,15 มิถุนายน 2482,14.1,6.2,ขนาดเล็ก,มีไฟฟ้า,6,22,7,24 พฤษภาคม 2561 เวลา 12:51:32 น.
154,1057120650,57020210,120650,บัวสลีวิทยา,buasaleewittaya,นายจำเริญ ไชยยะ,อนุบาล-มัธยมศึกษาตอนต้น,,หมู่ 12 บัวสลี,บัวสลี,แม่ลาว,เชียงราย,57250,buasalee@gmail.com,,บัวสลี,,,1 มกราคม 2462,9.2,9.2,ขนาดเล็ก,มีไฟฟ้า,12,62,11,20 สิงหาคม 2562 เวลา 12:24:39 น.
155,1057120651,57020211,120651,บ้านต้นยาง,bantonyang,นายนวภัทร หมื่นองค์,อนุบาล-ประถมศึกษา,,หมู่ 6 ต้นยาง,บัวสลี,แม่ลาว,เชียงราย,57250,tyschool7@gmail.com,,อบต.บัวสลี,53673375,-,1 มิถุนายน 2482,7,12.6,ขนาดเล็ก,มีไฟฟ้า,9,48,9,19 สิงหาคม 2562 เวลา 15:02:28 น.
156,1057120648,57020212,120648,บ้านโป่งมอญ,banpongmon,นายสมเกียรติ ไชยะ,อนุบาล-ประถมศึกษา,,หมู่ 1 โป่งมอญ,ป่าก่อดำ,แม่ลาว,เชียงราย,57250,banpongmon@gmail.com,,องค์การบริหารส่วนตำบลป่าก่อดำ,53778186,-,2481,10,2.5,ขนาดเล็ก,มีไฟฟ้า,7,89,8,23 มิถุนายน 2562 เวลา 06:44:48 น.
157,1057120649,57020213,120649,บ้านแม่ผง,banmaepong,ว่าที่ร้อยตรีวุฒินัย ประชานุเคราะห์,อนุบาล-ประถมศึกษา,,หมู่ 5 บ้านแม่ผง,ป่าก่อดำ,แม่ลาว,เชียงราย,57250,banmaepong@gmail.com,,ป่าก่อดำ,53778269,53778269,1 กันยายน 2481,8.3,6.7,ขนาดเล็ก,มีไฟฟ้า,7,30,9,01 มิถุนายน 2561 เวลา 12:26:26 น.
158,1057120647,57020214,120647,ชุมชนบ้านป่าก่อดำ,Chumchon Ban Pa Kor Dam,นายอำนวย จอมใจ,อนุบาล-มัธยมศึกษาตอนต้น,,หมู่ 10 ป่าก่อดำ,ป่าก่อดำ,แม่ลาว,เชียงราย,57250,office@pkd.ac.th,www.pkd.ac.th,เทศบาลตำบลป่าก่อดำ,53666187,53666187,2463,5,8,ขนาดกลาง,มีไฟฟ้า,17,122,11,24 กรกฎาคม 2562 เวลา 09:40:45 น.
159,1057120646,57020215,120646,บ้านห้วยส้านพลับพลา,huaisanplubplaschool,ว่าที่ พ.ต.ขวัญชัย อดุลย์ฐานานุศักดิ์,อนุบาล-ประถมศึกษา,,หมู่ 5 ห้วยส้านพลับพลา,โป่งแพร่,แม่ลาว,เชียงราย,57000,huaisanplubpla@gmail.com,data.bopp-obec.info/web/?School_ID=1057120646,อบต.โป่งแพร่,53184706,-,15/6/2482,12.9,7.2,ขนาดกลาง,มีไฟฟ้า,12,95,8,05 มิถุนายน 2560 เวลา 11:22:31 น.
160,1057120645,57020216,120645,โป่งแพร่วิทยา,pongphraewitthayaschool,นายระพิพงษ์ ไชยลังกา,อนุบาล-มัธยมศึกษาตอนต้น,,หมู่ 2 ป่าซางใต้,โป่งแพร่,แม่ลาว,เชียงราย,57250,pongphrae.cr2@gmail.com,data.bopp-obec.info/web/?School_ID=1057120645,โป่งแพร่,53778333,53778333,29/11/2442,16.1,10.4,ขนาดกลาง,มีไฟฟ้า,19,173,11,24 พฤษภาคม 2561 เวลา 12:57:10 น.
