50,1057120223,57020090,120223,บ้านแม่พุง,MAEPHUNG,นายชาญวิทย์ ออมสิน,อนุบาล-ประถมศึกษา,,หมู่ 5 บ้านแม่พุง,ป่าแดด,ป่าแดด,เชียงราย,57190,maephung@gmail.com,data.bopp-obec.info/web/?School_ID=1057120223,เทศบาลตำบลป่าแดด,53710136,53607211,พ.ศ.2484,53.9,6,ขนาดเล็ก,มีไฟฟ้า,10,67,9,22 มิถุนายน 2562 เวลา 14:12:32 น.
51,1057120224,57020091,120224,โรงช้างวิทยา,Rongchangwitthaya,นายพงษ์ศักดิ์ แสนชุมภู,อนุบาล-มัธยมศึกษาตอนต้น,,หมู่ 5 โรงช้างวิทยา,โรงช้าง,ป่าแดด,เชียงราย,57190,rcw.2524@gmail.com,,เทศบาลตำบลโรงช้าง,53761446,53761446,06/05/2480,57.9,4.9,ขนาดกลาง,มีไฟฟ้า,20,159,12,24 พฤษภาคม 2561 เวลา 12:56:25 น.
52,1057120225,57020092,120225,บ้านโป่ง,ฺBanpong school,นายสัญญา ทะกัน,อนุบาล-ประถมศึกษา,,หมู่ 11 บ้านโป่ง,โรงช้าง,ป่าแดด,เชียงราย,57190,banpong103@gmail.com,data.bopp-obec.info/web/index_view.php?School_ID=1057120225&page=info,โรงช้าง,53761500,,พ.ศ. 2487,57,3.5,ขนาดกลาง,มีไฟฟ้า,15,164,8,25 มิถุนายน 2562 เวลา 12:20:38 น.
53,1057120235,57020094,120235,ศรีโพธิ์เงินวิทยา,SRIPHONGOENWITTHAYA,นายกันติทัต บุญศรี,อนุบาล-มัธยมศึกษาตอนต้น,,หมู่ 2 ศรีมงคล,ศรีโพธิ์เงิน,ป่าแดด,เชียงราย,57190,sripho375@gmail.com,,เทศบาลตำบลศรีโพธิ์เงิน,53607303,53607303,2504,63.3,10.3,ขนาดกลาง,มีไฟฟ้า,16,151,11,31 ตุลาคม 2562 เวลา 16:17:06 น.
54,1057120236,57020095,120236,บ้านวังวิทยา,Banwangwittaya,นายถวิล สุริยะ,อนุบาล-มัธยมศึกษาตอนต้น,,หมู่ 2 บ้านวังผา,สันมะค่า,ป่าแดด,เชียงราย,57190,banwangpha@gmail.com,,สันมะค่า,945631522,-,15 พฤศจิกายน 2504,70,10,ขนาดกลาง,มีไฟฟ้า,17,278,12,28 มิถุนายน 2562 เวลา 14:49:21 น.
55,1057120234,57020096,120234,ชุมชนบ้านสันมะค่า,Choomchonbansanmaka,นางรุ่งจิตร ลือยศ,อนุบาล-ประถมศึกษา,,หมู่ 1 สันมะค่า,สันมะค่า,ป่าแดด,เชียงราย,57190,sanmaka03@gmail.com,,สันมะค่า,53761084,53761084,13/11/2505,59.5,5,ขนาดเล็ก,มีไฟฟ้า,8,94,8,13 พฤศจิกายน 2562 เวลา 10:25:15 น.
56,1057120396,57020097,120396,บ้านป่าตึงงาม,PATUNGNAM,นางณัฐรภา สุภาอินทร์,อนุบาล-ประถมศึกษา,,หมู่ 11 ใหม่แสงแก้ว,เจดีย์หลวง,แม่สรวย,เชียงราย,57180,patungngam@gmail.com,,องค์การบริหารส่วนตำบลเจดีย์หลวง,-,-,2497,37,10,ขนาดเล็ก,มีไฟฟ้า,5,82,8,16 สิงหาคม 2562 เวลา 18:37:26 น.
57,1057120397,57020098,120397,บ้านร้องบง,RONGBONG,นายประกอบ สนมฉ่ำ,อนุบาล-ประถมศึกษา,,หมู่ 2 ร้องบง,เจดีย์หลวง,แม่สรวย,เชียงราย,57180,rongbong@gmail.com,http://data.bopp-obec.info/web/index.php?School_ID=1057120397,เจดีย์หลวง,52029333,-,01/06/2482,39,10,ขนาดกลาง,มีไฟฟ้า,14,133,8,29 พฤศจิกายน 2562 เวลา 09:24:15 น.
58,1057120398,57020099,120398,เจดีย์หลวงพิทยา,Jedeeluangpittaya,นายธนากร วรากุลพิชัย,อนุบาล-มัธยมศึกษาตอนต้น,,หมู่ 4 หนองหล่ม,เจดีย์หลวง,แม่สรวย,เชียงราย,57180,jedeeluang48@gmail.com,www.jedeeluang.ac.th,เทศบาลตำบลเจดีย์หลวง,53950474,53950474,28 ธันวาคม 2476,38,11,ขนาดกลาง,มีไฟฟ้า,21,240,13,29 พฤษภาคม 2562 เวลา 14:53:10 น.
59,1057120399,57020100,120399,บ้านห้วยหมอเฒ่า,BanHuaMorTow,นายปกาศิต อนุกูล,อนุบาล-ประถมศึกษา,,หมู่ 10 ห้วยหมอเฒ่า,เจดีย์หลวง,แม่สรวย,เชียงราย,57180,Mortow34@Gmail.com,,เจดีย์หลวง,53950275,,14 มีนาคม 2511,12.9,40,ขนาดเล็ก,มีไฟฟ้า,12,107,9,31 มกราคม 2563 เวลา 17:32:28 น.
60,1057120400,57020101,120400,บ้านสันก้างปลา,SUNKANGPLA,นายพิสัณห์ อินลี,อนุบาล-ประถมศึกษา,,หมู่ 7 สันก้างปลา,เจดีย์หลวง,แม่สรวย,เชียงราย,57180,sangangpa@gmail.com,,เจดีย์หลวง,53950651,,2502,45,10,ขนาดเล็ก,มีไฟฟ้า,9,77,6,15 มกราคม 2563 เวลา 15:15:27 น.
61,1057120404,57020102,120404,บ้านแม่ตาแมว,MAETAMAW,นายจักริน เมืองใจหล้า,อนุบาล-ประถมศึกษา,,หมู่ 9 บ้านแม่ตาแมว,เจดีย์หลวง,แม่สรวย,เชียงราย,57180,maetamaw@gmail.com,data.bopp-obec.info/web/?School_ID=1057120404,เจดีย์หลวง,-,-,2530,55,25,ขนาดเล็ก,มีไฟฟ้า,4,26,8,20 มกราคม 2563 เวลา 10:26:59 น.
62,1057120406,57020103,120406,บ้านดินดำ,Dindum School,นายดำริ สุริยา,อนุบาล-ประถมศึกษา,,หมู่ 1 ดินดำ,ท่าก๊อ,แม่สรวย,เชียงราย,57180,dindum511@gmail.com,http://data.bopp-obec.info/web/?School_ID=1057120406,ท่าก๊อ,053-950043,,1 พฤษภาคม 2500,45,20,ขนาดเล็ก,มีไฟฟ้า,9,105,8,28 มกราคม 2563 เวลา 15:18:01 น.
63,1057120407,57020104,120407,บ้านแม่ผักแหละ,Banmaephuklae,นายจาตุรงค์ เทสมุทร,อนุบาล-มัธยมศึกษาตอนต้น,,หมู่ 11 แม่ผักแหละ,ท่าก๊อ,แม่สรวย,เชียงราย,57180,maephuklae@gmail.com,banmaephuklae.ac.th,ท่าก๊อ,-,-,01 พฤษภาคม 2542,78,27,ขนาดกลาง,มีไฟฟ้า,19,233,12,20 มกราคม 2563 เวลา 10:19:21 น.
64,1057120408,57020105,120408,บ้านป่าถ่อน(วิทยาสมิทธิ์),Pathon(Wittayasmith),นายปฐมทัศน์ อวดห้าว,อนุบาล-ประถมศึกษา,,หมู่ 2 ใหม่สุขสรรค์,ท่าก๊อ,แม่สรวย,เชียงราย,57180,pathon.v@gmail.com,-,ท่าก๊อ,-,-,15 กันยายน 2476,50,20,ขนาดเล็ก,มีไฟฟ้า,11,80,9,14 มกราคม 2563 เวลา 14:08:25 น.
65,1057120409,57020106,120409,บ้านแม่ต๋ำ,Banmaetam,นายกิตติศักดิ์ อัครสิริธีรกุล,อนุบาล-ประถมศึกษา,,หมู่ 20 แม่ต่ำ,ท่าก๊อ,แม่สรวย,เชียงราย,57180,maetamsc2502@gmail.com,-,ท่าก๊อ,968793947,-,11/08/2502,52,18,ขนาดกลาง,มีไฟฟ้า,23,381,15,31 มกราคม 2563 เวลา 21:15:20 น.
66,1057120410,57020107,120410,ท่าก๊อพลับพลาพิทยา,Takoeplabpla Pittaya,นายจตุรงค์ สิทธิบุญมา,อนุบาล-มัธยมศึกษาตอนต้น,,หมู่ 6 ท่าก๊อพลับพลา,ท่าก๊อ,แม่สรวย,เชียงราย,57180,takoeplabpla@gmail.com,,ท่าก๊อ,53724145,53724145,29 พฤศจิกายน 2442,47,22,ขนาดกลาง,มีไฟฟ้า,24,233,14,17 มกราคม 2563 เวลา 14:38:47 น.
67,1057120411,57020108,120411,บ้านปางหลวง,Phangluang,นางศิริรัตน์ เขื่อนข่าย,อนุบาล-ประถมศึกษา,,หมู่ 8 บ้านปางหลวง,ท่าก๊อ,แม่สรวย,เชียงราย,57180,phangluang@gmail.com,http://data.bopp-obec.info/web/?School_ID=1057120411,ท่าก๊อ,856201359,-,พ.ศ. 2478,74.8,46.7,ขนาดเล็ก,ไม่มีไฟฟ้า,7,40,9,30 มกราคม 2563 เวลา 18:13:54 น.
68,1057120412,57020109,120412,บ้านปางหก,banpanghok,นางวิลาสินี จันทร์ลือ,อนุบาล-ประถมศึกษา,,หมู่ 9 ปางหก,ท่าก๊อ,แม่สรวย,เชียงราย,57180,banpanghok.school@gmail.com,,ท่าก๊อ,"052029616,087-6580776",,2488,78,30,ขนาดเล็ก,ไม่มีไฟฟ้า,5,23,8,22 มิถุนายน 2562 เวลา 13:55:15 น.
69,1057120413,57020110,120413,ห้วยน้ำขุ่นวิทยา,huainamkhunvittaya,นายสนิท นันทชัย,อนุบาล-มัธยมศึกษาตอนต้น,,หมู่ 16 บ้านห้วยน้ำข่น,ท่าก๊อ,แม่สรวย,เชียงราย,57180,huainamkhun@gmail.com,www.huainamkhun.ac.th,ท่าก๊อ,53163390,53163390,30/11/2513,71,44,ขนาดใหญ่,มีไฟฟ้า,39,724,27,20 ธันวาคม 2561 เวลา 08:51:57 น.
70,1057120394,57020112,120394,บ้านห้วยมะแกง,huaymakaeng,นายพัฒน์พงษ์ เต็มเสาร์,อนุบาล-ประถมศึกษา,,หมู่ 20 บ้านห้วยมะแกง,แม่สรวย,แม่สรวย,เชียงราย,57180,huaymakaeng@gmail.com,-,ป่าแดด,080-6750372,-,01/12/2530,47,20,ขนาดกลาง,มีไฟฟ้า,15,138,8,14 สิงหาคม 2562 เวลา 13:21:06 น.
71,1057120395,57020113,120395,บ้านห้วยสะลักวิทยา,huaysalakvittaya,นายสุพจน์ ปัญญา,อนุบาล-ประถมศึกษา,,หมู่ 21 บ้านห้วยสะลัก,ป่าแดด,แม่สรวย,เชียงราย,57180,huaysalakvittaya@gmail.com,,ป่าแดด,53160064,-,01/06/2541,51,26,ขนาดกลาง,มีไฟฟ้า,16,208,9,18 ธันวาคม 2562 เวลา 13:09:54 น.
72,1057120388,57020114,120388,บ้านป่าแดด(เวทยาสมิทธิ์),BANPADAET(WETTAYASMIS),นายบุญเพ็ง แปงการิยา,อนุบาล-มัธยมศึกษาตอนต้น,,หมู่ 17 สันโค้งใต้,ป่าแดด,แม่สรวย,เชียงราย,57180,padaetschool@gmil.com,203.172.210.163/main/,ป่าแดด,53656504,53656504,2475,33.4,6.3,ขนาดกลาง,มีไฟฟ้า,26,413,19,23 มกราคม 2563 เวลา 14:24:15 น.
73,1057120389,57020115,120389,ชุมชนบ้านโป่ง,chumchonbanpongschool,นายอำพล โทอรัญ,อนุบาล-มัธยมศึกษาตอนต้น,,หมู่ 6 สันขี้เหล็ก,ป่าแดด,แม่สรวย,เชียงราย,57180,chumchonbanpongschool@gmail.com,,ป่าแดด,53708262,53708033,16/05/2460,35,15,ขนาดกลาง,มีไฟฟ้า,17,195,12,24 มกราคม 2563 เวลา 14:24:09 น.
74,1057120390,57020116,120390,บ้านดอนสลี,BANDONSALEE,นายทรงวุฒิ บุญงาม,อนุบาล-ประถมศึกษา,,หมู่ 19 ศรีดอนมูล,ป่าแดด,แม่สรวย,เชียงราย,57180,donsalee1@gmail.com,-,องค์การบริหารส่วนตำบลป่าแดด,,-,2522,39.2,12.1,ขนาดกลาง,มีไฟฟ้า,14,149,8,20 มกราคม 2563 เวลา 15:51:43 น.
75,1057120391,57020117,120391,บ้านหัวฝาย,banhuafai,นายปรีชา นิธิเจริญ,อนุบาล-ประถมศึกษา,,หมู่ 8 หัวฝาย,ป่าแดด,แม่สรวย,เชียงราย,57180,banhuafai1@gmail.com,,ป่าแดด,53727288,,2501,37,10,ขนาดกลาง,มีไฟฟ้า,16,196,9,27 พฤษภาคม 2562 เวลา 08:58:23 น.
76,1057120392,57020118,120392,บ้านห้วยหญ้าไซ,huayyasai,นายสงคราม มังคะละ,อนุบาล-มัธยมศึกษาตอนต้น,,หมู่ 11 ห้วยหญ้าไซ,ป่าแดด,แม่สรวย,เชียงราย,57180,huayyasai@gmail.com,data.bopp-obec.info/web/index.php?School_ID=1057120392,ป่าแดด,52029342,,1/3/2522,51,17,ขนาดกลาง,มีไฟฟ้า,16,458,20,09 มีนาคม 2560 เวลา 17:30:32 น.
77,1057120393,57020119,120393,บ้านแม่ตาช้าง,banmaetachang,นายบดินทร์ ศรีเงิน,อนุบาล-ประถมศึกษา,,หมู่ 18 แม่ตาช้าง,ป่าแดด,แม่สรวย,เชียงราย,57180,maetachang@gmail.com,,ป่าแดด,052-029339,-,2533,50,18,ขนาดเล็ก,มีไฟฟ้า,6,102,9,05 มิถุนายน 2560 เวลา 11:21:40 น.
78,1057120386,57020120,120386,บ้านปางอ้อย,Banpangaoy,-,อนุบาล-ประถมศึกษา,,หมู่ 9 ปางอ้อย,แม่พริก,แม่สรวย,เชียงราย,57180,pangaoy.school@gmail.com,,แม่พริก,,,2500,40,13,ขนาดเล็ก,มีไฟฟ้า,5,28,8,17 มกราคม 2563 เวลา 10:01:44 น.
79,1057120387,57020121,120387,บ้านป่าเมี่ยงแม่พริก,Banparmiengmaeprig,ดร.บุญยืน ทูปแป้น,อนุบาล-ประถมศึกษา,,หมู่ 4 บ้านปางกลาง,แม่พริก,แม่สรวย,เชียงราย,57180,parmiengmaeprig@gmail.com,,แม่พริก,887626499,,1 เมษายน 2484,48,25,ขนาดเล็ก,มีไฟฟ้า,6,28,8,07 กุมภาพันธ์ 2561 เวลา 08:56:42 น.
80,1057120382,57020122,120382,บ้านแม่พริก(เมืองยศพิทยานุกุล),Banmaeprik,นายวันชัย วงศ์เรียน,อนุบาล-ประถมศึกษา,,หมู่ 1 บ้านแม่พริก,แม่พริก,แม่สรวย,เชียงราย,57180,maeprik@gmail.com,,แม่พริก,53656586,53656586,2496,30,5,ขนาดกลาง,มีไฟฟ้า,15,133,8,15 สิงหาคม 2562 เวลา 17:50:55 น.
81,1057120383,57020123,120383,ชุมชนบ้านสันจำปา,sanjumpaschool@gmail.com,นายชูชาติ ซาวคำเขตต์,อนุบาล-มัธยมศึกษาตอนต้น,,หมู่ 3 สันจำปา,แม่พริก,แม่สรวย,เชียงราย,57180,sanjumpaschool@gmil.com,-,แม่พริก,53656399,-,พ.ศ. 2464,27,4.5,ขนาดกลาง,มีไฟฟ้า,28,511,23,07 พฤศจิกายน 2562 เวลา 11:53:25 น.
82,1057120377,57020126,120377,บ้านโป่งปูเฟือง,banpongpufeang,นางศิริชนก แปงการิยา,อนุบาล-ประถมศึกษา,,หมู่ 1 บ้านโป่งปูเฟือง,แม่สรวย,แม่สรวย,เชียงราย,57180,pongpufeang@gmail.com,-,เวียงสรวย,53160139,-,๑ พฤษภาคม ๒๔๙๙,15,10,ขนาดเล็ก,มีไฟฟ้า,5,48,8,23 สิงหาคม 2560 เวลา 03:48:04 น.
83,1057120379,57020128,120379,บ้านหนองผำ,bannongpam school,นายอภิชาติ สุปิน,อนุบาล-ประถมศึกษา,,หมู่ 9 หนองผำ,แม่สรวย,แม่สรวย,เชียงราย,57180,bonnongpam.2008@gmail.com,-,แม่สรวย,53160183,,2520,15,13,ขนาดกลาง,มีไฟฟ้า,7,83,8,31 ตุลาคม 2562 เวลา 19:14:03 น.
84,1057120380,57020129,120380,บ้านป่าบงท้าวแก่นจันทน์,pabongtaoganjan,นายเกรียงไกร ฟูธรรม,อนุบาล-ประถมศึกษา,,หมู่ 4 ป่าบง,แม่สรวย,แม่สรวย,เชียงราย,57180,pabongtaoganjan428@gmail.com,pabongtaoganjan.cri2.go.th/,เวียงสรวย,53656428,53656428,17 พฤษภาคม พ.ศ.2516,28,3,ขนาดเล็ก,มีไฟฟ้า,12,102,8,29 มกราคม 2563 เวลา 11:00:23 น.
85,1057120375,57020130,120375,อนุบาลแม่สรวย,anubanmeasuai,นายปราการ เหมยเมืองแก้ว,อนุบาล-ประถมศึกษา,,หมู่ 5 บ้านตลาด แม่สรวย,แม่สรวย,แม่สรวย,เชียงราย,57180,anumeasuai@gmail.com,school.obec.go.th/anuma,เทศบาลตำบลแม่สรวย,53656290,53786371,พ.ศ.2454,28.5,0.1,ขนาดกลาง,มีไฟฟ้า,42,524,19,19 สิงหาคม 2562 เวลา 14:04:56 น.
86,1057120376,57020131,120376,บ้านสันกลาง (ราษฎร์พัฒนา),bansanklang(radpattana),นายมนตรี นวลจีน,อนุบาล-ประถมศึกษา,,หมู่ 2 สันกลาง,แม่สรวย,แม่สรวย,เชียงราย,57180,bansanklang.radpattana@gmail.com,,เทศบาลตำบลเวียงสรวย,53786008,53786008,วันที่ 7 เดือนตุลาคม พ.ศ.2487,25,1,ขนาดกลาง,มีไฟฟ้า,17,169,11,06 กุมภาพันธ์ 2563 เวลา 11:25:10 น.
87,1057120414,57020132,120414,บ้านวาวี,Banwawee,ว่าที่ ร.อ.เสรี เชื้ออ้วน,อนุบาล-ประถมศึกษา,,หมู่ 1 บ้านวาวี,วาวี,แม่สรวย,เชียงราย,57180,banvavee@gmail.com,www.banvavee.ac.th,วาวี,53760147,53760176,2509,74,55,ขนาดใหญ่,มีไฟฟ้า,23,628,30,25 พฤษภาคม 2561 เวลา 11:14:55 น.
88,1057120415,57020133,120415,บ้านมังกาล่า,mangkalaุ67@gmail.com,นายศวิต ฟักงาม,อนุบาล-ประถมศึกษา,,หมู่ 22 บ้านมังกาล่า,วาวี,แม่สรวย,เชียงราย,57180,mangkala67@gmail.com,www.facebook.com/mangkala67/,วาวี,819511041,,2526,72,55,ขนาดเล็ก,มีไฟฟ้า,11,107,8,30 มิถุนายน 2562 เวลา 12:34:43 น.
89,1057120417,57020134,120417,บ้านเลาลี,BANLAOLEE,นายสมชาย สุทธิพงศ์,อนุบาล-ประถมศึกษา,,หมู่ 20 เลาลี,วาวี,แม่สรวย,เชียงราย,57180,laolee.chiangrai@gmail.com,banlaolee59.wordpress.com/,วาวี,53760215,53760215,24/04/2520,80,55,ขนาดกลาง,มีไฟฟ้า,12,208,8,22 มกราคม 2563 เวลา 16:50:44 น.
90,1057120418,57020135,120418,บ้านปางกิ่ว(ศุภสิทธิ์มหาคุณ),Banpangkew,นายภิญโญ อุโคตร,อนุบาล-ประถมศึกษา,,หมู่ 2 ปางกิ่ว,วาวี,แม่สรวย,เชียงราย,57180,pangkew@gmail.com,https://data.bopp-obec.info/emis/schooldata-view.php?School_ID=1057120418&Area_CODE=5702,วาวี,52029349,-,พ.ศ. 2509,88,68,ขนาดเล็ก,มีไฟฟ้า,7,87,8,21 มกราคม 2563 เวลา 16:06:02 น.
91,1057120419,57020136,120419,บ้านแม่โมงเย้า,Ban Maemongyao,นางพิมพ์พิชชา ตาคำ สงวนสิทธิ์,อนุบาล-ประถมศึกษา,,หมู่ 15 แม่โมงเย้า,วาวี,แม่สรวย,เชียงราย,57180,maemongyou@gmail.com,,วาวี,052-029630,,พ.ศ. 2527,78,57,ขนาดเล็ก,มีไฟฟ้า,8,75,8,27 มกราคม 2563 เวลา 09:34:17 น.
92,1057120431,57020138,120431,ดอยเวียงวิทยา,Doywiangwittaya,นายสหัส พรหมขัติแก้ว,อนุบาล-ประถมศึกษา,,หมู่ 19 บ้านจู้จี้,วาวี,แม่สรวย,เชียงราย,57180,Doywiangwittaya@gmail.com,-,วาวี,53609440,-,3 พศจิกายน 2539,61,38,ขนาดเล็ก,มีไฟฟ้า,8,97,8,22 มิถุนายน 2562 เวลา 13:59:46 น.
93,1057120416,57020139,120416,โป่งกลางน้ำประชาสรรค์,Pongklangnam,นายสมเดช พิศาลไพโรจน์,อนุบาล-มัธยมศึกษาตอนต้น,,หมู่ 12 โป่งกลางน้ำ,วาวี,แม่สรวย,เชียงราย,57180,pongklangnam@gmail.com,,องค์การบริหารส่วนตำบลวาวี,843682112,-,วันที่ 20 ธันวาคม 2525,62,40,ขนาดกลาง,มีไฟฟ้า,22,271,14,31 มกราคม 2563 เวลา 13:36:26 น.
94,1057120424,57020140,120424,บ้านขุนสรวย,Bankhunsuay School,นางณาตยา มานะ,อนุบาล-ประถมศึกษา,,หมู่ 14 ขุนสรวย,วาวี,แม่สรวย,เชียงราย,57180,khunsuay14@gmail.com,,วาวี,-,,2535,80,55,ขนาดเล็ก,มีไฟฟ้า,7,99,8,31 มกราคม 2563 เวลา 11:36:56 น.
95,1057120426,57020141,120426,บ้านห้วยไคร้,Huaykrai,นายสุทัด จันทะสินธุ์,อนุบาล-มัธยมศึกษาตอนต้น,,หมู่ 13 ห้วยไคร้,วาวี,แม่สรวย,เชียงราย,57180,hauykrai@gmail.com,www.huaykrai.ac.th,วาวี,53918079,53918079,16/05/2529,55,25,ขนาดกลาง,มีไฟฟ้า,26,398,18,09 กรกฎาคม 2562 เวลา 12:46:11 น.
96,1057120427,57020142,120427,บ้านห้วยน้ำเย็น,Hauynamyen,นายเจษฎา แซ่หาง,อนุบาล-มัธยมศึกษาตอนต้น,,หมู่ 11 ห้วยน้ำเย็น,วาวี,แม่สรวย,เชียงราย,57180,namyen@hny.ac.th,,วาวี,53727102,,12/06/2532,52,30,ขนาดกลาง,มีไฟฟ้า,16,301,13,02 กรกฎาคม 2561 เวลา 13:23:52 น.
97,1057120429,57020143,120429,บ้านห้วยกล้า,hauykar,นายเกียรติศักดิ์ อุตชี,อนุบาล-ประถมศึกษา,,หมู่ 18 บ้านห้วยกล้า,วาวี,แม่สรวย,เชียงราย,57180,banhauykar@gmail.com,,อบต.วาวี,53160070,,16062532,ุ60,28,ขนาดเล็ก,มีไฟฟ้า,5,59,9,19 สิงหาคม 2562 เวลา 10:04:47 น.
98,1057120430,57020144,120430,บ้านผาแดงหลวง,phadangluang,นายรักษ์ชัย ฉัตรเงิน,อนุบาล-ประถมศึกษา,,หมู่ 17 บ้านผาแ ดงหลวง,วาวี,แม่สรวย,เชียงราย,57180,phadangluang@gmail.com,,วาวี,53160186,-,16/06/2530,67,32,ขนาดเล็ก,มีไฟฟ้า,9,73,8,26 มิถุนายน 2561 เวลา 10:51:17 น.
