49,1092140246,92010068,140246,บ้านควนยวน,Bankhuanyuan,นายพงศักดิ์ จันทรเกษ,อนุบาล-ประถมศึกษา,,หมู่ 5 บ้านควนยวน,ทุ่งค่าย,ย่านตาขาว,ตรัง,92140,bankhuanyuan@trang1.go.th,http://data.bopp-obec.info/web/?School_ID=1092140246,ทุ่งค่าย,896450750,,6 พฤษภาคม 2502,9,20,ขนาดเล็ก,มีไฟฟ้า,8,96,8,13 มิถุนายน 2562 เวลา 13:15:22 น.
50,1092140242,92010070,140242,บ้านทุ่งค่าย,bantungkai,นางธิดา วนาสุวรรณวณิช,อนุบาล-ประถมศึกษา,,หมู่ 2 ทุ่งค่าย,ทุ่งค่าย,ย่านตาขาว,ตรัง,92140,bantungkai@hotmail.co.th,,ทุ่งค่าย,0-7528-0151,-,2 ตุลาคม 2548,12,8,ขนาดกลาง,มีไฟฟ้า,16,224,8,30 มิถุนายน 2562 เวลา 16:11:51 น.
51,1092140243,92010071,140243,บ้านเขาไม้แก้ว,Bankhaomaikaew,นายอภินันท์ พรหมปลัด,อนุบาล-ประถมศึกษา,,หมู่ 4 เขาไม้แก้ว,ทุ่งค่าย,ย่านตาขาว,ตรัง,92140,bankhaomaikaew@trang1.go.th,http://data.bopp-obec.info/web/?School_ID=1092140243,ทุ่งค่าย,887540830,-,30 /11/2479,12,14,ขนาดเล็ก,มีไฟฟ้า,7,71,8,20 มิถุนายน 2562 เวลา 10:33:18 น.
52,1092140223,92010072,140223,บ้านยูงงาม,Ban Yougngam,นางสาวนลินทิพย์ พรหมสังข์,อนุบาล-ประถมศึกษา,,หมู่ 1 บ้านยูงงาม,โพรงจระเข้,ย่านตาขาว,ตรัง,92140,Yougnagam@obec.go.th,,โพรงจรเข้,936146759,-,12 มิถุนายน พ.ศ. 2518,36,19,ขนาดเล็ก,มีไฟฟ้า,7,42,8,22 ตุลาคม 2562 เวลา 13:08:16 น.
53,1092140238,92010073,140238,วัดหนองเป็ด,WAT NONGPET SCHOOL,-,อนุบาล-มัธยมศึกษาตอนต้น,,หมู่ 6 หนองเป็ด,นาชุมเห็ด,ย่านตาขาว,ตรัง,92140,watnongpetschool@gmail.com,,นาชุมเห็ด,0-7528-5105,0-7528-5105,1 มิ.ย.2481,23,13.5,ขนาดเล็ก,มีไฟฟ้า,16,105,11,27 มิถุนายน 2562 เวลา 15:46:29 น.
54,1092140239,92010074,140239,บ้านหนองชุมแสง,Bannongchumsang,นายวีระยุทธิ์ รักษาศรี,อนุบาล-ประถมศึกษา,,หมู่ 3 ต้นปรง,นาชุมเห็ด,ย่านตาขาว,ตรัง,92140,-,data.bopp-obec.info/web/?School_ID=1092140239,นาชุมเห็ด,-,-,15 สิงหาคม 2498,20,18,ขนาดเล็ก,มีไฟฟ้า,10,51,8,30 มิถุนายน 2562 เวลา 16:56:02 น.
55,1092140224,92010075,140224,วัดควนนิมิตศิลา,Watkuannimitsila,นางทัศณีย์ เทพเนียม,อนุบาล-ประถมศึกษา,,หมู่ 2 บ้านควนหิน,นาชุมเห็ด,ย่านตาขาว,ตรัง,92140,todjon0810@obec.go.th,www.school.obec.go.th/nimitsila/,นาชุมเห็ด,075-829846,,15 มิถุนายน 2474,32,30,ขนาดเล็ก,มีไฟฟ้า,12,99,8,21 มิถุนายน 2562 เวลา 11:24:16 น.
56,1092140225,92010076,140225,บ้านไทรงาม,Bansaingam school,นางพิมพ์ชนก ประดิษฐานุสรณ์,อนุบาล-มัธยมศึกษาตอนต้น,,หมู่ 1 ไทรงาม,นาชุมเห็ด,ย่านตาขาว,ตรัง,92140,bansi-ngam@hotmail,,นาชุมเห็ด,0-7520-6453,,26/09/2500,26,15,ขนาดกลาง,มีไฟฟ้า,18,142,11,21 สิงหาคม 2562 เวลา 12:52:12 น.
57,1092140226,92010077,140226,บ้านลำพิกุล,Banlumpikul,นายธัญญา วิเชียร,อนุบาล-ประถมศึกษา,,หมู่ 8 บ้านลำหนุน,นาชุมเห็ด,ย่านตาขาว,ตรัง,92140,-,-,นาชุมเห็ด,817973590,-,30 พฤศจิกายน 2442,32,25,ขนาดกลาง,มีไฟฟ้า,15,226,9,14 มิถุนายน 2562 เวลา 08:53:02 น.
58,1092140227,92010078,140227,บ้านทอนพลา,Bantonpla,นางสาวศิริภรณ์ เพชรแก้ว,อนุบาล-ประถมศึกษา,,หมู่ 7 บ้านทอนพลา,นาชุมเห็ด,ย่านตาขาว,ตรัง,92140,tonpla@obec.go.th,-,นาชุมเห็ด,0,0,15/10/2502,27,10,ขนาดเล็ก,มีไฟฟ้า,10,42,8,22 ตุลาคม 2562 เวลา 15:40:05 น.
59,1092140233,92010079,140233,บ้านทุ่งศาลา,BANTHUNGSALA,นายวิรัช เกตุแทน,อนุบาล-ประถมศึกษา,,หมู่ 4 ทุ่งศาลา,ในควน,ย่านตาขาว,ตรัง,92140,thungsala@obec.go.th,182.93.220.204/Banthungsala/adminstrator,ในควน,75829847,-,2484,29,7,ขนาดเล็ก,มีไฟฟ้า,10,67,8,19 มิถุนายน 2562 เวลา 13:59:03 น.
60,1092140231,92010080,140231,บ้านห้วยด้วน,Banhuayduan,นายธีรศานติ์ กาญจนศรีเมฆ,อนุบาล-ประถมศึกษา,,หมู่ 2 ห้วยด้วน,ในควน,ย่านตาขาว,ตรัง,92140,,,ในควน,,,21 พฤษภาคม 2493,33,10,ขนาดเล็ก,มีไฟฟ้า,9,61,8,24 มิถุนายน 2562 เวลา 15:55:10 น.
61,1092140232,92010081,140232,บ้านในควน,bannaikhuan,นางสาวนวพร รอดหาญ,อนุบาล-ประถมศึกษา,,หมู่ 7 บ้านในควน,ในควน,ย่านตาขาว,ตรัง,92140,bunnaikoun@trang1.go.th,http://school.obec.go.th/naikoun,ในควน,075-829848,075-207289,พ.ศ. 2508,35,11,ขนาดกลาง,มีไฟฟ้า,11,122,8,28 มิถุนายน 2561 เวลา 14:55:29 น.
62,1092140228,92010082,140228,บ้านทุ่งหนองแห้ง,Ban Thung Nong Hang School,นายมาโนช โสธารัตน์,อนุบาล-ประถมศึกษา,,หมู่ 1 ทุ่งหนองแห้ง,ในควน,ย่านตาขาว,ตรัง,92140,nonghang_school@hotmail,www.banthungnonghang.org,ในควน,0-7557-6252,0-7557-6252,1 กรกฎาคม 2469,29,10,ขนาดกลาง,มีไฟฟ้า,14,201,8,28 มิถุนายน 2562 เวลา 16:24:43 น.
63,1092140222,92010086,140222,บ้านโคกทราย,Bankoktsai,นายอัศวกรณ์ สิทธิศักดิ์,อนุบาล-ประถมศึกษา,,หมู่ 4 บ้านโคกทราย,โพรงจระเข้,ย่านตาขาว,ตรัง,92140,bankhoksai1234@gmail.com,http://data.bopp-obec.info/web/?School_ID=1092140222,โพรงจระเข้,75576035,75576035,15 กรกฏาคม 2498,38,20,ขนาดกลาง,มีไฟฟ้า,13,222,8,27 กันยายน 2562 เวลา 11:42:23 น.
64,1092140249,92010087,140249,บ้านย่านตาขาว,Banyantakaw,นายณัฐ ลายทองสุก,อนุบาล-ประถมศึกษา,,หมู่ 1 ย่านตาขาว,ย่านตาขาว,ย่านตาขาว,ตรัง,92140,banyantakaw@hotmail.com,www.banyantakaw.ac.th/obeclms,ย่านตาขาว,0-7528-1234,0-7528-1695,15 เมษายน 2454,20,1,ขนาดใหญ่,มีไฟฟ้า,48,955,29,10 มิถุนายน 2562 เวลา 07:11:03 น.
65,1092140257,92010088,140257,บ้านนายายหม่อม,Bannayaimom School,นายสำเริง ช่วยเรือง,อนุบาล-ประถมศึกษา,,หมู่ 4 บ้านนายายหม่อม,ย่านตาขาว,ย่านตาขาว,ตรัง,92140,bannayaimom@trang1.go.th,,ย่านตาขาว,0-75584132,-,15 มีนาคม 2503,15,2,ขนาดเล็ก,มีไฟฟ้า,11,85,8,10 มิถุนายน 2562 เวลา 15:15:25 น.
66,1092140256,92010089,140256,บ้านควนโพธิ์,Bankuanpo,นายวิรัตน์ สังขมณี,อนุบาล-ประถมศึกษา,,หมู่ 3 บ้านควนโพธ์ิ,ย่านตาขาว,ย่านตาขาว,ตรัง,92140,kaunposchool@hotmail.com,www.thai-school.net/bankuanpo/,ย่านตาขาว,0-7528-0989,75280989,1/11/2482,23,4,ขนาดกลาง,มีไฟฟ้า,15,191,8,30 มิถุนายน 2562 เวลา 16:29:20 น.
67,1092140235,92010091,140235,วัดชลวาปีวิหาร,Watchonwapeewiharn,นางสาวอรอุมา ชูสุวรรณ์,อนุบาล-ประถมศึกษา,,หมู่ 3 หนักแบก,หนองบ่อ,ย่านตาขาว,ตรัง,92140,Chonwa@obec.go.th,-,หนองบ่อ,0-7528-5104,-,1 ธันวาคม 2464,30,12,ขนาดเล็ก,มีไฟฟ้า,12,81,9,22 มิถุนายน 2562 เวลา 17:12:11 น.
68,1092140252,92010094,140252,บ้านทุ่งเกาะญวน,bantungkoayoun,นางสาวสุภาวดี โชติกเสถียร,อนุบาล-มัธยมศึกษาตอนต้น,,หมู่ 5 ทุ่งเกาะญวน,หนองบ่อ,ย่านตาขาว,ตรัง,92140,tungkoyoun@obec.go.th,data.bopp-obec.info/web/index.php?School_ID=1092140252,หนองบ่อ,0-7528-5103,-,12 พฤศจิกายน 2490,27,7,ขนาดเล็ก,มีไฟฟ้า,11,52,11,31 กรกฎาคม 2562 เวลา 10:09:21 น.
69,1092140158,92010095,140158,หาดทรายทอง,hadsaithong,นายอนุแสน ใจจ้อง,อนุบาล-มัธยมศึกษาตอนต้น,,หมู่ 4 หาดทรายทอง,เกาะสุกร,ปะเหลียน,ตรัง,92120,,school.obec.go.th/hadsaithong,เกาะสุกร,,,16 พฤศจิกายน 2471,62,40,ขนาดกลาง,มีไฟฟ้า,18,175,10,05 มิถุนายน 2562 เวลา 10:22:57 น.
70,1092140159,92010096,140159,บ้านแหลม,banleam,นายมนัสพงค์ ไชยรุตม์,อนุบาล-ประถมศึกษา,,หมู่ 2 บ้านแหลม,เกาะสุกร,ปะเหลียน,ตรัง,92120,,,เกาะสุกร,0-7527-0182,,2491,65,20,ขนาดเล็ก,มีไฟฟ้า,9,74,7,18 มิถุนายน 2562 เวลา 20:06:09 น.
71,1092140156,92010098,140156,บ้านสามแยก,bansamyak,นายวิสุทธิ์ ชายภักตร์,อนุบาล-ประถมศึกษา,,หมู่ 5 สามแยก,ท่าข้าม,ปะเหลียน,ตรัง,92120,bansamyak@trang1.go.th,http://school.obec.go.t,ท่าข้าม,0-7550-1916,-,5พฤษภาคม 2482,42,5,ขนาดกลาง,มีไฟฟ้า,12,123,8,27 มิถุนายน 2562 เวลา 14:41:12 น.
72,1092140157,92010099,140157,บ้านทอนหาน,Banthonhan,นางสาวกาญจนา คงเลิศ,อนุบาล-ประถมศึกษา,,หมู่ 6 บ้านทอนหาน,ท่าข้าม,ปะเหลียน,ตรัง,92120,banthonhan@hotmail.co.th,-,ท่าข้าม,0-75501887,-,17/05/2517,46,7,ขนาดเล็ก,มีไฟฟ้า,10,97,8,28 ตุลาคม 2562 เวลา 11:29:03 น.
73,1092140153,92010100,140153,บ้านท่าข้าม,Banthakham,นางสาวกิตติมา มุ่งวัฒนา,อนุบาล-ประถมศึกษา,,หมู่ 1 ท่าข้าม,ท่าข้าม,ปะเหลียน,ตรัง,92120,bantakam@trang1.go.th,http://data.bopp-obec.info/web/?School_ID=1092140153,ท่าข้าม,0-7528-9394,-,28/03/2456,45,0.5,ขนาดเล็ก,มีไฟฟ้า,10,80,8,09 มิถุนายน 2560 เวลา 12:52:31 น.
74,1092140154,92010101,140154,บ้านหยงสตาร์,Banyongstar,นางพรพนา สมัยรัฐ,อนุบาล-ประถมศึกษา,,หมู่ 3 พิกุลทอง,ท่าข้าม,ปะเหลียน,ตรัง,92120,yongstar@obec.go.th,http://school.obec.go.t,ท่าข้าม,0-7528-9310,,31/12/2471,47,2,ขนาดเล็ก,มีไฟฟ้า,11,95,8,17 มิถุนายน 2562 เวลา 08:44:17 น.
75,1092140155,92010102,140155,ทุ่งรวงทอง,Thungroungtong School,นายเลอศักดิ์ ล่ำล่อง,อนุบาล-ประถมศึกษา,,หมู่ 4 ทุ่งรวงทอง,ท่าข้าม,ปะเหลียน,ตรัง,92120,tungrungtong@obec.go.th,http://data.bopp-obec.info/,ท่าข้าม,0-7528-9397,0-7528-9397,17 พ.ค. 2517,46,4,ขนาดเล็ก,มีไฟฟ้า,11,70,8,28 ตุลาคม 2562 เวลา 21:44:36 น.
76,1092140161,92010103,140161,วัดท่าพญา,wattapaya,นางสาวพัชรินทร์ดา นาคพล,อนุบาล-ประถมศึกษา,,หมู่ 4 ท่าพญา,ท่าพญา,ปะเหลียน,ตรัง,92140,schooltapaya@gmail.com,-,ท่าพญา,-,-,1 กรกฎาคม 2466,25,25,ขนาดเล็ก,มีไฟฟ้า,7,44,7,25 ตุลาคม 2562 เวลา 09:57:08 น.
77,1092140168,92010104,140168,บ้านทุ่งยาว,Banthungyao,นายศรศักดิ์ สีนา,อนุบาล-ประถมศึกษา,,หมู่ 1 ทุ่งยาว,ทุ่งยาว,ปะเหลียน,ตรัง,92180,bantungyao@mail.com,thungyao.ac.th,ทุ่งยาว,75208170,75208170,05/03/2478,46,15,ขนาดกลาง,มีไฟฟ้า,21,399,14,30 มิถุนายน 2562 เวลา 12:09:57 น.
78,1092140169,92010105,140169,บ้านหนองหว้า,bannongwa,นายให้ พลประสิทธิ์,อนุบาล-ประถมศึกษา,,หมู่ 4 บ้านหนองหว้า,ทุ่งยาว,ปะเหลียน,ตรัง,92180,nongwa2515@hotmail.com,,ทุ่งยาว,898759135,-,ปี 2515,46,15,ขนาดกลาง,มีไฟฟ้า,13,135,8,28 มิถุนายน 2562 เวลา 17:36:27 น.
79,1092140171,92010107,140171,บ้านทุ่งมะขามป้อม,bantungmakampom,นายจรูญศักดิ์ โรจน์จิรนนท์,อนุบาล-ประถมศึกษา,,หมู่ 6 ทุ่งมะขามป้อม,ทุ่งยาว,ปะเหลียน,ตรัง,92180,tungmakam@obec.go.th,www.thungmakampom.ac.th,ทุ่งยาว,923968146,,5 พฤษภาคม 2502,50,6,ขนาดกลาง,มีไฟฟ้า,10,123,8,30 มิถุนายน 2562 เวลา 16:23:14 น.
80,1092140166,92010108,140166,บ้านยวนโปะ,Banyuanpo,นายอัฐพล หอวิชยกุล,ประถมศึกษา,,หมู่ 2 ยวนโปะ,บางด้วน,ปะเหลียน,ตรัง,92140,-,-,บางด้วน,0-7520-7343,-,2491,28,50,ขนาดเล็ก,มีไฟฟ้า,9,92,7,30 มิถุนายน 2562 เวลา 15:36:59 น.
81,1092140167,92010109,140167,บ้านป่าแก่,banpakae,นางรัชฎาภรณ์ ณ พัทลุง,อนุบาล-ประถมศึกษา,,หมู่ 4 ป่าแก่,บางด้วน,ปะเหลียน,ตรัง,92140,,,บางด้วน,-,-,15/08/2482,30,30,ขนาดเล็ก,มีไฟฟ้า,8,74,7,30 พฤษภาคม 2561 เวลา 15:01:29 น.
82,1092140164,92010110,140164,บ้านบางด้วน,BANBANGDUAN,นายอาคม บริสุทธิ์,ประถมศึกษา,,หมู่ 5 บางด้วน,บางด้วน,ปะเหลียน,ตรัง,92140,bangduan067@hotmail.com,210.246.188.58/banbangduan/,บางด้วน,0-752-91709,-,1มิถุนายน 2519,28,21,ขนาดกลาง,มีไฟฟ้า,14,160,7,05 มิถุนายน 2562 เวลา 12:55:55 น.
83,1092140165,92010111,140165,วัดควนวิไล,watkuanwilai,นางพนารัตน์ มิ่งมาก,ประถมศึกษา,,หมู่ 1 บ้านส้มเฟือง,บางด้วน,ปะเหลียน,ตรัง,92140,kuanwilaischool @gmail.com,http://school.area.obec,บางด้วน,0-7528-2496,,15 ธันวาคม พ.ศ. 2453,28,25,ขนาดเล็ก,มีไฟฟ้า,8,57,7,29 พฤษภาคม 2560 เวลา 13:48:11 น.
84,1092140163,92010113,140163,บ้านหนองยายแม็ม,Bannongyaimam,นางนิตยา ฉิมเรือง,อนุบาล-ประถมศึกษา,,หมู่ 1 บ้านหนองยายแม็ม,บ้านนา,ปะเหลียน,ตรัง,92140,nongyaimam@hotmail.com,,บ้านนา,0-7529-1257,,6 สิงหาคม 2485,27,19,ขนาดกลาง,มีไฟฟ้า,15,149,8,30 มิถุนายน 2562 เวลา 16:16:58 น.
85,1092140173,92010114,140173,บ้านหนองโต๊ะ,bannongto,นางสาวพันธ์สุรีย์ จิตรหลัง,อนุบาล-ประถมศึกษา,,หมู่ 8 หนองโต๊ะ,บ้านนา,ปะเหลียน,ตรัง,92120,nongto@obec.go.th,,บ้านนา,937639595,-,2514,31,15,ขนาดเล็ก,มีไฟฟ้า,9,51,8,12 มิถุนายน 2562 เวลา 10:09:13 น.
86,1092140177,92010115,140177,บ้านห้วยม่วง,Banhuaimuang,นางสาวจันทร์เพ็ญ ศิริกาญจน์,อนุบาล-ประถมศึกษา,,หมู่ 7 แหลมยาง,บ้านนา,ปะเหลียน,ตรัง,92140,,banhuaimuangschool.net,บ้านนา,0-7526-8341,-,2483,32,18,ขนาดกลาง,มีไฟฟ้า,12,154,8,29 มิถุนายน 2562 เวลา 09:32:33 น.
87,1092140178,92010116,140178,บ้านหินคอกควาย,Banhinkokkwai,นายเดชพล ชูสังข์,อนุบาล-มัธยมศึกษาตอนต้น,,หมู่ 3 หินคอกควาย,บ้านนา,ปะเหลียน,ตรัง,92140,Hinkokkai@obec.ac.th,,บ้านนา,0-7520-7557,-,1 ตุลาคม 2499,34,20,ขนาดกลาง,มีไฟฟ้า,17,112,11,30 มิถุนายน 2562 เวลา 20:53:38 น.
88,1092140179,92010117,140179,บ้านหัวควน,Banhoukhoun,นางยุพา ตั้งสถิตพร,อนุบาล-ประถมศึกษา,,หมู่ 5 หัวควน,บ้านนา,ปะเหลียน,ตรัง,92140,,,บ้านนา,0-7520-7535,-,พ.ศ.2482,40,25,ขนาดเล็ก,มีไฟฟ้า,9,35,8,30 มิถุนายน 2562 เวลา 15:02:12 น.
89,1092140180,92010118,140180,บ้านวังศิลา,BANWANGSILA,นางสุวรินทร์ เดชวรรณ,อนุบาล-ประถมศึกษา,,หมู่ 4 วังศิลา,บ้านนา,ปะเหลียน,ตรัง,92140,wangsilaschool01@gmail.com,http://data.bopp-obec.info/web/?School_ID=1092140180,บ้านนา,-,-,พ.ศ.2507,28,17,ขนาดเล็ก,มีไฟฟ้า,11,102,8,11 มิถุนายน 2562 เวลา 12:40:50 น.
90,1092140193,92010119,140193,บ้านควนไม้ดำ,kuanmaidum school,นายสมเกียรติ ลีสุรพงศ์,อนุบาล-ประถมศึกษา,,หมู่ 2 ควนไม้ดำ,ปะเหลียน,ปะเหลียน,ตรัง,92180,kuanmaidum@obec.go.th,school.obec.go.th/trang104/kuanmaidum/,ปะเหลียน,0-7582-9824,-,21ธันวาคม2535,50,30,ขนาดกลาง,มีไฟฟ้า,12,107,9,30 มิถุนายน 2562 เวลา 10:19:07 น.
91,1092140187,92010121,140187,บ้านลำปลอกเหนือ,BANLAMPLOKNURE,นายสุรวิทย์ สุทธิปรีชานนท์,อนุบาล-ประถมศึกษา,,หมู่ 6 ลำปลอกเหนือ,ปะเหลียน,ปะเหลียน,ตรัง,92180,lamplok@obec.go.th,-,ลำปลอกเหนือ,0-7520-7270,-,พ.ศ.2503,43,12,ขนาดเล็ก,มีไฟฟ้า,10,101,8,30 มิถุนายน 2562 เวลา 11:23:09 น.
92,1092140188,92010122,140188,บ้านหาดเลา,banhadlao,ว่าที่ร้อยโทจักรเพชร์ พรมยศ,อนุบาล-ประถมศึกษา,,หมู่ 3 บ้านหาดเลา,ปะเหลียน,ปะเหลียน,ตรัง,92180,hadlaoschool61@gmail.com,www.obec.go.th/h,ปะเหลียน,0-7528-9912,0-7528-9912,24 พฤศจิกายน 2461,36,30,ขนาดกลาง,มีไฟฟ้า,13,122,8,28 มิถุนายน 2562 เวลา 10:07:58 น.
93,1092140185,92010123,140185,บ้านปะเหลียน,banpalian school,นายสนิท หูเขียว,อนุบาล-มัธยมศึกษาตอนต้น,,หมู่ 1 หัวถนน,ปะเหลียน,ปะเหลียน,ตรัง,92180,banpalian.school@obec.go.th,data.bopp-obec.info/web/?School_ID=1092140185,ปะเหลียน,0-7526-9309,0-7526-9309,"26 ,มิถุนายน 2486",39,25,ขนาดกลาง,มีไฟฟ้า,26,400,17,30 มิถุนายน 2562 เวลา 14:57:51 น.
94,1092140186,92010124,140186,บ้านลำแคลง,banlamkleng,นายรัตน์ ฉิมเรือง,อนุบาล-มัธยมศึกษาตอนต้น,,หมู่ 4 บ้านลำแคลง,ปะเหลียน,ปะเหลียน,ตรัง,92180,lamkleng@obec.go.th.,school.obec.go.th/lamkleng,ปะเหลียน,0-7526-9306,-,13/10/2478,42,25,ขนาดกลาง,มีไฟฟ้า,17,174,12,19 มิถุนายน 2562 เวลา 09:12:43 น.
95,1092140176,92010125,140176,บ้านเขาติง,bankhaoting,นายอัสลามี หนูเบ๊ะ,อนุบาล-ประถมศึกษา,,หมู่ 5 เขาติง,ลิพัง,ปะเหลียน,ตรัง,92180,khowthing@gmail.com,www.bankhaoting.com,ลิพัง,75829990,,3 มิถุนายน 2545,57,18,ขนาดเล็ก,มีไฟฟ้า,11,106,8,27 มิถุนายน 2562 เวลา 06:58:47 น.
96,1092140174,92010126,140174,บ้านลิพัง,banliphang,นายดำรงค์ วรรณแรก,อนุบาล-มัธยมศึกษาตอนต้น,,หมู่ 7 บ้านทางสาย,ลิพัง,ปะเหลียน,ตรัง,92180,banliphang@trang1.go.th,,ลิพัง,75204439,75204438,พ.ศ. 2478,55,17,ขนาดกลาง,มีไฟฟ้า,18,224,11,21 มิถุนายน 2562 เวลา 08:51:18 น.
97,1092140175,92010127,140175,บ้านทุ่งปาหนัน,ฺBANTUNGPANAN SCHOOL,นางสาวสุนิตย์ เอ้งฉ้วน,อนุบาล-ประถมศึกษา,,หมู่ 2 ทุ่งปาหนัน,ลิพัง,ปะเหลียน,ตรัง,92180,bantungpanan@trang1.go.th,data.bopp-obec.info/web/index.php?School_ID=1092140175,ลิพัง,75204432,75204432,9 มิถุนายน 2512,51,7,ขนาดเล็ก,มีไฟฟ้า,11,84,8,02 พฤศจิกายน 2561 เวลา 14:43:51 น.
98,1092140181,92010128,140181,บ้านสุโสะ,bansuso,-,อนุบาล-ประถมศึกษา,,หมู่ 1 สุโสะ,สุโสะ,ปะเหลียน,ตรัง,92120,bansusoschool@hotmail.com,,สุโสะ,0-7528-9396,,2477,38,25,ขนาดเล็ก,มีไฟฟ้า,6,24,8,25 มิถุนายน 2561 เวลา 10:55:39 น.
