99,1092140182,92010129,140182,บ้านท่าคลอง,bantaklong,นางชาลี เทศนอก,อนุบาล-ประถมศึกษา,,หมู่ 4 ท่าคลอง,สุโสะ,ปะเหลียน,ตรัง,92120,bantaklong@trang1.go.th,http://data.bopp-obec.info/web/?School_ID=1092140182,สุโสะ,0-7528-9633,,01/05/2515,38,12,ขนาดเล็ก,มีไฟฟ้า,7,32,8,27 มิถุนายน 2562 เวลา 09:00:11 น.
100,1092140183,92010130,140183,ทุ่งไทรทอง,Tungsaitong,นายกิตติ บุญศรี,ประถมศึกษา,,หมู่ 6 สุโสะ,สุโสะ,ปะเหลียน,ตรัง,92120,tungsaitong.ttt@gmail.com,data.bopp-obec.info/web/?School_ID=1092140183,สุโสะ,0-7528-9649,-,1/06/2519,25,10,ขนาดเล็ก,มีไฟฟ้า,5,38,7,05 พฤศจิกายน 2562 เวลา 06:41:29 น.
101,1092140184,92010131,140184,บ้านท่าเทศ,Bantatet,นางเสาวลักษณ์ พลพัง,อนุบาล-ประถมศึกษา,,หมู่ 2 วังยาว,สุโสะ,ปะเหลียน,ตรัง,92120,bantatet2014@gmail.com,school.obec.go.th/trang104/banthated/,สุโสะ,75270183,-,30 เมษายน 2483,40,25,ขนาดเล็ก,มีไฟฟ้า,8,51,8,28 พฤษภาคม 2560 เวลา 06:37:29 น.
102,1092140172,92010132,140172,หนองผักฉีด,Nongpukcheedschool,นายมณเฑียร โคกเขา,อนุบาล-ประถมศึกษา,,หมู่ 5 หนองผักฉีด,สุโสะ,ปะเหลียน,ตรัง,92180,,,สุโสะ,75270180,,16 พ.ค.56,51,20,ขนาดเล็ก,มีไฟฟ้า,10,44,8,12 มิถุนายน 2562 เวลา 11:36:55 น.
103,1092140189,92010133,140189,บ้านหนองเจ็ดบาท,Bannongjetbath School,นางสาวพิมพ์ประกาย ศรีไตรรัตน์,อนุบาล-ประถมศึกษา,,หมู่ 5 บ้านหนองเจ็ดบาท,แหลมสอม,ปะเหลียน,ตรัง,92120,bannongjetbath@trang1.go.th,,แหลมสอม,0-7582-9831,-,27/04/2513,32,9,ขนาดกลาง,มีไฟฟ้า,13,108,8,07 มิถุนายน 2561 เวลา 15:25:00 น.
104,1092140190,92010134,140190,บ้านแหลมสอม,banlaemsom,นายวีรยุทธ์ เสียมใหม,อนุบาล-ประถมศึกษา,,หมู่ 1 แหลมสอม,แหลมสอม,ปะเหลียน,ตรัง,92180,banlaemsom.palean@gmail.com,,แหลมสอม,0-7557-6462,75576402,25 ตุลาคม 2492,40,15,ขนาดกลาง,มีไฟฟ้า,13,184,8,28 มิถุนายน 2562 เวลา 14:12:10 น.
105,1092140191,92010135,140191,บ้านนาทุ่ง,BANNATHUNG,นายบรรจบ จิตรหลัง,อนุบาล-ประถมศึกษา,,หมู่ 3 นาทุ่ง,แหลมสอม,ปะเหลียน,ตรัง,92180,natung@obec.go.th,http://data.bopp-obec.info/web/?School_ID=1092140191,แหลมสอม,75829830,-,11 กุมภาพันธ์,50,15,ขนาดกลาง,มีไฟฟ้า,16,181,8,28 มิถุนายน 2562 เวลา 10:06:53 น.
106,1092140292,92010136,140292,วัดไทรทอง,watsaithong,นายปิยะ ลักษณะพริ้ม,อนุบาล-ประถมศึกษา,,หมู่ 11 เกาะหยี,โคกสะบ้า,นาโยง,ตรัง,92170,watsaithong93@gmail.com,-,โคกสะบ้า,0-7558-3101,75583101,1 พฤศจิกายน 2472,19.8,12.6,ขนาดกลาง,มีไฟฟ้า,20,330,13,02 ตุลาคม 2562 เวลา 13:47:46 น.
107,1092140293,92010137,140293,วัดนางประหลาด,watnangpralad,นางกรสิวรรณ์ เธียรโชติ,อนุบาล-ประถมศึกษา,,หมู่ 5 นางประหลาด,โคกสะบ้า,นาโยง,ตรัง,92170,nangpalad@hotmail.com,,โคกสะบ้า,0-75829817,-,2476,9,7.8,ขนาดกลาง,มีไฟฟ้า,11,128,8,06 พฤศจิกายน 2562 เวลา 08:06:56 น.
108,1092140294,92010138,140294,บ้านไร่หลวง,Banrailloung,นายภิญโย ชูเดช,อนุบาล-ประถมศึกษา,,หมู่ 3 พะยอมงาม,โคกสะบ้า,นาโยง,ตรัง,92170,railoung@obec.go.th,https://www.facebook.com/banrailuangschool/,โคกสะบ้า,0-7582-9816,,1 พฤษภาคม 2487,20,8,ขนาดกลาง,มีไฟฟ้า,12,117,8,05 มิถุนายน 2562 เวลา 12:46:42 น.
109,1092140299,92010139,140299,บ้านช่อง,Banchong,นางโศภิษฐ์ ไกรแสง,อนุบาล-ประถมศึกษา,,หมู่ 1 ช่อง,ช่อง,นาโยง,ตรัง,92170,banchong@trang1.go.th,http://data.bopp-obec.info/web/index_view.php?School_ID=1092140299&page=info,ช่อง,0-7557-3501,-,2460,24,10,ขนาดเล็ก,มีไฟฟ้า,11,77,8,26 มิถุนายน 2562 เวลา 12:54:18 น.
110,1092140300,92010140,140300,วัดช่องเปี่ยมราษฎร์,Watchongpeamrat,นายสุรเชฐ นวลศรี,อนุบาล-มัธยมศึกษาตอนต้น,,หมู่ 6 ถนนคด,ช่อง,นาโยง,ตรัง,92170,watchongpeamrat@trang1.go.th,http://data.bopp-obec.info/emis/editschooldata_history.php?School_ID=1092140300&id=4064&page=banner_web&id=4064,ช่อง,0-7558-3466,-,16 สิงหาคม พ.ศ. 2483,22,10,ขนาดกลาง,มีไฟฟ้า,18,180,11,26 ตุลาคม 2562 เวลา 18:40:56 น.
111,1092140301,92010141,140301,บ้านห้วยลึก,banhuailuk,นายวรัญญู ฉิมเพชร์,อนุบาล-ประถมศึกษา,,หมู่ 5 ห้วยลึก,ช่อง,นาโยง,ตรัง,92170,,data.bopp-obec.info/web/?School_ID=1092140301,ช่อง,-,-,3 ม.ค.2492,24,13,ขนาดกลาง,มีไฟฟ้า,12,145,8,15 มกราคม 2562 เวลา 12:45:16 น.
112,1092140288,92010142,140288,วัดธรรมาราม,Watthammaram,นางภาวิณี ลีลาชุติพงศ์,อนุบาล-มัธยมศึกษาตอนต้น,,หมู่ 4 นาปด,นาข้าวเสีย,นาโยง,ตรัง,92170,-,,นาข้าวเสีย,0-7557-3005,-,พ.ศ.2454,14,8.9,ขนาดกลาง,มีไฟฟ้า,19,221,11,24 มิถุนายน 2562 เวลา 16:47:36 น.
113,1092140289,92010143,140289,บ้านเกาะปุด,ฺBankohput,นางณกมล รอดคืน,อนุบาล-ประถมศึกษา,,หมู่ 2 เกาะปุด,นาข้าวเสีย,นาโยง,ตรัง,92170,,,นาข้าวเสีย,0-7529-9952,75299952,10 ก.ค.2482,12,3,ขนาดกลาง,มีไฟฟ้า,15,122,8,14 มิถุนายน 2562 เวลา 11:40:14 น.
114,1092140290,92010144,140290,วัดควนสีนวล,Watkhuansinuan,นายประเสริฐศักดิ์ ลักติธรรม,อนุบาล-มัธยมศึกษาตอนต้น,,หมู่ 5 ควนสีนวล,นาข้าวเสีย,นาโยง,ตรัง,92170,watkhuansinuan@hotmail.com,data.bopp-obec.info/web/?School_ID=1092140290,นาข้าวเสีย,0-7557-3063,-,4 มิถุนายน 2448,17,6,ขนาดกลาง,มีไฟฟ้า,26,411,17,28 มิถุนายน 2562 เวลา 16:33:09 น.
115,1092140285,92010147,140285,บ้านหนองไทร,bannongsai,นายประมวล นานช้า,อนุบาล-ประถมศึกษา,,หมู่ 1 หนองไทร,นาโยงเหนือ,นาโยง,ตรัง,92170,nongtrai@obec.go.th,school.obec.go.th/bannongtrail/,นาโยงเหนือ,0-7529-9239,75299239,2479,15,1,ขนาดกลาง,มีไฟฟ้า,21,417,16,28 มิถุนายน 2562 เวลา 10:28:30 น.
116,1092140283,92010148,140283,วัดจอมไตร,watjomtri,นายพงษ์พัฒน์ ศรีรัตนพันธ์,อนุบาล-ประถมศึกษา,,หมู่ 7 บ้านเจาะ,นาโยงเหนือ,นาโยง,ตรัง,92170,-,-,นาโยงเหนือ,0-75299656,-,01/07/2476,14,5,ขนาดกลาง,มีไฟฟ้า,14,146,8,11 กันยายน 2562 เวลา 15:32:11 น.
117,1092140286,92010149,140286,ไทรงาม,taignam,นางวิรัตน์ รักภักดี,อนุบาล-ประถมศึกษา,,หมู่ 4 ไสเดือย,นาหมื่นศรี,นาโยง,ตรัง,92170,patsad0706@obecmail.obec.go.th,-,นาหมื่นศรี,0-75583562,-,11 มีนาคม 2499,23,9,ขนาดเล็ก,มีไฟฟ้า,9,77,8,04 ธันวาคม 2562 เวลา 10:51:05 น.
118,1092140287,92010150,140287,บ้านควนสวรรค์,Bankonsawan,นายสุทธิเมธ ชัยเพชร์,อนุบาล-มัธยมศึกษาตอนต้น,,หมู่ 8 นาหมื่นศรี,นาหมื่นศรี,นาโยง,ตรัง,92170,ิbksw2019@gmail.com,www.bksw.ac.th,นาหมื่นศรี,075-583676,075-583676,29 เมษายน 2475,16,3,ขนาดกลาง,มีไฟฟ้า,21,282,11,23 ตุลาคม 2562 เวลา 10:02:37 น.
119,1092140298,92010151,140298,บ้านคลองลำปริง,Banklonglumpring,นายเสรี ย่องจีน,อนุบาล-ประถมศึกษา,,หมู่ 3 คลองลำปริง,ละมอ,นาโยง,ตรัง,92170,banklonglumpring@trang1.go.th,http://data.bopp-obec.info/web/?School_ID=1092140298,ละมอ,0-7582-9818,-,20/06/2518,24,12,ขนาดกลาง,มีไฟฟ้า,14,119,9,08 พฤศจิกายน 2561 เวลา 14:47:53 น.
120,1092140296,92010152,140296,บ้านหนองยวน,bannongyuan,นายวิเชียร ใจทน,อนุบาล-ประถมศึกษา,,หมู่ 5 หนองยวน,ละมอ,นาโยง,ตรัง,92170,bannongyuan@trang.go.th,-,ละมอ,0-75583-941,-,1 มิถุนายน 2481,20,7,ขนาดกลาง,มีไฟฟ้า,11,103,8,05 มิถุนายน 2562 เวลา 12:35:57 น.
121,1092140297,92010153,140297,บ้านทุ่งส้มป่อย,bantungsompoy,นางสาววีรยา ขำวิชา,อนุบาล-ประถมศึกษา,,หมู่ 4 ทุ่งส้มป่อย,ละมอ,นาโยง,ตรัง,92170,tkungsompoy @ obec.go.th,data.bopp-obec.info/web/index.php?School_ID=1092140297,ละมอ,0-7557-4050,,2483,20,6,ขนาดเล็ก,มีไฟฟ้า,5,62,8,24 มิถุนายน 2562 เวลา 14:57:42 น.
122,1092140295,92010154,140295,วัดมงคลสถาน,Watmongkonsathan,นายประนอม ศรัทธาประยูร,อนุบาล-ประถมศึกษา,,หมู่ 10 ละมอ,ละมอ,นาโยง,ตรัง,92170,mongkon@obec.go.th,-,ละมอ,0-7529-9845,-,2470,18,4,ขนาดกลาง,มีไฟฟ้า,12,164,8,21 มิถุนายน 2562 เวลา 11:25:38 น.
123,1092140327,92010155,140327,บ้านตะเสะ,bantase,นางเสาวภา สมาพงค์,อนุบาล-ประถมศึกษา,,หมู่ 4 ตะเสะ,ตะเสะ,หาดสำราญ,ตรัง,92120,bantase@trang1.go.th,www.data.bopp-obec.,ตะเสะ,0-7520-7708,-,27 พฤศจิกายน 2490,55,15,ขนาดเล็ก,มีไฟฟ้า,11,113,8,27 ธันวาคม 2562 เวลา 12:53:26 น.
124,1092140328,92010156,140328,บ้านนาทะเล,Bannatalea,นายจำรัส เผ่าพิศุทธิ์,อนุบาล-มัธยมศึกษาตอนต้น,,หมู่ 1 บ้านนาทะเล,ตะเสะ,หาดสำราญ,ตรัง,92120,natalea100@hotmail.com,,ตะเสะ,835232662,,14 มิ.ย.2455,50,10,ขนาดกลาง,มีไฟฟ้า,22,293,13,29 กันยายน 2562 เวลา 09:24:44 น.
125,1092140329,92010157,140329,บ้านโคกรัก,bankokrak,นายวรัตน์ หูเขียว,อนุบาล-ประถมศึกษา,,หมู่ 2 นาชุมเห็ด,ตะเสะ,หาดสำราญ,ตรัง,92120,Kokrak9999@gmail.com,www.school.obec.go.th/kokrak,ตะเสะ,0-7527-7100,,13 เมษายน 2524,48,10,ขนาดเล็ก,มีไฟฟ้า,11,111,8,23 ตุลาคม 2562 เวลา 10:56:12 น.
126,1092140326,92010158,140326,บ้านทุ่งกอ,bantungkor,นายวิชาติ เดิมหลิ่ม,อนุบาล-ประถมศึกษา,,หมู่ 3 บ้านทุ่งกอ,บ้าหวี,หาดสำราญ,ตรัง,92120,E-Mail: tungko@obec.go.th,school.obec.go.th/bantungkor,บ้าหวี,081-5379214,,,38,7,ขนาดเล็ก,มีไฟฟ้า,11,120,8,18 ตุลาคม 2562 เวลา 13:22:31 น.
127,1092140325,92010159,140325,บ้านบ้าหวี,Banbawee,นายนิมิตร ชัยมาดสิริกุล,อนุบาล-ประถมศึกษา,,หมู่ 1 บ้านบ้าหวี,บ้าหวี,หาดสำราญ,ตรัง,92120,bawee@obec,,บ้าหวี,0-7520-7775,-,2476,38,10,ขนาดเล็ก,มีไฟฟ้า,10,99,8,21 มิถุนายน 2562 เวลา 13:07:08 น.
128,1092140324,92010160,140324,บ้านบกหัก,Banbokhuk,นางสุพัตรา เพิ่มเพ็ชร์,อนุบาล-ประถมศึกษา,,หมู่ 4 บกหัก,หาดสำราญ,หาดสำราญ,ตรัง,92120,,-,หาดสำราญ,085-7292884,-,17 พ.ค. 2515,41,5,ขนาดเล็ก,มีไฟฟ้า,9,91,8,14 ธันวาคม 2562 เวลา 20:58:31 น.
129,1092140320,92010161,140320,หาดสำราญ,hadsamran,นางอมรา เพทาย,อนุบาล-ประถมศึกษา,,หมู่ 5 หาดสำราญ,หาดสำราญ,หาดสำราญ,ตรัง,92120,hadsamran@obec.go.th,http://school.obec.go.t,หาดสำราญ,0-7520-8990,-,16/03/2504,49,10,ขนาดเล็ก,มีไฟฟ้า,12,86,8,11 มิถุนายน 2562 เวลา 12:42:02 น.
130,1092140321,92010162,140321,วัดหนองสมาน,WADNONGSAMAN,นายสุชาติ เตี่ยวย่อง,อนุบาล-ประถมศึกษา,,หมู่ 3 หนองสมาน,หาดสำราญ,หาดสำราญ,ตรัง,92120,-,-,หาดสำราญ,0-7520-8789,-,16/05/2485,48,1,ขนาดกลาง,มีไฟฟ้า,17,201,8,30 มิถุนายน 2562 เวลา 14:25:48 น.
131,1092140322,92010163,140322,บ้านปากปรน,banpagpron,นายจักรี ฉิมเรือง,อนุบาล-ประถมศึกษา,,หมู่ 1 บ้านปากปรน,หาดสำราญ,หาดสำราญ,ตรัง,92120,banpagpron_072@hotmail.com,-,หาดสำราญ,098-0147941,-,18 พฤศจิกายน 2454,50,7,ขนาดกลาง,มีไฟฟ้า,13,131,8,27 มิถุนายน 2562 เวลา 09:28:49 น.
132,1092140323,92010164,140323,วัดปากปรน,watpakpron,-,อนุบาล-ประถมศึกษา,,หมู่ 2 ปากปรนออก,หาดสำราญ,หาดสำราญ,ตรัง,92120,,,หาดสำราญ,061-5945492,,5 พฤษภาคม 2489,46,10,ขนาดกลาง,มีไฟฟ้า,14,144,8,30 มิถุนายน 2562 เวลา 15:30:06 น.
