1,1092140017,92010001,140017,บ้านควนปริง,Bankuanpring,นางสุมน ไชยเสนีย์,อนุบาล-มัธยมศึกษาตอนต้น,,หมู่ 6 บ้านควนปริง,ควนปริง,เมืองตรัง,ตรัง,92000,kounpring@obec.go.th,http://data.bopp-obec.info/web/?School_ID=1092140017,ควนปริง,75258805,75258805,พ.ศ.2460,9.5,5.7,ขนาดกลาง,มีไฟฟ้า,21,272,11,07 มิถุนายน 2562 เวลา 20:17:32 น.
2,1092140018,92010002,140018,บ้านนาป้อ,bannapoo,นายฐโชตณัฏฐ์ ขวัญเมือง,อนุบาล-ประถมศึกษา,,หมู่ 8 บ้านนาป้อ,ควนปริง,เมืองตรัง,ตรัง,92000,bannapo56@gmail.com,http://school.obec.go.th/baannapo/,ควนปริง,0-7525-8139,-,01/06/2482,5,9,ขนาดกลาง,มีไฟฟ้า,13,135,8,25 มิถุนายน 2562 เวลา 10:47:08 น.
3,1092140009,92010004,140009,วัดนิคมประทีป,Watnikomprateep school,นายมานะ มีมาก,อนุบาล-ประถมศึกษา,,หมู่ 6 โคกหล่อ,โคกหล่อ,เมืองตรัง,ตรัง,92000,-,data.bopp-obec.info/web/?School_ID=1092140009,โคกหล่อ,75290564,-,2470,4,3,ขนาดกลาง,มีไฟฟ้า,13,131,8,07 มิถุนายน 2562 เวลา 13:32:50 น.
4,1092140010,92010005,140010,วัดสาริการาม,watsarigaram,นางอาวร พราหมเภทย์,อนุบาล-ประถมศึกษา,,หมู่ 9 โคกพลา,โคกหล่อ,เมืองตรัง,ตรัง,9200,,,โคกหล่อ,75298770,,พ.ศ.2475,6,1,ขนาดเล็ก,มีไฟฟ้า,8,65,8,21 มกราคม 2563 เวลา 14:12:32 น.
5,1092140011,92010006,140011,มิตรภาพที่ 31,mittrapap31,นายสุพร ศรสงวนสกุล,อนุบาล-ประถมศึกษา,,หมู่ 12 บ้านทุ่งหวัง,โคกหล่อ,เมืองตรัง,ตรัง,92000,31tungwang@gmail.com,school.obec.go.th/mittapap31,โคกหล่อ,0-7557-2034,0-7557-2034,1/10/2475,2,8,ขนาดกลาง,มีไฟฟ้า,11,129,8,05 กันยายน 2562 เวลา 11:43:05 น.
6,1092140022,92010007,140022,วัดควนวิเศษ,watkuanwisade,นายจรรยา ส่งศรีจันทร์,อนุบาล-ประถมศึกษา,,หมู่ 1,ทับเที่ยง,เมืองตรัง,ตรัง,92000,watkuan379@gmail.com,www.watkuan.ac.th,ทับเที่ยง(เทศบาล),0-7521-8379,75215128,1 มีนาคม 2469,6,0.1,ขนาดใหญ่พิเศษ,มีไฟฟ้า,74,1677,47,25 เมษายน 2561 เวลา 22:42:07 น.
7,1092140021,92010008,140021,อนุบาลตรัง,anubantrang,นายสนทยา ภักดีวานิช,อนุบาล-ประถมศึกษา,,หมู่ - -,ทับเที่ยง,เมืองตรัง,ตรัง,92000,anubantrangschool@gmail.com,www.anubantrang.ac.th,ทับเที่ยง(เทศบาล),0-7521-8818,75218818,1 กันยายน 2503,7,1,ขนาดใหญ่พิเศษ,มีไฟฟ้า,104,1819,48,07 มิถุนายน 2561 เวลา 21:36:48 น.
8,1092140042,92010009,140042,วัดไทรงาม,Wattringam,นางเสาวภาพัชร ภู่ประภาดิลก,อนุบาล-ประถมศึกษา,,หมู่ 2 นาขา,นาตาล่วง,เมืองตรัง,ตรัง,92000,parilux1@hotmail.com,www thaschool.in.th,นาตาล่วง,0-75298235,0-75298235,1 มิถุนายน 2519,13,5,ขนาดกลาง,มีไฟฟ้า,18,265,10,29 มิถุนายน 2561 เวลา 13:47:12 น.
9,1092140043,92010010,140043,วัดไพรสนฑ์,Watprison,นางภาวนา มีมาก,อนุบาล-ประถมศึกษา,,หมู่ 4 ป่าหมาก,นาตาล่วง,เมืองตรัง,ตรัง,92000,-,-,นาตาล่วง,0-75502675,0-75502675,1 ตุลาคม 2479,12,8,ขนาดเล็ก,มีไฟฟ้า,12,111,8,13 มิถุนายน 2562 เวลา 14:27:34 น.
10,1092140048,92010011,140048,ไทยรัฐวิทยา ๓๙,Thairath wittaya 39 School,นายสัญญา ทองมีขวัญ,อนุบาล-มัธยมศึกษาตอนต้น,,หมู่ 5 นาโต๊ะหมิง,นาโต๊ะหมิง,เมืองตรัง,ตรัง,92000,thairath39@gmail.com,data.bopp-obec.info/web/?School_ID=1092140048,นาโต๊ะหมิง,0-7527-8108,0-7527-8108,2479,18,9,ขนาดกลาง,มีไฟฟ้า,19,180,11,28 ตุลาคม 2562 เวลา 17:23:06 น.
11,1092140052,92010015,140052,บ้านควนสระแก้ว,kounsrakeaw,นางสาวเพียงตะวัน วิคบำเพิง,อนุบาล-ประถมศึกษา,,หมู่ 6 บ้านควนสระแก้ว,นาโต๊ะหมิง,เมืองตรัง,ตรัง,92000,kuansrakeawtrang1@gmail.com,https://data.bopp-obec.info/web/?School_ID=1092140052,นาโต๊ะหมิง,957795142,-,2519,30,15,ขนาดเล็ก,มีไฟฟ้า,6,44,8,27 ตุลาคม 2562 เวลา 20:04:12 น.
12,1092140040,92010016,140040,วัดศรีสุวรรณาราม,watsrisuwannaram,นางจุฬารัตน์ สุขขุม,อนุบาล-ประถมศึกษา,,หมู่ 1 นาท่ามใต้,นาท่ามใต้,เมืองตรัง,ตรัง,92190,watsrisuwannaram@trang1.go.th,school.obec.go.th/natamtai/,นาท่ามใต้,0-75270977,-,พ.ศ.2479,24,16,ขนาดเล็ก,มีไฟฟ้า,12,131,8,22 ตุลาคม 2562 เวลา 19:19:29 น.
13,1092140006,92010017,140006,วัดนานอน,Watnanon,นายสุธิพงษ์ ว่องวรานนท์,อนุบาล-มัธยมศึกษาตอนต้น,,หมู่ 4 นานอน,นาท่ามใต้,เมืองตรัง,ตรัง,92190,watnanon1234@gmail.com,data.bopp-obec.info/web/index.php?School_ID=1092140006,นาท่ามใต้,075-204-143,075-204-143,1 พค.2447,24,20,ขนาดกลาง,มีไฟฟ้า,20,276,11,29 กันยายน 2562 เวลา 09:39:30 น.
14,1092140004,92010023,140004,บ้านบางยาง,Bunbangyang,นางสาววารัตดา บุญสุด,อนุบาล-ประถมศึกษา,,หมู่ 1 บางยาง,นาท่ามเหนือ,เมืองตรัง,ตรัง,92190,chanisa2118@hotmail.com,,นาท่ามเหนือ,874742118,,1 พฤษภาคม 2495,26,20,ขนาดกลาง,มีไฟฟ้า,14,144,8,21 มิถุนายน 2562 เวลา 11:12:00 น.
15,1092140001,92010025,140001,บ้านคลองเต็ง,BanKlongTeng,นางพรรณนิภา ไพรัตน์,อนุบาล-มัธยมศึกษาตอนต้น,,หมู่ 3 คลองเต็ง,นาท่ามเหนือ,เมืองตรัง,ตรัง,92190,klongtang.ban@thaimail.com,http://school.obec.go.th,คลองเต็ง,0-7527-6187,,1 มกราคม 2454,20,10,ขนาดกลาง,มีไฟฟ้า,20,291,11,30 มิถุนายน 2562 เวลา 11:17:07 น.
16,1092140014,92010028,140014,วัดทุ่งหินผุด,Wattunghinput,นายอำนาจ ขันทกาญจน์,อนุบาล-ประถมศึกษา,,หมู่ 1 ทุ่งหินผุด,นาบินหลา,เมืองตรัง,ตรัง,92000,wattunghinput@gmail.com,http://data.bopp-obec.info/web/?School_ID=1092140014,นาบินหลา,831768009,-,1 เม.ย. 2470,7.9,8,ขนาดเล็ก,มีไฟฟ้า,8,112,8,27 มิถุนายน 2562 เวลา 15:25:37 น.
17,1092140015,92010029,140015,บ้านโคกชะแง้,bankokchangae,นายสุวิทย์ กังแฮ,อนุบาล-ประถมศึกษา,,หมู่ 5 ควนล้อน,นาบินหลา,เมืองตรัง,ตรัง,92000,,school.obec.go.th/bankokchangea,นาบินหลา,75501198,,1 พฤษภาคม พ.ศ.2487,6,10,ขนาดเล็ก,มีไฟฟ้า,15,113,8,18 มิถุนายน 2562 เวลา 12:33:44 น.
18,1092140027,92010031,140027,บ้านหนองเรี้ย,BANNONGREAI,นายรัตพล มุสิกพันธ์,อนุบาล-ประถมศึกษา,,หมู่ 9 บ้านหนองนนท์,นาพละ,เมืองตรัง,ตรัง,92000,nongrei@obec.go.th,,นาพละ,0-7529-1712,-,3 ธันวาคม 2492,14,12,ขนาดเล็ก,มีไฟฟ้า,8,84,8,30 ตุลาคม 2562 เวลา 17:33:42 น.
19,1092140028,92010032,140028,ต้นบากราษฎร์บำรุง,Tonbakrasbamrung,นางสายสุณี ศิริรัตนวรางกูร,อนุบาล-ประถมศึกษา,,หมู่ 7 ต้นบาก,นาพละ,เมืองตรัง,ตรัง,92000,,,นาพละ,0-7520-6049,,2520,18,14,ขนาดเล็ก,มีไฟฟ้า,9,56,8,24 มิถุนายน 2562 เวลา 10:03:36 น.
20,1092140029,92010033,140029,วัดขุนสิทธิ์,Watkhunsit School,นายพรชัย คำนวณศิลป์,อนุบาล-มัธยมศึกษาตอนต้น,,หมู่ 10 บ้านโพธิ์,บ้านโพธิ์,เมืองตรัง,ตรัง,92000,-,http://school.obec.go.t,บ้านโพธิ์,75582404,75582405,18 มิถุนายน 2475,15,10,ขนาดกลาง,มีไฟฟ้า,20,236,11,02 กรกฎาคม 2562 เวลา 13:09:03 น.
21,1092140024,92010034,140024,เพาะปัญญา ในพระอุปถัมภ์ฯ,Phorpanya,นางสาวชวาลา จินดาผ่อง,อนุบาล-ประถมศึกษา,,หมู่ 5 นาโยงใต้,นาโยงใต้,เมืองตรัง,ตรัง,92170,phorpanya@trang1.go.th,data.bopp-obec.info/web/?School_ID=1092140024,นาโยงใต้,75242044,75242044,พ.ศ. 2456,12,10,ขนาดกลาง,มีไฟฟ้า,12,245,12,25 ตุลาคม 2562 เวลา 13:56:50 น.
22,1092140031,92010037,140031,วัดน้ำผุด,watnumphut school,นายจักรพงษ์ ทองประดับ,อนุบาล-ประถมศึกษา,,หมู่ 1 บ้านน้ำผุด,น้ำผุด,เมืองตรัง,ตรัง,92000,watnamput@obec.go.th,http://school.obec.go.t,น้ำผุด,0-75-574627,-,15 มีนาคม 2476,26,19,ขนาดกลาง,มีไฟฟ้า,12,129,8,09 มิถุนายน 2560 เวลา 08:00:49 น.
23,1092140036,92010038,140036,บ้านห้วยเร็จ,Banhuairet,นางธรินทร์รัษฎ์ ทองสุข,อนุบาล-ประถมศึกษา,,หมู่ 3 ห้วยเร็จ,น้ำผุด,เมืองตรัง,ตรัง,92000,,,น้ำผุด,0-75295075,,29/11/2442,26,20,ขนาดเล็ก,มีไฟฟ้า,12,83,8,29 มิถุนายน 2560 เวลา 23:05:27 น.
24,1092140037,92010039,140037,บ้านปากห้วย,BANPAKHUAI,นางสาวยุพเยาว์ เอียดสั้น,อนุบาล-ประถมศึกษา,,หมู่ 6 ปากห้วย,น้ำผุด,เมืองตรัง,ตรัง,92000,banpakhuai@obec.go.th,http://school.obec.go.t,น้ำผุด,75204210,-,25 พฤษภาคม 2513,28,25,ขนาดเล็ก,มีไฟฟ้า,9,63,8,30 พฤษภาคม 2561 เวลา 08:23:08 น.
25,1092140032,92010040,140032,บ้านไร่พรุ,Banraipru,นางนงคราญ ตันธนกุล,อนุบาล-ประถมศึกษา,,หมู่ 8 ไร่พรุ,น้ำผุด,เมืองตรัง,ตรัง,92000,raipru@hotmail.com,www.schoolweb.eduzones.com/raipruschool,น้ำผุด,0-7525-9107,,24 พฤษภาคม 2481,21,10,ขนาดกลาง,มีไฟฟ้า,16,299,12,22 ตุลาคม 2562 เวลา 15:19:47 น.
26,1092140033,92010041,140033,บ้านทุ่งนา,Banthungna,นางอรุณศรี บัวขวัญ,อนุบาล-ประถมศึกษา,,หมู่ 2 บ้านทุ่งนา,น้ำผุด,เมืองตรัง,ตรัง,92000,tungna050@gmail.com,,น้ำผุด,0-7527-0127,0-7520-4323,1ตุลาคม2479,31,22,ขนาดกลาง,มีไฟฟ้า,11,146,8,18 พฤษภาคม 2560 เวลา 14:39:59 น.
27,1092140034,92010042,140034,บ้านเขาหลัก,bankowlak,นายพิทยา หวานขัน,อนุบาล-ประถมศึกษา,,หมู่ 7 บ้านเขาหลัก,น้ำผุด,เมืองตรัง,ตรัง,92000,bankowlak@trang1.go.th,http://school.obec.go.th,น้ำผุด,918600527,-,2505,30,21,ขนาดเล็ก,มีไฟฟ้า,6,63,8,30 มิถุนายน 2562 เวลา 12:59:58 น.
28,1092140035,92010043,140035,บ้านด่าน,BANDAN,นางสุดาพร มุสิกพันธ์,อนุบาล-ประถมศึกษา,,หมู่ 5 บ้านด่าน,น้ำผุด,เมืองตรัง,ตรัง,92000,bandan@trang1.go.th,http://data.bopp-obec.info/web/?School_ID=1092140035,น้ำผุด,075-291231,-,15/03/2519,35,30,ขนาดเล็ก,มีไฟฟ้า,10,50,8,10 พฤษภาคม 2562 เวลา 09:54:22 น.
29,1092140016,92010044,140016,วัดแจ้ง,watjang,นายกษิดิ์เดช กุลศรี,อนุบาล-ประถมศึกษา,,หมู่ 5 บางรัก,บางรัก,เมืองตรัง,ตรัง,92000,watjang@gmail.com,school.obec.go.th/watjeang,บางรัก,0-75-502-871,-,11 /5/2476,8,5,ขนาดเล็ก,มีไฟฟ้า,11,87,8,30 พฤษภาคม 2561 เวลา 14:08:34 น.
30,1092140013,92010045,140013,วัดเกาะมะม่วง,watkhomamoung,นายอภิพัฒน์ อภัยรัตน์,อนุบาล-ประถมศึกษา,,หมู่ 6 เกาะมะม่วง,บ้านควน,เมืองตรัง,ตรัง,92000,komamoung@school.obec.go.th,http://data.bopp-obec.info/web/index_view.php?School_ID=1092140013&page=info,บ้านควน,0-7550-1194,-,4 มีนาคม 2519,3,8,ขนาดกลาง,มีไฟฟ้า,13,126,8,26 พฤศจิกายน 2562 เวลา 11:16:03 น.
31,1092140030,92010047,140030,บ้านห้วยไทร,้ีhuaisai,นายอภิชาติ อนุตรพัฒน์,อนุบาล-ประถมศึกษา,,หมู่ 8 บ้านห้วยไทร,บ้านโพธิ์,เมืองตรัง,ตรัง,92000,huaitrai@obec.go.th,,องค์การบริหารส่วนตำบลบ้านโพธิ์,0-7527-0128,,18พฤษภาคม2513,15,8,ขนาดเล็ก,มีไฟฟ้า,11,103,9,26 มิถุนายน 2561 เวลา 14:33:29 น.
32,1092140026,92010048,140026,วัดโพธาราม,potaram,นายสมเกียรติ อมรลักษณ์,อนุบาล-ประถมศึกษา,,หมู่ 1 บ้านโพธิ์,บ้านโพธิ์,เมืองตรัง,ตรัง,92000,potaram@obec.go.th,http://school.obec.go.t,อบต.บ้านโพธิ์,0-7522-6356,,,16,4,ขนาดเล็ก,มีไฟฟ้า,11,102,8,24 มิถุนายน 2562 เวลา 14:22:56 น.
33,1092140045,92010050,140045,วัดเชี่ยวชาญกิจ,Watchiewchankit,นายพิสิทธิ์ สุขรักษา,อนุบาล-มัธยมศึกษาตอนต้น,,หมู่ 7 บ้านน้ำฉา,หนองตรุด,เมืองตรัง,ตรัง,92000,wateheaw@school.obec.go,http://school.obec.go.th,อบต.หนองตรุด,75571266,75571266,1 พฤศจิกายน 2467,20,10,ขนาดกลาง,มีไฟฟ้า,20,148,11,30 มิถุนายน 2562 เวลา 15:13:19 น.
34,1092140046,92010051,140046,บ้านปากไพ,BANPAKPAI,-,อนุบาล-ประถมศึกษา,,หมู่ 6 บ้านสันตัง,หนองตรุด,เมืองตรัง,ตรัง,92000,banpakpai@trang1.go.th,-,หนองตรุด,0-75829838,-,20 ตุลาคม 2481,20,15,ขนาดเล็ก,มีไฟฟ้า,4,21,8,25 มิถุนายน 2561 เวลา 11:17:44 น.
35,1092140047,92010052,140047,บ้านกลางนา,BANKLANGNA,นายเสริมศักดิ์ รักใหม่,อนุบาล-ประถมศึกษา,,หมู่ 9 กลางนา,หนองตรุด,เมืองตรัง,ตรัง,92000,banklangna@trang1.go.th,-,หนองตรุด,-,-,12 มิถุนายน 2519,30,20,ขนาดเล็ก,มีไฟฟ้า,10,48,8,30 มิถุนายน 2562 เวลา 13:09:59 น.
36,1092140234,92010053,140234,บ้านโพรงจระเข้,Banprongjarakae,นางสาววันดี โต๊ะดำ,อนุบาล-ประถมศึกษา,,หมู่ 2 นาหว้า,โพรงจระเข้,ย่านตาขาว,ตรัง,92140,banploung@gmail.com,,โพรงจระเข้,0-7550-0643,-,29/11/2442,34,10,ขนาดเล็ก,มีไฟฟ้า,12,121,8,19 สิงหาคม 2561 เวลา 18:04:07 น.
37,1092140221,92010054,140221,วัดโหละคล้า,watlohkhla,นายอุดม เจริญลาภ,อนุบาล-ประถมศึกษา,,หมู่ 7 โหละคล้า,โพรงจระเข้,ย่านตาขาว,ตรัง,92140,watlohkhla@gmail.com,,โพรงจระเข้,899700575,,15พฤศจิกายน2479,38,10,ขนาดเล็ก,มีไฟฟ้า,9,64,8,27 ตุลาคม 2562 เวลา 14:39:17 น.
38,1092140248,92010056,140248,วัดอัมพวัน,wat-ampawan,นายสุรสีห์ หนูพุทธิ,อนุบาล-ประถมศึกษา,,หมู่ 4 โคกมะม่วง,เกาะเปียะ,ย่านตาขาว,ตรัง,92140,watampawan@trang1.go.th,http://www.pracharathschool.go.th/schoolpage.php?School_ID=1092140248&Area_CODE=9201,เกาะเปียะ,0-7557-5688,,15 เมษายน 2454,18,11,ขนาดเล็ก,มีไฟฟ้า,10,103,8,24 มิถุนายน 2562 เวลา 15:56:50 น.
39,1092140240,92010057,140240,บ้านคลองทรายขาว,Bankloungtraikow,นายชัยชนะ จิตบุญ,อนุบาล-ประถมศึกษา,,หมู่ 6 คลองทรายขาว,เกาะเปียะ,ย่านตาขาว,ตรัง,92140,kloungtraikow@obec.go.th,,เกาะเปียะ,862717143,,18 มิถุนายน 2488,21,14,ขนาดเล็ก,มีไฟฟ้า,9,57,8,20 มิถุนายน 2562 เวลา 15:14:41 น.
40,1092140241,92010058,140241,บ้านทุ่งนา,Bantungna,นายสุวิทารณ์ ธำรงวิศว,อนุบาล-ประถมศึกษา,,หมู่ 3 บ้านทุ่งนา,เกาะเปียะ,ย่านตาขาว,ตรัง,92140,bantungna.y@trang1.go.th,,เกาะเปียะ,810913675,-,23 ตุลาคม 2490,18,23,ขนาดเล็ก,มีไฟฟ้า,7,28,8,23 ตุลาคม 2562 เวลา 15:32:08 น.
41,1092140262,92010059,140262,บ้านหนองชวด,Bannongchuod,นายอาริยะ ดำช่วย,อนุบาล-ประถมศึกษา,,หมู่ 5 บ้านหนองชวด,เกาะเปียะ,ย่านตาขาว,ตรัง,92140,nongchoud@obec.go.th,http://data.bopp-obec.info/web/?School_ID=1092140262,เกาะเปียะ,862860839,,กรกฎาคม 2504,18,8,ขนาดเล็ก,มีไฟฟ้า,7,36,8,30 มิถุนายน 2562 เวลา 12:50:50 น.
42,1092140259,92010061,140259,บ้านนาโตง,bannatong,นายทศพล จงรักษ์,อนุบาล-ประถมศึกษา,,หมู่ 5 บ้านนาโตง,ทุ่งกระบือ,ย่านตาขาว,ตรัง,92140,bannatong@trang1.go.th,http://data.bopp-obec.info/web/?School_ID=1092140259,ทุ่งกระบือ,887140797,-,พ.ศ.2486,15,2,ขนาดเล็ก,มีไฟฟ้า,12,110,9,24 สิงหาคม 2562 เวลา 08:55:14 น.
43,1092140260,92010062,140260,บ้านนานิน,Bannanin,นายฉกาจ ขันชู,อนุบาล-ประถมศึกษา,,หมู่ 7 นานิน,ทุ่งกระบือ,ย่านตาขาว,ตรัง,92140,bannanin@trang1.go.th,school.obec.go.th/nanin/,ทุ่งกระบือ,0-7520-4718,-,15/05/2515,20,6,ขนาดเล็ก,มีไฟฟ้า,11,86,8,28 มิถุนายน 2562 เวลา 10:26:20 น.
44,1092140253,92010063,140253,บ้านคลองปะเหลียน,BANKLONGPALIAN,-,อนุบาล-ประถมศึกษา,,หมู่ 2 บ้านคลองปะเหลียน,ทุ่งกระบือ,ย่านตาขาว,ตรัง,92140,banklongpalian@trang1.go.th,-,ทุ่งกระบือ,0-7528-1760,-,1 มิถุนายน 2482,24,4,ขนาดเล็ก,มีไฟฟ้า,8,83,8,06 มิถุนายน 2562 เวลา 12:25:26 น.
45,1092140254,92010064,140254,บ้านท่าบันได,bantabandai,นายจีระศักดิ์ นุ่นปาน,อนุบาล-ประถมศึกษา,,หมู่ 4 ท่าบันได,ทุ่งกระบือ,ย่านตาขาว,ตรัง,92140,-kasyeh1109@obecmail.obec.go.th,-http://data.bopp-obec.info/web/?School_ID=1092140254,ทุ่งกระบือ,0-7528-1791,-,2483,27,5,ขนาดเล็ก,มีไฟฟ้า,7,102,8,02 กรกฎาคม 2562 เวลา 21:48:02 น.
46,1092140258,92010065,140258,บ้านควนอินทนินงาม,Bankhuanintaninngam,นายศุภพงค์ คงอ่อนศรี,อนุบาล-ประถมศึกษา,,หมู่ 1 ควนอินทนินงาม,ทุ่งกระบือ,ย่านตาขาว,ตรัง,92140,intanin@obec.go.th,school.obec.go.th/bankhuanintaninngam,ทุ่งกระบือ,0-7528-0062,-,5 ธันวาคม 2464,15,2,ขนาดเล็ก,มีไฟฟ้า,13,137,8,24 มิถุนายน 2562 เวลา 12:44:13 น.
47,1092140244,92010066,140244,บ้านควนเคี่ยม,Bankuankeim,นายกริชานันท์ ลันดา,อนุบาล-ประถมศึกษา,,หมู่ 6 บ้านควนเคี่ยม,ทุ่งค่าย,ย่านตาขาว,ตรัง,92140,bankounkeim@gmail.com,http://school.obec.go.th/bankunkium,องค์การบริหารส่วนตำบลทุ่งค่าย,-,-,24/06/2486,6,25,ขนาดเล็ก,มีไฟฟ้า,7,52,8,22 ตุลาคม 2562 เวลา 10:15:41 น.
48,1092140245,92010067,140245,บ้านควนยาง,Bankounyang,นายคะนึง แก้วอัมพร,อนุบาล-ประถมศึกษา,,หมู่ 9 คลองลำเลียง,ทุ่งค่าย,ย่านตาขาว,ตรัง,92140,roserosepo@gmail.com,school.obec.go.th/kounyang,ทุ่งค่าย,089-6455291,-,11ตุลาคม 2485,2,15,ขนาดกลาง,มีไฟฟ้า,14,136,8,18 มิถุนายน 2562 เวลา 11:45:14 น.
