1,1095440059,95020001,440059,บ้านจาเราะปะไต,JAROHPATAI,นางสาวนิสิตา นารีหวานดี,อนุบาล-ประถมศึกษา,,หมู่ 1 จาเราะปะไต,ตาเนาะแมเราะ,เบตง,ยะลา,95110,jarohpatai@gmail.com,,ตาเนาะแมเราะ,073 - 232038,,2508,5,7,ขนาดเล็ก,มีไฟฟ้า,14,85,9,29 กรกฎาคม 2560 เวลา 16:32:44 น.
2,1095440060,95020002,440060,ไทยรัฐวิทยา 94 (บ้านบ่อน้ำร้อน),Thairath withaya 94 ( Ban bo nam ron),นางพัชรี เจ๊ะและ,อนุบาล-มัธยมศึกษาตอนต้น,,หมู่ 2 บ่อน้ำร้อน,ตาเนาะแมเราะ,เบตง,ยะลา,95110,thairath9478@gmail.com,www.thairath94_yala3.org,ตาเนาะแมเราะ,073 - 272111,73272111,17/05/2507,10,10,ขนาดกลาง,มีไฟฟ้า,23,214,11,01 มิถุนายน 2562 เวลา 15:00:09 น.
3,1095440061,95020003,440061,บ้านตาเนาะแมเราะ,Bantanomaeroh,นางสาวนิษฐเนตร เทพเกื้อ,อนุบาล-ประถมศึกษา,,หมู่ 4 บ้าน กม.7,ตาเนาะแมเราะ,เบตง,ยะลา,95110,bantanohmaeroh.school@gmail.com,tanohmaeroh,ตาเนาะแมเราะ,73720564,-,17/05/2482,8,8,ขนาดกลาง,มีไฟฟ้า,16,126,8,10 มิถุนายน 2562 เวลา 14:38:34 น.
4,1095440063,95020004,440063,บ้านด่านสันติราษฎร์,Bandansantirat,นายสุหริ ทิพย์มณี,อนุบาล-มัธยมศึกษาตอนต้น,,หมู่ 6 กม.18,ตาเนาะแมเราะ,เบตง,ยะลา,95110,ิbandansantirat@hotmail.com,,ตาเนาะแมเราะ,073 - 378781,073 - 378781,13 เมษายน 2500,20,20,ขนาดกลาง,มีไฟฟ้า,19,199,11,01 มิถุนายน 2562 เวลา 15:00:09 น.
5,1095440053,95020005,440053,บ้านจาเราะซูซู,jarohsusu,นายอิฟฟาน สมอดียอ,อนุบาล-ประถมศึกษา,,หมู่ 4 จาเราะซูซู,ธารน้ำทิพย์,เบตง,ยะลา,95110,banjarohsusu@gmail.com,-,???????????,-,-,2504,11,14,ขนาดเล็ก,มีไฟฟ้า,7,34,9,01 มิถุนายน 2561 เวลา 08:34:58 น.
6,1095440056,95020006,440056,บ้านบาแตตูแง,Banbataetungae,นางชลินทรา จักรถนอม,อนุบาล-ประถมศึกษา,,หมู่ 2 บาแตตูแง,ธารน้ำทิพย์,เบตง,ยะลา,95110,ิbanbataetungae@hotmail.com,banbataetungae.yala3.org,ธารน้ำทิพย์,073-287015,-,2498,5,4,ขนาดเล็ก,มีไฟฟ้า,19,122,9,04 มิถุนายน 2562 เวลา 14:39:22 น.
7,1095440050,95020007,440050,บ้านธารน้ำทิพย์,ฺBAN THANAMTIP,นายมะสอและ ดอเลาะอาลี,อนุบาล-ประถมศึกษา,,หมู่ 1 ธารน้ำทิพย์,ธารน้ำทิพย์,เบตง,ยะลา,95110,banthanamthip@gmail.com,www.banthanamthip.yala3.org,ธารน้ำทิพย์,073-299869,,4 มีนาคม 2502,8,8,ขนาดเล็ก,มีไฟฟ้า,6,33,8,10 มิถุนายน 2562 เวลา 13:53:48 น.
8,1095440058,95020009,440058,อนุบาลเบตง (สุภาพอนุสรณ์),Anubanbetong (Supap Anusorn),นางอรวรรณ เรืองหิรัญ,อนุบาล-ประถมศึกษา,,หมู่ 0 ตลาดเบตง,เบตง,เบตง,ยะลา,95110,banbetong@hotmail.com,,เบตง,073-230550,73230550,ปี พ.ศ. 2465,1,1,ขนาดใหญ่,มีไฟฟ้า,61,1155,36,10 มิถุนายน 2562 เวลา 12:56:19 น.
9,1095440062,95020010,440062,บ้านมาลา,Ban Mala,นางสาวอนุรี แซ่ไว,อนุบาล-ประถมศึกษา,,หมู่ 3 บ้านมาลา,ตาเนาะแมเราะ,เบตง,ยะลา,95110,banmalaschool56@gmail.com,www.banmalaschool.com,ตาเนาะแมเราะ,073-286011,-,11 พฤษภาคม 2484,12,12,ขนาดกลาง,มีไฟฟ้า,17,132,9,09 มิถุนายน 2562 เวลา 14:33:52 น.
10,1095440057,95020011,440057,สังวาลย์วิท 5,Sangwalvit5,นางสาวคาดียะห์ อามานะกุล,อนุบาล-ประถมศึกษา,,หมู่ 6 บ้านจันทรัตน์,ยะรม,เบตง,ยะลา,95110,sangwal5@hotmail.com,,ยะรม,073-284948,073-284948,15 กรกฎาคม 2507,13,18,ขนาดกลาง,มีไฟฟ้า,17,151,8,06 มิถุนายน 2562 เวลา 10:35:05 น.
11,1095440055,95020012,440055,บ้านยะรม,banyarom,นางสาวซารีนา เจ๊ะโด,อนุบาล-ประถมศึกษา,,หมู่ 3 ยะรม,ยะรม,เบตง,ยะลา,95110,banyarom@gmail.com,www.banyarom.yala3.go.th,ยะรม,073-284123,73284130,6 พฤษภาคม 2501,5,8,ขนาดกลาง,มีไฟฟ้า,23,245,10,01 มิถุนายน 2562 เวลา 10:16:23 น.
12,1095440054,95020013,440054,บ้านธารน้ำใส,bantannamsai,นายชนกนันท์ พะสุโร,อนุบาล-ประถมศึกษา,,หมู่ 5 จาเราะสตาร์,ยะรม,เบตง,ยะลา,95110,tannamsai_78@hotmail.com,tansai.yala3org,ยะรม,-,-,ปี พ.ศ. 2512,8,12,ขนาดเล็ก,มีไฟฟ้า,12,85,9,07 มิถุนายน 2562 เวลา 13:41:31 น.
13,1095440052,95020014,440052,บ้านราโมง,Banramongschool,นายบาฮารอดิง เจ๊ะและ,อนุบาล-มัธยมศึกษาตอนต้น,,หมู่ 5 ราโมง,ยะรม,เบตง,ยะลา,95110,banramongschool2477@hotmail.com,,ยะรม,073-299849,073-299849,2477,4,6,ขนาดกลาง,มีไฟฟ้า,32,345,14,07 มิถุนายน 2562 เวลา 13:39:03 น.
14,1095440049,95020015,440049,บ้านนาข่อย,Bannakoi,นางสาวสุชาดา ศิริสุวรรณ,อนุบาล-ประถมศึกษา,,หมู่ 1 นาข่อย,ยะรม,เบตง,ยะลา,95110,,www.bannakoy.yala3.org,ยะรม,073-230892,073-230892,26 สิงหาคม 2508,100,2,ขนาดกลาง,มีไฟฟ้า,18,248,8,15 ตุลาคม 2562 เวลา 12:52:02 น.
15,1095440064,95020016,440064,บ้านอัยเยอร์เวง,Baniyerweng,นายจำลอง จันทรโชติ,อนุบาล-มัธยมศึกษาตอนต้น,,หมู่ 1 กม.29,อัยเยอร์เวง,เบตง,ยะลา,95110,baniyerweng29@gmail.com,www.baniyerweng.yala3.go.th/web/,อบต.ตำบลอัยเยอร์เวง,073-363307,073-363307,29 / 11 / 2500,33,35,ขนาดใหญ่,มีไฟฟ้า,63,951,33,01 มิถุนายน 2562 เวลา 15:00:10 น.
16,1095440065,95020017,440065,บ้านใหม่ (วันครู 2503),BANMAI (WANKRU 2503),นายธีรวิทช์ โรจนานิติวัฒน์,อนุบาล-ประถมศึกษา,,หมู่ 3 กม.36,อัยเยอร์เวง,เบตง,ยะลา,95110,banmai_36@hotmail.co.th,data.bopp-obec.info/web/?School_ID=1095440065,อัยเยอ์เวง,073-299989,073-299989,ปี พ.ศ.2518,36,36,ขนาดใหญ่,มีไฟฟ้า,46,655,27,10 มิถุนายน 2562 เวลา 15:34:03 น.
17,1095440066,95020018,440066,บ้านวังใหม่ (ประชาอุทิศ 2519),Banwangmai school,นายมารุต รามแก้ว,อนุบาล-ประถมศึกษา,,หมู่ 5 วังใหม่,อัยเยอร์เวง,เบตง,ยะลา,95110,,,อัยเยอร์เวง,073-203061,73203061,25 มิถุนายน 2519,34,35,ขนาดกลาง,มีไฟฟ้า,19,148,8,04 ตุลาคม 2562 เวลา 09:43:26 น.
18,1095440067,95020019,440067,บ้านธารมะลิ,Banthanmali,นางสาวภัทรชรี หนูแพ,อนุบาล-ประถมศึกษา,,หมู่ 4 ธารมะลิ,อัยเยอร์เวง,เบตง,ยะลา,95110,thanmali61@gmail.com,-,อัยเยอร์เวง,073-201813,-,24 พ.ค. 2515,40,40,ขนาดกลาง,มีไฟฟ้า,18,213,9,01 มิถุนายน 2562 เวลา 15:00:12 น.
19,1095440183,95020053,440183,บ้านศรีนคร,Bansrinakorn,นายไฟซอล หลงลูวา,อนุบาล-ประถมศึกษา,,หมู่ 6 นครธรรม,คีรีเขต,ธารโต,ยะลา,95150,bansrinakornschool@outlook.go.th,-,คีรีเขต,073-206032,-,2510,95,10,ขนาดเล็ก,มีไฟฟ้า,14,106,8,07 มิถุนายน 2562 เวลา 14:30:50 น.
20,1095440184,95020054,440184,บ้านไทยพัฒนา,Banthaipattana School,นางสาวนุรไอนี เจ๊ะกา,อนุบาล-ประถมศึกษา,,หมู่ 4 ไทยพัฒนา,คีรีเขต,ธารโต,ยะลา,95150,thaipattana506@gmail.com,thaipattana.yala3.org,คีรีเขต,073-206506-7,,1 พฤษภาคม 2510,75,15,ขนาดเล็ก,มีไฟฟ้า,9,35,8,21 มิถุนายน 2562 เวลา 13:24:39 น.
21,1095440182,95020055,440182,บ้านนิคมสร้างตนเองธารโต,Bannikom sangtoneng thanto,นายไพโรจน์ ทองศิริ,อนุบาล-ประถมศึกษา,,หมู่ 1 ธารโต,ธารโต,ธารโต,ยะลา,95150,bannikom_school@hotmail.com,,องค์การบริหารส่วนตำบลธารโต,073-297075,073-297075,17 กรกฎาคม 2504,63,1,ขนาดใหญ่,มีไฟฟ้า,57,770,26,04 มิถุนายน 2562 เวลา 09:34:07 น.
22,1095440185,95020056,440185,นิคมสร้างตนเองธารโต 5,Nikhomsangton-eng thanto 5,นางสาวอามาล เจ๊ะสนิ,อนุบาล-ประถมศึกษา,,หมู่ 3 จาเราะแป,ธารโต,ธารโต,ยะลา,95150,thanto5school@hotmail.com,-,ธารโต,073-360588,-,4 ตุลาคม 2516,ุ60,6,ขนาดกลาง,มีไฟฟ้า,16,123,9,31 ตุลาคม 2561 เวลา 15:06:02 น.
23,1095440187,95020057,440187,บ้านศรีท่าน้ำ,Bansritanam,นางมารีน่า สะนี,อนุบาล-ประถมศึกษา,,หมู่ 4 ศรีท่าน้ำ,ธารโต,ธารโต,ยะลา,95150,sritanamschool@hotmail.com,www.bansritanam.yala3.org,ธารโต,073-201817,-,13 มิถุนายน 2520,85,4,ขนาดเล็ก,มีไฟฟ้า,7,51,8,01 มิถุนายน 2562 เวลา 15:00:07 น.
24,1095440186,95020058,440186,นิคมสร้างตนเองธารโต 6,nikomsarngtonaengthanto6,นางอาอีซะฮ์ สมาแอ,อนุบาล-ประถมศึกษา,,หมู่ 3 ซาไก,บ้านแหร,ธารโต,ยะลา,95150,nikhom6.017@gmail.com,,บ้านแหร,073-201818,,พ.ศ.2516,73,12,ขนาดเล็ก,มีไฟฟ้า,9,70,8,10 มิถุนายน 2562 เวลา 14:03:12 น.
25,1095440188,95020059,440188,บ้านแหร,Banrae,นายเจริญ แขกไทย,อนุบาล-ประถมศึกษา,,หมู่ 1 บ้านแหร,บ้านแหร,ธารโต,ยะลา,95150,banrae.thanto@gmail.com,www.banrae.yala3.go.th,บ้านแหร,73373442,73373442,2468,65,6,ขนาดกลาง,มีไฟฟ้า,35,275,14,28 มิถุนายน 2561 เวลา 14:28:40 น.
26,1095440189,95020060,440189,บ้านวังศิลา,ิิBanwangsila,นายมนัส เกื้อภาระ,อนุบาล-ประถมศึกษา,,หมู่ 10 ควนดินดำ,บ้านแหร,ธารโต,ยะลา,95150,wangsila61@gmail.com,-,บ้านแหร,073-720170,-,2519,70,15,ขนาดเล็ก,มีไฟฟ้า,11,77,8,19 มิถุนายน 2562 เวลา 14:31:11 น.
27,1095440190,95020061,440190,บ้านบัวทอง,banbuatong,นายฟัฎลี แนโม,อนุบาล-ประถมศึกษา,,หมู่ 2 บัวทอง,ธารโต,ธารโต,ยะลา,95150,banbuatong@hotmail.com,,บ้านแหร,073-360530,073-360530,18/07/2513,75,10,ขนาดกลาง,มีไฟฟ้า,18,139,8,26 มิถุนายน 2562 เวลา 11:38:40 น.
28,1095440195,95020062,440195,บ้านบ่อหิน,banbohin,นายวาริด ขำนุรักษ์,อนุบาล-ประถมศึกษา,,หมู่ 7 บ่อหิน,บ้านแหร,ธารโต,ยะลา,95150,bohinschool@hotmail.com,www.­banbohin.­yala3.­org,บ้านแหร,073-236575,073-236575,พ.ศ.2507,ุ65,13,ขนาดกลาง,มีไฟฟ้า,16,134,8,04 มิถุนายน 2562 เวลา 12:36:23 น.
29,1095440194,95020063,440194,บ้านปะเด็ง,banpadeng,นางสาววรรณี หนูชูสุข,อนุบาล-ประถมศึกษา,,หมู่ 4 ปะเด็ง,แม่หวาด,ธารโต,ยะลา,95170,-,www.banpadang.yala3.org,แม่หวาด,073-373236,,2523,40,40,ขนาดเล็ก,มีไฟฟ้า,12,56,8,01 มิถุนายน 2562 เวลา 15:00:21 น.
30,1095440191,95020064,440191,บ้านเยาะ,BANYOH,นายรอสะ มาเล๊ะ,อนุบาล-มัธยมศึกษาตอนต้น,,หมู่ 6 สันติ2,แม่หวาด,ธารโต,ยะลา,95160,,,แม่หวาด,073-201779,,29/11/2442,130,30,ขนาดกลาง,มีไฟฟ้า,41,482,19,19 กรกฎาคม 2560 เวลา 10:37:51 น.
31,1095440192,95020065,440192,บ้านโต,Banto,นายประสิทธิ์ เรืองหิรัญ,อนุบาล-มัธยมศึกษาตอนต้น,,หมู่ 7 คอกช้าง,แม่หวาด,ธารโต,ยะลา,95170,office@banto.ac.th,www.banto.ac.th,คอกช้าง,073-280162,073-280162,2483,60,20,ขนาดกลาง,มีไฟฟ้า,33,343,19,06 มิถุนายน 2562 เวลา 14:43:01 น.
32,1095440193,95020066,440193,บ้านจุโป,banjupo,นายชัยศักดิ์ วิสุทธิ์,อนุบาล-มัธยมศึกษาตอนต้น,,หมู่ 1 บ้านละหาด,แม่หวาด,ธารโต,ยะลา,95170,banjupo76@gmail.com,,แม่หวาด,073-360016,,7 ธันวาคม 2481,40,60,ขนาดกลาง,มีไฟฟ้า,21,170,11,07 มิถุนายน 2562 เวลา 10:19:24 น.
